id,Account Created At(same for all rows),status created_at,Fav_cont,retweeted_count,reply_to_status,reply_to_screen,quote,text
https://twitter.com/AgentPete/status/535823781248630785,Mon Feb 25 16:03:47 +0000 2008,2014-11-21 15:55:19,0,0,repNone,,False,"“God always forgives, but the Earth does not” – Pope Francis. Had no idea the Earth and Schwarzenegger were related. http://t.co/FsvKvt3OiP"
https://twitter.com/AgentPete/status/535099822429450240,Mon Feb 25 16:03:47 +0000 2008,2014-11-19 15:58:33,0,1,repNone,,False,"If you liked our last LAD with Mal Peet, see him live (and free!) in London next Tuesday http://t.co/uRnaIVukCA"
https://twitter.com/AgentPete/status/535037281317711872,Mon Feb 25 16:03:47 +0000 2008,2014-11-19 11:50:03,0,4,repNone,,False,RT @iansiBalls: #cutedog Olive sez: Mal Peet is the antidote to #GameOfThrones! DIY fantasy on @Litopia AD! http://t.co/sSQKwwCUXH http://t…
https://twitter.com/AgentPete/status/534651605766144000,Mon Feb 25 16:03:47 +0000 2008,2014-11-18 10:17:30,0,0,repNone,,False,"Darkest Peru my foot, he’s a chav bear outta of 32 Windsor Gardens. Innit? http://t.co/SJ5OoBEzVr #paddingtonbear"
https://twitter.com/AgentPete/status/534320497157492736,Mon Feb 25 16:03:47 +0000 2008,2014-11-17 12:21:48,0,0,rep534295033705684992,TheVimes,False,"@nellynero1 Thanks! :) I'm always out before dawn, which for me is quite a magical time..."
https://twitter.com/AgentPete/status/534240844258480129,Mon Feb 25 16:03:47 +0000 2008,2014-11-17 07:05:17,1,0,repNone,,False,Rainy dawn in Oxford Street today http://t.co/bdQ48mzLlw
https://twitter.com/AgentPete/status/532255469369577472,Mon Feb 25 16:03:47 +0000 2008,2014-11-11 19:36:07,0,1,repNone,,False,RT @DFB_storyhouse: See the wonderful Mal Peet discuss his  book THE MURDSTONE TRILOGY #MurdstoneTrilogy: http://t.co/7wqYM1lUzk
https://twitter.com/AgentPete/status/532184092495081472,Mon Feb 25 16:03:47 +0000 2008,2014-11-11 14:52:29,1,1,repNone,,False,"What hubris, Google: behold the face of our terminator. I'm seriously creeped out http://t.co/VqFhcBhsPL"
https://twitter.com/AgentPete/status/532066677044047872,Mon Feb 25 16:03:47 +0000 2008,2014-11-11 07:05:55,2,0,repNone,,False,Dawn over Baker Street just now http://t.co/Bvh6rXnhWD
https://twitter.com/AgentPete/status/531487291454521345,Mon Feb 25 16:03:47 +0000 2008,2014-11-09 16:43:39,0,1,repNone,,False,RT @iansiBalls: #NeverForget the assassin who pulled the Trigger on #RemembranceSunday: @timbobutcher on @Litopia. http://t.co/dMawb9wexN #…
https://twitter.com/AgentPete/status/530432660095897602,Mon Feb 25 16:03:47 +0000 2008,2014-11-06 18:52:55,0,7,repNone,,False,RT @DFB_storyhouse: See the wonderful Mal Peet discuss his just-published book THE MURDSTONE TRILOGY here #MurdstoneTrilogy: http://t.co/N5…
https://twitter.com/AgentPete/status/529920038275674113,Mon Feb 25 16:03:47 +0000 2008,2014-11-05 08:55:57,0,0,repNone,,False,"Really enjoyed #NevillesIsland last night, delightful comedy"
https://twitter.com/AgentPete/status/528501021455450112,Mon Feb 25 16:03:47 +0000 2008,2014-11-01 10:57:17,2,0,repNone,,False,"Hyde Park Corner, deck chairs are out! http://t.co/HU7STTbeUX"
https://twitter.com/AgentPete/status/527022827468492800,Mon Feb 25 16:03:47 +0000 2008,2014-10-28 09:03:28,0,1,repNone,,False,Regent St brought to standstill by a wayward bus http://t.co/Vlb7NbXthk
https://twitter.com/AgentPete/status/524887007794065408,Mon Feb 25 16:03:47 +0000 2008,2014-10-22 11:36:29,1,0,rep524881726469062656,ClareFurniss,False,@ClareFurniss @DFB_storyhouse Couldn't agree more! It's delicious from beginning to end. Thx for kind words :)
https://twitter.com/AgentPete/status/524873954830614528,Mon Feb 25 16:03:47 +0000 2008,2014-10-22 10:44:37,0,0,rep524679863262019585,ClareFurniss,False,@ClareFurniss @DFB_storyhouse You are SO right! :)
https://twitter.com/AgentPete/status/524597449139453952,Mon Feb 25 16:03:47 +0000 2008,2014-10-21 16:25:53,1,1,repNone,,False,Today's already peaked. RT @pickover: A walrus was discovered asleep atop a Russian submarine. http://t.co/ZR4c8AOB2i http://t.co/gHAHKrzJ4d
https://twitter.com/AgentPete/status/524283600066203648,Mon Feb 25 16:03:47 +0000 2008,2014-10-20 19:38:45,0,0,rep523857421018886144,iansiBalls,False,"@iansiBalls Dang! Those sneaky, pesky terroristics! See something = say something, Hope you reported this."
https://twitter.com/AgentPete/status/524283107810086913,Mon Feb 25 16:03:47 +0000 2008,2014-10-20 19:36:48,0,2,repNone,,False,RT @iansiBalls: It's closer than we thought... #greenwich #Isis #waronterror #fear http://t.co/rnNjYiIQZ2
https://twitter.com/AgentPete/status/523071233261572096,Mon Feb 25 16:03:47 +0000 2008,2014-10-17 11:21:14,0,0,repNone,,False,Fantastic new USP for apps... simply lie about your so-called privacy settings... http://t.co/xnoUNqa2JL
https://twitter.com/AgentPete/status/522856246492540928,Mon Feb 25 16:03:47 +0000 2008,2014-10-16 21:06:58,3,3,repNone,,False,"Seriously, one of the nicest hotels I’ve stayed at in England, totally recommended @RCHDartmouth1 http://t.co/5403X9Rrdl"
https://twitter.com/AgentPete/status/522855205914685440,Mon Feb 25 16:03:47 +0000 2008,2014-10-16 21:02:49,1,0,rep522485454596497408,VictoriaParkBks,False,@VictoriaParkBks email me again... I've been on hols :)
https://twitter.com/AgentPete/status/519209702534950912,Mon Feb 25 16:03:47 +0000 2008,2014-10-06 19:36:54,0,0,repNone,,False,"Twin Peaks is returning? Gad, the weeks’ best news – or the worst. Can’t decide. http://t.co/8CAoyOKVOA"
https://twitter.com/AgentPete/status/519072602619658240,Mon Feb 25 16:03:47 +0000 2008,2014-10-06 10:32:07,1,0,repNone,,False,It's a grey day in town today http://t.co/usyjFql0aw
https://twitter.com/AgentPete/status/517634410402050049,Mon Feb 25 16:03:47 +0000 2008,2014-10-02 11:17:15,0,0,rep517633995488919552,petewrites,False,"@petewrites @dcpae Ian Winn, aka @iansiBalls"
https://twitter.com/AgentPete/status/517627923512459265,Mon Feb 25 16:03:47 +0000 2008,2014-10-02 10:51:28,0,0,repNone,,False,"@dcpae @petewrites Agree, a very impressive person. Her critics are ad hominem, i.e. won’t address the issues, which sets off alarm bells."
https://twitter.com/AgentPete/status/517626370877571072,Mon Feb 25 16:03:47 +0000 2008,2014-10-02 10:45:18,1,1,rep517624847187599360,petewrites,False,@petewrites @dcpae Hope you enjoy it! Worth comparing our show to the mugging Stephen Sackur attempted on BBC’s HardTalk the other day.
https://twitter.com/AgentPete/status/517617034910502912,Mon Feb 25 16:03:47 +0000 2008,2014-10-02 10:08:12,0,2,repNone,,False,It seems that much criticism of Susan Greenfiled is just misogyny – saddos who hate powerful and intelligent women.http://t.co/Hi3kyVHopC
https://twitter.com/AgentPete/status/515981665060278272,Mon Feb 25 16:03:47 +0000 2008,2014-09-27 21:49:50,0,0,repNone,,False,I’m so angry with the #NFL for paralyzing central London today. Closing Regent St for a dumb NFL promo is antisocial and frankly dangerous.
https://twitter.com/AgentPete/status/515088642411618304,Mon Feb 25 16:03:47 +0000 2008,2014-09-25 10:41:16,0,1,repNone,,False,"RT @GarryBushell: My new podcast now up with a Buster Shuffle live session &amp; music from 1Eye, The Q, Blackwolf, The Fallen &amp; much more http…"
https://twitter.com/AgentPete/status/514883261064314881,Mon Feb 25 16:03:47 +0000 2008,2014-09-24 21:05:10,0,1,repNone,Bustershuffle,False,"@Bustershuffle's new show with Garry Bushell just gone live, what a totally nice band they are, lovely people! http://t.co/nCGCm2Dhuw"
https://twitter.com/AgentPete/status/514691000716247041,Mon Feb 25 16:03:47 +0000 2008,2014-09-24 08:21:11,0,0,repNone,,False,"I suspect middle age starts when you need to put your glasses on to have sex. Just a hypothetical, obviously."
https://twitter.com/AgentPete/status/512984987894026240,Mon Feb 25 16:03:47 +0000 2008,2014-09-19 15:22:06,0,0,repNone,,False,Verbally assailed six times by chuggers in a 3-min walk down Baker Street. I finally snapped at the 6th one. This is simply dreadful.
https://twitter.com/AgentPete/status/512588291431206913,Mon Feb 25 16:03:47 +0000 2008,2014-09-18 13:05:46,0,0,rep512580157551697920,ed_pr,False,@ed_pr Give Mal my love :)
https://twitter.com/AgentPete/status/511833471359418369,Mon Feb 25 16:03:47 +0000 2008,2014-09-16 11:06:23,0,1,repNone,,False,"RT @iansiBalls: @BytetheBook did you eat Hillary?(ah, the cheap laugh). Tues avo central london work for you? I'm on important aquarium bus…"
https://twitter.com/AgentPete/status/507904390335057920,Mon Feb 25 16:03:47 +0000 2008,2014-09-05 14:53:37,0,1,repNone,,False,RT @iansiBalls: Just in time for kickoff #cutedog Olive does the Heisman! @HeismanTrophy #NFL http://t.co/I0FhNAxAUx
https://twitter.com/AgentPete/status/507091426979901441,Mon Feb 25 16:03:47 +0000 2008,2014-09-03 09:03:12,0,0,repNone,,False,Shocked that Apple has leaked salacious pictures of me &amp; my pet goat Miss Misty Blue-Eyes to gutter http://t.co/lTUeK1rQ7Q must be exhumed.
https://twitter.com/AgentPete/status/505041102270136320,Mon Feb 25 16:03:47 +0000 2008,2014-08-28 17:15:56,0,2,repNone,,False,"RT @iansiBalls: All #BurningMan needs now is Whole Foods, wifi and a school shooting. Stick a(nother) fork in it. #dreamover #sigh http://t…"
https://twitter.com/AgentPete/status/504923555331833856,Mon Feb 25 16:03:47 +0000 2008,2014-08-28 09:28:51,0,0,repNone,,False,"Avoiding #Triyoga until its nasty, yobbish teacher training course has finished. Their customer care has fallen off a cliff :("
https://twitter.com/AgentPete/status/502463091242987520,Mon Feb 25 16:03:47 +0000 2008,2014-08-21 14:31:50,0,0,repNone,,False,If you like film noir... http://t.co/qHlQtDDnKH
https://twitter.com/AgentPete/status/502397874702123009,Mon Feb 25 16:03:47 +0000 2008,2014-08-21 10:12:42,0,0,repNone,,False,"The world may be burning, but at least Tony and Dubya are having a nice time – something to be grateful for http://t.co/4bDWYTJplh"
https://twitter.com/AgentPete/status/502021333602304001,Mon Feb 25 16:03:47 +0000 2008,2014-08-20 09:16:27,0,0,repNone,,False,"Grateful for the life of BKS #Iyengar. Not a god, please don’t deify him – a purposeful life, well lived."
https://twitter.com/AgentPete/status/501325682312761345,Mon Feb 25 16:03:47 +0000 2008,2014-08-18 11:12:11,0,0,repNone,,False,My take on #TheRover film http://t.co/a1G49YYxiH
https://twitter.com/AgentPete/status/499627328759402496,Mon Feb 25 16:03:47 +0000 2008,2014-08-13 18:43:32,1,0,repNone,,False,Our lovely local #Everyman... always there with le mot juste http://t.co/qY8UbFpD9R
https://twitter.com/AgentPete/status/499177945291059200,Mon Feb 25 16:03:47 +0000 2008,2014-08-12 12:57:51,2,1,repNone,,False,So very sad to hear about #RobinWilliams :(
https://twitter.com/AgentPete/status/498882386550345729,Mon Feb 25 16:03:47 +0000 2008,2014-08-11 17:23:24,0,0,rep498843547106549761,empireofbooks,False,@empireofbooks Soon :) Keep in touch... P.
https://twitter.com/AgentPete/status/498752516243599360,Mon Feb 25 16:03:47 +0000 2008,2014-08-11 08:47:20,0,0,rep498106954271973376,empireofbooks,False,"@empireofbooks Yes, some very good news soon. Join Litopia, that's where it will be announced :)"
https://twitter.com/AgentPete/status/497715000761270272,Mon Feb 25 16:03:47 +0000 2008,2014-08-08 12:04:37,0,0,repNone,,False,Forthcoming on Litopia http://t.co/JbrYwSqmDd via @Litopia
https://twitter.com/AgentPete/status/497393399826100224,Mon Feb 25 16:03:47 +0000 2008,2014-08-07 14:46:42,0,0,repNone,,False,Review: - A Small Family Business http://t.co/B8lNKaEcRk via @Litopia
https://twitter.com/AgentPete/status/496712374879936513,Mon Feb 25 16:03:47 +0000 2008,2014-08-05 17:40:33,0,2,repNone,,False,RT @iansiBalls: #cutedog Olive: Sometimes life must contemplate death. And vice versa. @sameetkumar can help. http://t.co/HHO4lYDkEW http:/…
https://twitter.com/AgentPete/status/496410994445672449,Mon Feb 25 16:03:47 +0000 2008,2014-08-04 21:42:58,1,0,repNone,,False,Dang! That's my chilli shirt!!! RT @NevilleStaple: podcast interview nr Baker St London  http://t.co/6uhtV82uVW
https://twitter.com/AgentPete/status/496266920036139008,Mon Feb 25 16:03:47 +0000 2008,2014-08-04 12:10:28,0,0,repNone,,False,Nice deconstruction of Obama’s “folksiness”... folks http://t.co/lmwdp1jUaK
https://twitter.com/AgentPete/status/494415048467836928,Mon Feb 25 16:03:47 +0000 2008,2014-07-30 09:31:48,1,0,repNone,,False,"Wherever there’s conflict, big oil/gas interests not far away. #Ukraine crisis agenda, maybe? http://t.co/RexORhcdxg"
https://twitter.com/AgentPete/status/493114022036639744,Mon Feb 25 16:03:47 +0000 2008,2014-07-26 19:21:59,0,1,repNone,,False,RT @iansiBalls: Check it or the dog gets it. It being dry food only. And nobody wants that. Even @AgentPete http://t.co/1LVRLM4sl4 http://t…
https://twitter.com/AgentPete/status/492593873466978304,Mon Feb 25 16:03:47 +0000 2008,2014-07-25 08:55:06,0,0,repNone,,False,Love this pic of recent guest &amp; reggae legend Roy Ellis with our host Garry http://t.co/xScOHL7nL3 http://t.co/9ZxO0e0hSt
https://twitter.com/AgentPete/status/492252416566628352,Mon Feb 25 16:03:47 +0000 2008,2014-07-24 10:18:16,1,0,repNone,,False,"Yes, your #Nandos chicken may be contaminated - but give a thought to the cruel life of the poor chicken too, please. http://t.co/5iXWEBnrhj"
https://twitter.com/AgentPete/status/491587279052611584,Mon Feb 25 16:03:47 +0000 2008,2014-07-22 14:15:15,0,0,repNone,,False,Beef is 10 times more damaging to the environment... as I wrote some 25 years ago... http://t.co/tpGmZ5DnMs
https://twitter.com/AgentPete/status/489045594410057728,Mon Feb 25 16:03:47 +0000 2008,2014-07-15 13:55:30,1,0,repNone,,False,"Really enjoyed the 3-hander #Daytona @ Theatre Royal Haymarket. Maureen Lipman + Mr. Burns from The Simpsons, what’s not to like?"
https://twitter.com/AgentPete/status/486624745816092672,Mon Feb 25 16:03:47 +0000 2008,2014-07-08 21:35:55,0,0,repNone,,False,"Weirdest thing: everyone in #Boyhood visibly ages, except Ethan Hawke - who gets visibly younger! Spooky! #DorianGray"
https://twitter.com/AgentPete/status/486584446322483201,Mon Feb 25 16:03:47 +0000 2008,2014-07-08 18:55:46,0,0,repNone,,False,"Off to see #Boyhood in a few mins, I have high hopes...:)"
https://twitter.com/AgentPete/status/486234692921077760,Mon Feb 25 16:03:47 +0000 2008,2014-07-07 19:45:59,0,0,repNone,,False,"Unlikeable, pretentious, superficial &amp; insufferably tedious... #Chef is sadly my candidate for worst movie of the year – so far :("
https://twitter.com/AgentPete/status/483528372426121216,Mon Feb 25 16:03:47 +0000 2008,2014-06-30 08:32:02,1,0,repNone,,False,"“Cold In July”, more like lukewarm in pasticheville: a reasonable thriller whose dénouement is marred by oh-so-self-conscious Tarantinery."
https://twitter.com/AgentPete/status/481770268600590336,Mon Feb 25 16:03:47 +0000 2008,2014-06-25 12:05:57,0,0,repNone,,False,Amazon/Hachette wrange kills JK Rowlings new title http://t.co/XhFbrPheO9
https://twitter.com/AgentPete/status/481398326429253632,Mon Feb 25 16:03:47 +0000 2008,2014-06-24 11:27:59,0,0,repNone,,False,"Proud to announce a brand new show on Litopia, BURNING BOOKS! More here http://t.co/NT2pWvMx5Q"
https://twitter.com/AgentPete/status/481171266091905024,Mon Feb 25 16:03:47 +0000 2008,2014-06-23 20:25:44,0,0,repNone,,False,"I’m appalled by this: HC sticking to 25%, and sticking it to authors, too. They will regret it. http://t.co/VAOdJw9xpM"
https://twitter.com/AgentPete/status/480093663432015873,Mon Feb 25 16:03:47 +0000 2008,2014-06-20 21:03:43,0,0,rep480083511580581888,iansiBalls,False,"@iansiBalls I know, i know... :)"
https://twitter.com/AgentPete/status/480071665364508672,Mon Feb 25 16:03:47 +0000 2008,2014-06-20 19:36:18,0,0,repNone,,False,"Jersey Boys only truly comes alive in the excellent closing credits; why couldn’t the whole film be like this, Clint?"
https://twitter.com/AgentPete/status/479223479901122561,Mon Feb 25 16:03:47 +0000 2008,2014-06-18 11:25:55,0,0,repNone,,False,"The tediously self-promoting Jeanette Winterson has been out of the headlines for a while, so she kills a rabbit. Yawn."
https://twitter.com/AgentPete/status/478906578738085888,Mon Feb 25 16:03:47 +0000 2008,2014-06-17 14:26:40,0,0,repNone,,False,"A $14m advance for a political memoir is insane! And sucks funds away from other authors, too. No sympathy. http://t.co/x9aXt9T3fg"
https://twitter.com/AgentPete/status/478886059271806976,Mon Feb 25 16:03:47 +0000 2008,2014-06-17 13:05:08,0,0,repNone,,False,95% of US terrorist arrests since 9/11 the result of FBI foiling its own entrapment plots says new study. http://t.co/fow4YzErIM
https://twitter.com/AgentPete/status/478816775577276416,Mon Feb 25 16:03:47 +0000 2008,2014-06-17 08:29:49,0,0,repNone,,False,To Regent’s Park Open Air Theatre ce soir for Hobson’s Choice... weather looks threatening...
https://twitter.com/AgentPete/status/478465768620032000,Mon Feb 25 16:03:47 +0000 2008,2014-06-16 09:15:03,2,0,repNone,,False,"Of all the things #Blair could say about Iraq “it could be worse” is perhaps the most fatuous, heartless &amp; egregious http://t.co/u3MuV4o6tV"
https://twitter.com/AgentPete/status/478462900345266176,Mon Feb 25 16:03:47 +0000 2008,2014-06-16 09:03:39,0,2,repNone,,False,Ian McDiarmid (Palpatine!) gives a virtuoso performance in #BakersfieldMist. Highly recommended if you’re looking for great London theatre.
https://twitter.com/AgentPete/status/477535984662609920,Mon Feb 25 16:03:47 +0000 2008,2014-06-13 19:40:25,0,0,repNone,,False,"@142books Worth seeing if you perversely enjoy/could professionally learn from movie misfires. Otherwise, normal people... stay well away :)"
https://twitter.com/AgentPete/status/477533960093048832,Mon Feb 25 16:03:47 +0000 2008,2014-06-13 19:32:22,0,0,repNone,,False,"Just seen TS Spivet. Cannot believe this is the same director as “Amelie”. Ay, caramba."
https://twitter.com/AgentPete/status/477035442903449600,Mon Feb 25 16:03:47 +0000 2008,2014-06-12 10:31:27,0,0,repNone,,False,One reason why #Blair should never be allowed to become President of Europe http://t.co/4W4OGMyqZE
https://twitter.com/AgentPete/status/476422790300839937,Mon Feb 25 16:03:47 +0000 2008,2014-06-10 17:56:59,0,0,repNone,,False,"Before knocking off, I offer you this priceless pearl of enlightenment: a tziganologist is one who studies Hungarian gypsies. Night, folks!"
https://twitter.com/AgentPete/status/476357190950072320,Mon Feb 25 16:03:47 +0000 2008,2014-06-10 13:36:19,0,1,repNone,,False,The fabulous Mal Peet tells you how to write football fiction in today’s Gdn http://t.co/KtXC7ja4a3 #WorldCup2014
https://twitter.com/AgentPete/status/476347323904438272,Mon Feb 25 16:03:47 +0000 2008,2014-06-10 12:57:06,0,0,repNone,,False,"VAT on books? Good god, that would really finish us off! #UtterMadness  http://t.co/WB05Dyxdf6"
https://twitter.com/AgentPete/status/476285823013646336,Mon Feb 25 16:03:47 +0000 2008,2014-06-10 08:52:43,0,0,repNone,,False,"Academic publishers have always ripped off authors, fact. Why so surprising that the truth should finally emerge? http://t.co/m2vmDj8iL5"
https://twitter.com/AgentPete/status/476069733163597825,Mon Feb 25 16:03:47 +0000 2008,2014-06-09 18:34:03,0,0,repNone,,False,I went straight from the heart-stopping finale of #BreakingBad to watching “Grace of Monaco”. No wonder I’m feeling nauseous.
https://twitter.com/AgentPete/status/475974144136605696,Mon Feb 25 16:03:47 +0000 2008,2014-06-09 12:14:13,0,1,repNone,,False,“Powerful” enemies? Don’t think so! Top authors slate Amazon... consumers yawn. http://t.co/FltWJynvjv
https://twitter.com/AgentPete/status/475920466876833792,Mon Feb 25 16:03:47 +0000 2008,2014-06-09 08:40:56,0,0,repNone,,False,Excellent NYT critique of the “Something for Nothing” economy. It’s decimated music biz - publishing is sinking fast. http://t.co/XWUifkj6cr
https://twitter.com/AgentPete/status/475905827707293697,Mon Feb 25 16:03:47 +0000 2008,2014-06-09 07:42:45,0,0,rep475888604682518528,agmonporat,False,@12mass You tweet like one.
https://twitter.com/AgentPete/status/475880820864188416,Mon Feb 25 16:03:47 +0000 2008,2014-06-09 06:03:23,0,0,rep475547946746773504,agmonporat,False,"@12mass Sod off,bot."
https://twitter.com/AgentPete/status/475228268669718528,Mon Feb 25 16:03:47 +0000 2008,2014-06-07 10:50:23,0,1,rep475039797904695297,RealMGHarris,False,"@RealMGHarris Highest praise I can give BB is that at its best, it achieved Shakespearean dimensions. Stunning creation."
https://twitter.com/AgentPete/status/474972997254926336,Mon Feb 25 16:03:47 +0000 2008,2014-06-06 17:56:01,0,0,rep474944221531869184,RealMGHarris,False,@RealMGHarris I am virgin and untainted by spoilers :) BB is a masterpiece. Here we go - see you on the other side...
https://twitter.com/AgentPete/status/474835906785206272,Mon Feb 25 16:03:47 +0000 2008,2014-06-06 08:51:16,1,0,repNone,,False,Genuinely disturbed/apprehensive – watching final two episodes of Breaking Bad tonight.  Don’t let me down...
https://twitter.com/AgentPete/status/474485942271901696,Mon Feb 25 16:03:47 +0000 2008,2014-06-05 09:40:38,0,0,repNone,,False,Secret Service to track sarcastic tweets.  That’s ironic. http://t.co/jgN5Ms5XC1
https://twitter.com/AgentPete/status/474282338374148097,Mon Feb 25 16:03:47 +0000 2008,2014-06-04 20:11:35,0,1,repNone,,False,"RT @iansiBalls: So Amazons all ""J.K. Who?"" Industry's like ""Oh no they di'nt!"" Then MoS quotes @AgentPete &amp; namechecks @Litopia!  http://t.…"
https://twitter.com/AgentPete/status/472802110116220928,Mon Feb 25 16:03:47 +0000 2008,2014-05-31 18:09:41,2,1,repNone,,False,Just wanted to share my evening shot of Castle Corfe: http://t.co/cXnuNInOEE
https://twitter.com/AgentPete/status/471947282787868672,Mon Feb 25 16:03:47 +0000 2008,2014-05-29 09:32:55,0,0,repNone,,False,London’s Dirty Secret: Pollution Worse Than Beijing’s http://t.co/IoPc68NtvK
https://twitter.com/AgentPete/status/468446173423206401,Mon Feb 25 16:03:47 +0000 2008,2014-05-19 17:40:45,0,0,repNone,,False,Looking forward to Miller's All My Sons in Regent’s Park Open Air Theatre tomorrow eve... if the weather holds...
https://twitter.com/AgentPete/status/468037076982980608,Mon Feb 25 16:03:47 +0000 2008,2014-05-18 14:35:09,0,0,repNone,,False,Godzilla needed that Spielberg magic: B-movies shouldn’t take themselves too seriously.
https://twitter.com/AgentPete/status/467610147494563840,Mon Feb 25 16:03:47 +0000 2008,2014-05-17 10:18:41,1,0,repNone,,False,"Yes, I’m sure #Godzilla will be pants, but I could watch Bryan Cranston read the phone book and die happy."
https://twitter.com/AgentPete/status/467399233570893825,Mon Feb 25 16:03:47 +0000 2008,2014-05-16 20:20:35,0,0,repNone,,False,"Truthfully, I didn’t really care about anyone in The Two faces of January. The hats were nice, tho."
https://twitter.com/AgentPete/status/467397731401883648,Mon Feb 25 16:03:47 +0000 2008,2014-05-16 20:14:37,0,0,rep467292593286823936,The1980sGirl,False,"@Claudia80sGirl I'm wretchedly over-committed at the moment, Claudia, sorry but not enough hours in the day :("
https://twitter.com/AgentPete/status/466886573729284096,Mon Feb 25 16:03:47 +0000 2008,2014-05-15 10:23:28,0,0,rep466881882207318017,iansiBalls,False,"@iansiBalls I am so asskicking that my backlog no longer has a bottom. Or is bottomless, can’t decide."
https://twitter.com/AgentPete/status/466880520576843776,Mon Feb 25 16:03:47 +0000 2008,2014-05-15 09:59:24,0,0,repNone,,False,Took a precious day out yesterday to take a yoga workshop. Utter waste of time and money. Feel like a mug today - and the backlog... :(
https://twitter.com/AgentPete/status/466140597452288000,Mon Feb 25 16:03:47 +0000 2008,2014-05-13 08:59:13,1,0,repNone,,False,"Should we launch a Kickstarter campaign to end #RichardandJudy’s suffering? It’s the kindest thing to do, I think http://t.co/TP8nwA8iHo"
https://twitter.com/AgentPete/status/465476777394339841,Mon Feb 25 16:03:47 +0000 2008,2014-05-11 13:01:26,0,0,repNone,,False,"For me, best film of the year so far is #Locke: most overhyped/rated, #Frank."
https://twitter.com/AgentPete/status/465201412214128641,Mon Feb 25 16:03:47 +0000 2008,2014-05-10 18:47:14,1,0,rep465200768434184192,RebeccaEnzor,False,"@RebeccaEnzor Very low on magic, sadly. But pretty big on pre-war Japanese fighter plane design :)"
https://twitter.com/AgentPete/status/465198997817135104,Mon Feb 25 16:03:47 +0000 2008,2014-05-10 18:37:38,0,0,rep465197829406068737,RebeccaEnzor,False,"@RebeccaEnzor You should still see it... with expectations lowered, I think."
https://twitter.com/AgentPete/status/465197657871642624,Mon Feb 25 16:03:47 +0000 2008,2014-05-10 18:32:19,0,0,repNone,,False,"Would love to say that Miyazaki’s #TheWindRises is a brilliant farewell – but it’s simply dull, shapeless and deeply disappointing :("
https://twitter.com/AgentPete/status/463997370590826496,Mon Feb 25 16:03:47 +0000 2008,2014-05-07 11:02:48,0,0,repNone,,False,"#PayPal customer service: an oxymoron.  Absolutely Kafkaesque. Designed to make problems disappear - theirs, not yours. Deep sigh."
https://twitter.com/AgentPete/status/463330017284726784,Mon Feb 25 16:03:47 +0000 2008,2014-05-05 14:50:59,0,0,rep463323645750677504,iansiBalls,False,@iansiBalls Always was. Please note this is a Bank Holiday and I'm working my fingers to bone on the new website. Greater love hath no man.
https://twitter.com/AgentPete/status/463309261800742913,Mon Feb 25 16:03:47 +0000 2008,2014-05-05 13:28:30,0,0,rep463244688557096960,iansiBalls,False,"@iansiBalls Strange, my Scottish friends often ask me, what exactly is a techno-pagan octopus?"
