id,Account Created At(same for all rows),status created_at,Fav_cont,retweeted_count,reply_to_status,reply_to_screen,quote,text
https://twitter.com/AgentPete/status/1334801394260447239,Mon Feb 25 16:03:47 +0000 2008,2020-12-04 10:07:06,0,305,repNone,,False,RT @blackwelloxford: Want to start 2021 with a win? We're giving away a personalised 12 month paperback subscription! That's twelve books c…
https://twitter.com/AgentPete/status/1334044926045261825,Mon Feb 25 16:03:47 +0000 2008,2020-12-02 08:01:10,0,0,repNone,,False,"On today’s show:  Millennials Vs. Boomers – who’s got the best deal?  Millennials have their smartphones and their avo toast… but Boomers had free college education, great pensions and steady employment… none of which today’s young people will have https://t.co/uKb12jFIHH"
https://twitter.com/AgentPete/status/1333682523172376576,Mon Feb 25 16:03:47 +0000 2008,2020-12-01 08:01:06,1,0,repNone,,False,On today’s show:  Stunning incompetence?  An ideology-driven agenda? Or perhaps a mixture of both?  Today we’re exploring the British government's lamentable response to the #Covid-19 pandemic - the gravest public health crisis in a generation https://t.co/t8UcgJbxqd
https://twitter.com/AgentPete/status/1333387611415736320,Mon Feb 25 16:03:47 +0000 2008,2020-11-30 12:29:14,1,1,repNone,,False,"On today’s show:  An intelligent look at the myth  that “we can’t live beyond our means”.  While that's true of individuals, it's absolutely not true for governments.  In fact, governments *must* borrow in order to keep the private sector healthy…! https://t.co/lsShhkI8dw"
https://twitter.com/AgentPete/status/1332285199963582465,Mon Feb 25 16:03:47 +0000 2008,2020-11-27 11:28:38,0,0,repNone,,False,What Is #Sunak’s Spending Review Really Doing?  Today’s video looks at the ideological agenda behind the British Chancellors’ forthcoming #austerity measures https://t.co/2wztF5Nlrq
https://twitter.com/AgentPete/status/1331267061721534464,Mon Feb 25 16:03:47 +0000 2008,2020-11-24 16:02:55,0,0,repNone,,False,Many people are concerned about the ways in which Britain’s (largely) unwritten #constitution is being subverted for political ends. Today’s NEXT SIX MONTHS asks what can be done https://t.co/Tcx1Ku1hE7 #freedom
https://twitter.com/AgentPete/status/1330960605914800128,Mon Feb 25 16:03:47 +0000 2008,2020-11-23 19:45:11,2,0,repNone,,False,"There’ s a perception that “the economy” is a sort of force of nature – we can’t change it, it’s just how things are.   Today’s NEXT SIX MONTHS presents a new vision for the #economy https://t.co/LqhGWmsbRu #financialcrisis"
https://twitter.com/AgentPete/status/1330882911097278464,Mon Feb 25 16:03:47 +0000 2008,2020-11-23 14:36:27,2,1,repNone,,False,"What is the real agenda of Boris Johnson's government?  On today’s NEXT SIX MONTHS, we’re looking at the plan to remake the British state https://t.co/ZnZSlCeTLK #brexit #COVID19"
https://twitter.com/AgentPete/status/1326903901640126468,Mon Feb 25 16:03:47 +0000 2008,2020-11-12 15:05:17,0,0,repNone,,False,Today’s video from me and economist Mark Thomas explores disaster scenarios for the next six months… What Keeps You Up At Night?  https://t.co/042ZTMFL6P  #money #finance
https://twitter.com/AgentPete/status/1319985595737870337,Mon Feb 25 16:03:47 +0000 2008,2020-10-24 12:54:24,0,0,repNone,Hyperoptic,False,@Hyperoptic  My router is failing here... and so is your service :(
https://twitter.com/AgentPete/status/1315943133667037184,Mon Feb 25 16:03:47 +0000 2008,2020-10-13 09:11:06,0,0,repNone,,False,Shocking that the govt dithered for 3 weeks following clear #SAGE advice to impose a lockdown.  The sitn now is far more difficult because of that.  Sheer incompetence – or worse. #COVID19
https://twitter.com/AgentPete/status/1313549773111205893,Mon Feb 25 16:03:47 +0000 2008,2020-10-06 18:40:45,0,0,repNone,marcuswquinn,False,"@marcuswquinn You took £236.30 from my payPal account on 13th August.  You don't answer your phone or respond to emails.  And of course you didn't send the goods.  Now, what does that make you...?"
https://twitter.com/AgentPete/status/1300850427106406400,Mon Feb 25 16:03:47 +0000 2008,2020-09-01 17:38:05,1,0,repNone,,False,I've just rebooted into Safe Mode.
https://twitter.com/AgentPete/status/1287831114615267329,Mon Feb 25 16:03:47 +0000 2008,2020-07-27 19:23:59,0,0,rep1287819172165160961,Sendinblue,False,"@Sendinblue ""Haven't had the best experience...""?  You are surely joking.  Your customer service is shockingly bad.  You appear to be entirely staffed by algorithms.  I want nothing further to do with you."
https://twitter.com/AgentPete/status/1287814333263683589,Mon Feb 25 16:03:47 +0000 2008,2020-07-27 18:17:18,1,0,repNone,,False,Shockingly bad customer service from @Sendinblue.  Everything seems to be driven by algorithms.  And bad ones at that. :(
https://twitter.com/AgentPete/status/1277519569687642112,Mon Feb 25 16:03:47 +0000 2008,2020-06-29 08:29:35,1,0,repNone,,False,"Terrific show yesterday, thank you Melissa Eveleigh of publsiher @MarchHamilton and Litopian author Georgina Kay https://t.co/6GzBKTfJJY"
https://twitter.com/AgentPete/status/1274800856228155396,Mon Feb 25 16:03:47 +0000 2008,2020-06-21 20:26:23,0,0,repNone,,False,Pop-Up Submissions LIVE with Special Guest Brian Clegg &amp; Publisher Bella Pearson! https://t.co/le3ycla4FJ
https://twitter.com/AgentPete/status/1273936888643162113,Mon Feb 25 16:03:47 +0000 2008,2020-06-19 11:13:17,1,0,repNone,,False,"Seriously regretting buying my blades from @shavingshack.  Watch this video, and you’ll never buy a #badger bristle #shaving brush again.  https://t.co/MG6FQLehuX"
https://twitter.com/AgentPete/status/1273265921830924290,Mon Feb 25 16:03:47 +0000 2008,2020-06-17 14:47:06,0,0,repNone,,False,Post in thread 'Corona-memes: A bit of a laugh during a time of plague.' https://t.co/fcRIZ4Iaac via @Litopia
https://twitter.com/AgentPete/status/1263771965023715330,Mon Feb 25 16:03:47 +0000 2008,2020-05-22 10:01:30,0,0,repNone,,False,"Can I just ask about the problem I have with @Postbox, please?  A helpful response would be nice..."
https://twitter.com/AgentPete/status/1259844716444729345,Mon Feb 25 16:03:47 +0000 2008,2020-05-11 13:56:01,0,7195,repNone,,False,RT @pete_sinclair: This is the work of the nudge unit. Ignore the words. Red means STOP. Green means GO. The subliminal message is to encou…
https://twitter.com/AgentPete/status/1243239661809664001,Mon Feb 25 16:03:47 +0000 2008,2020-03-26 18:13:28,0,9,repNone,,False,"RT @ed_pr: We're very excited to announce our #blogtour for #VipersDaughter! Starting next week, we'll be hearing from all these brilliant…"
https://twitter.com/AgentPete/status/1242815476708904960,Mon Feb 25 16:03:47 +0000 2008,2020-03-25 14:07:54,0,0,repNone,,False,"Food supplies in central London are clearly running lower and lower daily.  Please take decisive #ActionThisDay @BorisJohnson, as your inspiration Mr. Churchill would have done. #covid19UK"
https://twitter.com/AgentPete/status/1241044009327513600,Mon Feb 25 16:03:47 +0000 2008,2020-03-20 16:48:43,0,367,repNone,,False,"RT @TheMendozaWoman: Tim Martin is the embodiment of disaster capitalism. He’s inviting his customers to die, rather than lose their custom…"
https://twitter.com/AgentPete/status/1236349670298923009,Mon Feb 25 16:03:47 +0000 2008,2020-03-07 17:55:06,0,0,repNone,,False,Tomorrow's Pop-Up Submissions: climatic fiction by Oliver Prescott; comedy by Tom Duggins; spec fiction by Caroline A Scott; post-apocalyptic distopia by Theodor Bernard Kung; espionage by Billy Mays. Join us! https://t.co/ztVLuWStQT #writingtips #getpublished #literaryagentpitch
https://twitter.com/AgentPete/status/1201096356577853442,Mon Feb 25 16:03:47 +0000 2008,2019-12-01 11:11:01,0,1,repNone,,False,Take a break from the Xmas insanity &amp; join me plus very special guest Daisy Waugh at 5pm UK time today for Pop-Up Submissions… https://t.co/WViq2DFAQZ
https://twitter.com/AgentPete/status/1198905722307842048,Mon Feb 25 16:03:47 +0000 2008,2019-11-25 10:06:13,1,0,repNone,,False,Delighted to say that my client Mark Thomas’s book “99%: Mass Impoverishment and How We Can End It” has been chosen by Martin Wolf of the Financial Times as one of his Best Books of 2019 :) https://t.co/9ze019dxKM
https://twitter.com/AgentPete/status/1198564268398071809,Mon Feb 25 16:03:47 +0000 2008,2019-11-24 11:29:24,0,0,repNone,,False,Welcome to #Margate! Apparently this is called Dreamland. Oh dear. https://t.co/AlC37z0CJc
https://twitter.com/AgentPete/status/1185563726050680832,Mon Feb 25 16:03:47 +0000 2008,2019-10-19 14:29:53,1,0,rep1185552210761015296,aamnamohdin,False,"@aamnamohdin I saw this.  Less than 10 “pro Brexit” yobs, chanting football slogans, clearly looking for a fight.  Followed everywhere by the same number of police.  You didn’t give any context."
https://twitter.com/AgentPete/status/1181554603340521472,Mon Feb 25 16:03:47 +0000 2008,2019-10-08 12:59:04,0,0,repNone,,False,"Boris Johnson’s script rejection is a good example of why I say, for most writers, working on an unsol screenplay is not the way to go about getting a movie deal https://t.co/itYyNFRWjz https://t.co/EUnhYvOQ5Q"
https://twitter.com/AgentPete/status/1181075043247415296,Mon Feb 25 16:03:47 +0000 2008,2019-10-07 05:13:28,0,0,repNone,,False,6am Victoria https://t.co/G2J3XeiM4Y
https://twitter.com/AgentPete/status/1180129666285350913,Mon Feb 25 16:03:47 +0000 2008,2019-10-04 14:36:52,0,0,repNone,,False,Test integration #torak
https://twitter.com/AgentPete/status/1169953296070651904,Mon Feb 25 16:03:47 +0000 2008,2019-09-06 12:39:37,0,0,repNone,,False,"On this Sunday's Pop-Ups... ""A Continuum of Love"" by Ernest Pick; ""Danny's Choice"" by Jim Erith; ""Little Faustus"" by Bertie Nuttall; “A Fool's Diary"" by Brian Hurley; ""Darkness &amp; Light"" by Kyle Hoy. Join us live at 5pm UK! https://t.co/15HUsvlj2k #amwriting #writingtips"
https://twitter.com/AgentPete/status/1169533426464149504,Mon Feb 25 16:03:47 +0000 2008,2019-09-05 08:51:12,0,1,repNone,,False,"RT @AgentPete: Would be interested to know, @OgilvyUK @rorysutherland, why you've pulled down your #Nudgestock video of Dominic Cummings ex…"
https://twitter.com/AgentPete/status/1169312222520250368,Mon Feb 25 16:03:47 +0000 2008,2019-09-04 18:12:13,0,1,repNone,,False,"Would be interested to know, @OgilvyUK @rorysutherland, why you've pulled down your #Nudgestock video of Dominic Cummings explaining how he masterminded the #Brexit vote?  Thanks in anticipation..."
https://twitter.com/AgentPete/status/1169247992093843457,Mon Feb 25 16:03:47 +0000 2008,2019-09-04 13:56:59,0,1,repNone,,False,"Fascinating behind-the-scenes confession of how Dominic Cummings pulled our strings to vote for #Brexit. This is not Rasputin-level juju, it’s really just basic marketing. https://t.co/q5yo9nYgCv"
https://twitter.com/AgentPete/status/1168547170213146624,Mon Feb 25 16:03:47 +0000 2008,2019-09-02 15:32:10,0,0,repNone,,False,Test Twitter integration #torak
https://twitter.com/AgentPete/status/1167168101286318080,Mon Feb 25 16:03:47 +0000 2008,2019-08-29 20:12:14,1,0,repNone,,False,"Worth revisiting this video, I think.  Many people were persuaded to vote for #brexit on the basis of NOT leaving the single market.  That is clearly not the deal we are now being bum-rushed into. https://t.co/UlwdgMAHbH"
https://twitter.com/AgentPete/status/1166814982396370950,Mon Feb 25 16:03:47 +0000 2008,2019-08-28 20:49:04,0,3741,repNone,,False,"RT @dcakraemer: Remember that time Matt Hancock said prorogation would go against ""everything that those men who waded onto those beaches f…"
https://twitter.com/AgentPete/status/1166812398201819144,Mon Feb 25 16:03:47 +0000 2008,2019-08-28 20:38:48,1,0,repNone,,False,Opinion: At least Boris Johnson had the decency not to try and conceal his lies with a straight face https://t.co/A5gfqTitjf
https://twitter.com/AgentPete/status/1166806869731659781,Mon Feb 25 16:03:47 +0000 2008,2019-08-28 20:16:50,0,220,repNone,,False,"RT @Ian_Fraser: ""You don't deliver on democracy by trashing democracy . . . we are not selecting a dictator of our country"". Yes, these wer…"
https://twitter.com/AgentPete/status/1166798919415808000,Mon Feb 25 16:03:47 +0000 2008,2019-08-28 19:45:15,0,941,repNone,,False,"RT @SimonFraser00: As I recall, the original argument for #Brexit, all those moons ago, was that it would restore sovereign powers to the B…"
https://twitter.com/AgentPete/status/1166798096350810113,Mon Feb 25 16:03:47 +0000 2008,2019-08-28 19:41:58,0,208,repNone,,False,RT @DarrenEuronews: Whether you believe in #Brexit or not - no doubt UK’s reputation internationally has taken a kicking👊🏻  🇮🇹I’m in Italy…
https://twitter.com/AgentPete/status/1166786729820471296,Mon Feb 25 16:03:47 +0000 2008,2019-08-28 18:56:48,0,3248,repNone,,False,"RT @Haggis_UK: Amber Rudd - It would be absolutely outrageous for Boris Johnson to #prorogue Parliament... Proroguing parliament is ""the mo…"
https://twitter.com/AgentPete/status/1166783854323097600,Mon Feb 25 16:03:47 +0000 2008,2019-08-28 18:45:23,12,8,repNone,,False,Parliament Square just now #Brexit https://t.co/RsLtn6eJrt
https://twitter.com/AgentPete/status/1166777821550862336,Mon Feb 25 16:03:47 +0000 2008,2019-08-28 18:21:24,5,3,repNone,,False,Downing St just now #Brexit https://t.co/chyewO5IYn
https://twitter.com/AgentPete/status/1166757997504319489,Mon Feb 25 16:03:47 +0000 2008,2019-08-28 17:02:38,0,82773,repNone,,True,RT @HackedOffHugh: You will not fuck with my children’s future. You will not destroy the freedoms my grandfather fought two world wars to d…
https://twitter.com/AgentPete/status/1166659278524092416,Mon Feb 25 16:03:47 +0000 2008,2019-08-28 10:30:22,0,0,repNone,,False,“Wouldn't it be simpler... if the government dissolved the people and elected another?” #Brecht #Brexit
https://twitter.com/AgentPete/status/1166658759277645824,Mon Feb 25 16:03:47 +0000 2008,2019-08-28 10:28:18,1,1,repNone,,False,"Or as Brecht said, “Wouldn't it be simpler... if the government dissolved the people and elected another?”  https://t.co/glyEjU5NSg https://t.co/eqC0UJPzKA"
https://twitter.com/AgentPete/status/1166289463263289345,Mon Feb 25 16:03:47 +0000 2008,2019-08-27 10:00:51,0,0,repNone,,False,"Well that was painless.  Turns out there are lots of #green electricty providers.  #Ecotricity is simply the most expensive.  Just switched to @bulbenergy's 100% renewable, saving £300 p.a.!"
https://twitter.com/AgentPete/status/1166274311616942081,Mon Feb 25 16:03:47 +0000 2008,2019-08-27 09:00:38,0,0,repNone,,False,"Oh boy.  After years and years, finally got round to checking out @DaleVince.  Not at all liking what I’m seeing, Dale.  Very pleased to be ""moving on"" from #Ecotricity today.  #unethical https://t.co/Ubaidymgjp"
https://twitter.com/AgentPete/status/1165972516965404673,Mon Feb 25 16:03:47 +0000 2008,2019-08-26 13:01:25,0,0,repNone,,False,"After years of paying through the nose for #Ecotricity, I am SO much looking forward to junking them tomorrow morning.  #unethical"
https://twitter.com/AgentPete/status/1165247536849981440,Mon Feb 25 16:03:47 +0000 2008,2019-08-24 13:00:36,0,0,repNone,,False,"So much looking forward to getting rid of #unethical #Ecotricity on Tuesday morning (and paying far less, too)."
https://twitter.com/AgentPete/status/1164915158562627586,Mon Feb 25 16:03:47 +0000 2008,2019-08-23 14:59:51,0,0,repNone,,False,"And yes, I still want @DaleVince’s private cellphone number, so I can bombard you, Dale, with junk texts.  After all, I do have that right, you know.  Or maybe you didn’t ready my T&amp;Cs?  (they're the same as #ecotricity's)"
https://twitter.com/AgentPete/status/1164913987445825542,Mon Feb 25 16:03:47 +0000 2008,2019-08-23 14:55:12,0,0,repNone,,False,"I didn’t know I was giving #Ecotricity permission to pass my private details to some anonymous third party (and who will they in turn give them to?)  But hey, somewhere in the T&amp;Cs it probably gives them Droit du Seigneur over my firstborn.  My stupid mistake #unethical"
https://twitter.com/AgentPete/status/1164912364271087622,Mon Feb 25 16:03:47 +0000 2008,2019-08-23 14:48:45,1,0,repNone,,False,"So really, the only difference between #ecotricity and – oh any other electricity company – is that they charge you 40% more.  They’re certainly no more #ethical."
https://twitter.com/AgentPete/status/1164911707334070272,Mon Feb 25 16:03:47 +0000 2008,2019-08-23 14:46:08,1,0,repNone,,False,"Hidden away in all this verbiage (you’ve read every word, right?) is a catch-all clause that gives them the right to violate your privacy in any way they so choose.  So that’s OK then, #ecotricity?"
https://twitter.com/AgentPete/status/1164910850978787330,Mon Feb 25 16:03:47 +0000 2008,2019-08-23 14:42:44,1,0,repNone,,False,"Beware #Ecotricity.  Not only will they charge you a 40% premium on your electricity bills.  But they will also bombard you with junk advertising texts.  “You have agreed to our terms and conditions”, they say. This is a 7000 word document!"
https://twitter.com/AgentPete/status/1164899686236479488,Mon Feb 25 16:03:47 +0000 2008,2019-08-23 13:58:22,1,0,rep1164895129745932289,ecotricity,False,@ecotricity Not getting a straight answer from you.  Very disillusioned with #Ecotricity.  Been paying a 40% premium to deal with you for years! Turns out you’re just as #unethical as any other multinational. :( Feel mugged.
https://twitter.com/AgentPete/status/1164893581544513538,Mon Feb 25 16:03:47 +0000 2008,2019-08-23 13:34:07,0,0,rep1164890094869929986,ecotricity,False,"@ecotricity The texts say they’re from #Ecotricity.  So that’s untrue, too?  #unethical"
https://twitter.com/AgentPete/status/1164890951405514752,Mon Feb 25 16:03:47 +0000 2008,2019-08-23 13:23:40,1,0,rep1164890094869929986,ecotricity,False,"@ecotricity #ecotricity  An afterthought.  Why don’t you give me @DaleVince’s private cellphone no?  I will then send him two unwanted junk texts every day.  If #ecotricity think that's OK to do to their customers, I'm sure Dale won't mind a bit. #unethical"
https://twitter.com/AgentPete/status/1164890045138051072,Mon Feb 25 16:03:47 +0000 2008,2019-08-23 13:20:04,0,0,rep1164885713722236930,ecotricity,False,"@ecotricity #ecotricity is allegedly an ethical company, that’s why I deal with you.  Abusing my data like this is a violation of trust.  I hope you can see that?  Or do you still maintain “we have the right to do that?” #unethical"
https://twitter.com/AgentPete/status/1164889123615911936,Mon Feb 25 16:03:47 +0000 2008,2019-08-23 13:16:24,0,0,rep1164885713722236930,ecotricity,False,"@ecotricity .../... I phoned to complain #ecotricity – this took half an hour – and was told it wouldn’t happen again.  Another junk txt has just come in.  You’ve given my personal data to a 3rd party, haven’t you?"
https://twitter.com/AgentPete/status/1164888970016280576,Mon Feb 25 16:03:47 +0000 2008,2019-08-23 13:15:47,0,0,rep1164885713722236930,ecotricity,False,@ecotricity You do not have - and never had had - permission to keep sending me junk texts.  You pulled me out of a meeting this am to read a junk text from #ecotricity.  .../...
https://twitter.com/AgentPete/status/1164843672967364611,Mon Feb 25 16:03:47 +0000 2008,2019-08-23 10:15:48,0,0,repNone,ecotricity,False,"@ecotricity touts itself as an ethical company. This apparently doesn’t prevent them from giving confidential customer info to 3rd parties, and sending you nuisance texts.  “We have the right to do so”, they tell me.  I don't pay a premium to be treated like this."
https://twitter.com/AgentPete/status/1159858627731251202,Mon Feb 25 16:03:47 +0000 2008,2019-08-09 16:07:00,0,0,repNone,,False,"Difficult to justify this obscenity, surely? Cyanide bombs ""kill vast numbers of wild animals each year"" https://t.co/mIkNd20uWw"
https://twitter.com/AgentPete/status/1155877431506608129,Mon Feb 25 16:03:47 +0000 2008,2019-07-29 16:27:09,0,0,repNone,,False,#michellepaver test tweet...
https://twitter.com/AgentPete/status/1151781061745172480,Mon Feb 25 16:03:47 +0000 2008,2019-07-18 09:09:38,0,0,repNone,,False,"Cripes! Had no idea the #BBC have a Director of Police! Would that be the Police Procedural Drama Police, the Policy Police i/c Police Policy, or the Thought Police? So bewildering! https://t.co/Xzv0L2DvPr"
https://twitter.com/AgentPete/status/1150418622998818816,Mon Feb 25 16:03:47 +0000 2008,2019-07-14 14:55:48,0,0,repNone,,False,Integration test no 2 #pop84
https://twitter.com/AgentPete/status/1150074336532946945,Mon Feb 25 16:03:47 +0000 2008,2019-07-13 16:07:43,0,0,repNone,,False,And another integration test... #pop84
https://twitter.com/AgentPete/status/1150068254330818561,Mon Feb 25 16:03:47 +0000 2008,2019-07-13 15:43:33,0,0,repNone,,False,This is a test tweet to see if trigger is working #popups
https://twitter.com/AgentPete/status/1144893394554171393,Mon Feb 25 16:03:47 +0000 2008,2019-06-29 09:00:31,2,0,repNone,,False,"`What is life but a series of sharp corners, round each of which fate lies in wait for us with a stuffed eelskin?' - P.G. Wodehouse"
https://twitter.com/AgentPete/status/1144531074439110656,Mon Feb 25 16:03:47 +0000 2008,2019-06-28 09:00:47,0,0,repNone,,False,`There are more old drunkards than old doctors' - Benjamin Franklin
https://twitter.com/AgentPete/status/1144166483720888321,Mon Feb 25 16:03:47 +0000 2008,2019-06-27 08:52:01,0,0,repNone,,False,"`Never apologise for showing feeling, my friend. Remember that when you do, you apologise for truth.' - Benjamin Disraeli"
https://twitter.com/AgentPete/status/1143871134481506304,Mon Feb 25 16:03:47 +0000 2008,2019-06-26 13:18:25,0,0,repNone,,False,"""A casual attitude is apt to produce a casualty."" Never more true than in today's publishing world."
https://twitter.com/AgentPete/status/1143492443125555200,Mon Feb 25 16:03:47 +0000 2008,2019-06-25 12:13:38,0,3,repNone,,False,RT @ktlncartomancer: Crack The Spine @CrackTheSpine has just released Issue 252 and it's got one of MY stories in it:) #writingcommunity Th…
https://twitter.com/AgentPete/status/1143479188265033729,Mon Feb 25 16:03:47 +0000 2008,2019-06-25 11:20:57,0,0,repNone,,False,“It is impossible that a man who is false to his friends and neighbours should be true to the public.”
https://twitter.com/AgentPete/status/1138481279412973575,Mon Feb 25 16:03:47 +0000 2008,2019-06-11 16:21:03,0,0,repNone,,False,Ending #mysore effectively means @indabayoga can't really call itself a yoga studio any longer.
https://twitter.com/AgentPete/status/1127585563492720642,Mon Feb 25 16:03:47 +0000 2008,2019-05-12 14:45:22,1,0,repNone,,False,Just a test to see whether we're picking up the tweets... #dldwaugh
https://twitter.com/AgentPete/status/1116994674751942657,Mon Feb 25 16:03:47 +0000 2008,2019-04-13 09:20:57,0,2,repNone,,False,RT @BarryKowal: 1 of 2 Here is a reminder of information that would've  remained hidden from the world but for Julian Assange &amp; Wikileaks.…
https://twitter.com/AgentPete/status/1116685078095114243,Mon Feb 25 16:03:47 +0000 2008,2019-04-12 12:50:44,0,0,rep1116684430121361409,SD_Newspapers,False,@SD_Newspapers Assange should certainly be crucified for revealing American war crimes.
https://twitter.com/AgentPete/status/1116325389708791808,Mon Feb 25 16:03:47 +0000 2008,2019-04-11 13:01:27,2,0,rep1116184341275713536,sapinker,False,@sapinker It is indeed the best of all possible worlds.
https://twitter.com/AgentPete/status/1116321330276765697,Mon Feb 25 16:03:47 +0000 2008,2019-04-11 12:45:20,39,0,rep1116320671657865216,haveigotnews,False,@haveigotnews Seriously? Is that the best you can do?
https://twitter.com/AgentPete/status/1108484523501764609,Mon Feb 25 16:03:47 +0000 2008,2019-03-20 21:44:39,0,2,repNone,,False,Petition: Revoke Article 50 and remain in the EU. https://t.co/NQ7gv303Py #RevokeArticle50
https://twitter.com/AgentPete/status/1106527984083714050,Mon Feb 25 16:03:47 +0000 2008,2019-03-15 12:10:04,1,0,repNone,,False,Life of a Legend - https://t.co/sMTH1orxH2
https://twitter.com/AgentPete/status/1106343902695571457,Mon Feb 25 16:03:47 +0000 2008,2019-03-14 23:58:35,0,0,repNone,,False,DeepMind and Google: the battle to control artificial intelligence - https://t.co/1AwopbGH1M via @trendspottr
https://twitter.com/AgentPete/status/1106162217030946817,Mon Feb 25 16:03:47 +0000 2008,2019-03-14 11:56:38,0,0,repNone,,False,Thank heaven something is. #Brexit https://t.co/EUccFSD0IE
https://twitter.com/AgentPete/status/1101509959848730624,Mon Feb 25 16:03:47 +0000 2008,2019-03-01 15:50:14,2,1,repNone,,False,"The Debriefer goes live at the top of the hour, ten mins https://t.co/c6hRT3pcok"
https://twitter.com/AgentPete/status/1101431931152072704,Mon Feb 25 16:03:47 +0000 2008,2019-03-01 10:40:10,0,0,rep1100802732934471680,Sitdown_Jim,False,@Sitdown_Jim @CityWestminster @EveningStandard I understand there've been three serious accidents now.  The woman under the bus (my photo) was there for 2 hours apparently before they could get her out. Wish we had a newspaper that would pick this issue up.
https://twitter.com/AgentPete/status/1100704330011893760,Mon Feb 25 16:03:47 +0000 2008,2019-02-27 10:28:57,3,1,repNone,,False,Carnage in #BakerStreet today... whose stupid idea was this 2-way system? @CityWestminster @EveningStandard https://t.co/hzrPq7F45X
https://twitter.com/AgentPete/status/1100703791974961152,Mon Feb 25 16:03:47 +0000 2008,2019-02-27 10:26:48,0,0,repNone,,False,Carnage in  #BakerStreet today... whose stupid idea was this 2-way system? @CityWestminster @EveningStandard https://t.co/0Gb1tNhsZX
