id,Account Created At(same for all rows),status created_at,Fav_cont,retweeted_count,reply_to_status,reply_to_screen,quote,text
https://twitter.com/AiglonCollege/status/1084800563164954625,Tue Dec 22 20:04:40 +0000 2009,2019-01-14 13:13:03,1,0,repNone,,False,Aiglon has been named the first Google Reference School in Switzerland! Read: https://t.co/F9cSlqePfj https://t.co/tDfr3cK1n2
https://twitter.com/AiglonCollege/status/1083398324475101184,Tue Dec 22 20:04:40 +0000 2009,2019-01-10 16:21:03,1,0,repNone,,False,"Join Aiglon in the fresh snow for this year's Winter Camps, accepting all Junior School aged students! Learn more: https://t.co/RAHMKoDUVD https://t.co/GWuvILSGFh"
https://twitter.com/AiglonCollege/status/1083059100819304448,Tue Dec 22 20:04:40 +0000 2009,2019-01-09 17:53:06,0,0,repNone,,False,Read about Sofija's experiences as one of Aiglon's Student Ambassadors: https://t.co/YbcZH9wDGE https://t.co/n0JRkDK9MX
https://twitter.com/AiglonCollege/status/1082634049880055808,Tue Dec 22 20:04:40 +0000 2009,2019-01-08 13:44:06,2,0,repNone,,False,"Welcome back to the mountain! More snow is on the way, but the winter term (and skiing) have made a great start! https://t.co/lmmYVPhifH"
https://twitter.com/AiglonCollege/status/1080151191173107712,Tue Dec 22 20:04:40 +0000 2009,2019-01-01 17:18:06,4,1,repNone,,False,Wishing you a happy new year from Aiglon College. https://t.co/5kDDgJbo9n
https://twitter.com/AiglonCollege/status/1078214177163042816,Tue Dec 22 20:04:40 +0000 2009,2018-12-27 09:01:06,1,0,repNone,,False,Dent Favre or Petit Muveran? What's your position on the great mountain debate? https://t.co/GqRtarvAEE https://t.co/ZJxvatuHPP
https://twitter.com/AiglonCollege/status/1077978616171061249,Tue Dec 22 20:04:40 +0000 2009,2018-12-26 17:25:04,2,0,repNone,,False,Curious to learn what expeditions look like in our Junior School? Check out the video summary from our autumn term! https://t.co/O32BKaxxhz https://t.co/mdRwgWoWoP
https://twitter.com/AiglonCollege/status/1077203255556485121,Tue Dec 22 20:04:40 +0000 2009,2018-12-24 14:04:04,3,0,repNone,,False,"Silicon Valley startup alumna, Roya Ansari (Clairmont, 1979), took time to Skype with a current student to help start an entrepreneurship club! https://t.co/7PcwdvIKmt https://t.co/uiggqEJ9XR"
https://twitter.com/AiglonCollege/status/1076087909760073729,Tue Dec 22 20:04:40 +0000 2009,2018-12-21 12:12:05,1,0,repNone,,False,Can you spot a favourite Aiglon memory in our 70th anniversary commemorative cover? https://t.co/79d7Aa0lvQ https://t.co/ZQm1cJFK28
https://twitter.com/AiglonCollege/status/1075760246499524610,Tue Dec 22 20:04:40 +0000 2009,2018-12-20 14:30:04,2,0,repNone,,False,Did you know there is a great debate about Aiglon's classic mountain view? We take a look at this history in Issue 11 #aroundthemountain https://t.co/GqRtarvAEE https://t.co/fonZSVdCLE
https://twitter.com/AiglonCollege/status/1075372699604738048,Tue Dec 22 20:04:40 +0000 2009,2018-12-19 12:50:05,0,0,repNone,,False,"""Sometimes we want to protect our children and students and this is of course natural, however it is important to remind ourselves that they are often more capable than we realise and are well able to rise to the occasion."" https://t.co/Mq3eZbsEvC https://t.co/3b6pT08npH"
https://twitter.com/AiglonCollege/status/1075126323096506370,Tue Dec 22 20:04:40 +0000 2009,2018-12-18 20:31:04,2,0,repNone,,False,"It's always great when alumni team up with students. Read about how successful Silicon Valley alumna, Roya (Clairmont, 1979) is working to help Santiago (Delaware, Year 13) start Aiglon's Entrepreneurship Club! https://t.co/F9AreDiZZA"
https://twitter.com/AiglonCollege/status/1074640716175937537,Tue Dec 22 20:04:40 +0000 2009,2018-12-17 12:21:27,0,0,repNone,,False,Need some reading during the term break? Take a look at Issue 11 of the Aiglon Magzine. https://t.co/79d7Aa0lvQ https://t.co/sE1WcMZRUq
https://twitter.com/AiglonCollege/status/1073672484300435457,Tue Dec 22 20:04:40 +0000 2009,2018-12-14 20:14:02,3,0,repNone,,False,"Congratulations to everyone on another successful term. Enjoy your time away, and we look forward to seeing you in January! https://t.co/lKvKWtrPue"
https://twitter.com/AiglonCollege/status/1073618894760394752,Tue Dec 22 20:04:40 +0000 2009,2018-12-14 16:41:06,3,0,repNone,,False,Issue 11 is out! Featuring a special cover for Aiglon's upcoming 70th Anniversary. Enjoy the latest issue of our award-winning magazine.  https://t.co/79d7Aa0lvQ https://t.co/hVp02BfRvW
https://twitter.com/AiglonCollege/status/1073144264836726784,Tue Dec 22 20:04:40 +0000 2009,2018-12-13 09:15:05,0,0,repNone,,False,Our Wellbeing Coordinator talks about self-efficacy and expectations. https://t.co/Mq3eZbsEvC https://t.co/Owrhp403Nn
https://twitter.com/AiglonCollege/status/1072906192173850624,Tue Dec 22 20:04:40 +0000 2009,2018-12-12 17:29:04,2,0,repNone,,False,"Read the latest piece from Aiglon's Wellbeing Coordinator! Especially during a stressful time of year, how do we set expectations? https://t.co/Mq3eZbsEvC https://t.co/6cUjYLlXtp"
https://twitter.com/AiglonCollege/status/1072572248198926336,Tue Dec 22 20:04:40 +0000 2009,2018-12-11 19:22:06,3,0,repNone,,False,Mornings of sunshine and fresh snow in the trees. These are the best kind of days on the mountain. https://t.co/ok3Qfk2C5I
https://twitter.com/AiglonCollege/status/1072490966743957504,Tue Dec 22 20:04:40 +0000 2009,2018-12-11 13:59:07,2,0,repNone,,False,"We are excited to present ""On the Razzle"" a hilarious farce for your enjoyment! Come and see it this week: Tuesday at 19h, Wednesday at 19h or Thursday at 16h! https://t.co/gmvJMQhCxa"
https://twitter.com/AiglonCollege/status/1072091577235972096,Tue Dec 22 20:04:40 +0000 2009,2018-12-10 11:32:05,1,0,repNone,,False,"""I am more interested in producing young people who are going to be great people with really strong values and a sense of purpose, a strong intercultural understanding and a strong desire to convert their lives into meaningful and positive changes."" https://t.co/Wr8I5ms3DU https://t.co/wVeZsvPEug"
https://twitter.com/AiglonCollege/status/1071083684567109632,Tue Dec 22 20:04:40 +0000 2009,2018-12-07 16:47:04,0,0,repNone,,False,"Congratulations to the girls' basketball team who, in defeating Beau Soleil 44 - 36, have won 4 straight games! https://t.co/ldr0hBpQUO https://t.co/gkWZP65T5y"
https://twitter.com/AiglonCollege/status/1070642521657753600,Tue Dec 22 20:04:40 +0000 2009,2018-12-06 11:34:03,0,0,repNone,,False,Interested in hospitality or business? Our College &amp; Careers Director offers some advice... https://t.co/CnGp1UnavG https://t.co/qwbVargzhg
https://twitter.com/AiglonCollege/status/1069599903070982145,Tue Dec 22 20:04:40 +0000 2009,2018-12-03 14:31:03,1,0,repNone,,False,"Read the interview by John Catt Educational in speaking with Aiglon's Head Master, Mr Richard McDonald, about why Aiglon's unique character as a ""mountain school"" is valued in today's busy world. https://t.co/Wr8I5ms3DU https://t.co/16yj6XL172"
https://twitter.com/AiglonCollege/status/1068540419770851334,Tue Dec 22 20:04:40 +0000 2009,2018-11-30 16:21:03,0,0,repNone,,False,"Aiglon graduates attended programmes ranked in the top 10 for hospitality and business management degrees worldwide, including Ecole Hôtelière de Lausanne, Cornell University, and Glion Institute of Higher Education. https://t.co/CnGp1UnavG https://t.co/uWvDoSvXeW"
https://twitter.com/AiglonCollege/status/1068443277924462594,Tue Dec 22 20:04:40 +0000 2009,2018-11-30 09:55:02,0,0,repNone,,False,Alumni and students alike are involved in efforts to protect our oceans. Read more about the story from our most recent magazine: https://t.co/PtsrD6dG1d https://t.co/MX7V50inlb
https://twitter.com/AiglonCollege/status/1068204395228250112,Tue Dec 22 20:04:40 +0000 2009,2018-11-29 18:05:48,0,0,repNone,,False,"Only two days out from #GivingTuesday and we have raised CHF 19,000 toward this year's annual campaign! Join us today and get your name on a room! https://t.co/McuTG6oTyK https://t.co/Vx9GcOCfp4"
https://twitter.com/AiglonCollege/status/1068176777984581632,Tue Dec 22 20:04:40 +0000 2009,2018-11-29 16:16:04,0,0,repNone,,False,"Alumni, add yourself today on Aiglon's updated LinkedIn page. https://t.co/Uh3sqitB42 https://t.co/dORHjkFHKR"
https://twitter.com/AiglonCollege/status/1068144573338271745,Tue Dec 22 20:04:40 +0000 2009,2018-11-29 14:08:06,0,0,repNone,,False,"Our College &amp; Careers Director offers advice on the many options within the worlds of business, hospitality or economics. https://t.co/CnGp1UnavG https://t.co/U6d0XP07gt"
https://twitter.com/AiglonCollege/status/1068073356266754049,Tue Dec 22 20:04:40 +0000 2009,2018-11-29 09:25:06,0,0,repNone,,False,This year Belvedere led an initiative to prepare 70 gift boxes to send to children who might not otherwise receive gifts this year. This gave us the chance to also think about how fortunate we are. Read more:  https://t.co/snePkckRmz https://t.co/zFWQOYAEcj
https://twitter.com/AiglonCollege/status/1067836527605137410,Tue Dec 22 20:04:40 +0000 2009,2018-11-28 17:44:02,1,0,repNone,,False,"We've been on LinkedIn for a while, but after some recent updates, we are encouraging our alumni to reconnect! Add Aiglon College on your profile! https://t.co/Uh3sqitB42 https://t.co/kksjsI0OPI"
https://twitter.com/AiglonCollege/status/1067517439196446720,Tue Dec 22 20:04:40 +0000 2009,2018-11-27 20:36:05,3,0,repNone,,False,Recent years have brought asylum seekers to our doorstep. Read about how our students and staff have the opportunity to regularly meet our neighbours: https://t.co/ycrzSTxoM4 https://t.co/HMmdLGLedU
https://twitter.com/AiglonCollege/status/1067431872802697220,Tue Dec 22 20:04:40 +0000 2009,2018-11-27 14:56:05,0,0,repNone,,False,"Today is #GivingTuesday --together as a community, we are working to name a room in honour of Aiglon's 70th Anniversary. Join us! https://t.co/UtLkdjHgQP https://t.co/r4AfhaSBHx"
https://twitter.com/AiglonCollege/status/1067137680994115586,Tue Dec 22 20:04:40 +0000 2009,2018-11-26 19:27:04,5,0,repNone,,False,"'Tis the season. Saturday morning classroom at Zinal --2,800m worth of season training. Looking forward to some good races this year! https://t.co/9iat7SRFBa"
https://twitter.com/AiglonCollege/status/1067098162593181702,Tue Dec 22 20:04:40 +0000 2009,2018-11-26 16:50:02,0,0,repNone,,False,"#GivingTuesday begins tomorrow! Join with Aiglon alumni, parents, staff and trustees to name a room in the new Assembly &amp; Arts Building! https://t.co/UtLkdjYSfp https://t.co/2qjEHUyjfe"
https://twitter.com/AiglonCollege/status/1067044559224475648,Tue Dec 22 20:04:40 +0000 2009,2018-11-26 13:17:02,1,0,repNone,,False,"The ""Reading Competition"" is a favourite tradition that challenges students to prepare and perform a special piece in front of classmates, parents and judges! Read more and watch the 1st place winner! https://t.co/E8hYIRJ1n4 https://t.co/Vd0h29EmhX"
https://twitter.com/AiglonCollege/status/1066987780482445312,Tue Dec 22 20:04:40 +0000 2009,2018-11-26 09:31:25,0,3,repNone,,False,RT @annmarielynchh: Happy Monday after a great weekend training in Zinal with @AiglonCollege race team @SnowsportsIRE @HerSportDotIE @20x20…
https://twitter.com/AiglonCollege/status/1066327833495199744,Tue Dec 22 20:04:40 +0000 2009,2018-11-24 13:49:01,2,0,repNone,,False,"You may think that only major donors get to see their names on plaques, but this year we are offering a chance for our annual donors to be recognised. #givingtuesday https://t.co/Cxiapa5IMK"
https://twitter.com/AiglonCollege/status/1066040955550220288,Tue Dec 22 20:04:40 +0000 2009,2018-11-23 18:49:04,0,0,repNone,,False,In honour of Aiglon's 70th anniversary we have launched a community fundraising project. Let's join together on #givingtuesday to support the new Assembly &amp; Arts Building! https://t.co/UtLkdjYSfp https://t.co/0CxOddlyJb
https://twitter.com/AiglonCollege/status/1066010762362138625,Tue Dec 22 20:04:40 +0000 2009,2018-11-23 16:49:05,2,0,repNone,,False,"Aiglon's girl volleyball team enjoyed hosting an invitational tournament this weekend. A great chance to compete, learn and grow! https://t.co/rG038sehr5"
https://twitter.com/AiglonCollege/status/1065906576043753472,Tue Dec 22 20:04:40 +0000 2009,2018-11-23 09:55:05,0,0,repNone,,False,How do you make an impact? Read about one teacher and student's visits to a local centre for people with physical and mental challenges.  https://t.co/Qm2fFQsCgx https://t.co/b63ER2YwKZ
https://twitter.com/AiglonCollege/status/1065293781631680512,Tue Dec 22 20:04:40 +0000 2009,2018-11-21 17:20:04,4,0,repNone,,False,Thanks @GlionNews for hosting five of our IB business students to participate in your marketing workshop. They learned about the Swiss hospitality education industry and participated in a challenge to pitch a new luxury watch. https://t.co/XKsHZvGREe
https://twitter.com/AiglonCollege/status/1065226587229036546,Tue Dec 22 20:04:40 +0000 2009,2018-11-21 12:53:04,3,0,repNone,,False,"This weekend, Aiglon's Alpine Development Squad made their way to our Glacier 3000 Diablerets - Gstaad for some pre-season training. Our resort isn't open yet, but there is still snow to be found! https://t.co/ZMagaUgG9J"
https://twitter.com/AiglonCollege/status/1064962589619351553,Tue Dec 22 20:04:40 +0000 2009,2018-11-20 19:24:02,2,0,repNone,,False,Students engage their #BODY cycling along the Rhone as we use our Guiding Principles as part of our Expedition Programme. https://t.co/WWM6D5e0pJ https://t.co/JoAKvmhkZd
https://twitter.com/AiglonCollege/status/1064513128908681217,Tue Dec 22 20:04:40 +0000 2009,2018-11-19 13:38:02,1,0,repNone,,False,"Spend your summer in Switzerland! Aiglon's unique summer programmes offer students ages 8 through 17 to immerse themselves into a world of camping, canoeing and sightseeing --all while also studying a diverse range of specialised classes. https://t.co/DT72hjZVXV https://t.co/iwcgQBtzVu"
https://twitter.com/AiglonCollege/status/1063431766835429376,Tue Dec 22 20:04:40 +0000 2009,2018-11-16 14:01:05,0,0,repNone,,False,"Read about students' experiences in Costa Rica, just one of Aiglon's many global trips that focus on culture, ecology and everything in between. https://t.co/zLgewihTva https://t.co/D0Czw6aMJZ"
https://twitter.com/AiglonCollege/status/1063361557533462528,Tue Dec 22 20:04:40 +0000 2009,2018-11-16 09:22:06,0,0,repNone,,False,"On Sunday we host the annual Hélène de Beir lecture in honour of Hélène (Clairmont, 1992) to commemorate her work in human rights. https://t.co/Sf8cfIC3Al"
https://twitter.com/AiglonCollege/status/1062764869362073600,Tue Dec 22 20:04:40 +0000 2009,2018-11-14 17:51:04,0,0,repNone,,False,Inspiring stories from this year's annual report: https://t.co/J3avxkFSLk https://t.co/m8Fp8vg4HF
https://twitter.com/AiglonCollege/status/1062418830809542659,Tue Dec 22 20:04:40 +0000 2009,2018-11-13 18:56:02,4,0,repNone,,False,"On Sunday Aiglon students and staff commemorated an especially significant Remembrance Day, marking 100 years since the end of World War I. https://t.co/08qAqSc8uD"
https://twitter.com/AiglonCollege/status/1062308855214940160,Tue Dec 22 20:04:40 +0000 2009,2018-11-13 11:39:02,0,0,repNone,,False,"Thanks, Affixxius Academic for another great video! Check out the full version on YouTube: https://t.co/XsYhez4okI https://t.co/QQTfb6mmd0"
https://twitter.com/AiglonCollege/status/1062085650315427840,Tue Dec 22 20:04:40 +0000 2009,2018-11-12 20:52:06,0,0,repNone,,False,Our brand new summer school video is now out! Check out the FULL version on YouTube! And book your place at Summer School today. https://t.co/hCZOtQTobp https://t.co/Q6EXtYQ2YQ
https://twitter.com/AiglonCollege/status/1060930018325549057,Tue Dec 22 20:04:40 +0000 2009,2018-11-09 16:20:02,1,0,repNone,,False,Students report back on their time working on an ecology project in Costa Rica during the half term break. Read online: https://t.co/zLgewihTva https://t.co/Lz51snJUxQ
https://twitter.com/AiglonCollege/status/1060840787842383873,Tue Dec 22 20:04:40 +0000 2009,2018-11-09 10:25:27,0,1,repNone,,False,RT @DigitalAlta: @AiglonCollege Proud to be a Canadian and a long time supporter of protecting this amazing world we live in. And so wonder…
https://twitter.com/AiglonCollege/status/1060825585558011904,Tue Dec 22 20:04:40 +0000 2009,2018-11-09 09:25:03,4,0,repNone,,False,Alumni and students alike are involved in efforts to protect our oceans. https://t.co/PtsrD5W4CD https://t.co/s6ZGJkWAXy
https://twitter.com/AiglonCollege/status/1060131775463202817,Tue Dec 22 20:04:40 +0000 2009,2018-11-07 11:28:06,0,0,repNone,,False,"Preparing our students for education beyond high school we look at what it means to study liberal arts, and how it can help you with what's next. https://t.co/ooTV39KyYn https://t.co/M5ukydEMuE"
https://twitter.com/AiglonCollege/status/1058747392512745478,Tue Dec 22 20:04:40 +0000 2009,2018-11-03 15:47:03,0,0,repNone,,False,"""Diving on a dead coral reef is like putting a needle in my heart. Perfectly evolved over millions of years, it's taken us just a hundred years to destroy them"" - Kyriakos (Belvedere, Year 13) https://t.co/PtsrD6dG1d https://t.co/xtmuWMmeyz"
https://twitter.com/AiglonCollege/status/1058371931894878208,Tue Dec 22 20:04:40 +0000 2009,2018-11-02 14:55:06,0,0,repNone,,False,"Sea life across our oceans is under acute threat.  This is a global crisis. It requires massive, concerted action – which is why so many Aiglonians are working to change the future. Read Online: https://t.co/PtsrD6dG1d https://t.co/TjHUL76chP"
https://twitter.com/AiglonCollege/status/1057971289187631105,Tue Dec 22 20:04:40 +0000 2009,2018-11-01 12:23:06,0,0,repNone,,False,"""It's very moving to read Nick's perspective on Patrick and that, fourteen years on, Seba's legacy is providing opportunities to children who may not have them otherwise.” https://t.co/ss2Apz9IYQ https://t.co/vgT669Asq7"
https://twitter.com/AiglonCollege/status/1057692458400825344,Tue Dec 22 20:04:40 +0000 2009,2018-10-31 17:55:07,2,0,repNone,,False,"Life on the mountain is inspiring, healthy and invigorating. Here, you will climb hills and see views that would impress seasoned hikers. Apply today for Summer School 2019! #adventurebeginshere https://t.co/DT72hjZVXV https://t.co/sf7UrsRd3Z"
https://twitter.com/AiglonCollege/status/1057369320546803712,Tue Dec 22 20:04:40 +0000 2009,2018-10-30 20:31:05,0,0,repNone,,False,Read about the great work from Aiglon's recent service project in Cambodia! https://t.co/bLnHL5BXKy https://t.co/QGQItCMZOa
https://twitter.com/AiglonCollege/status/1057314445364523008,Tue Dec 22 20:04:40 +0000 2009,2018-10-30 16:53:02,1,0,repNone,,False,"A quiet campus for the season's first snow! But with the first bright rays of sunshine for days, we may still have some autumn left after all... #aiglonviews https://t.co/qXO4XMe8uN"
https://twitter.com/AiglonCollege/status/1056918852792188929,Tue Dec 22 20:04:40 +0000 2009,2018-10-29 14:41:05,2,0,repNone,,False,"In case you missed it this summer, Aiglon's main reception building received a facelift. We are looking forward to share more #campusupgrades soon! https://t.co/ScxJqlxswX"
https://twitter.com/AiglonCollege/status/1055414682075443200,Tue Dec 22 20:04:40 +0000 2009,2018-10-25 11:04:03,1,0,repNone,,False,#campusupgrades During half term the John Corlette Building basement is receiving a big upgrade. A whole new technology and IT centre! https://t.co/QB8Qf0F0it
https://twitter.com/AiglonCollege/status/1055133825536278528,Tue Dec 22 20:04:40 +0000 2009,2018-10-24 16:28:02,1,0,repNone,,False,"Glad that our students can take advantage of unique, local competitions that come to town, like the European Junior Orienteering Championship! https://t.co/bs5iojebcx https://t.co/eYMPzrt1JW"
https://twitter.com/AiglonCollege/status/1055074453284118528,Tue Dec 22 20:04:40 +0000 2009,2018-10-24 12:32:06,0,0,repNone,,False,"""Metacognition is thinking about our thinking. It is an awareness and understanding of our own thought processes. When we begin to pay attention to our thought processes we can identify what helps or hinders us."" https://t.co/yulGk8aYfx https://t.co/5xpiozhUS7"
https://twitter.com/AiglonCollege/status/1055046509392211974,Tue Dec 22 20:04:40 +0000 2009,2018-10-24 10:41:04,0,0,repNone,,False,"What does it mean at Aiglon to push boundaries, and explore what's possible with today's technology? Read our annual report: https://t.co/J3avxkFSLk https://t.co/nKcmIYpecX"
https://twitter.com/AiglonCollege/status/1054656434774908928,Tue Dec 22 20:04:40 +0000 2009,2018-10-23 08:51:03,1,0,repNone,,False,What is orienteering? It is a competitive sport that combines racing with navigation. Aiglon students competed when the championships came to town! https://t.co/bs5iojebcx https://t.co/xfXZ0lrb6X
https://twitter.com/AiglonCollege/status/1054343636484272133,Tue Dec 22 20:04:40 +0000 2009,2018-10-22 12:08:06,0,0,repNone,,False,"""My first impression of Florence was that it looked as if it had been held back in time. It encapsulated renaissance beauty and Italian culture in one . . ."" Cami (Clairmont, Year 12) shares her experiences from Florence. https://t.co/GGOAgMqGab https://t.co/tgctBy7QMG"
https://twitter.com/AiglonCollege/status/1053244394583846912,Tue Dec 22 20:04:40 +0000 2009,2018-10-19 11:20:06,2,0,repNone,,False,"As most of the school takes a pause for half term, groups of students are abroad on service projects in Costa Rica and Cambodia. Here are a few shots from the field! Students hard at work (and having some fun) in Costa Rica. https://t.co/mZM0QUrz83"
https://twitter.com/AiglonCollege/status/1052941146157146113,Tue Dec 22 20:04:40 +0000 2009,2018-10-18 15:15:06,0,0,repNone,,False,Inspiring a spirit of challenge on and off the mountain. Read our annual report: https://t.co/J3avxkFSLk https://t.co/WEPOGsUNOE
https://twitter.com/AiglonCollege/status/1052908927334174720,Tue Dec 22 20:04:40 +0000 2009,2018-10-18 13:07:05,2,0,repNone,,False,"What do you think? Students display their ""Theory of Knowledge"" research exhibitions after trips to Barcelona and Florence. https://t.co/LcpPpZJ7WR"
https://twitter.com/AiglonCollege/status/1052836945901043713,Tue Dec 22 20:04:40 +0000 2009,2018-10-18 08:21:03,2,0,repNone,,False,"#lifeinLaBaita ""I don’t normally eat Chinese food so it was great to try something new. It was also interesting to try different cooking methods and hear from the Chinese students about the food from their homes. We had a great time with each other."" - Adrian https://t.co/pEYH5kZQhf"
https://twitter.com/AiglonCollege/status/1052649964650844166,Tue Dec 22 20:04:40 +0000 2009,2018-10-17 19:58:03,2,0,repNone,,False,"A great tip to Barcelona as part of the TOK (Theory of Knowledge) curriculum. This evening students present their ""artefacts"" from Barcelona and Florence! https://t.co/Z4PhG7Leyk"
https://twitter.com/AiglonCollege/status/1052595423595175936,Tue Dec 22 20:04:40 +0000 2009,2018-10-17 16:21:19,2,0,repNone,,False,"Our ""Year in Review"" gives our constituents and donors the chance to see what we have been doing for the past year. Read it online today! https://t.co/J3avxkFSLk https://t.co/3yuNPvwoix"
https://twitter.com/AiglonCollege/status/1050836266097565703,Tue Dec 22 20:04:40 +0000 2009,2018-10-12 19:51:04,0,0,repNone,,False,So proud that three of our scholars were able to attend the Global Leaders Program at Wheaton College Massachusetts this past summer. It looks like they had a great time learning what it takes to help change our world. https://t.co/EKhdvTIyvl
https://twitter.com/AiglonCollege/status/1050764055043039232,Tue Dec 22 20:04:40 +0000 2009,2018-10-12 15:04:07,1,0,repNone,,False,"Costa Rica, Florence, Luzern, Cambodia, Barcelona. Students are visiting some exciting destinations as part of the #AiglonCulturalTrips programme. Read about why and where we go. https://t.co/9xiQf2ubMT"
https://twitter.com/AiglonCollege/status/1050402415369957376,Tue Dec 22 20:04:40 +0000 2009,2018-10-11 15:07:06,0,0,repNone,,False,"While home last summer in Kenya an Aiglon scholar made a cool, small world connection with the family who sponsors him.  https://t.co/ss2Apz9IYQ https://t.co/3TvZw4G1tx"
https://twitter.com/AiglonCollege/status/1050372210945343488,Tue Dec 22 20:04:40 +0000 2009,2018-10-11 13:07:04,0,0,repNone,,False,Check out Aiglon's third annual service project in #Cambodia https://t.co/2j70FG4SFW #boardingschool #internationalservice #mindbodyspirit https://t.co/qRefbQhNYO
https://twitter.com/AiglonCollege/status/1050344279435038721,Tue Dec 22 20:04:40 +0000 2009,2018-10-11 11:16:05,0,0,repNone,,False,"50 years in, how does the @IB_DP stack up in today's world? https://t.co/j3EAjjBiRb https://t.co/e2y2iZ8b5x"
https://twitter.com/AiglonCollege/status/1050054603805511682,Tue Dec 22 20:04:40 +0000 2009,2018-10-10 16:05:01,0,0,repNone,,False,Does the IB make a difference in today's world? It's a good question. https://t.co/oEqNJ30xvJ
https://twitter.com/AiglonCollege/status/1049912977997123584,Tue Dec 22 20:04:40 +0000 2009,2018-10-10 06:42:15,0,0,repNone,,False,"A great friendly match against Beau Soleil Collège Alpin International in yesterday's beautiful autumn afternoon. Final score, 2-2. Great work! https://t.co/zFn2oIRAcc"
https://twitter.com/AiglonCollege/status/1049663193528848384,Tue Dec 22 20:04:40 +0000 2009,2018-10-09 14:09:41,0,0,repNone,,False,We were pleased to present some gold medals and winners' trophies in this morning's assembly for some great work on the football pitch this weekend! The boys' team managed a fantastic SGIS tournament victory! https://t.co/JhdLio2K3V
