id,Account Created At(same for all rows),status created_at,Fav_cont,retweeted_count,reply_to_status,reply_to_screen,quote,text
https://twitter.com/AiglonCollege/status/724618181604683776,Tue Dec 22 20:04:40 +0000 2009,2016-04-25 15:16:51,0,3,repNone,,False,RT @Aiglon_SPACE: Students are getting some stunning images using our observatory. Here's a recent shot of  M51a; the Whirlpool Galaxy http…
https://twitter.com/AiglonCollege/status/714430833122258944,Tue Dec 22 20:04:40 +0000 2009,2016-03-28 12:35:58,2,1,repNone,,False,"Junior Schoolers out in Iceland. Exploring, learning, and jumping off walls! https://t.co/TwyzDOyBE4"
https://twitter.com/AiglonCollege/status/706769664664346624,Tue Dec 22 20:04:40 +0000 2009,2016-03-07 09:13:13,6,1,repNone,,False,"Perfect weather for a ski tour! Thanks, @djfairweather1 for the great photo. https://t.co/aouMWYUXpV"
https://twitter.com/AiglonCollege/status/706111026496933888,Tue Dec 22 20:04:40 +0000 2009,2016-03-05 13:36:02,4,0,repNone,,False,Well-ordered Aiglonians out on Winter Long-Ex. A great way to experience all the mountains have to offer! https://t.co/qFC5I7LZ6z
https://twitter.com/AiglonCollege/status/703258126146015234,Tue Dec 22 20:04:40 +0000 2009,2016-02-26 16:39:37,0,1,repNone,,False,RT @mbrettuk: An excellent afternoon teaching a puppetry workshop at the @NationalTheatre for @AiglonCollege. Sure they'll enjoy @WarHorseO…
https://twitter.com/AiglonCollege/status/696622758722199552,Tue Dec 22 20:04:40 +0000 2009,2016-02-08 09:13:02,6,2,repNone,,False,Our classroom. https://t.co/GoZFPbymsR
https://twitter.com/AiglonCollege/status/694555636055609345,Tue Dec 22 20:04:40 +0000 2009,2016-02-02 16:19:02,1,1,repNone,,False,There are still spaces in Aiglon's Easter Holiday Sports Course. Register today! https://t.co/7HBcrgQ5DD
https://twitter.com/AiglonCollege/status/693862135298916352,Tue Dec 22 20:04:40 +0000 2009,2016-01-31 18:23:19,1,1,repNone,,False,Saddened to announce the death of former Headmaster Philip Parsons on 30th of January 2016. https://t.co/kMsqbQx5Cg https://t.co/y1ouyW039T
https://twitter.com/AiglonCollege/status/691580324711645184,Tue Dec 22 20:04:40 +0000 2009,2016-01-25 11:16:13,5,1,repNone,,False,Aiglon: conquering mountains since 1949. Here's a peak at one of the weekend's expeditions! https://t.co/JwoDTZXsvc
https://twitter.com/AiglonCollege/status/691549441908719616,Tue Dec 22 20:04:40 +0000 2009,2016-01-25 09:13:29,1,0,repNone,,False,Aiglon students in The Hague about to start lobbying as the Delegation of Finland in the MUN Conference. #thimun https://t.co/utgzfJG0AN
https://twitter.com/AiglonCollege/status/690462171734659073,Tue Dec 22 20:04:40 +0000 2009,2016-01-22 09:13:04,6,4,repNone,,False,Aiglon Ski Team in Champéry on this beautiful morning preparing for the Welsh BASS races. Wish them luck! https://t.co/vMNUC3gI3q
https://twitter.com/AiglonCollege/status/687629365031624705,Tue Dec 22 20:04:40 +0000 2009,2016-01-14 13:36:30,0,0,repNone,,False,Aiglon house debates remain strong tradition https://t.co/dRsSIqFgOY
https://twitter.com/AiglonCollege/status/687617301898727424,Tue Dec 22 20:04:40 +0000 2009,2016-01-14 12:48:34,0,2,repNone,,False,RT @CMCinSwitz: Fantastic to have Jackie Cox at school today | day 4 Euro Certificate #PD #edchat #boarding https://t.co/dXN4OzULEN https:/…
https://twitter.com/AiglonCollege/status/687617044032937984,Tue Dec 22 20:04:40 +0000 2009,2016-01-14 12:47:33,1,0,rep676745501035905024,OfficeCEL,False,"@OfficeCEL Hi Annabel, glad you liked the magazine! All editions can be found online here: https://t.co/hfqBwgsCfU"
https://twitter.com/AiglonCollege/status/671255683501793280,Tue Dec 22 20:04:40 +0000 2009,2015-11-30 09:13:20,1,0,repNone,,False,Really great to see Aiglon alumni gathering all over the world! Here is a photo from a couple weeks ago in Canada. https://t.co/RrStsuGba5
https://twitter.com/AiglonCollege/status/670530825201545216,Tue Dec 22 20:04:40 +0000 2009,2015-11-28 09:13:01,1,2,repNone,,False,We are pleased to make our 2014 -15 Annual Report available. Please read it here: https://t.co/TypPZZ73XL https://t.co/nzt21EMWd7
https://twitter.com/AiglonCollege/status/668749867666251776,Tue Dec 22 20:04:40 +0000 2009,2015-11-23 11:16:07,7,1,repNone,,False,"Well would you look at that. Hello, snow! The beautiful view Aiglon has this morning. https://t.co/mI9S29pHT2"
https://twitter.com/AiglonCollege/status/667300322767847424,Tue Dec 22 20:04:40 +0000 2009,2015-11-19 11:16:09,0,0,repNone,,False,Aiglon College seeks to appoint a suitably qualified Teacher of Chinese Literature to join the school. https://t.co/R9xswGhjxq
https://twitter.com/AiglonCollege/status/667269341973512192,Tue Dec 22 20:04:40 +0000 2009,2015-11-19 09:13:03,0,0,repNone,,False,A big thank you to @alicehackman for sharing her perspectives with Aiglon students last night at the 12th annual #HélèneDeBeirLecture
https://twitter.com/AiglonCollege/status/666544557211951104,Tue Dec 22 20:04:40 +0000 2009,2015-11-17 09:13:00,0,0,repNone,,False,Have you thought about joining Aiglon in Milan next week? You should! https://t.co/6Jmb6VLwQy
https://twitter.com/AiglonCollege/status/666289431003971584,Tue Dec 22 20:04:40 +0000 2009,2015-11-16 16:19:14,0,0,repNone,,False,Aiglon is advertising for a Health Centre Manager (100%) to join the school from mid-August 2016. https://t.co/K89bR5dO2w
https://twitter.com/AiglonCollege/status/666193524807892992,Tue Dec 22 20:04:40 +0000 2009,2015-11-16 09:58:08,0,4,repNone,,False,RT @CMCinSwitz: Had an amazing day learning more with colleagues &amp; @olivertrussell who came to play #GAfE #edtech  #learning @GEG_UK #Googl…
https://twitter.com/AiglonCollege/status/662262141207101440,Tue Dec 22 20:04:40 +0000 2009,2015-11-05 13:36:13,2,0,repNone,,False,"Rumor has it a flood is coming to Villars, but don't worry. Alpina houseparent Mr. Kruger is building an ark. He cl… https://t.co/aVJhbHcbZV"
https://twitter.com/AiglonCollege/status/657573561624829953,Tue Dec 22 20:04:40 +0000 2009,2015-10-23 15:05:28,0,0,repNone,,False,Hey! Are you an Aiglon alum based in NYC? Come join old classmates and meet new friends next Friday… https://t.co/hs3ir0ZNS4
https://twitter.com/AiglonCollege/status/654274488973008896,Tue Dec 22 20:04:40 +0000 2009,2015-10-14 12:36:08,1,0,repNone,,False,With a well-earned singing break the choir enjoyed themselves on the roller coasters at @SingaporeUSS #aiglonexplores http://t.co/de1epSxPM7
https://twitter.com/AiglonCollege/status/654255363357810689,Tue Dec 22 20:04:40 +0000 2009,2015-10-14 11:20:08,0,0,rep653447044074377217,URAsg,False,@URAsg Thanks so much for sharing your city with us!
https://twitter.com/AiglonCollege/status/654255096767901696,Tue Dec 22 20:04:40 +0000 2009,2015-10-14 11:19:05,0,3,repNone,,False,RT @CobisDirector: Article about boarding by @nsdmorrison features several #COBIS schools @Kings_Soto @TransylvaniaCol @AiglonCollege http:…
https://twitter.com/AiglonCollege/status/654239273365995520,Tue Dec 22 20:04:40 +0000 2009,2015-10-14 10:16:12,0,0,repNone,,False,"5th Form students on #CLE in Paris push boundaries on the question, ""What is art?"" Thank you #streetartparis! http://t.co/30cNcWIaj5"
https://twitter.com/AiglonCollege/status/653845921487278080,Tue Dec 22 20:04:40 +0000 2009,2015-10-13 08:13:10,0,0,repNone,Telegraph,False,@Telegraph offers alternative from UK to study at Aiglon and experience different cultures. http://t.co/Qvt4ZwmwTL
https://twitter.com/AiglonCollege/status/652477387976900608,Tue Dec 22 20:04:40 +0000 2009,2015-10-09 13:35:06,0,0,repNone,,False,Aiglon travels the world in October! Are you part of it? Share with #aiglonexplores http://t.co/PFRYIQsQ6v
https://twitter.com/AiglonCollege/status/652141155006570496,Tue Dec 22 20:04:40 +0000 2009,2015-10-08 15:19:02,0,0,repNone,,False,5 Day Intensive SAT Preparation Course: Christmas or Easter holidays. Register today! http://t.co/BZqe9leGHw
https://twitter.com/AiglonCollege/status/651340153324240896,Tue Dec 22 20:04:40 +0000 2009,2015-10-06 10:16:08,0,0,repNone,,False,Come check out today's book fair in the Clairmont Library!
https://twitter.com/AiglonCollege/status/651309171305021440,Tue Dec 22 20:04:40 +0000 2009,2015-10-06 08:13:01,1,1,repNone,,False,"Interested in working at Aiglon? Hiring a Gifts Officer, Administrative Assistant and Teacher of French &amp; Spanish. http://t.co/remeKC4c68"
https://twitter.com/AiglonCollege/status/651054005142032384,Tue Dec 22 20:04:40 +0000 2009,2015-10-05 15:19:05,0,0,repNone,,False,"Keep up the great work, Aiglon! Switzerland has a terrific @modelun presence. http://t.co/6BdkH2gIL2"
https://twitter.com/AiglonCollege/status/650931716924829696,Tue Dec 22 20:04:40 +0000 2009,2015-10-05 07:13:09,2,2,repNone,,False,The first team from Aiglon to climb the Wildhorn in at least 15 years. A great effort from all of the boys! http://t.co/a5fP9Oifk7
https://twitter.com/AiglonCollege/status/649541557318742016,Tue Dec 22 20:04:40 +0000 2009,2015-10-01 11:09:09,0,1,repNone,,False,Welcoming ten schools to campus tonight! To name a few: @GWtweets @AUPtweets @StGeorgesUni @BryantUniv @GoSyracuseU http://t.co/SIEn6FvtG5
https://twitter.com/AiglonCollege/status/649526698615177216,Tue Dec 22 20:04:40 +0000 2009,2015-10-01 10:10:07,0,0,repNone,,False,Proud to have Aiglon College in Singapore for #RSIC2015! Learn more about @r0undsquare here: http://t.co/P8neWYolPz
https://twitter.com/AiglonCollege/status/646958890614136832,Tue Dec 22 20:04:40 +0000 2009,2015-09-24 08:06:34,0,2,repNone,,False,RT @acanthusclews: Great progress @AiglonCollege on the new Exeter boarding house - the view from inside will be amazing! http://t.co/9F4Sw…
https://twitter.com/AiglonCollege/status/645887862983028736,Tue Dec 22 20:04:40 +0000 2009,2015-09-21 09:10:41,0,0,repNone,,False,One of the several Aiglon expedition teams out this weekend summited Les Dents du Midi! This was a… https://t.co/YAz8ddwKdU
https://twitter.com/AiglonCollege/status/644245474447392768,Tue Dec 22 20:04:40 +0000 2009,2015-09-16 20:24:25,1,0,repNone,,False,"We couldn't have asked for better weather during today's famed Aiglon Challenge. Even the ""locals""… https://t.co/TJOgpvzhfo"
https://twitter.com/AiglonCollege/status/642365923156992000,Tue Dec 22 20:04:40 +0000 2009,2015-09-11 15:55:45,0,0,repNone,,False,"Chairman of the Board Tony Jashanmal, Treasurer John Cheesmond and Head Master Richard McDonald took… https://t.co/o96iQAu38n"
https://twitter.com/AiglonCollege/status/641995219504889856,Tue Dec 22 20:04:40 +0000 2009,2015-09-10 15:22:42,1,2,repNone,,False,"Lights, camera, action! Aiglon is excited to have partnered with @affixxius to help tell our story… https://t.co/x29KRzjmLY"
https://twitter.com/AiglonCollege/status/639693821035548672,Tue Dec 22 20:04:40 +0000 2009,2015-09-04 06:57:46,0,0,repNone,,True,"Congratulations to our magazine team! If you haven't seen it, take a look! http://t.co/IEQiIrUvoo https://t.co/hy9Cg4H4uQ"
https://twitter.com/AiglonCollege/status/638281606751518720,Tue Dec 22 20:04:40 +0000 2009,2015-08-31 09:26:08,0,0,repNone,,False,Third Form was in the mountains this weekend on the term's first expedition! ⛺️What mountains have… https://t.co/ApPjCFXX3w
https://twitter.com/AiglonCollege/status/637199048638865408,Tue Dec 22 20:04:40 +0000 2009,2015-08-28 09:44:26,0,0,repNone,,False,"Here we go! New students arriving today. It's the only Autumn 2015 term in all of history, let's make… https://t.co/pPyUx7GL19"
https://twitter.com/AiglonCollege/status/636858997560188928,Tue Dec 22 20:04:40 +0000 2009,2015-08-27 11:13:11,0,0,repNone,,False,New staff have made it to Aiglon! Send us pictures of your own travels back to the mountain!… https://t.co/njhFo5NTn5
https://twitter.com/AiglonCollege/status/636573212235726848,Tue Dec 22 20:04:40 +0000 2009,2015-08-26 16:17:35,0,0,repNone,,False,A lot of new welcomes this week: here's one you should be excited about! #cookieoncampus🍪… https://t.co/g8wqJRntuB
https://twitter.com/AiglonCollege/status/624209856933851136,Tue Dec 22 20:04:40 +0000 2009,2015-07-23 13:30:01,1,0,repNone,,False,6 Aiglon students on the top of Europe! They climbed #MontBlanc and 3 other summits #alpinism http://t.co/1N0eg0Dbgr http://t.co/KRe196cpOg
https://twitter.com/AiglonCollege/status/623399050688221184,Tue Dec 22 20:04:40 +0000 2009,2015-07-21 07:48:10,0,1,repNone,,False,Aiglon community members can now download all the yearbooks dating back to 1974 http://t.co/nUbeoKw6oJ http://t.co/Qj5dHDjUx6
https://twitter.com/AiglonCollege/status/621302374834028544,Tue Dec 22 20:04:40 +0000 2009,2015-07-15 12:56:44,0,10,repNone,,False,RT @iborganization: Research shows #IBDP students highly valued by uni admissions. Find out why #IBHigherEd Symposium Rotterdam 27-29 Oct h…
https://twitter.com/AiglonCollege/status/621280284508573696,Tue Dec 22 20:04:40 +0000 2009,2015-07-15 11:28:57,2,1,repNone,,False,6 Aiglon students on the top of Europe! They climbed #MontBlanc and 3 other summits #alpinism http://t.co/1N0eg0Dbgr http://t.co/S7TXcFIsWT
https://twitter.com/AiglonCollege/status/621230565409341440,Tue Dec 22 20:04:40 +0000 2009,2015-07-15 08:11:23,1,2,repNone,,False,Learning and enjoying #photography at #summerschool with our professional photographer from the UK! @AndrewBate78 http://t.co/sNJtlcbdWM
https://twitter.com/AiglonCollege/status/619476213275488256,Tue Dec 22 20:04:40 +0000 2009,2015-07-10 12:00:13,1,0,repNone,,False,Experiencing the #Swiss mountains at Aiglon #summerschool2015 http://t.co/NDKYcTEn1v
https://twitter.com/AiglonCollege/status/618789777886855168,Tue Dec 22 20:04:40 +0000 2009,2015-07-08 14:32:34,0,1,repNone,,False,Aiglon #SummerSchool has started with Icebreaker games on the first night! http://t.co/YXcjISYgPg #swisssummerschool http://t.co/6MP63FWkFL
https://twitter.com/AiglonCollege/status/618782902063599616,Tue Dec 22 20:04:40 +0000 2009,2015-07-08 14:05:14,0,2,repNone,,False,Excellent overall IB Diploma results by the Class of 2015! http://t.co/1N0eg0Dbgr @iborganization @IB_DP http://t.co/o5VJjXUlCE
https://twitter.com/AiglonCollege/status/616877345186676736,Tue Dec 22 20:04:40 +0000 2009,2015-07-03 07:53:14,4,3,repNone,,False,International Big Band Weekend in Villars. Villars Big starts today! http://t.co/JhOU1wSIAd @JazzClubsWorld @VillarsTourisme #jazz
https://twitter.com/AiglonCollege/status/616494742289940480,Tue Dec 22 20:04:40 +0000 2009,2015-07-02 06:32:55,0,0,rep616364536275333120,Siricherokee,False,@Siricherokee it was a pleasure seeing you. Congratulations! We will miss Teddy.
https://twitter.com/AiglonCollege/status/616164265339289600,Tue Dec 22 20:04:40 +0000 2009,2015-07-01 08:39:43,0,3,repNone,,False,RT @intSchools: 10 daily habits that will actually make you smarter http://t.co/7dwBp25wei http://t.co/OAsdk9BCIV
https://twitter.com/AiglonCollege/status/615504665099288576,Tue Dec 22 20:04:40 +0000 2009,2015-06-29 12:58:42,0,2,repNone,,False,4 Aiglon alumni leading the charge in long-form documentary.http://t.co/gqNE2zv2Uu @gaurichadha @ceciliapeck @markstewartprod
https://twitter.com/AiglonCollege/status/614518044262535168,Tue Dec 22 20:04:40 +0000 2009,2015-06-26 19:38:13,6,3,repNone,,False,Beautiful Graduation Dance @ChaletRoyAlp #aigloncollege #boardingschool @pretaportrait #graduation http://t.co/XnnJPXKztq
https://twitter.com/AiglonCollege/status/614512089479184384,Tue Dec 22 20:04:40 +0000 2009,2015-06-26 19:14:33,0,2,repNone,,False,RT @pretaportrait: Spectacular setting for the @AiglonCollege graduation event  where we are taking pictures this evening. http://t.co/oMQx…
https://twitter.com/AiglonCollege/status/614477556918693888,Tue Dec 22 20:04:40 +0000 2009,2015-06-26 16:57:20,1,0,repNone,,False,Watch Aiglon Graduation Ceremony live at http://t.co/1N0eg0Dbgr tomorrow at 10am EST. #aiglongrad15 #graduation #boardingschool
https://twitter.com/AiglonCollege/status/614353024811724800,Tue Dec 22 20:04:40 +0000 2009,2015-06-26 08:42:29,1,1,repNone,,False,Junior School students heading down to the Prize Giving Ceremony. Awards well deserved! #boardingschool #Switzerland http://t.co/5QOL3dC2TO
https://twitter.com/AiglonCollege/status/613995361921712128,Tue Dec 22 20:04:40 +0000 2009,2015-06-25 09:01:16,0,0,repNone,,False,Our U6th student taking the next step on her last Aiglon expedition ever! #aiglongrad15 #challengeyourself http://t.co/u31qBIdRCu
https://twitter.com/AiglonCollege/status/613708045210791936,Tue Dec 22 20:04:40 +0000 2009,2015-06-24 13:59:34,1,0,repNone,,False,The gowns are ready for Saturday! #graduation #countdown #aiglongrad15 http://t.co/hIyYwD2Wa2
https://twitter.com/AiglonCollege/status/613684975439867904,Tue Dec 22 20:04:40 +0000 2009,2015-06-24 12:27:54,1,1,repNone,,False,What a great place to learn #geography! #prepform #longexpedition #diablerets #switzerland http://t.co/h5S4LbMg3j
https://twitter.com/AiglonCollege/status/613633444476796928,Tue Dec 22 20:04:40 +0000 2009,2015-06-24 09:03:08,1,0,repNone,,True,"Useful tricks for a sharp mind and productive days! At Aiglon, we start our days with #meditation! https://t.co/D9DtyURtm4"
https://twitter.com/AiglonCollege/status/610736561039220736,Tue Dec 22 20:04:40 +0000 2009,2015-06-16 09:11:57,0,2,repNone,,False,RT @tele_education: The best UK universities for law http://t.co/voPEmaaY14
https://twitter.com/AiglonCollege/status/610371882186080256,Tue Dec 22 20:04:40 +0000 2009,2015-06-15 09:02:51,0,1,repNone,,False,Wishing you an excellent week! #aigloncampus #MondayMotivation http://t.co/XuFBGreBsq
https://twitter.com/AiglonCollege/status/609366202255867905,Tue Dec 22 20:04:40 +0000 2009,2015-06-12 14:26:38,1,0,repNone,,False,"We are recruiting a ""Major Gifts Officer"" and an ""Alumni &amp; Events Officer to join the school as soon as possible. http://t.co/gKOTNNwTG6"
https://twitter.com/AiglonCollege/status/609325109665509377,Tue Dec 22 20:04:40 +0000 2009,2015-06-12 11:43:21,0,0,rep609301829881626624,AiglonCollege,False,@nicola_ns12
https://twitter.com/AiglonCollege/status/609301829881626624,Tue Dec 22 20:04:40 +0000 2009,2015-06-12 10:10:51,1,2,repNone,,False,"When students are engaged and mesmerised by #learning, their brains make new connections http://t.co/FgecthUIAW http://t.co/gEA4ZgoJmG"
https://twitter.com/AiglonCollege/status/608545974986940416,Tue Dec 22 20:04:40 +0000 2009,2015-06-10 08:07:21,1,0,repNone,,False,The countdown has begun! #aiglongrad15 #aiglon #graduation http://t.co/u6dMSFObJy
https://twitter.com/AiglonCollege/status/606384314041925632,Tue Dec 22 20:04:40 +0000 2009,2015-06-04 08:57:41,1,1,repNone,,False,Silver #casecoe award for Aiglon's new magazine! @CASE_Europe http://t.co/IKID3rrZdt http://t.co/2yFeF18zkI
https://twitter.com/AiglonCollege/status/606382456208560128,Tue Dec 22 20:04:40 +0000 2009,2015-06-04 08:50:18,0,2,repNone,,False,"RT @CASE_Europe: Well done to @AiglonCollege, two-time Silver #casecoe award for Editorial Design of Laid Bare magazine and Magazine Publis…"
https://twitter.com/AiglonCollege/status/605707068507582464,Tue Dec 22 20:04:40 +0000 2009,2015-06-02 12:06:33,0,1,repNone,,False,"How Aiglon influenced our alumna Julietta Dexter, Founder of @TheCommsStore? http://t.co/zRaGBtiJzB http://t.co/NP74MgrVSL"
https://twitter.com/AiglonCollege/status/603837564705964032,Tue Dec 22 20:04:40 +0000 2009,2015-05-28 08:17:48,2,0,repNone,,False,#Aiglon has won the interschool debate against Le Rosey!Thank you Le Rosey for hosting us.Looking forward to welcoming you for Round 2.
https://twitter.com/AiglonCollege/status/603832077516148736,Tue Dec 22 20:04:40 +0000 2009,2015-05-28 07:56:00,0,1,repNone,,False,Have a nice day all! We are enjoying the fieldwork in the sunny Alps. #boardingschool #aiglon http://t.co/f4kEeFUBM9
https://twitter.com/AiglonCollege/status/601681826957107200,Tue Dec 22 20:04:40 +0000 2009,2015-05-22 09:31:40,1,0,repNone,,False,What a fantastic school drama production! So professional and magical! You were wonderful Junior… https://t.co/AMJiSinLoY
https://twitter.com/AiglonCollege/status/601677674034163713,Tue Dec 22 20:04:40 +0000 2009,2015-05-22 09:15:10,0,1,repNone,,False,The well deserved half term begins today. Have a fantastic break! http://t.co/HUkuIbaLNv
https://twitter.com/AiglonCollege/status/600605853822099456,Tue Dec 22 20:04:40 +0000 2009,2015-05-19 10:16:08,0,433,repNone,,False,RT @WWF: 🐅🐆🐯🐧🐘🐫🐺🐼🐒🐊🐍🐢🐸🐋🐳🐬🐟 → These 17 emoji are in danger of extinction http://t.co/pGrVvwjfel #EndangeredEmoji
https://twitter.com/AiglonCollege/status/600292193660698626,Tue Dec 22 20:04:40 +0000 2009,2015-05-18 13:29:46,0,0,repNone,,False,Aiglon Art Exhibit at @24heuresch today. Come to LeSporting in #Villars and vote for your top three student artworks http://t.co/zIASpnqgUm
https://twitter.com/AiglonCollege/status/599135173314277376,Tue Dec 22 20:04:40 +0000 2009,2015-05-15 08:52:11,0,1,repNone,,False,The construction of the new #Aiglon girl's boarding house has begun. http://t.co/1N0eg0Dbgr #boardingschool http://t.co/TFu69xDr3j
https://twitter.com/AiglonCollege/status/598770766293934080,Tue Dec 22 20:04:40 +0000 2009,2015-05-14 08:44:09,0,0,repNone,,False,Our #JuniorSchool student made this lovely video himself! https://t.co/tzSUCHSe8R  #aigloncollege #boardingschool #switzerland
https://twitter.com/AiglonCollege/status/597737891637374976,Tue Dec 22 20:04:40 +0000 2009,2015-05-11 12:19:53,0,0,rep597513075584040960,acanthusclews,False,@acanthusclews Welcome back!
https://twitter.com/AiglonCollege/status/596234547106357248,Tue Dec 22 20:04:40 +0000 2009,2015-05-07 08:46:08,1,0,repNone,,False,Aiglon 2015 graduates got accepted by universities such as @Cambridge_Uni and @Penn. See application results http://t.co/yRe04xvrsT
https://twitter.com/AiglonCollege/status/595960320016982016,Tue Dec 22 20:04:40 +0000 2009,2015-05-06 14:36:27,0,40,repNone,,False,RT @IB_DP: Good luck to all #IBDP students taking their exams this week. We wish you all the very best!!
https://twitter.com/AiglonCollege/status/595482881000112128,Tue Dec 22 20:04:40 +0000 2009,2015-05-05 06:59:17,0,0,repNone,,False,We are looking for an experienced College and Careers Counsellor http://t.co/dD2tvgJcDL #aigloncareersoffice #job
https://twitter.com/AiglonCollege/status/595481444845228032,Tue Dec 22 20:04:40 +0000 2009,2015-05-05 06:53:34,0,0,repNone,,False,13 Beautifully Unusual Libraries From Around The World http://t.co/sKOmM2j07g @AiglonLibrary @HuffingtonPost
https://twitter.com/AiglonCollege/status/595239699771424768,Tue Dec 22 20:04:40 +0000 2009,2015-05-04 14:52:58,1,0,repNone,,False,Babson College is meeting Aiglon students this week. #aigloncareersoffice @babson
https://twitter.com/AiglonCollege/status/595230761378275328,Tue Dec 22 20:04:40 +0000 2009,2015-05-04 14:17:27,0,0,repNone,,False,Trinity College Music Exams: 100% pass rate – with 11‘Merit’ and 9 ‘Distinction’ awards http://t.co/BQQ9iHOi6C
https://twitter.com/AiglonCollege/status/593415265435701249,Tue Dec 22 20:04:40 +0000 2009,2015-04-29 14:03:19,0,0,repNone,,False,Aiglon College student Yoon Sung @letemps  Entre la Corée et les Etats-Unis http://t.co/sQnvj1AVbv
https://twitter.com/AiglonCollege/status/592983419438632960,Tue Dec 22 20:04:40 +0000 2009,2015-04-28 09:27:18,0,1,repNone,,False,How to invest in your future? L6th Aiglon students @CreditSuisse workshop at @ChaletRoyAlp @Aigloneconbus http://t.co/4vTSHk7v3s
https://twitter.com/AiglonCollege/status/592948483818188800,Tue Dec 22 20:04:40 +0000 2009,2015-04-28 07:08:29,0,0,rep592946800371376128,beejash,False,@beejash It is indeed!
https://twitter.com/AiglonCollege/status/592943514742296576,Tue Dec 22 20:04:40 +0000 2009,2015-04-28 06:48:44,0,1,repNone,,False,Switzerland is the happiest country in the world according to a new study http://t.co/CPEUOcaYY4
https://twitter.com/AiglonCollege/status/592612424869617664,Tue Dec 22 20:04:40 +0000 2009,2015-04-27 08:53:06,0,0,repNone,,False,This week's university and college representatives at Aiglon: @LynnUniversity @UCLA @UofR @rollinscollege @ChapmanU
https://twitter.com/AiglonCollege/status/591532603854958592,Tue Dec 22 20:04:40 +0000 2009,2015-04-24 09:22:17,2,4,repNone,,False,Spring is here! #swissboardingschool #villars #aigloncampus http://t.co/WGrXBAMQ0b
https://twitter.com/AiglonCollege/status/591237657054806016,Tue Dec 22 20:04:40 +0000 2009,2015-04-23 13:50:16,3,0,repNone,,False,Who wouldn't like to find a cosy corner in the library and read a book?#WorldBookDay @AiglonLibrary http://t.co/PB83JT9X7k
https://twitter.com/AiglonCollege/status/591224739198332928,Tue Dec 22 20:04:40 +0000 2009,2015-04-23 12:58:56,1,1,repNone,AlexScarrow,False,@AlexScarrow is giving an amazing workshop to the Junior School on generating story ideas. #ideasengines #bookweek http://t.co/dGd3PCMrsH
https://twitter.com/AiglonCollege/status/590425569944281088,Tue Dec 22 20:04:40 +0000 2009,2015-04-21 08:03:20,2,3,rep590165454427201536,GuardianTeach,False,@GuardianTeach An Alpine campus becomes an inspirational classroom for an art lesson. http://t.co/pUtsIt1eWk
https://twitter.com/AiglonCollege/status/588307075832352768,Tue Dec 22 20:04:40 +0000 2009,2015-04-15 11:45:11,3,1,repNone,,False,Today's classroom is very inspirational. #aigloncollege #swissboardingschool #arts #alpinecampus http://t.co/HewYgeSpB2
https://twitter.com/AiglonCollege/status/588277232935821312,Tue Dec 22 20:04:40 +0000 2009,2015-04-15 09:46:36,0,0,repNone,,False,Today's arts classroom #nofilter #inspirational #aigloncampus #aiglon #arts #alpinecampus… https://t.co/n7gb93nEHo
https://twitter.com/AiglonCollege/status/587885160508612608,Tue Dec 22 20:04:40 +0000 2009,2015-04-14 07:48:39,0,0,repNone,,False,The British Poet laureate Carol Ann Duffy is visiting Aiglon this week to deliver workshops and a whole school culture.
