id,Account Created At(same for all rows),status created_at,Fav_cont,retweeted_count,reply_to_status,reply_to_screen,quote,text
https://twitter.com/AiglonCollege/status/1356977767338901506,Tue Dec 22 20:04:40 +0000 2009,2021-02-03 14:48:05,1,0,repNone,,False,"Last week Aiglon welcomed a 'virtual visit' as part of a comprehensive review for CIS &amp; NEASC reaccreditation. With 27 lesson visits and 35 meetings, the virtual visitors met 60 staff, 14 students, 9 parents and 4 directors. Thank you all! @CISEducation @neasc https://t.co/tb3xDkrG3l"
https://twitter.com/AiglonCollege/status/1356580132341903360,Tue Dec 22 20:04:40 +0000 2009,2021-02-02 12:28:02,3,0,repNone,,False,"Ski touring, ice climbing, nordic skiing and snowshoeing —Aiglon's winter expedition program is in full swing! https://t.co/BPvRFLzi06"
https://twitter.com/AiglonCollege/status/1355138379776745475,Tue Dec 22 20:04:40 +0000 2009,2021-01-29 12:59:01,4,1,repNone,,False,"We wouldn't call it the easy way down —but Cristobal and Rita sure make it look simple. They are both learning what it takes to assist in the #Handiconcept programme. During the Winter Long-Ex, they will help a handicapped skier enjoy the thrill of some ski touring. https://t.co/pPoBkZj1Yj"
https://twitter.com/AiglonCollege/status/1354830361465937922,Tue Dec 22 20:04:40 +0000 2009,2021-01-28 16:35:04,0,0,repNone,,False,Tuesday morning assembly is an opportunity for Aiglon students to showcase their incredible musical talents. Don't miss a performance and check out the Aiglon Music Playlist on our YouTube channel: https://t.co/HRLrUwlIKy
https://twitter.com/AiglonCollege/status/1354721411458338816,Tue Dec 22 20:04:40 +0000 2009,2021-01-28 09:22:08,0,0,repNone,,False,"It's #ThrowbackThursday! Who knows which well-known ski jumper is featured in this photo from Patrick Roberts (S '65 - '87)? Hint, he is an alumnus and a former staff member. https://t.co/z0Ynd1oJwg"
https://twitter.com/AiglonCollege/status/1353997630607659010,Tue Dec 22 20:04:40 +0000 2009,2021-01-26 09:26:05,4,1,repNone,,False,Nothing says Winter Term at Aiglon like some ice climbing! https://t.co/vv97nG7wWW
https://twitter.com/AiglonCollege/status/1353712240130740224,Tue Dec 22 20:04:40 +0000 2009,2021-01-25 14:32:03,8,2,repNone,,False,Did you know that Aiglon students can train as ski instructors? This year we have 20 students who are undertaking a ski instructor training course working toward a professional qualification. The amazing snow conditions certainly help! https://t.co/e4JYFjOToQ
https://twitter.com/AiglonCollege/status/1352654024688996352,Tue Dec 22 20:04:40 +0000 2009,2021-01-22 16:27:05,3,0,repNone,,False,Congratulations to the 20 students who received outstanding IGCSE &amp; O Level exam results in English and French this week - everyone achieving an A* or A! https://t.co/z33SERfIV4
https://twitter.com/AiglonCollege/status/1352174501287571458,Tue Dec 22 20:04:40 +0000 2009,2021-01-21 08:41:37,0,1,repNone,,False,"RT @PDPEDAGOGUE: This time spotted in the Swiss Alps. Thanks Nichola Sparrow, Head at @AiglonCollege, for sharing.  Grab your own copy (htt…"
https://twitter.com/AiglonCollege/status/1352174401433829376,Tue Dec 22 20:04:40 +0000 2009,2021-01-21 08:41:14,0,1,repNone,,False,RT @isparentmag: Did you know that a goldfish has an attention span of nine seconds? The average teenager may have an attention span less t…
https://twitter.com/AiglonCollege/status/1351182331407724546,Tue Dec 22 20:04:40 +0000 2009,2021-01-18 14:59:06,1,0,repNone,,False,"Aiglon's newest College &amp; Careers counsellor, Beth Downing, shares her thoughts and experiences for the university search process. https://t.co/f7FHIYrY70 https://t.co/981pgUc8Yx"
https://twitter.com/AiglonCollege/status/1349753908919496705,Tue Dec 22 20:04:40 +0000 2009,2021-01-14 16:23:03,4,0,repNone,,False,"Thanks, Mr Logie, for capturing some fun winter scenes on campus —learning no matter the conditions! https://t.co/SI1oJizlm4"
https://twitter.com/AiglonCollege/status/1347555680362881024,Tue Dec 22 20:04:40 +0000 2009,2021-01-08 14:48:05,4,1,repNone,,False,The Class of 2021 already have offers to excellent schools around the world. Take a look at this impressive list! https://t.co/jEPL1Zx5Va https://t.co/KtZHk10oMA
https://twitter.com/AiglonCollege/status/1346817052208726017,Tue Dec 22 20:04:40 +0000 2009,2021-01-06 13:53:02,3,0,repNone,,False,"Classes begin next week, but our race teams are already training in excellent conditions. https://t.co/RNUkYTiR21"
https://twitter.com/AiglonCollege/status/1344678472157962240,Tue Dec 22 20:04:40 +0000 2009,2020-12-31 16:15:05,9,0,repNone,,False,It's #ThrowbackThursday! As the sun sets on 2020 we look back to December 1970 for this beautiful view of Solalex taken by Patrick Roberts (Staff 1965 - 1987). We send our best wishes for the new year to Aiglonians far and wide! https://t.co/0xD43KeQiA
https://twitter.com/AiglonCollege/status/1344295943395532801,Tue Dec 22 20:04:40 +0000 2009,2020-12-30 14:55:03,0,0,repNone,,False,"#aiglonsummer  Interactive learning, new challenges and an international community!  We look forward to welcoming you to Aiglon next summer... let the adventure begin!  https://t.co/zyHbwUFC3P https://t.co/GwHF5bxA4M"
https://twitter.com/AiglonCollege/status/1344237066494869507,Tue Dec 22 20:04:40 +0000 2009,2020-12-30 11:01:06,0,0,repNone,,False,In case you missed it . . . How do Aiglonians tackle the future of farming? How do you graduate with a helicopter licence? What's the lasting impact of your houseparent? Read #Issue15. https://t.co/DYe81jUz9Z https://t.co/GMuwp47PqC
https://twitter.com/AiglonCollege/status/1343880975357505537,Tue Dec 22 20:04:40 +0000 2009,2020-12-29 11:26:07,2,0,repNone,,False,"Support our scholars and make dreams like Stephen's a reality.""My dream is to have a positive impact on the lives of others. I hope to live up to my fullest potential, to serve my community with diligence, integrity and love, and to pay it forward."" https://t.co/MrIKoMDajT https://t.co/fn9ZmS0eBJ"
https://twitter.com/AiglonCollege/status/1341391076591079425,Tue Dec 22 20:04:40 +0000 2009,2020-12-22 14:32:09,1,0,repNone,,False,"Aiglon scholarships change lives, as Stepan (Alpina, 2015) can attest. Impact a life by making a gift of any size. https://t.co/MrIKoMDajT https://t.co/SvYmIQkqhx"
https://twitter.com/AiglonCollege/status/1339860469507645447,Tue Dec 22 20:04:40 +0000 2009,2020-12-18 09:10:03,1,0,repNone,,False,#aiglonsummer  Come and enjoy the lakes and mountains with Aiglon Summer School.  We offer both residential and non residential places for Summer 2021.  Find out more at https://t.co/zyHbwUFC3P https://t.co/W9hQ54LZzr
https://twitter.com/AiglonCollege/status/1337844188176650243,Tue Dec 22 20:04:40 +0000 2009,2020-12-12 19:38:05,2,0,repNone,,False,End of term greetings from Aiglon's Head of School. Filmed as part of our Prize Giving ceremony. https://t.co/4hsMufCgEl
https://twitter.com/AiglonCollege/status/1337764406151819266,Tue Dec 22 20:04:40 +0000 2009,2020-12-12 14:21:03,2,0,repNone,,False,"#aiglonsummer  Why not put your map reading skills to the test, whilst making new friends!  Let the adventure begin.  Find out more at https://t.co/zyHbwUFC3P https://t.co/lQ8DkSe5ba"
https://twitter.com/AiglonCollege/status/1337077390506418179,Tue Dec 22 20:04:40 +0000 2009,2020-12-10 16:51:06,4,1,repNone,,False,#Issue15 of the Aiglon Magazine has arrived! Check it out. https://t.co/DYe81jUz9Z https://t.co/loif6S5OXh
https://twitter.com/AiglonCollege/status/1336719537950117888,Tue Dec 22 20:04:40 +0000 2009,2020-12-09 17:09:07,7,2,repNone,,False,"Some of our classes recently worked with CLiPPA award winner, Karl Nova. Together they learned about the connections between poetry and rap. Students wrote their own poems and asked him questions. https://t.co/7hJXKzBJMp"
https://twitter.com/AiglonCollege/status/1336284159812186120,Tue Dec 22 20:04:40 +0000 2009,2020-12-08 12:19:05,4,0,repNone,,False,"With a cast that rotates throughout the production, the Aiglon Senior School is happy to present their performance of ""Art"" this week. Congrats to all who have been involved —the production will be streamed to the school community this evening. https://t.co/YNswWpBE6I"
https://twitter.com/AiglonCollege/status/1335947737217585152,Tue Dec 22 20:04:40 +0000 2009,2020-12-07 14:02:15,2,0,repNone,,False,"Always an Aiglon favourite, last week the Year 8 students participated in the traditional reading competition! Take a look at the winner's video! https://t.co/iMvKCt1YBP https://t.co/6iGbAvjEIv"
https://twitter.com/AiglonCollege/status/1334828372829085697,Tue Dec 22 20:04:40 +0000 2009,2020-12-04 11:54:18,10,1,repNone,,False,Not a bad spot for some Geography field work with our Year 10 students! https://t.co/losknaZlVC
https://twitter.com/AiglonCollege/status/1334121410592124931,Tue Dec 22 20:04:40 +0000 2009,2020-12-02 13:05:05,1,0,repNone,,False,#Summerschool  We look forward to next summer and meeting new students!  Morning courses range from English and French to Leadership Skills and Science and Engineering.  Activities range from mountain adventure and climbing to dance and visual art.  Let the adventure begin! https://t.co/FBM7xb8zMz
https://twitter.com/AiglonCollege/status/1334060008414326785,Tue Dec 22 20:04:40 +0000 2009,2020-12-02 09:01:06,3,0,repNone,,False,"Le Cerf held their first-ever Thanksgiving organised by the Year 12 students. Each girl had the opportunity to briefly say what they were thankful for. Common themes were family, friends and Le Cerf! https://t.co/8S9XFoSGqs"
https://twitter.com/AiglonCollege/status/1331652395789668352,Tue Dec 22 20:04:40 +0000 2009,2020-11-25 17:34:06,4,0,repNone,,False,"Le Cerf held their first-ever Thanksgiving organised by the Year 12 students. Each girl had the opportunity to briefly say what they were thankful for. Common themes were family, friends and Le Cerf! https://t.co/YZtqA1q5po"
https://twitter.com/AiglonCollege/status/1331578135666696195,Tue Dec 22 20:04:40 +0000 2009,2020-11-25 12:39:01,3,0,repNone,,False,We would love to see you at Aiglon next Summer!   Let the adventure begin... https://t.co/zyHbwUFC3P https://t.co/iMnfWYCdK1
https://twitter.com/AiglonCollege/status/1330791673115406337,Tue Dec 22 20:04:40 +0000 2009,2020-11-23 08:33:54,3,0,repNone,,True,Congratulations Mrs. Fanella-Koch! https://t.co/jkvFiI7o12
https://twitter.com/AiglonCollege/status/1329818554229809154,Tue Dec 22 20:04:40 +0000 2009,2020-11-20 16:07:04,1,0,repNone,,False,Take a look at the inaugural issue of our annual #ImpactReport — a publication which looks back over one of the most unusual years in Aiglon history. Read the report here: https://t.co/fC2uAxZC9j https://t.co/ezmDYGVN9L
https://twitter.com/AiglonCollege/status/1329763702250287107,Tue Dec 22 20:04:40 +0000 2009,2020-11-20 12:29:07,1,0,repNone,,False,"Read how alumna Léa Henaux (Exeter, 2020) tries to pay it forward as Peer Mentor in our ""Why I love"" column in Aiglon Magazine #Issue14. Read online:  https://t.co/Ks1xdD3BgF https://t.co/fVt1oskDrr"
https://twitter.com/AiglonCollege/status/1329518817735815171,Tue Dec 22 20:04:40 +0000 2009,2020-11-19 20:16:02,2,0,repNone,,False,What's happening in class this week? Year 7 students work on their Geography skills while studying map symbols. https://t.co/JabYHpiQ8T
https://twitter.com/AiglonCollege/status/1329465732363657216,Tue Dec 22 20:04:40 +0000 2009,2020-11-19 16:45:05,3,0,repNone,,False,Some Aiglon staff recently participated in the Swiss-wide health promotion programme #biketoworkch. Not only some impressive statistics but a wonderful initiative in support of sustainable mobility. https://t.co/e9rRytpjo7
https://twitter.com/AiglonCollege/status/1329061580458385408,Tue Dec 22 20:04:40 +0000 2009,2020-11-18 13:59:08,4,1,repNone,,False,"The 2020 #roundsquare mountain marathon was completed last weekend, raising money for the RS emergency fund. 7 Aiglon staff and students completed the full 42km (1000m+ of ascent) and 12 others either the half marathon or 10km options - a massive effort from everyone involved! https://t.co/UQjZzvjzRo"
https://twitter.com/AiglonCollege/status/1328796579243974658,Tue Dec 22 20:04:40 +0000 2009,2020-11-17 20:26:06,1,0,repNone,,False,#SummerSchool....  Let the adventure begin! Find out more at https://t.co/zyHbwUFC3P https://t.co/HCpm1HeytK
https://twitter.com/AiglonCollege/status/1328705980088115204,Tue Dec 22 20:04:40 +0000 2009,2020-11-17 14:26:06,4,0,repNone,,False,Plenty of amazing expeditions were out this weekend taking full advantage of the lovely autumn conditions. One group summited La Seya above Ovronnaz in Valais. https://t.co/dGDvtDzhzN
https://twitter.com/AiglonCollege/status/1328382849192484867,Tue Dec 22 20:04:40 +0000 2009,2020-11-16 17:02:06,2,0,repNone,,False,"Tune in as alumna Alia Al-Senussi (Chantecler, 2000) shares how Aiglon helped shape her career path, which now includes numerous board and advisory positions and her recent PhD! https://t.co/1aXoZ2eZ8X"
https://twitter.com/AiglonCollege/status/1327291650939424769,Tue Dec 22 20:04:40 +0000 2009,2020-11-13 16:46:04,1,0,repNone,,False,"It's tricky to keep advancing our technology, and yet also be sustainable and thoughtful in the process. An Aiglon's IT technician pioneered a donation project to offer our old desktop machines to a Swiss relief agency aiding their video conferencing and communication needs. https://t.co/NahBoKQapz"
https://twitter.com/AiglonCollege/status/1326925735899095047,Tue Dec 22 20:04:40 +0000 2009,2020-11-12 16:32:03,3,0,repNone,,False,"#LaCasa According to some of our students, these past two weeks have been the best of the year. We had tons of fun but also kept a high academic standard. We have worked hard to make sure that the girls are not too unsettled by these rather strange times. https://t.co/1s2OKxupO9"
https://twitter.com/AiglonCollege/status/1326629801763991552,Tue Dec 22 20:04:40 +0000 2009,2020-11-11 20:56:06,6,0,repNone,,False,"For Remembrance Day, Aiglon history teacher, Ms Widdows, created a WWI exhibit for students to visit and learn about the stories of people who fought. The whole school also participated in a streamed event and moment of silence. https://t.co/3dEw7W2lK8"
https://twitter.com/AiglonCollege/status/1326575931692085252,Tue Dec 22 20:04:40 +0000 2009,2020-11-11 17:22:03,2,0,repNone,,False,"Run by our languages department, there were 45 entries in 5 different languages for the 2020 translation competition. Well done to everyone who entered their version of Spike Milligan's 'The Ning Nang Nong.' https://t.co/LPit2tYnPD"
https://twitter.com/AiglonCollege/status/1326177688025968640,Tue Dec 22 20:04:40 +0000 2009,2020-11-10 14:59:34,4,0,repNone,,False,"Aiglon's ski team is back at it! Slopes are open at the Diablerets Glacier, and our teams are making the most of the beautiful autumn weather. https://t.co/OOfZUGqnhD"
https://twitter.com/AiglonCollege/status/1325044443238588416,Tue Dec 22 20:04:40 +0000 2009,2020-11-07 11:56:28,9,0,repNone,,False,"Houses at Aiglon are always full of life and activities, and we're looking forward to another weekend together! https://t.co/ho1ghMHZRi"
https://twitter.com/AiglonCollege/status/1323223094337671168,Tue Dec 22 20:04:40 +0000 2009,2020-11-02 11:19:04,2,0,repNone,,False,"“The cloud kitchen is becoming a global norm, but it’s something that doesn’t exist in Saudi yet – I’m one of the first, and the lack of overheads is proving a successful model in these challenging times.” Read more about Amna's (Exeter, 2005) business ... https://t.co/YzKjBLDHJb https://t.co/pgAWXdiVCx"
https://twitter.com/AiglonCollege/status/1322215701554352129,Tue Dec 22 20:04:40 +0000 2009,2020-10-30 16:36:03,2,0,repNone,,False,Mr Duckling and Mr Wise shared the 6 Ways Hybrid Teaching Has Boosted Learning at Aiglon with TES. Read more here: https://t.co/dLOoldv8SS
https://twitter.com/AiglonCollege/status/1321817099019452417,Tue Dec 22 20:04:40 +0000 2009,2020-10-29 14:12:09,2,1,repNone,,False,"Its #ThrowbackThursday! It is a grey autumn day here in Chesières with the peaks of the mountains hidden by clouds, so let's enjoy the view from the top of the Dents du Midi in this photo from our archives. Do you recognise anyone in the photo? Post your comments and let us know. https://t.co/82XLwkI5Im"
https://twitter.com/AiglonCollege/status/1320740985933123590,Tue Dec 22 20:04:40 +0000 2009,2020-10-26 14:56:03,1,0,repNone,,False,Always dreamed of setting up your own place serving food and drink? We meet the Aiglonians in #Issue14 of the Aiglon Magazine showing how it’s done – and delivering the hottest plates in town. Read online: https://t.co/YzKjBLDHJb https://t.co/KlizNFCI4X
https://twitter.com/AiglonCollege/status/1319599961915461633,Tue Dec 22 20:04:40 +0000 2009,2020-10-23 11:22:02,1,0,repNone,,False,Last week our #Juniors managed to reach the summits of Mont Chevreuil (1749m) and Grand Chamossaire (2112m) in challenging conditions!   These days gave them the opportunity to challenge themselves both physically and mentally whilst getting to know more about their friends. https://t.co/bZ1dC3sMfx
https://twitter.com/AiglonCollege/status/1318535717165957120,Tue Dec 22 20:04:40 +0000 2009,2020-10-20 12:53:06,1,1,repNone,,False,"We couldn't visit famous European cities, but how did we reinvent our #LongEx Programme to embrace adventure, learn a new skill and have some fun? Read about the Year 9 experiences online: https://t.co/YMyl78ILcv https://t.co/u4b836byxJ"
https://twitter.com/AiglonCollege/status/1318138579273568257,Tue Dec 22 20:04:40 +0000 2009,2020-10-19 10:35:01,2,0,repNone,,False,"Tune in to the Aiglon Music playlist on our YouTube channel and don't miss another musical performance! Recorded on campus for Tuesday morning assembly, there is so much talent at Aiglon! https://t.co/Z7Ba4iXVaX"
https://twitter.com/AiglonCollege/status/1317134918812663808,Tue Dec 22 20:04:40 +0000 2009,2020-10-16 16:06:50,3,1,repNone,,False,"Canoeing, biking, and navigating: Year 9 students worked on the theme of ""journeying"" to explore some beautiful corners of our local area as part of their #LongEx this week! https://t.co/Jh9eZCLkxY"
https://twitter.com/AiglonCollege/status/1317021228666822656,Tue Dec 22 20:04:40 +0000 2009,2020-10-16 08:35:04,2,0,repNone,,False,"""Service is about putting others first. People lead busy lives and are often focused on themselves, so service is a time to reflect on that – on being less selfish."" Read the full article in #Issue14 https://t.co/nL7MQi7Zlg https://t.co/JOJchpfCMG"
https://twitter.com/AiglonCollege/status/1316770094761082881,Tue Dec 22 20:04:40 +0000 2009,2020-10-15 15:57:09,6,0,repNone,,False,"During the #Clairmont house outing, the girls really got to know each other and create stronger bonds across all year groups. Many unforgettable and very entertaining moments were created.  Through this house outing, the Clairmont spirit was augmented in everyone's hearts. https://t.co/1ZqnAifNA3"
https://twitter.com/AiglonCollege/status/1316434102900457473,Tue Dec 22 20:04:40 +0000 2009,2020-10-14 17:42:02,3,0,repNone,,False,"#summerschool The 2021 schedule is now live on the website!  With morning courses, outdoor activities and camping - its time to plan for new adventures! https://t.co/F7IUxrYRDV"
https://twitter.com/AiglonCollege/status/1316038450995507206,Tue Dec 22 20:04:40 +0000 2009,2020-10-13 15:29:52,1,1,repNone,,False,"On a beautiful autumn day, Junior language students head outside for a ""translation"" relay! Running back and forth they had to help their team translate a short conversation from French to English. Not a bad way to practise your French! https://t.co/Mn9XerovVO"
https://twitter.com/AiglonCollege/status/1315641894324654081,Tue Dec 22 20:04:40 +0000 2009,2020-10-12 13:14:05,3,0,repNone,,False,"It's Monday, so just in case you needed an amusing reminder of how molecules work --we present our Year 7 students. https://t.co/60F6nNtC70"
https://twitter.com/AiglonCollege/status/1314595997998252032,Tue Dec 22 20:04:40 +0000 2009,2020-10-09 15:58:04,0,0,repNone,,False,Service is central to the Aiglon experience. It can also be life changing. You told us why in #Issue14 of the Aiglon Magazine. Read online: https://t.co/15wWTTjRBe https://t.co/OKRfOBQlAY
https://twitter.com/AiglonCollege/status/1314159613743435776,Tue Dec 22 20:04:40 +0000 2009,2020-10-08 11:04:02,2,0,repNone,,False,For our first #housepost of the year we take a look at our proud #Alpina boys. Throughout the term we will feature each of Aiglon's boarding houses. https://t.co/9rKdovoYPQ
https://twitter.com/AiglonCollege/status/1311251075845021696,Tue Dec 22 20:04:40 +0000 2009,2020-09-30 10:26:33,2,0,repNone,,False,"#SummerSchool2021 Summer school at Aiglon, a fantastic place to be... fresh air, interactive learning, new friends and fun! https://t.co/matYQOgAR6"
https://twitter.com/AiglonCollege/status/1310955758536798222,Tue Dec 22 20:04:40 +0000 2009,2020-09-29 14:53:03,16,1,repNone,,False,Peering through the cloud window on a moody autumn day. Who enjoys this kind of day on the mountain? https://t.co/mtKlnfCvcz
https://twitter.com/AiglonCollege/status/1310896115160682497,Tue Dec 22 20:04:40 +0000 2009,2020-09-29 10:56:03,8,1,repNone,,False,Year 13 environmental systems &amp; societies students have been busy this week learning how to measure biodiversity as they investigate human impact on the environment in Villars. Yes --that is snow in September. https://t.co/aiU3Jvo4xF
https://twitter.com/AiglonCollege/status/1309478532469477378,Tue Dec 22 20:04:40 +0000 2009,2020-09-25 13:03:05,5,0,repNone,,False,"Boarding life resumes at Aiglon! Each house is unique, and Clairmont has started their year with a pizza party, pancake morning, tutor meetings and lots of fun. Aiglon's house spirit continues! https://t.co/Hqn7yWMohR"
https://twitter.com/AiglonCollege/status/1309413922961854464,Tue Dec 22 20:04:40 +0000 2009,2020-09-25 08:46:21,2,0,repNone,,False,Year 8 students experiment with burning magnesium as part of a lab practical this week. https://t.co/yxs9TBKeL9
https://twitter.com/AiglonCollege/status/1309094744295960576,Tue Dec 22 20:04:40 +0000 2009,2020-09-24 11:38:03,2,0,repNone,,False,"It's #ThrowbackThursday! It is the season for high expeditions so we look back to an all-time favorite - the ascent of the Dent de Morcles. This photo was taken in 1972 and features a man who was usually behind the camera, Patrick Roberts (Staff 1965-87), shown here second fr.... https://t.co/3YnNfHAOGB"
https://twitter.com/AiglonCollege/status/1309040896319598594,Tue Dec 22 20:04:40 +0000 2009,2020-09-24 08:04:05,1,0,repNone,,False,"Year 7 students are exploring their local environment through 'Flora &amp; Fauna'. They are now scientific illustrators and discoverers, identifying species and recording their findings through drawing, photography and writing. https://t.co/7u0BOKCJPT"
https://twitter.com/AiglonCollege/status/1308801813618057216,Tue Dec 22 20:04:40 +0000 2009,2020-09-23 16:14:03,2,0,repNone,,False,"Almost all of our students have been able to safely return to campus, but a few are still at home taking advantage of our Hybrid Learning programme. Here on campus, Edward (Year 8) collaborates through the iPad with two classmates who are abroad to model compounds! https://t.co/DlgmmFnvF7"
https://twitter.com/AiglonCollege/status/1308475910723637250,Tue Dec 22 20:04:40 +0000 2009,2020-09-22 18:39:02,6,0,repNone,,False,It's beginning to feel like autumn here on the mountain! (Photo from the weekend's Year 9 expedition above the Col de la Croix.) https://t.co/AOJpEHnTAr
https://twitter.com/AiglonCollege/status/1308356883095457793,Tue Dec 22 20:04:40 +0000 2009,2020-09-22 10:46:03,1,0,repNone,,False,"#Summerschool2021 Applications are now open for next years Summer School. We offer both residential and non residential places, and look forward to welcoming students to our action packed programmes! https://t.co/Mkm78fbjMQ"
https://twitter.com/AiglonCollege/status/1308070741406109696,Tue Dec 22 20:04:40 +0000 2009,2020-09-21 15:49:02,4,0,repNone,,False,How does it feel to be back at Aiglon? Students take in the magnificent views over Lac Léman during the new year's first weekend expeditions. https://t.co/LKlmtQLUQe
https://twitter.com/AiglonCollege/status/1308017907721527297,Tue Dec 22 20:04:40 +0000 2009,2020-09-21 12:19:05,5,0,repNone,,False,Students celebrate their first week back by returning to the mountains. Expeditions this weekend saw students summiting the Point d'Arpille and the Grammont while others spent time canoeing down in the valley. It's nice to have our students back! https://t.co/67qzIJOaTo
https://twitter.com/AiglonCollege/status/1298907365757120512,Tue Dec 22 20:04:40 +0000 2009,2020-08-27 08:57:03,7,0,repNone,,False,"Its #ThrowbackThursday and since the crocuses are appearing in the fields signaling the end of summer, it is a good time to look back to the winter of 1970. The view from the top of the Roc d'Orsay hasn't changed, but the gondolas have. The new gondolas take 8 people to the t...! https://t.co/NBsd377oHx"
https://twitter.com/AiglonCollege/status/1290210321055899648,Tue Dec 22 20:04:40 +0000 2009,2020-08-03 08:58:06,1,0,repNone,,False,"In case you missed this long read from #Issue14? Learn how Aiglon teachers, students and staff managed to transition to a completely online learning environment. https://t.co/Oa6GX8QLgA https://t.co/uYx6bqqnio"
https://twitter.com/AiglonCollege/status/1288790460564209664,Tue Dec 22 20:04:40 +0000 2009,2020-07-30 10:56:05,5,0,repNone,,False,Its #ThrowbackThursday! This photo courtesy of Patrick Roberts (Staff 1965 - 87) comes from the 1966 Dijon Cultural Long Ex. The French trains have evolved a bit since then. The TGV now makes the Aigle-Dijon trip in less than 3 hours. https://t.co/f1oHD25LSt
