id,Account Created At(same for all rows),status created_at,Fav_cont,retweeted_count,reply_to_status,reply_to_screen,quote,text
https://twitter.com/AiglonCollege/status/1204751422933348353,Tue Dec 22 20:04:40 +0000 2009,2019-12-11 13:14:57,0,0,repNone,,False,"Congratulations to all on the stellar performance of William Shakespeare's Romeo &amp; Juliet, if you didn't see it last night, the show runs this evening and tomorrow afternoon. Well done to all involved! https://t.co/pSAe99C1KS"
https://twitter.com/AiglonCollege/status/1204400158454296576,Tue Dec 22 20:04:40 +0000 2009,2019-12-10 13:59:09,1,0,repNone,,False,"Subscribe to our YouTube channel and check out the rest of our ""Life on the Mountain"" series to learn more about Aiglon.  https://t.co/QwTtNYey6J https://t.co/nRJHDMMECd"
https://twitter.com/AiglonCollege/status/1204364410623610880,Tue Dec 22 20:04:40 +0000 2009,2019-12-10 11:37:06,1,0,repNone,,False,Join us tonight to enjoy Aiglon's autumn production with a  re-imagined take on the classic story of Romeo &amp; Juliet. Shows tonight and tomorrow at 19h30 and on Thursday at 16h00. See you there! https://t.co/BLLp2szfnX
https://twitter.com/AiglonCollege/status/1204310589432045568,Tue Dec 22 20:04:40 +0000 2009,2019-12-10 08:03:14,4,0,repNone,,False,"TONIGHT. Two warring families, one night club, tunes to die for and a love that knows no bounds. Welcome to our re-imagining of Shakespeare’s ‘Romeo and Juliet’. Performances tonight, tomorrow and Thursday! https://t.co/wd7Z9kn4ZW"
https://twitter.com/AiglonCollege/status/1202957624775446529,Tue Dec 22 20:04:40 +0000 2009,2019-12-06 14:27:02,1,0,repNone,,False,"Don't forget to register before the end of the month to take advantage of the early bird discount! Mention ""Early Bird Discount"" in the comments section of the application. https://t.co/zLl4OkB7lv"
https://twitter.com/AiglonCollege/status/1202887919205330944,Tue Dec 22 20:04:40 +0000 2009,2019-12-06 09:50:03,2,0,repNone,,False,"What makes Year 5 &amp; 6 at Aiglon so speical? Take a look at all the activities, outings and adventures that made this term so amazing for our youngest! #JuniorSchool https://t.co/dMiGNnS3BQ"
https://twitter.com/AiglonCollege/status/1202623679462543362,Tue Dec 22 20:04:40 +0000 2009,2019-12-05 16:20:03,2,0,repNone,,False,"What's happening in #LaBaita? The holidays will be upon us soon and the boys in La Baita are getting ready for the break with their families. However, the last two weeks of term are very busy! https://t.co/zWmyIaI6oR"
https://twitter.com/AiglonCollege/status/1200378632088281092,Tue Dec 22 20:04:40 +0000 2009,2019-11-29 11:39:02,3,0,repNone,,False,#WinterCamps2020 at Aiglon start in January!!!  Residential or non-residential places are available for students aged 8 -13 years. A great way to combine classroom teaching with learning to ski. Learn more: https://t.co/qcXBz51Wru https://t.co/WAulHPaGy2
https://twitter.com/AiglonCollege/status/1200126476953239558,Tue Dec 22 20:04:40 +0000 2009,2019-11-28 18:57:04,0,0,repNone,,False,Up with People travels across the United States and several European countries delivering important messages to youth through the performing arts. Thank you for your visit yesterday to perform and run workshops with our students. https://t.co/EB4eZMomoU
https://twitter.com/AiglonCollege/status/1200056531175301123,Tue Dec 22 20:04:40 +0000 2009,2019-11-28 14:19:07,1,0,repNone,,False,#LaCasa girls love reading! Take a look at this week's #HouseUpdate to learn how we emphasise important literacy skills in our youngest students. #AiglonJuniors https://t.co/ni1RYnmaaP https://t.co/MpitJuHpVc
https://twitter.com/AiglonCollege/status/1199744210682941440,Tue Dec 22 20:04:40 +0000 2009,2019-11-27 17:38:04,1,0,repNone,,False,#ProjectTenerife #AiglonDiscovery Year 8 students returned after spending an amazing week exploring Tenerife as part of our Discovery Programme. Read our journal: https://t.co/IkYt32E7fL https://t.co/FdDoDLi0c7
https://twitter.com/AiglonCollege/status/1199692617950416896,Tue Dec 22 20:04:40 +0000 2009,2019-11-27 14:13:03,1,0,repNone,,False,Students spent a busy weekend in Paris as part of a Modern Foreign Languages trip. What better way to work on your French then while cooking and exploring the City of Lights? https://t.co/CIRW3L4uVZ
https://twitter.com/AiglonCollege/status/1199420627997876224,Tue Dec 22 20:04:40 +0000 2009,2019-11-26 20:12:16,6,1,repNone,,False,"In a favourite tradition, the #ElderlyLunch allows students to invite and serve locals with an afternoon of food, friends and entertainment. It's a great way we make local connections. Thanks to everyone who helped make this a fantastic event once again! https://t.co/0Wk0f3rdYf"
https://twitter.com/AiglonCollege/status/1199318261365706759,Tue Dec 22 20:04:40 +0000 2009,2019-11-26 13:25:30,0,0,repNone,,False,"The Annual Fund allows us to provide unique opportunities and accelerate our progress as a leading global school. Every gift counts, please consider supporting Aiglon today.  https://t.co/8ANb5wcG4B"
https://twitter.com/AiglonCollege/status/1197968258462310403,Tue Dec 22 20:04:40 +0000 2009,2019-11-22 20:01:04,1,0,repNone,,False,Register before December 31st to benefit from our early bird discount.  Between our multiple Summer School options you are sure to find the right programme for your child! https://t.co/tovzOmIM55
https://twitter.com/AiglonCollege/status/1197911384824131585,Tue Dec 22 20:04:40 +0000 2009,2019-11-22 16:15:04,2,0,repNone,,False,"The Aiglon boys' and girls' badminton teams have both returned home as winners of La Cote's u19 invitational tournament. Congratulations to Jamie, Lakshmi, Penny and Amanda and Tony, Ryuto, Jens and Jack! https://t.co/trudo6bGb3"
https://twitter.com/AiglonCollege/status/1196882883048361984,Tue Dec 22 20:04:40 +0000 2009,2019-11-19 20:08:10,3,0,repNone,,False,"#AiglonDiscovery #ProjectTenerife We’ve had great days so far in Tenerife with Year 8 working to connect the classroom to real life experiences. From solar telescopes to volcanoes, there is so much here to explore and discover! Read our live journal: https://t.co/3yTEvo4Z46 https://t.co/ytyDft5smr"
https://twitter.com/AiglonCollege/status/1196521625656672256,Tue Dec 22 20:04:40 +0000 2009,2019-11-18 20:12:40,5,0,repNone,,False,"We have such a wonderful community in Japan! 30 alumni, parents and friends gathered at the Grand Kitchen of the Palace Hotel Tokyo this past Saturday.  A special thanks to Sae Tanaka for assisting with the planning; it was a wonderful time bringing people together. https://t.co/WqmT9fzSVi"
https://twitter.com/AiglonCollege/status/1196410936065765377,Tue Dec 22 20:04:40 +0000 2009,2019-11-18 12:52:50,1,0,repNone,,False,"Do you live in the Czech Republic and want to learn more about Aiglon? Arrange a time to meet with Admissions Officer, Luke Steward (l.steward@aiglon.ch). Meet Aiglon Worldwide: https://t.co/0Uvhh8LE4S https://t.co/eG3Vd4SpCs"
https://twitter.com/AiglonCollege/status/1196355124643405824,Tue Dec 22 20:04:40 +0000 2009,2019-11-18 09:11:03,2,0,repNone,,False,"#Summer2020Courses Camp craft and survival skills to public speaking, team challenges, map reading, orienteering and climbing --the new #MountainLeadership course has it all! Applications are open! https://t.co/BVuFqfAd1e https://t.co/Ggh4N56tte"
https://twitter.com/AiglonCollege/status/1196092146685743104,Tue Dec 22 20:04:40 +0000 2009,2019-11-17 15:46:04,6,0,repNone,,False,"#Summer2020Courses The new #SwissExplorer course teaches students about Switzerland's unique geography and culture. Explore the local community, learn how cheese and chocolate are made and experience mountains and waterfalls. #LettheAdventureBegin https://t.co/YnUmOcnQyt https://t.co/pOtLNesx4q"
https://twitter.com/AiglonCollege/status/1195661811321847809,Tue Dec 22 20:04:40 +0000 2009,2019-11-16 11:16:04,3,0,repNone,,False,"#Summer2020Courses Take time away from the classroom and learn how to build and cook on a stone oven: teamwork, engineering and a new challenge! https://t.co/5etAWHIn0B https://t.co/ANHrpoSQiw"
https://twitter.com/AiglonCollege/status/1195381459449733120,Tue Dec 22 20:04:40 +0000 2009,2019-11-15 16:42:03,0,0,repNone,,False,"#Summer2020Courses The Business and Entrepreneurship Course: create a business concept, learn marketing skills, how to write a CV and cover letter and public speaking. Applications are open! #LetTheAdventureBegin https://t.co/kEPRwm9LAZ https://t.co/EyTJbg2YS6"
https://twitter.com/AiglonCollege/status/1195354046116311042,Tue Dec 22 20:04:40 +0000 2009,2019-11-15 14:53:07,0,0,repNone,,False,"Meet Admissions Officer, Luke Steward, in Kazakhstan this weekend. Arrange a meeting (l.steward@aiglon.ch) today! https://t.co/VxGCnWtP7Q"
https://twitter.com/AiglonCollege/status/1195279033283567616,Tue Dec 22 20:04:40 +0000 2009,2019-11-15 09:55:03,2,0,repNone,,False,"SATs at Aiglon. Past participants of the programme applied and were admitted to: Babson, Brown, Claremont McKenna, Cornell, Dartmouth, Duke, Georgetown, Harvard, Princeton, Stanford, Tufts, UCLA, UC Berkeley, and USC to name just a few! https://t.co/xtF0v7LNat https://t.co/MChhlG8tOK"
https://twitter.com/AiglonCollege/status/1195053562369335302,Tue Dec 22 20:04:40 +0000 2009,2019-11-14 18:59:06,1,0,repNone,,False,"People always ask, what is life in house like? Well, Exeter told us! Dishwashers. Football. Expedition. Shared meals. Red velvet cake. Gratitude. Exeter girls love their house, read more: https://t.co/qyaTpB0yMh https://t.co/xDosLMJk5z"
https://twitter.com/AiglonCollege/status/1194988116756578304,Tue Dec 22 20:04:40 +0000 2009,2019-11-14 14:39:03,1,0,repNone,,False,"Aiglon students have great SAT scores, but what does that mean? Our College &amp; Careers Director takes a close look. Read: https://t.co/xtF0v7LNat https://t.co/u2NXmvPYxz"
https://twitter.com/AiglonCollege/status/1194613709097844736,Tue Dec 22 20:04:40 +0000 2009,2019-11-13 13:51:17,0,0,repNone,,False,"Join Aiglon's Director of Admissions &amp; Marketing, Valerie Scullion, in Tokyo this week. Arrange a meeting (v.scullion@aiglon.ch) to learn what's special about education at Aiglon College. https://t.co/0GAJ0WRGMJ"
https://twitter.com/AiglonCollege/status/1194585979740393472,Tue Dec 22 20:04:40 +0000 2009,2019-11-13 12:01:06,1,0,repNone,,False,Alumni parent Mr Burgunder is a Yale University alumnus interviewer. He spoke to Year 12 and 13 students earlier this week on how best to prepare for university interviews. It's great to have so much experience in our community! https://t.co/YfnGV08Df4
https://twitter.com/AiglonCollege/status/1194551492470083584,Tue Dec 22 20:04:40 +0000 2009,2019-11-13 09:44:04,1,0,repNone,,False,"Enjoyed collaborating with 5 Elements Production last season to produce the latest in our ""Life on the Mountain"" video series. Check out all our videos on YouTube: https://t.co/QwTtNYey6J https://t.co/ME5xFO2bbV"
https://twitter.com/AiglonCollege/status/1193952572207484931,Tue Dec 22 20:04:40 +0000 2009,2019-11-11 18:04:10,1,0,repNone,,False,Students and staff mark #RemembranceDay each year on the South Lawn. This year bagpipes and trumpets joined poems and readings of reflection before concluding with a two-minute silence. https://t.co/XWMIHKGbS7
https://twitter.com/AiglonCollege/status/1193933933060263937,Tue Dec 22 20:04:40 +0000 2009,2019-11-11 16:50:06,2,0,repNone,,False,"Aiglon welcomed the best of basketball over the weekend, hosting our annual girls' SGIS tournament. Against some outstanding teams, we narrowly lost in the 3rd place playoff. Well done to all teams involved! https://t.co/80tHGlbTaN"
https://twitter.com/AiglonCollege/status/1193905998811017226,Tue Dec 22 20:04:40 +0000 2009,2019-11-11 14:59:06,0,0,repNone,,False,"Valerie Scullion, Aiglon's Admissions &amp; Marketing Director, will be in Seoul this week. Contact her (v.scullion@aiglon.ch) if you want to arrange a meeting to talk about the opportunities at Aiglon. Learn about all of our upcoming dates: https://t.co/0Uvhh8LE4S https://t.co/MtFwypzUnt"
https://twitter.com/AiglonCollege/status/1192786620958814213,Tue Dec 22 20:04:40 +0000 2009,2019-11-08 12:51:05,0,0,repNone,,False,"The next SAT course runs from the 13 - 17 December 2019 for students wishing to develop their aptitude for future SAT or ACT testing.  Places are available now, and application is on the Aiglon website! https://t.co/xoYP3V9YgV"
https://twitter.com/AiglonCollege/status/1192485885289390081,Tue Dec 22 20:04:40 +0000 2009,2019-11-07 16:56:05,3,0,repNone,,False,"Great commitment shown by Aiglon's volleyball girls, coming back early from holidays to compete in the SGIS Championships. Finishing 5th out of 13, they lost to only 2 teams - both eventual finalists! https://t.co/lukJt7Xpbh"
https://twitter.com/AiglonCollege/status/1192414922807955456,Tue Dec 22 20:04:40 +0000 2009,2019-11-07 12:14:06,0,0,repNone,,False,"It's that time of year! University application season. Mrs Fanella-Koch offers some expert advice on how to craft a ""balanced"" application list. Read: https://t.co/GoNDZrvmhU https://t.co/VsOvqIq3Oe"
https://twitter.com/AiglonCollege/status/1190227259220725760,Tue Dec 22 20:04:40 +0000 2009,2019-11-01 11:21:06,1,0,repNone,,False,Always exciting to see the work on campus during the breaks. Art students return to a brand new digital suite --and Mrs Sparrow gives the computers a test run! https://t.co/XqHiagrCEL
https://twitter.com/AiglonCollege/status/1190007550571364365,Tue Dec 22 20:04:40 +0000 2009,2019-10-31 20:48:03,2,0,repNone,,False,"The remaining episodes of our first series of The Aiglon Meditation Podcast are now live! Thank you Mrs Hall, Mr Baynton, Mr Teal, Francesca, Mrs Ford, Kritee and Mr Fairweather for keeping this tradition alive and well. Listen on all platforms: https://t.co/aOp1fryLDA https://t.co/PwG1G7j0ff"
https://twitter.com/AiglonCollege/status/1189534056960200705,Tue Dec 22 20:04:40 +0000 2009,2019-10-30 13:26:34,0,0,repNone,,False,"Admissions Officer, Luke Steward, will be in Istanbul next week! Learn more about Aiglon by arranging a meeting: admissions@aiglon.ch. https://t.co/qdIGlBbEiD"
https://twitter.com/AiglonCollege/status/1189231649843798018,Tue Dec 22 20:04:40 +0000 2009,2019-10-29 17:24:54,5,0,repNone,,False,"Over half-term students had the unique opportunity to travel to Peru to participate in service projects, learn about the culture and explore the world. Here are some of their favourite photos. https://t.co/MUNvSnzH1E"
https://twitter.com/AiglonCollege/status/1186593102313730054,Tue Dec 22 20:04:40 +0000 2009,2019-10-22 10:40:16,8,0,repNone,,False,Campus wearing its autumn colours! 🍂🍂🍂 https://t.co/mAdk9UF38q
https://twitter.com/AiglonCollege/status/1185571837285163015,Tue Dec 22 20:04:40 +0000 2009,2019-10-19 15:02:07,1,0,repNone,,False,"The Challenger is aimed toward teenagers who are hungry to experience more challenging subject matter, to get to grips with ideas that go beyond the fundamental and really delve into fascinating opportunities for discovery. Learn more: https://t.co/N4V8WuWV2p https://t.co/xftWU7YMU2"
https://twitter.com/AiglonCollege/status/1185498590791245826,Tue Dec 22 20:04:40 +0000 2009,2019-10-19 10:11:04,2,0,repNone,,False,"Mrs Sparrow, Aiglon's Head of School, provides some half-term reflections on what it means to pursue excellence as habit in our learning community: https://t.co/LK5YKGiO2W https://t.co/TMZSMvlSpC"
https://twitter.com/AiglonCollege/status/1185179746075926529,Tue Dec 22 20:04:40 +0000 2009,2019-10-18 13:04:05,1,0,repNone,,False,"Students, enjoy your well-earned half term! As we leave, Mrs Sparrow gives some thoughts on how we pursue excellence as a habit, highlighting some of the successes we have seen so far this year. Read: https://t.co/LK5YKGiO2W https://t.co/uNdbqBhRqL"
https://twitter.com/AiglonCollege/status/1184828670646669315,Tue Dec 22 20:04:40 +0000 2009,2019-10-17 13:49:02,0,0,repNone,,False,"The new can be as daunting as it is exciting. For students embarking upon our Classic programme, it’s a chance to dive into untested waters with the reassurance that they will be supported by enthusiastic, caring experts. https://t.co/910VtiBHlQ"
https://twitter.com/AiglonCollege/status/1184788420670971907,Tue Dec 22 20:04:40 +0000 2009,2019-10-17 11:09:06,1,0,repNone,,False,"What is on your Aiglon bucket list? ""Camp in the centre of campus on my last night!"" ""Going on a service project."" ""Dents du Midi high-ex and more skinning."" ""Graduating!"" Read more from the #Belvedere interviews with Year 13: https://t.co/6jgKOKKa8O https://t.co/5L8W8SQ0HB"
https://twitter.com/AiglonCollege/status/1184747146576310273,Tue Dec 22 20:04:40 +0000 2009,2019-10-17 08:25:05,1,0,repNone,,False,"The next SAT course runs from the 13 - 17 December 2019 for students wishing to develop their aptitude for future SAT or ACT testing.  Places are available now, and application is on the Aiglon website! https://t.co/Qg8D3DLczt"
https://twitter.com/AiglonCollege/status/1184506552885100544,Tue Dec 22 20:04:40 +0000 2009,2019-10-16 16:29:03,0,0,repNone,,False,#Belvedere interviewed Year 13 students to reflect on their finest Aiglon memories in this week's #HouseUpdate  Read: https://t.co/6jgKOKKa8O https://t.co/udVg9Ilsdb
https://twitter.com/AiglonCollege/status/1184418470638837760,Tue Dec 22 20:04:40 +0000 2009,2019-10-16 10:39:03,2,0,repNone,,False,"Students approaching their final years of schooling are not only keen for new experiences, but are looking for opportunities to push their own limits - academically, emotionally, and physically. For this, we have a new programme with young adults aged 15-17 in mind. https://t.co/MS1dU6r7ML"
https://twitter.com/AiglonCollege/status/1184173751950303232,Tue Dec 22 20:04:40 +0000 2009,2019-10-15 18:26:38,5,0,repNone,,False,"What do Bern, Barcelona, Budapest and Rome all have in common? They are just some of the destinations in this year's #AiglonDiscoveryTrips. The whole school has emptied from Villars to travel around Europe! We look forward to seeing more! https://t.co/X5OcN8e8es"
https://twitter.com/AiglonCollege/status/1183712562908667904,Tue Dec 22 20:04:40 +0000 2009,2019-10-14 11:54:01,2,0,repNone,,False,Diversity forms part of our guiding principles and we understand how vital it is to share experiences with those whose cultures differ from our own. We are proud that our programme annually hosts attendees from more than 30 countries. Book today: https://t.co/N4V8WuWV2p https://t.co/D68cIq7Gqh
https://twitter.com/AiglonCollege/status/1183659726984364033,Tue Dec 22 20:04:40 +0000 2009,2019-10-14 08:24:04,0,0,repNone,,False,Winter Camps at Aiglon start on the 12th of January 2020 for students aged 7 - 13  - a great way to combine classroom teaching with learning to ski!  https://t.co/hnfKNcnOeD
https://twitter.com/AiglonCollege/status/1182973981084790784,Tue Dec 22 20:04:40 +0000 2009,2019-10-12 10:59:10,0,0,repNone,,False,Leadership courses in the beautiful alpine enviroment - Summer School 2020... Applications are open! https://t.co/Dih8VG0qP5
https://twitter.com/AiglonCollege/status/1182579108309618688,Tue Dec 22 20:04:40 +0000 2009,2019-10-11 08:50:05,1,0,repNone,,False,Check out the latest article from Aiglon's #CollegeandCareers team: https://t.co/YZxwcBLs11 https://t.co/6WdDEGiiLc
https://twitter.com/AiglonCollege/status/1182291451063017472,Tue Dec 22 20:04:40 +0000 2009,2019-10-10 13:47:02,4,0,repNone,,False,"#SummerSchool 2020 is now open for bookings! Discover one of our three, distinct programmes that enable our students to take part in the Aiglon experience for one to five weeks next summer. Learn more: https://t.co/N4V8WuWV2p https://t.co/m7BUojojfu"
https://twitter.com/AiglonCollege/status/1181971390976659456,Tue Dec 22 20:04:40 +0000 2009,2019-10-09 16:35:14,1,0,repNone,,False,"Do you remember last term's reporting on the #JuniorSchoolMasterChef competition? Charlotte (La Casa) won, and to celebrate, she was invited to help prepare her winning dish with Aiglon's Cuisine so the whole school could enjoy it. Great work, Charlotte! https://t.co/vThwbm8KZt"
https://twitter.com/AiglonCollege/status/1181885794006568960,Tue Dec 22 20:04:40 +0000 2009,2019-10-09 10:55:06,3,0,repNone,,False,Thanks to #Clairmont for this week's #HouseUpdate where we look back at their recent house expedition near Lac Taney. Read Rina's report here: https://t.co/mUmGkVLH86 https://t.co/RxtTzbgUS0
https://twitter.com/AiglonCollege/status/1181554824111898626,Tue Dec 22 20:04:40 +0000 2009,2019-10-08 12:59:56,1,0,repNone,,False,Another great Saturday for Aiglon sport! The girls WON the #SGISTournament --congrats! The two boys teams finished 5th and 3rd overall. https://t.co/wo4q1am7IN
https://twitter.com/AiglonCollege/status/1181485153396363265,Tue Dec 22 20:04:40 +0000 2009,2019-10-08 08:23:06,1,0,repNone,,False,"Last weekend marked the first ""expedition choices"" weekend where students had the chance to choose from different styles of expeditions such as Swiss Exploration with a hike along the Bisse Torrent Noir or an Adventure Expedition with some Via Ferrata! https://t.co/DHAHtbCXxc"
https://twitter.com/AiglonCollege/status/1181162265455861763,Tue Dec 22 20:04:40 +0000 2009,2019-10-07 11:00:03,2,0,repNone,,False,#CollegeandCareers welcomed senior-level US admission counsellors representing @Northeastern @BostonCollege @AmericanU @SMU. They provided an engaging workshop for all #IB teachers on writing recommendation letters! https://t.co/YZxwcBLs11 https://t.co/nCTrs4G7Yb
https://twitter.com/AiglonCollege/status/1180208602235191296,Tue Dec 22 20:04:40 +0000 2009,2019-10-04 19:50:32,3,0,repNone,,False,"The year 6,7 and 8 girls travelled to ISL yesterday to take part in a 14-team tournament and secured an incredible second-place finish. They came up against much bigger schools and more than held their own causing a few shocks along the way. They came home with silver medals ...! https://t.co/9x1lLfWEuz"
https://twitter.com/AiglonCollege/status/1180159872018653190,Tue Dec 22 20:04:40 +0000 2009,2019-10-04 16:36:54,0,0,repNone,,False,"For the year's first #HouseUpdate, we speak to #Alpina boys who have moved up from the Junior School. What's life like in a senior house? Read: https://t.co/yy12Z5f1tt https://t.co/aiSQTMg0lE"
https://twitter.com/AiglonCollege/status/1180140595119038464,Tue Dec 22 20:04:40 +0000 2009,2019-10-04 15:20:18,1,0,repNone,,False,#CollegeandCareers is already in a busy season. They travelled this week with Year 12 students to attend the CIS-College Fair in Geneva. They met with representatives from over 100 universities from around the world! Learn more: https://t.co/62aeKYDmSJ https://t.co/cIvvDpbDXz
https://twitter.com/AiglonCollege/status/1180038881498021888,Tue Dec 22 20:04:40 +0000 2009,2019-10-04 08:36:08,0,0,repNone,,False,"This Year 7 class made penguins to investigate the ways heat is transferred! They used different materials and method to stop heat transfer by conduction, convection and radiation. https://t.co/T2O2mI6sVZ"
https://twitter.com/AiglonCollege/status/1179782888595873792,Tue Dec 22 20:04:40 +0000 2009,2019-10-03 15:38:54,1,0,repNone,,False,A great afternoon of cooking earlier this week! Led by Mrs Luco the girls work in a team and prepare delicious food as they chat along and share their own cultural experiences. https://t.co/DmcGhWdMKQ
https://twitter.com/AiglonCollege/status/1179699634303897602,Tue Dec 22 20:04:40 +0000 2009,2019-10-03 10:08:05,3,0,repNone,,False,This Tweet from @AiglonCollege has been withheld in response to a report from the copyright holder. Learn more.
https://twitter.com/AiglonCollege/status/1179437095087214595,Tue Dec 22 20:04:40 +0000 2009,2019-10-02 16:44:51,0,0,repNone,,False,Art students had the opportunity to visit the Pierre Gianadda Foundation in Martigny and the European indoor cycling centre in Aigle. Why those two places? The unit the students are working within is “Man &amp;/or Machine” and both places help provoke interesting questions. https://t.co/zdKlrWlTmg
https://twitter.com/AiglonCollege/status/1179419867000299520,Tue Dec 22 20:04:40 +0000 2009,2019-10-02 15:36:23,3,2,repNone,,False,"The Girls and Boys CAT C (Year 8/9) football teams just returned from the SGIS tournament in Montreux held at St George's. The girls finished a very respectable 4th place out of 7 teams. They played 8, Won 2, Drew 2, lost 4. The boys WON the Tournament. They played 7 matches ...! https://t.co/FBUZGB5Z50"
https://twitter.com/AiglonCollege/status/1179067733251674113,Tue Dec 22 20:04:40 +0000 2009,2019-10-01 16:17:08,0,1,repNone,,False,Who knew that ski training began so early?! Last weekend Aiglon's Alpine Development Squad (ADS) were on the slopes at Zermatt getting ready for the winter season! https://t.co/XFRLaIcgRi
https://twitter.com/AiglonCollege/status/1179021417570066432,Tue Dec 22 20:04:40 +0000 2009,2019-10-01 13:13:05,1,1,repNone,,False,A music lesson you can only have at Aiglon! #JuniorSchool #soundofmusic https://t.co/FxHlhHqR6O
https://twitter.com/AiglonCollege/status/1178989441924435969,Tue Dec 22 20:04:40 +0000 2009,2019-10-01 11:06:02,6,1,repNone,,False,Students enjoying the sights of India as they arrive in time for the Round Square International Conference. #RSIC2019 https://t.co/0racuWFJzT
https://twitter.com/AiglonCollege/status/1178664182700548096,Tue Dec 22 20:04:40 +0000 2009,2019-09-30 13:33:34,0,0,repNone,,False,Basketball tipped off this week as the senior boys and girls and middle school boys teams hosted Beau Soleil. Good luck for the year ahead! https://t.co/D8AB4WT3Iq
https://twitter.com/AiglonCollege/status/1177611372370235393,Tue Dec 22 20:04:40 +0000 2009,2019-09-27 15:50:04,0,0,repNone,,False,"Congratulations to Felix (Year 11, Alpina) for reaching the SGIS Tennis final in Leysin this week, narrowly losing 6-8. The future is bright for Aiglon tennis! https://t.co/z8Y1bqtYOT"
