id,Account Created At(same for all rows),status created_at,Fav_cont,retweeted_count,reply_to_status,reply_to_screen,quote,text
https://twitter.com/akbardalai/status/1266997875583545344,Wed Mar 27 03:57:57 +0000 2013,2020-05-31 07:40:07,0,2,repNone,,False,RT @shubhojit67: @LtGen_Roy Our politicians don’t change ... Our Armed Forces remain the same ... no wonder we will end up treating the Chi…
https://twitter.com/akbardalai/status/1266942469184225280,Wed Mar 27 03:57:57 +0000 2013,2020-05-31 03:59:57,0,296,repNone,,False,RT @PravinSawhney: Ladakh: China says only way to end impasse &amp; move to deescalation is for India to accept PLA moved  forward (ingress) in…
https://twitter.com/akbardalai/status/1266654772846718976,Wed Mar 27 03:57:57 +0000 2013,2020-05-30 08:56:45,0,1,repNone,,False,"RT @shubhojit67: @akbardalai We, in India, have two challenges. One is the fact that our politicians know very little of the geopolitical m…"
https://twitter.com/akbardalai/status/1266604150504087553,Wed Mar 27 03:57:57 +0000 2013,2020-05-30 05:35:36,1,0,rep1266601845629153281,akbardalai,False,"Not very difficult. Simply needs poltical resolve, inputs from ground, listening to the wise words of our good neighbour and extending a more generous hand but without making too much noise about it -  it is the question of national security and not bureaucratic power"
https://twitter.com/akbardalai/status/1266601845629153281,Wed Mar 27 03:57:57 +0000 2013,2020-05-30 05:26:26,4,2,repNone,,True,"In Doklam, post disengagement, PLA constructed roads right up to Torsa river . It is China's political gain but tactical blunder. Those familiar with the geography, watch out for PLA's next obvious move. It is up to India to convert this political loss into a strategic advantage https://t.co/nGXLcmcsYO"
https://twitter.com/akbardalai/status/1266599614083264513,Wed Mar 27 03:57:57 +0000 2013,2020-05-30 05:17:34,0,0,rep1266554963359985664,APS588,False,@MIT047 Interesting! Is it also the position of our government and the army?
https://twitter.com/akbardalai/status/1266341299675820033,Wed Mar 27 03:57:57 +0000 2013,2020-05-29 12:11:07,0,147,repNone,,True,"RT @bsdhanoa: An unfair and unwarranted comment about a General who is knowledgeable, has dealt with PLA longer than most, and is capable o…"
https://twitter.com/akbardalai/status/1266027809798885380,Wed Mar 27 03:57:57 +0000 2013,2020-05-28 15:25:26,0,1,rep1263706903416147968,akbardalai,False,Friedman says there won't be war between US and China. How do we look at India-China faceoff? https://t.co/0q37aF2diX
https://twitter.com/akbardalai/status/1266013976703320065,Wed Mar 27 03:57:57 +0000 2013,2020-05-28 14:30:28,0,1,repNone,,False,"While the world is worried about Corona, fight for space and power continues in Libya. Russia turned the table in Syria. Can it do that in Libya? So far not. But one can never tell   https://t.co/y697qB0vz4"
https://twitter.com/akbardalai/status/1265921896702373889,Wed Mar 27 03:57:57 +0000 2013,2020-05-28 08:24:34,2,0,repNone,,False,"Indian leaders, who are also embroiled in a separate border dispute with Nepal this month, would also prefer to settle the problem quietly to whipping up a nationalist frenzy. That, at least, is good news  AS USUAL  https://t.co/uqOPKIfdLK"
https://twitter.com/akbardalai/status/1265530481380134915,Wed Mar 27 03:57:57 +0000 2013,2020-05-27 06:29:13,1,1,repNone,,True,Well written. Immediate neighbours are more important than our rich and distant relatives https://t.co/zHl1EDiejM
https://twitter.com/akbardalai/status/1265529715647004675,Wed Mar 27 03:57:57 +0000 2013,2020-05-27 06:26:11,0,0,repNone,,False,Indo-China standoff: Very informative and interesting  https://t.co/0kON5gHsPq
https://twitter.com/akbardalai/status/1265434579977949185,Wed Mar 27 03:57:57 +0000 2013,2020-05-27 00:08:09,0,41,repNone,,False,RT @different_take: Disputed borders &amp; incursions. What does China get by playing bully? Or is conflict its twisted cure for isolation amon…
https://twitter.com/akbardalai/status/1265271532504285185,Wed Mar 27 03:57:57 +0000 2013,2020-05-26 13:20:15,0,65,repNone,,True,"RT @PravinSawhney: What can Delhi do? Initiative rests with aggressor, not defender. India has no military options - closed with 1993 agree…"
https://twitter.com/akbardalai/status/1265250553350651905,Wed Mar 27 03:57:57 +0000 2013,2020-05-26 11:56:53,2,0,rep1265248297129631744,akbardalai,False,The unresolved boundary is PLA's tactical weapon platform to fire China's strategic weapon
https://twitter.com/akbardalai/status/1265248297129631744,Wed Mar 27 03:57:57 +0000 2013,2020-05-26 11:47:55,2,0,repNone,,False,"This is a response to international pressure to silence the firing dragon. China hurts those at the distance by non-military means and tries to scare India by its military might.   India, China face-off risks escalation as Beijing ups rhetoric https://t.co/aNqNecAudK"
https://twitter.com/akbardalai/status/1265246691130699777,Wed Mar 27 03:57:57 +0000 2013,2020-05-26 11:41:32,0,62,repNone,,False,RT @PravinSawhney: PLA intrusions in Ladakh tell us that all LAC peace agreements at all levels are good as long as they suit the stronger…
https://twitter.com/akbardalai/status/1265246450457251846,Wed Mar 27 03:57:57 +0000 2013,2020-05-26 11:40:35,0,3,repNone,,True,RT @anilduhoon: China to deploy AR500C unmanned plateau-focused unmanned helicopters along the LAC. Helicopters are capable of conducting r…
https://twitter.com/akbardalai/status/1264840821062242306,Wed Mar 27 03:57:57 +0000 2013,2020-05-25 08:48:46,2,1,rep1264839300098580481,akbardalai,False,"Is it possible to find a middle path? Probably solve some and leave some to China to use them as trigger points to  tell the world that China is still there. A graceful exit to both sides, respite to our soldiers from such stupid exercises and save some money"
https://twitter.com/akbardalai/status/1264839300098580481,Wed Mar 27 03:57:57 +0000 2013,2020-05-25 08:42:43,3,3,rep1264550868994543618,akbardalai,False,"If the Indo-China boundary was clearly demarcated and there were no disputed areas, China would have been  deprived of its power to send  message to either India or its allies as and when it wants.Therefore, it is not in China’s interest to solve the boundary problem"
https://twitter.com/akbardalai/status/1264790066959798272,Wed Mar 27 03:57:57 +0000 2013,2020-05-25 05:27:05,2,0,repNone,,False,"Stronger US presence is an incidental deterrence to the hungry power players in ME. As US gradually pulls back its hands, sense of insecurity amongst its allies and enthusiasm in the opposite camp to do what they could not do earlier, will only grow   https://t.co/WLuQ8GmSIm"
https://twitter.com/akbardalai/status/1264550868994543618,Wed Mar 27 03:57:57 +0000 2013,2020-05-24 13:36:36,5,3,repNone,,False,"As Corona heats up U.S.-China Competition in the rimland of Eurasia, cooperation between Australia and Japan may get stronger. Where does it leave India? Ladakh region is not going cool down soon   https://t.co/me664pccys via @Stratfor Worldview"
https://twitter.com/akbardalai/status/1264411679263055872,Wed Mar 27 03:57:57 +0000 2013,2020-05-24 04:23:30,0,1,repNone,,True,RT @shubhojit67: @digvijaya_28 @India_NHRC This is downright inhuman and beastly irrespective of the crime the guy has committed... https:/…
https://twitter.com/akbardalai/status/1264370030029881344,Wed Mar 27 03:57:57 +0000 2013,2020-05-24 01:38:00,0,1,repNone,,True,RT @ashokkmrsingh: Sad
https://twitter.com/akbardalai/status/1264369510359764992,Wed Mar 27 03:57:57 +0000 2013,2020-05-24 01:35:56,2,0,repNone,,True,Unbelievable! It happens when power goes to head. Fascism https://t.co/cEWtEexUDX
https://twitter.com/akbardalai/status/1264125271369592832,Wed Mar 27 03:57:57 +0000 2013,2020-05-23 09:25:25,0,0,rep1263706903416147968,akbardalai,False,China's leadership is in crisis. Loss of face at international level is not acceptable to Xi.  This is a message to its main opponent using India as the soft underbelly and also trying to remind India that it is on the wrong side   https://t.co/E8IM8H2pjh
https://twitter.com/akbardalai/status/1264118155888087040,Wed Mar 27 03:57:57 +0000 2013,2020-05-23 08:57:09,0,71,repNone,,False,RT @PravinSawhney: News from LAC: China has told India to dismantle all infrastructure ahead of PLA’s perception of LAC in Ladakh. After th…
https://twitter.com/akbardalai/status/1264102031137988608,Wed Mar 27 03:57:57 +0000 2013,2020-05-23 07:53:04,5,4,rep1261228883359051778,akbardalai,False,https://t.co/G4iMQOE5D3
https://twitter.com/akbardalai/status/1263706903416147968,Wed Mar 27 03:57:57 +0000 2013,2020-05-22 05:42:58,1,0,repNone,,False,"Is it a geopolitical or trade war between China and USA? Reading  in context of China's muscle flexing in Ladakh region, how much strategic advantage will be to China ? Or Pengong Tso lake is simply a pressure point in the great game between two giants ?   https://t.co/AHCYZz2Fkc"
https://twitter.com/akbardalai/status/1263144220119846922,Wed Mar 27 03:57:57 +0000 2013,2020-05-20 16:27:04,1,0,rep1263128044488634369,rud_ras,False,@rud_ras It depends how much can we do? I am not privy to such information hence can not comment
https://twitter.com/akbardalai/status/1263137219016970240,Wed Mar 27 03:57:57 +0000 2013,2020-05-20 15:59:15,0,0,repNone,,False,Russian gas: Average cost of Russian gas is $55 but it sells  to the buffer nations for a price between $120 to $ 165 at the contract rates. Interesting but how long will it stay like that way? https://t.co/ed9wxBs0A5
https://twitter.com/akbardalai/status/1263125442388611083,Wed Mar 27 03:57:57 +0000 2013,2020-05-20 15:12:27,0,0,rep1262992899483922432,anujchat,False,@anujchat 🙏
https://twitter.com/akbardalai/status/1263124949478207490,Wed Mar 27 03:57:57 +0000 2013,2020-05-20 15:10:30,2,1,repNone,,False,Turkey vs Russia in Libya: Libya’s Government of National Accord made serious gains in western Libya. This is bad news for Russia. Then what next?
https://twitter.com/akbardalai/status/1263064073026957313,Wed Mar 27 03:57:57 +0000 2013,2020-05-20 11:08:36,0,5,repNone,,False,RT @bsdhanoa: China reportedly triples its boats in India’s Pangong Tso Lake as tensions continue to rise according to @businessinsider
https://twitter.com/akbardalai/status/1263064027481030658,Wed Mar 27 03:57:57 +0000 2013,2020-05-20 11:08:25,0,10,repNone,,True,RT @bsdhanoa: Praiseworthy effort.
https://twitter.com/akbardalai/status/1263044885109592064,Wed Mar 27 03:57:57 +0000 2013,2020-05-20 09:52:21,0,0,rep1263043954095734784,shubhojit67,False,@shubhojit67 Must be true !
https://twitter.com/akbardalai/status/1262991653112954880,Wed Mar 27 03:57:57 +0000 2013,2020-05-20 06:20:50,1,0,rep1262961298637234178,anujchat,False,@anujchat I agree with you. Thanks
https://twitter.com/akbardalai/status/1262951269750190089,Wed Mar 27 03:57:57 +0000 2013,2020-05-20 03:40:21,11,3,rep1262949582771752960,akbardalai,False,"Had we constructed the tracks in those areas earlier, the situation would have been different now. When US takes on China, its response is from a distance. The response to India’s stand is seen along the border. China triggers and our troops get sucked in. Forever reactive!"
https://twitter.com/akbardalai/status/1262949582771752960,Wed Mar 27 03:57:57 +0000 2013,2020-05-20 03:33:39,43,13,repNone,,True,Our mistake was to limit our own patrolling boundary by China Study Group which was founded in 1969 . A group generally comprising scholars without any knowledge of ground. Now reaping the harvest that we sowed https://t.co/WNyDAjx8zV
https://twitter.com/akbardalai/status/1262705482029862913,Wed Mar 27 03:57:57 +0000 2013,2020-05-19 11:23:41,2,1,repNone,,False,Vivek has a point. ToD is like organising hike of army for three years with fun but no serious business. Hikers don't stand in the line of fire. Investors have announced campus placement even before the foundation stone of the University  has been laid.   https://t.co/bZWnD0oZ7H
https://twitter.com/akbardalai/status/1262630711397253121,Wed Mar 27 03:57:57 +0000 2013,2020-05-19 06:26:34,0,20,repNone,,False,RT @different_take: Global arguments nowadays are like He did this and Xi did that. An era where the Middle Kingdom finds itself in the mid…
https://twitter.com/akbardalai/status/1261732675833884673,Wed Mar 27 03:57:57 +0000 2013,2020-05-16 18:58:06,6,1,repNone,,True,“Tour of duty” sounds like an official hike in army’s area https://t.co/zKRLUuTzhA
https://twitter.com/akbardalai/status/1261614911790002176,Wed Mar 27 03:57:57 +0000 2013,2020-05-16 11:10:09,2,1,repNone,,False,"Khashan writes ""There are striking similarities between Islamic fundamentalism and totalitarian movements such as Nazism and fascism.""   Most countries own only one of these. But some coutries are owner of at least of two of these. Find out yourself!  https://t.co/B7POlfOQlz"
https://twitter.com/akbardalai/status/1261258684060991488,Wed Mar 27 03:57:57 +0000 2013,2020-05-15 11:34:37,0,4,repNone,,False,RT @KK_326: Says it all and must shake our conscious... https://t.co/fNkJgmRBSx
https://twitter.com/akbardalai/status/1261228883359051778,Wed Mar 27 03:57:57 +0000 2013,2020-05-15 09:36:12,3,1,rep1261223707399184386,akbardalai,False,All such incidents are supposed to be accurately recorded by the army for the sake of best practices. I am sure it is being done or still in draft form. Kashmir intel has done it and nothing else to be written. Or deny if it is wrong
https://twitter.com/akbardalai/status/1261223707399184386,Wed Mar 27 03:57:57 +0000 2013,2020-05-15 09:15:38,3,1,rep1261223427672702978,akbardalai,False,Handwara Encounter –Open Source Intelligence version https://t.co/Tes5CWksym via @kashmirosint
https://twitter.com/akbardalai/status/1261223427672702978,Wed Mar 27 03:57:57 +0000 2013,2020-05-15 09:14:32,2,1,repNone,,False,https://t.co/np5EHHUFFy
https://twitter.com/akbardalai/status/1261099535968776192,Wed Mar 27 03:57:57 +0000 2013,2020-05-15 01:02:14,1,0,repNone,,False,"Why have they refused? May be condition of some of the institutional quarantine is so pathetic that a healthy person is likely to fall sick. In some cases, self  quarantine would be better  https://t.co/wvRsQ83nyf"
https://twitter.com/akbardalai/status/1260813002531467264,Wed Mar 27 03:57:57 +0000 2013,2020-05-14 06:03:39,1,0,repNone,,False,Is a coup really looming in Turkey? https://t.co/tJDT7p14zN via @AlMonitor
https://twitter.com/akbardalai/status/1260811553785278465,Wed Mar 27 03:57:57 +0000 2013,2020-05-14 05:57:53,2,0,repNone,,False,These ceasefire agreement was never meant to be upheld. Is US in credibility trap now ?  Ghani Orders Forces into ‘Offensive’ Mode Against Taliban | TOLOnews https://t.co/AHAwR429il
https://twitter.com/akbardalai/status/1260736800017879042,Wed Mar 27 03:57:57 +0000 2013,2020-05-14 01:00:51,2,1,repNone,,False,Urban India &amp; plight of migrant workers  https://t.co/GLrWzHJA6Z
https://twitter.com/akbardalai/status/1260729384228421633,Wed Mar 27 03:57:57 +0000 2013,2020-05-14 00:31:23,0,7,repNone,,False,"RT @different_take: Turmeric Latte to 5G based Sensors. I write on ideas converging in life, as it will be known.   https://t.co/kJ3ufXjJid"
https://twitter.com/akbardalai/status/1260599835427655680,Wed Mar 27 03:57:57 +0000 2013,2020-05-13 15:56:36,0,2,repNone,,False,"RT @sinhgohil: Dear @PMOIndia, help us find missing autistic child Tarun. Spotted outside Rly Stn in your constituency Varanasi. @NRRPF is…"
https://twitter.com/akbardalai/status/1259981827726438400,Wed Mar 27 03:57:57 +0000 2013,2020-05-11 23:00:51,0,0,rep1259702212386672640,bsdhanoa,False,@bsdhanoa 😃
https://twitter.com/akbardalai/status/1259863919251750913,Wed Mar 27 03:57:57 +0000 2013,2020-05-11 15:12:20,7,1,repNone,,False,Superb job Lt Das. You have done something which should have happened long back.  I salute you sir!  Sikkim Clash: ‘Small’ Indian Lt Who Punched a ‘Big’ Chinese Major https://t.co/O8N90LwHOk
https://twitter.com/akbardalai/status/1259699547065839618,Wed Mar 27 03:57:57 +0000 2013,2020-05-11 04:19:10,0,9,repNone,,False,"RT @Warrior_Mukul: @BrigMps He is the same idiot who in 1991, while being SP Faridkot, thrashed a Lt Col of Artillery posted in a Unit ther…"
https://twitter.com/akbardalai/status/1259512090932334592,Wed Mar 27 03:57:57 +0000 2013,2020-05-10 15:54:17,3,1,repNone,,False,Isn't there any  limit even after what we are going through now?  Exclusive: Trump administration drafting 'Artemis Accords' pact for moon mining - sources https://t.co/uPzhEQQLPO
https://twitter.com/akbardalai/status/1259031011364499457,Wed Mar 27 03:57:57 +0000 2013,2020-05-09 08:02:39,0,1461,repNone,,False,"RT @AbhishekBhalla7: The famous Assam regiment song. Badlu Ram ka badan zameen ke neeche hai aur humko uska ration milta hai. Even at 16,00…"
https://twitter.com/akbardalai/status/1258996928211062785,Wed Mar 27 03:57:57 +0000 2013,2020-05-09 05:47:13,0,0,repNone,,False,https://t.co/jKnR5793Lz
https://twitter.com/akbardalai/status/1258962656901255168,Wed Mar 27 03:57:57 +0000 2013,2020-05-09 03:31:02,2,0,repNone,,False,"Baltic pipeline should replace Poland's reliance on Russian gas. But with Russia supplying more than 40 % of gas to Europe, Russian will remain there for quite some time https://t.co/qgY3WRp9XC"
https://twitter.com/akbardalai/status/1258956773286834184,Wed Mar 27 03:57:57 +0000 2013,2020-05-09 03:07:39,0,3,repNone,,True,RT @ashokkmrsingh: I can not belive... 21% believe  radicalism is not threat to Defence of India... Having knowledge of such social dynamic…
https://twitter.com/akbardalai/status/1258947524502548482,Wed Mar 27 03:57:57 +0000 2013,2020-05-09 02:30:54,0,0,repNone,,False,Credibility is not available upfront. One has to work for it continuously and supported by evidence. Then fall into credibility trap.  What happens now? Shift in balance of power in Middle East? It is likely the Quad will be left alone - India's options?  https://t.co/rvI3bAhLhP
https://twitter.com/akbardalai/status/1258769955555651586,Wed Mar 27 03:57:57 +0000 2013,2020-05-08 14:45:18,0,14,repNone,,False,"RT @different_take: I write on the 'Forced Migrants' of Corona. They maybe a sideshow in the news coverage, but the human costs are stagger…"
https://twitter.com/akbardalai/status/1258317558333050880,Wed Mar 27 03:57:57 +0000 2013,2020-05-07 08:47:38,0,5,repNone,,True,RT @LtGen_Roy: Officers did not do it even in the colonial days of Indian Police under British Raj. DGP Behura needs to be given counsellin…
https://twitter.com/akbardalai/status/1258317219387211779,Wed Mar 27 03:57:57 +0000 2013,2020-05-07 08:46:18,0,0,repNone,,False,Travellers' dismay Imagine the post-pandemic misery of business travel https://t.co/AlM7eFMxNh
https://twitter.com/akbardalai/status/1257932583913918464,Wed Mar 27 03:57:57 +0000 2013,2020-05-06 07:17:53,0,2,repNone,,True,RT @LtGen_Roy: Needs to be taken very seriously!!
https://twitter.com/akbardalai/status/1257707847732756481,Wed Mar 27 03:57:57 +0000 2013,2020-05-05 16:24:52,1,0,repNone,,False,@SandhuBalkirat @bsdhanoa @Maverick_Dubai @singhshwetabh71 Everything was removed from inside  also to convert it to carry infantry upto the fist line of obstacle. Old machines and was very difficult! Worked in the exercise !
https://twitter.com/akbardalai/status/1257682201849651200,Wed Mar 27 03:57:57 +0000 2013,2020-05-05 14:42:58,1,0,rep1257679852414664704,singhshwetabh71,False,@singhshwetabh71 Ex Vijaya Bhava
https://twitter.com/akbardalai/status/1257681101968924674,Wed Mar 27 03:57:57 +0000 2013,2020-05-05 14:38:35,1,1,repNone,,False,"The public perception of power is rooted in events that might have little to do with power. Perception warfare is good for buying time. But carried out too long, the perception warrior is believed, feared and engaged.  https://t.co/1EiYNO9cvd"
https://twitter.com/akbardalai/status/1257676559797764106,Wed Mar 27 03:57:57 +0000 2013,2020-05-05 14:20:33,2,1,repNone,,True,Always a new perspective! https://t.co/mQFz43OsQa
https://twitter.com/akbardalai/status/1257341217408507907,Wed Mar 27 03:57:57 +0000 2013,2020-05-04 16:08:01,2,1,repNone,,False,King never dies!  https://t.co/osEEzTzcmi
https://twitter.com/akbardalai/status/1257336288786681857,Wed Mar 27 03:57:57 +0000 2013,2020-05-04 15:48:26,4,0,repNone,,True,Many Generals have become Army Commanders. Gen Shukla  not only thinks and also delivers. We wish him all the best and hope to see him more often. https://t.co/uQfcxOtIT3
https://twitter.com/akbardalai/status/1257248076411965440,Wed Mar 27 03:57:57 +0000 2013,2020-05-04 09:57:54,0,1,repNone,,False,"RT @jmuthukrishnan: @akbardalai Logic and common sense died a silent death, and those flowers were being showered as a homage. I don't thin…"
https://twitter.com/akbardalai/status/1257180083791335424,Wed Mar 27 03:57:57 +0000 2013,2020-05-04 05:27:43,0,1,repNone,,False,RT @SohalVivek: To the soldiers of the country who laid down their lives at #Handwara!  You are truly brave men who walked into their sure…
https://twitter.com/akbardalai/status/1256973743248666624,Wed Mar 27 03:57:57 +0000 2013,2020-05-03 15:47:48,0,198,repNone,,True,"RT @bsdhanoa: Frankly, if you ask me, no lady who has just been subjected to such a devastating shock, should ever have a mike put before h…"
https://twitter.com/akbardalai/status/1256922057360588804,Wed Mar 27 03:57:57 +0000 2013,2020-05-03 12:22:25,1,0,repNone,,True,Another one in the series - good one https://t.co/yUi8ehmzqy
https://twitter.com/akbardalai/status/1256920893537742848,Wed Mar 27 03:57:57 +0000 2013,2020-05-03 12:17:48,0,0,rep1256918511974092806,bsdhanoa,False,@bsdhanoa That’s a good one!
https://twitter.com/akbardalai/status/1256917606780465155,Wed Mar 27 03:57:57 +0000 2013,2020-05-03 12:04:44,0,0,repNone,,True,It is because our Fools know not what others know and what others know not! https://t.co/2RNlWUHtjx
https://twitter.com/akbardalai/status/1256916926338486272,Wed Mar 27 03:57:57 +0000 2013,2020-05-03 12:02:02,2,2,repNone,,False,"So much for  a secular nation!  2 Indian expats suspended, 1 sacked from job in UAE for Islamophobic social media posts https://t.co/uhI1cShvUP"
https://twitter.com/akbardalai/status/1256831449258291200,Wed Mar 27 03:57:57 +0000 2013,2020-05-03 06:22:22,0,1805,repNone,,False,"RT @hemanth_kgowda: Don't know when &amp; where this happened, but just listen to the video, their levels and their intent to spread hate. How…"
https://twitter.com/akbardalai/status/1256831392182231040,Wed Mar 27 03:57:57 +0000 2013,2020-05-03 06:22:09,0,2,repNone,,False,RT @hemanth_kgowda: @ayesharamjoo2 It is always a much easier task to educate uneducated people than to re-educate the mis-educated. -Herbe…
https://twitter.com/akbardalai/status/1256809985037631488,Wed Mar 27 03:57:57 +0000 2013,2020-05-03 04:57:05,1,0,repNone,,True,Hypocrisy at its best https://t.co/C3GVyhwweR
https://twitter.com/akbardalai/status/1256802498263711745,Wed Mar 27 03:57:57 +0000 2013,2020-05-03 04:27:20,0,2,repNone,,False,"RT @bsdhanoa: @akbardalai I am sure it finds its place on walls in various strategic locations, only to be dusted and never read!"
https://twitter.com/akbardalai/status/1256792164018778112,Wed Mar 27 03:57:57 +0000 2013,2020-05-03 03:46:16,0,0,rep1256780530290393088,AmarjyotiBorah1,False,@AmarjyotiBorah1 @ashokkmrsingh My personal opinion? NO
https://twitter.com/akbardalai/status/1256777879225896960,Wed Mar 27 03:57:57 +0000 2013,2020-05-03 02:49:30,1,1,rep1256761304221712389,ashokkmrsingh,False,@ashokkmrsingh Certainly. But I thought that we don't have money!
https://twitter.com/akbardalai/status/1256777232757911559,Wed Mar 27 03:57:57 +0000 2013,2020-05-03 02:46:56,1,0,repNone,,False,The global food crisis: this prediction was made before outbreak of Corona outbreak. It will only get worse https://t.co/fYWxtcfTBj
https://twitter.com/akbardalai/status/1256775429743992832,Wed Mar 27 03:57:57 +0000 2013,2020-05-03 02:39:46,25,15,repNone,,False,Should frame and hang it on the walls of South Block and all Theatre/Command HQs with fervent hope that it may influence at least a negligible few https://t.co/QDmNyaFNPl
https://twitter.com/akbardalai/status/1256773592127160320,Wed Mar 27 03:57:57 +0000 2013,2020-05-03 02:32:28,0,0,repNone,,False,Even a Pandemic Does not Stop the South China Sea Competition https://t.co/F0ycgm78TH via @Stratfor Worldview
https://twitter.com/akbardalai/status/1256773331979624449,Wed Mar 27 03:57:57 +0000 2013,2020-05-03 02:31:26,0,0,repNone,,False,@SandhuBalkirat Thank you sir! God bless you
https://twitter.com/akbardalai/status/1256772838985306112,Wed Mar 27 03:57:57 +0000 2013,2020-05-03 02:29:29,3,0,repNone,,False,Territorial Claim of South China Sea https://t.co/fkxBzRypTh
https://twitter.com/akbardalai/status/1256759829315477505,Wed Mar 27 03:57:57 +0000 2013,2020-05-03 01:37:47,0,0,repNone,,False,The failure to plant the seeds of democracy in the Arab world is due to a number of complex factors. Religious mysticism and its promise of messianic redemption is prevalent among Arabs.   https://t.co/YPY3yc5yg2
https://twitter.com/akbardalai/status/1256754509566468096,Wed Mar 27 03:57:57 +0000 2013,2020-05-03 01:16:39,1,1,repNone,,False,"Myth of the Middle East: The more that you read the more things you will know that generally, two empires were responsible for most of the problems in the world  https://t.co/gX2OLmQVCy"
https://twitter.com/akbardalai/status/1256376524229316609,Wed Mar 27 03:57:57 +0000 2013,2020-05-02 00:14:40,0,0,rep1247159854751289345,akbardalai,False,https://t.co/QsnsOKpgfM
https://twitter.com/akbardalai/status/1256375648764846080,Wed Mar 27 03:57:57 +0000 2013,2020-05-02 00:11:11,1,0,repNone,,False,There was a time when Israel vowed not to negotiate like this. Time has changed  Families of missing IDF soldiers call on government to push Hamas deal https://t.co/7TvVdIRBkZ via @AlMonitor
