id,Account Created At(same for all rows),status created_at,Fav_cont,retweeted_count,reply_to_status,reply_to_screen,quote,text
https://twitter.com/akbardalai/status/1357555254309519360,Wed Mar 27 03:57:57 +0000 2013,2021-02-05 05:02:49,0,0,repNone,,False,It is in line with Biden's speech on ME in March 2020. There is still room for diplomacy   Pentagon sends aircraft carrier Nimitz home from Middle East https://t.co/GpuPXiRE8W via @AlMonitor
https://twitter.com/akbardalai/status/1356485471136665600,Wed Mar 27 03:57:57 +0000 2013,2021-02-02 06:11:53,0,0,repNone,,False,It is why Turkey has its way https://t.co/WBw9LPYIRD
https://twitter.com/akbardalai/status/1356394762765357057,Wed Mar 27 03:57:57 +0000 2013,2021-02-02 00:11:26,1,0,rep1356295906207780864,bsdhanoa,False,@bsdhanoa That is a good one!
https://twitter.com/akbardalai/status/1355868271921094663,Wed Mar 27 03:57:57 +0000 2013,2021-01-31 13:19:21,0,0,repNone,,False,Crimea a critical asset to Russia. Russia's Black Sea Fleet is located in Sevastopol https://t.co/WttQz0459w
https://twitter.com/akbardalai/status/1355482078641410051,Wed Mar 27 03:57:57 +0000 2013,2021-01-30 11:44:45,0,0,repNone,,False,The recommended alternate model  to handle the former terrorists will be a big domestic challenge   https://t.co/ajYulHtceb
https://twitter.com/akbardalai/status/1355475604892577792,Wed Mar 27 03:57:57 +0000 2013,2021-01-30 11:19:02,1,0,repNone,,False,https://t.co/estkqwq84O?
https://twitter.com/akbardalai/status/1355475072828362754,Wed Mar 27 03:57:57 +0000 2013,2021-01-30 11:16:55,0,0,repNone,,False,https://t.co/oASoh1jcgi?
https://twitter.com/akbardalai/status/1355163464302358529,Wed Mar 27 03:57:57 +0000 2013,2021-01-29 14:38:42,0,0,repNone,,False,The power-sharing arrangement has not worked well in past. Hope it does not meet the fate of South Sudan.   https://t.co/z17C41748a via @Stratfor Worldview
https://twitter.com/akbardalai/status/1354058318143082496,Wed Mar 27 03:57:57 +0000 2013,2021-01-26 13:27:14,0,0,rep1353977798998716416,bsdhanoa,False,@bsdhanoa Yes. But it includes who could have stage managed this
https://twitter.com/akbardalai/status/1351560988449927170,Wed Mar 27 03:57:57 +0000 2013,2021-01-19 16:03:45,0,0,repNone,,False,The Battle for the Soul of Islam https://t.co/qBGX6jw3e5
https://twitter.com/akbardalai/status/1348186720949342213,Wed Mar 27 03:57:57 +0000 2013,2021-01-10 08:35:37,1,0,repNone,,False,Writings of Gowan on UN matters are informative. Worth reading  https://t.co/YFtj4ROKuB
https://twitter.com/akbardalai/status/1348105202331643906,Wed Mar 27 03:57:57 +0000 2013,2021-01-10 03:11:41,1,0,rep1347947800055611393,bsdhanoa,False,@bsdhanoa I am mortally scared of this experience
https://twitter.com/akbardalai/status/1347505369635987456,Wed Mar 27 03:57:57 +0000 2013,2021-01-08 11:28:10,1,0,repNone,,False,The sad demise of Arab Street. https://t.co/bYQIEn4AtY
https://twitter.com/akbardalai/status/1347451766225346560,Wed Mar 27 03:57:57 +0000 2013,2021-01-08 07:55:10,0,0,repNone,,False,"Abraham accord, Israel and Middle East   https://t.co/m2wwipykPo via @AlMonitor"
https://twitter.com/akbardalai/status/1347351060117999616,Wed Mar 27 03:57:57 +0000 2013,2021-01-08 01:14:59,0,0,rep1347348735357898753,akbardalai,False,"“Authoritarian leaders are desperately afraid of ridicule because so much of their power comes from social connectedness,” said Naunihal Singh, a professor at the Naval War College whose research focuses on coups.  https://t.co/Fm55BzJVxK"
https://twitter.com/akbardalai/status/1347348735357898753,Wed Mar 27 03:57:57 +0000 2013,2021-01-08 01:05:45,2,0,repNone,,False,Unbelievable! Isn't it? There are a lot of similar traits among many world leaders.   https://t.co/C20uEs91rM
https://twitter.com/akbardalai/status/1344231242959441922,Wed Mar 27 03:57:57 +0000 2013,2020-12-30 10:37:57,1,0,rep1344184796918870016,akbardalai,False,Neither two states nor one state with normalisation of the Palestinians is likely to be acceptable to the right-wing Israelis. Where does that leave the Palestinians? Uprising?   https://t.co/Ttabc9PPEZ via @Stratfor Worldview
https://twitter.com/akbardalai/status/1344184796918870016,Wed Mar 27 03:57:57 +0000 2013,2020-12-30 07:33:23,1,1,repNone,,False,"Once hated by the Muslim world, now Israel is the superpower of the ME. Finally, it is the security and money that counts  https://t.co/26RPfmJZ3t via @Geopolitical Futures"
https://twitter.com/akbardalai/status/1344104081946603524,Wed Mar 27 03:57:57 +0000 2013,2020-12-30 02:12:40,0,0,repNone,,False,Flexing its muscle comes at a time when a few nations have decided to take sides with Israel.   https://t.co/MMfkm7vf7g via @AlMonitor
https://twitter.com/akbardalai/status/1343772407916478464,Wed Mar 27 03:57:57 +0000 2013,2020-12-29 04:14:42,0,0,repNone,,False,Pakistan and China will put the blame on India   https://t.co/BasOYT1rmH
https://twitter.com/akbardalai/status/1340201922641289218,Wed Mar 27 03:57:57 +0000 2013,2020-12-19 07:46:52,0,0,repNone,,False,2021 Annual Forecast: A Global Overview https://t.co/CCa6auIeWb via @Stratfor Worldview
https://twitter.com/akbardalai/status/1339583956832776196,Wed Mar 27 03:57:57 +0000 2013,2020-12-17 14:51:18,0,0,repNone,,False,Why is it said that everything is fair in love and war? It is because God has sanctioned it  https://t.co/T2zWrWHvIb
https://twitter.com/akbardalai/status/1339575674114166787,Wed Mar 27 03:57:57 +0000 2013,2020-12-17 14:18:23,0,0,repNone,,False,"The more I think I have understood the geopolitical layout of the Middle East, the more confused I am. Israel, Iran, Azerbaijan and Armenia are part of the web - who holds the key?   https://t.co/csoz32hOPg"
https://twitter.com/akbardalai/status/1339571855078789121,Wed Mar 27 03:57:57 +0000 2013,2020-12-17 14:03:12,0,0,repNone,,False,Democracy and the Middle East? 🤣  https://t.co/F1aLS5vCh8
https://twitter.com/akbardalai/status/1339154273028849664,Wed Mar 27 03:57:57 +0000 2013,2020-12-16 10:23:53,0,0,repNone,,False,Israel and Iran have swapped their places. But the Palestinian cause will get a new boost from Iran  https://t.co/TkiJkYk44o?
https://twitter.com/akbardalai/status/1339114201437020161,Wed Mar 27 03:57:57 +0000 2013,2020-12-16 07:44:39,11,0,repNone,,False,Turkey buys S 400 from Russia and now employs its drones to check Russian expansion to  Baltic sea. Russia probably will keep quiet in return of more arms sale to Turkey  https://t.co/ZBqClQyxHS via @AlMonitor
https://twitter.com/akbardalai/status/1339113190559379461,Wed Mar 27 03:57:57 +0000 2013,2020-12-16 07:40:38,0,0,repNone,,False,How Russia is preparing in Syria for Biden’s presidency https://t.co/b7KRMUlP0s via @AlMonitor
https://twitter.com/akbardalai/status/1337581802089664513,Wed Mar 27 03:57:57 +0000 2013,2020-12-12 02:15:27,0,0,repNone,,False,Not very difficult to understand what Putin is thinking. He has already stepped inside the ME https://t.co/Jue8K6wIcc
https://twitter.com/akbardalai/status/1337423985378660352,Wed Mar 27 03:57:57 +0000 2013,2020-12-11 15:48:20,0,0,repNone,,False,https://t.co/GiDfXYF4tx
https://twitter.com/akbardalai/status/1337423850221391873,Wed Mar 27 03:57:57 +0000 2013,2020-12-11 15:47:48,0,0,repNone,,False,https://t.co/aHp22PG4IL
https://twitter.com/akbardalai/status/1337408929890856961,Wed Mar 27 03:57:57 +0000 2013,2020-12-11 14:48:31,0,0,repNone,,False,The new alignment in the Middle East confers on Jerusalem not only rewards but also obligations. Such obligations could be dangerous when Iran decides to activate its proxies in Israel's northern border. https://t.co/LaYo1rbg1S
https://twitter.com/akbardalai/status/1337297484310167552,Wed Mar 27 03:57:57 +0000 2013,2020-12-11 07:25:40,1,0,repNone,,False,"In the Nagorno-Karabakh conflict, the round goes to Azerbaijan. But how does Azerbaijan now balance between Israel and Iran? It has defence ties with Israel and more than 18 million Azerbaijanis live in Iran. Turkey is likely to make things worse."
https://twitter.com/akbardalai/status/1335465942726262784,Wed Mar 27 03:57:57 +0000 2013,2020-12-06 06:07:47,2,0,repNone,,False,Trouble days ahead for Middle East  How Israel Will Try to Shape Biden’s Middle East Policies https://t.co/Oy4H3WbpUX via @Stratfor Worldview
https://twitter.com/akbardalai/status/1335424475769159680,Wed Mar 27 03:57:57 +0000 2013,2020-12-06 03:23:00,1,0,rep1334933699943571456,twangchuk23,False,@twangchuk23 Superb view!
https://twitter.com/akbardalai/status/1332112914556174336,Wed Mar 27 03:57:57 +0000 2013,2020-11-27 00:04:02,2,0,repNone,,False,India’s diminishing democracy – Narendra Modi threatens to turn India into a one-party state https://t.co/sYpKC9iQ3u
https://twitter.com/akbardalai/status/1329709061080633346,Wed Mar 27 03:57:57 +0000 2013,2020-11-20 08:51:59,1,0,repNone,,False,Russia to establish naval base in Sudan https://t.co/qEuV3gLeLu via @AlMonitor
https://twitter.com/akbardalai/status/1329306649987694592,Wed Mar 27 03:57:57 +0000 2013,2020-11-19 06:12:57,2,0,rep1329304933246455808,ChrisAn23283462,False,@ChrisAn23283462 @bsdhanoa Perfect example of even a CSM 🤪
https://twitter.com/akbardalai/status/1328554641034936323,Wed Mar 27 03:57:57 +0000 2013,2020-11-17 04:24:44,0,0,repNone,,False,"Following the ceasefire on Nagorno-Karabakh, Turkey considering troops to Azerbaijan. Russian troops are already there in the breakaway region. https://t.co/xDMUKxQ3Pl"
https://twitter.com/akbardalai/status/1324680084934979584,Wed Mar 27 03:57:57 +0000 2013,2020-11-06 11:48:38,0,0,rep1324666178095128576,akbardalai,False,Conflict in Tigray Has Major Implications for Ethiopia and the Region https://t.co/g9AvOqr23U
https://twitter.com/akbardalai/status/1324666178095128576,Wed Mar 27 03:57:57 +0000 2013,2020-11-06 10:53:22,0,0,repNone,,False,It is a good backgrounder to those who would like to follow the events that are unfolding in Ethiopia https://t.co/gZtI6iTB75 via @CFR_org
https://twitter.com/akbardalai/status/1324143795382808576,Wed Mar 27 03:57:57 +0000 2013,2020-11-05 00:17:36,1,0,repNone,,False,Ethiopia lurches towards civil war: Yet another internal conflict which the Security Council should be worried. https://t.co/9jmbV8Dtnb
https://twitter.com/akbardalai/status/1323927601346306048,Wed Mar 27 03:57:57 +0000 2013,2020-11-04 09:58:32,0,0,repNone,,False,Another  way of looking at Akhand Bharat https://t.co/PtSqcnU2FP
https://twitter.com/akbardalai/status/1323485673970491392,Wed Mar 27 03:57:57 +0000 2013,2020-11-03 04:42:28,1,0,repNone,,False,"In ancient times, when cities were besieged by hostile armies seeking to starve them into submission, the defenders used their last water reserves to hang dripping laundry over the walls to broadcast that they could outlast the siege. Kim is doing that  https://t.co/7dl3qt49jE"
https://twitter.com/akbardalai/status/1322805145210531842,Wed Mar 27 03:57:57 +0000 2013,2020-11-01 07:38:17,0,191,repNone,,True,"RT @TenzingLamsang: Chief Minister of India’s largest state warns against inter-faith marriage, promises to make a law against it &amp; issues…"
https://twitter.com/akbardalai/status/1322803943102050305,Wed Mar 27 03:57:57 +0000 2013,2020-11-01 07:33:31,1,0,rep1322751654244933633,bsdhanoa,False,@bsdhanoa That is a good one
https://twitter.com/akbardalai/status/1322135771663409152,Wed Mar 27 03:57:57 +0000 2013,2020-10-30 11:18:26,0,0,repNone,,False,Catch 22 situations for Russia??  https://t.co/DkUcCuichU via @Stratfor Worldview
https://twitter.com/akbardalai/status/1321669039198932992,Wed Mar 27 03:57:57 +0000 2013,2020-10-29 04:23:49,1,0,repNone,,False,"Turkey and Libyan peace agreement 23 October. Turkey is the reluctant signatory, who always get away  https://t.co/f8HldXOKHS via @AlMonitor"
https://twitter.com/akbardalai/status/1320710806036598784,Wed Mar 27 03:57:57 +0000 2013,2020-10-26 12:56:08,0,0,repNone,,False,This one gives a feeling that it was Sudan who was keener on normalising relation with Israel and not because of pressure from the US. Maybe the truth lies somewhere else. But does it matter as long as there is peace?   Sudan and Israel: An Era of Change https://t.co/c3hlWQAD9t
https://twitter.com/akbardalai/status/1320268898038472704,Wed Mar 27 03:57:57 +0000 2013,2020-10-25 07:40:09,1,0,rep1320012409071783936,jmuthukrishnan,False,@jmuthukrishnan Our heartiest congratulations! Keep it up
https://twitter.com/akbardalai/status/1319211766182678529,Wed Mar 27 03:57:57 +0000 2013,2020-10-22 09:39:29,0,0,repNone,,False,It is now confirmed that the Arab nations have discarded the Palestinian cause for good  Israel's West Bank Settlement Expansions Won't Undermine Gulf Normalization https://t.co/hvsY9LW3JR via @Stratfor Worldview
https://twitter.com/akbardalai/status/1319200088724434946,Wed Mar 27 03:57:57 +0000 2013,2020-10-22 08:53:05,2,0,repNone,,False,"How many of us even think that the US President can be associated with armed militias? Or, is it a common thread that runs in all democracies ???? It is worrying   Right-Wing Extremists: A Looming Threat to the U.S. Election https://t.co/ckSmge6blZ via @CFR_org"
https://twitter.com/akbardalai/status/1319173206876459008,Wed Mar 27 03:57:57 +0000 2013,2020-10-22 07:06:16,0,0,repNone,,False,Russia lost South Caucasus when the Soviet Union collapsed. Control of South Caucasus gives Russia control of North Caucasus as well as the potential invading route to the Russian heartland from Europe   https://t.co/lEGr88TG3e via @Geopolitical Futures
https://twitter.com/akbardalai/status/1318155604876161032,Wed Mar 27 03:57:57 +0000 2013,2020-10-19 11:42:41,0,0,rep1318155299610488833,akbardalai,False,It is too early to assess the true intent of either side and predict the final trajectory of the evolving geopolitical changes in the Middle East or if Hezbollah is biding time until the US election.
https://twitter.com/akbardalai/status/1318155299610488833,Wed Mar 27 03:57:57 +0000 2013,2020-10-19 11:41:28,0,0,repNone,,False,"To Rose, it looks like Israel extending an olive branch to Lebanon to thaw the frozen relationship and undermine Hezbollah. The US was believed to blackmail Beri with individual sanction unless he goes along with the plan  https://t.co/7YHPUkUR1i via @Geopolitical Futures"
https://twitter.com/akbardalai/status/1317749342166347776,Wed Mar 27 03:57:57 +0000 2013,2020-10-18 08:48:20,0,0,repNone,,False,"Traditionalists would hate these changes. I dare state that when one tried to implement most of these proposals, was labelled as ""showing off"".  Glad to know that changes are taking place. It is my personal outlook.  https://t.co/zt8VdAyHeo via @IndianExpress"
https://twitter.com/akbardalai/status/1317736601192026112,Wed Mar 27 03:57:57 +0000 2013,2020-10-18 07:57:42,0,0,repNone,,False,Something many of us did not know. Very informative   https://t.co/YENKEpdwFS
https://twitter.com/akbardalai/status/1317274243168571392,Wed Mar 27 03:57:57 +0000 2013,2020-10-17 01:20:28,1,0,rep1316935162198896640,bsdhanoa,False,@bsdhanoa It is such a bloody complicated process that the only moron can think of such adventure as automation
https://twitter.com/akbardalai/status/1317273261978185729,Wed Mar 27 03:57:57 +0000 2013,2020-10-17 01:16:34,1,0,rep1317268950388895745,akbardalai,False,Thais defy protest ban in tens of thousands in Bangkok https://t.co/zqgjQgFEM2
https://twitter.com/akbardalai/status/1317268950388895745,Wed Mar 27 03:57:57 +0000 2013,2020-10-17 00:59:26,1,0,repNone,,False,"Trained in an Australian academy, the King of Thailand holds the titles of admiral, field-marshal and air-marshal. The queen is a general and Ms Sineenat a major-general.   https://t.co/ji5X23W43t"
https://twitter.com/akbardalai/status/1316667701696192512,Wed Mar 27 03:57:57 +0000 2013,2020-10-15 09:10:17,1,0,repNone,,False,https://t.co/HRNytjoqdC
https://twitter.com/akbardalai/status/1315675752822575106,Wed Mar 27 03:57:57 +0000 2013,2020-10-12 15:28:38,0,0,repNone,,False,Palestinian cause becomes the first victim with the loss of Pan-Arabism and the divide between the Arab ruling class and the population. It is also the basis for survival for another nation in ME. https://t.co/vBdNAuqjs7
https://twitter.com/akbardalai/status/1315652001825341441,Wed Mar 27 03:57:57 +0000 2013,2020-10-12 13:54:15,3,1,repNone,,False,A difficult choice for Iran: 1. quarter of the Iranian population  and the Supreme leader is Azeri 2. Armenia shares a border with Iran and only good Christian Neighbour  3. Iran thinks Azerbaijan providing a base for Israeli drones  https://t.co/Xja9biEZEJ via @AlMonitor
https://twitter.com/akbardalai/status/1315645913776287746,Wed Mar 27 03:57:57 +0000 2013,2020-10-12 13:30:04,0,0,repNone,,False,"Despite isolation by the international community and the pandemic, it is surprising to see the Chinese economy recovering. Look at the way export curve going up https://t.co/GVshEypJNE"
https://twitter.com/akbardalai/status/1314769113034571778,Wed Mar 27 03:57:57 +0000 2013,2020-10-10 03:25:58,3,0,repNone,,False,"Armenia and Azerbaijan agreed to a ceasefire. Russia has beaten Turkey to it. Being the backer of Azerbaijan, Turkey could not have done it except for getting into the sphere of influence https://t.co/Xd9WG2vUaZ"
https://twitter.com/akbardalai/status/1314381271942922240,Wed Mar 27 03:57:57 +0000 2013,2020-10-09 01:44:49,1,0,rep1314380047491293184,akbardalai,False,https://t.co/6mg0V8vHt7 via @AlMonitor
https://twitter.com/akbardalai/status/1314380047491293184,Wed Mar 27 03:57:57 +0000 2013,2020-10-09 01:39:57,1,0,repNone,,False,Turkey's drive to expand its role in the Caucasus and challenge Russia.  Turkey possibly wants to do what Russia did in Syria - the game-changer. Russia has its hands full with its neighbours from NW to South.  https://t.co/gpPQ911EUy via @Stratfor Worldview
https://twitter.com/akbardalai/status/1314178918555947008,Wed Mar 27 03:57:57 +0000 2013,2020-10-08 12:20:45,0,0,rep1314096027964596224,CarnegieIndia,False,@CarnegieIndia @SushantSin @srinathraghava3 👍👏
https://twitter.com/akbardalai/status/1314178457996128256,Wed Mar 27 03:57:57 +0000 2013,2020-10-08 12:18:55,0,12,repNone,,False,"RT @CarnegieIndia: On this episode of #InterpretingIndia, @SushantSin joins @srinathraghava3 as they discuss the latest developments along…"
https://twitter.com/akbardalai/status/1314174086533111809,Wed Mar 27 03:57:57 +0000 2013,2020-10-08 12:01:33,1,1,repNone,,False,What does China's nine-dash line say? https://t.co/Vq11eRpmTl
https://twitter.com/akbardalai/status/1314058509424631808,Wed Mar 27 03:57:57 +0000 2013,2020-10-08 04:22:17,0,0,repNone,,False,Syrians are fighting the Armenians essentially because firstly they owe it to Turkey and secondly they need money to provide for their families    https://t.co/qRbGR5J6tv via @AlMonitor
https://twitter.com/akbardalai/status/1314046810155966465,Wed Mar 27 03:57:57 +0000 2013,2020-10-08 03:35:48,1,0,repNone,,False,"As the politics are heating up in Kyrgyzstan, a brief insight into the geopolitical importance of Fergana valley could be helpful. An old informative article   Central Asia: The Complexities of the Fergana Valley https://t.co/QAcXA1T2zG via @Stratfor Worldview"
https://twitter.com/akbardalai/status/1313656545389940737,Wed Mar 27 03:57:57 +0000 2013,2020-10-07 01:45:01,1,0,repNone,,False,Is Israel heading towards civil war? https://t.co/tEagXpy5vn via @AlMonitor
https://twitter.com/akbardalai/status/1312190272738975744,Wed Mar 27 03:57:57 +0000 2013,2020-10-03 00:38:34,1,0,repNone,,False,2020 Fourth-Quarter Forecast https://t.co/fiEac1TeO5 via @Stratfor Worldview
https://twitter.com/akbardalai/status/1311983804412690432,Wed Mar 27 03:57:57 +0000 2013,2020-10-02 10:58:09,1,0,repNone,,False,Will the opinion change after the November election? https://t.co/s3uGPsxVGt via @ForeignAffairs
https://twitter.com/akbardalai/status/1311696397230432258,Wed Mar 27 03:57:57 +0000 2013,2020-10-01 15:56:05,0,91,repNone,,False,RT @SushantSin: There are many reasons for India's poor state of defence modernisation but nothing more critical than the shortage of funds…
https://twitter.com/akbardalai/status/1311693322541436928,Wed Mar 27 03:57:57 +0000 2013,2020-10-01 15:43:52,0,0,rep1311278049950724096,akbardalai,False,Nagarono Karabakh https://t.co/MpELK6gSOC
https://twitter.com/akbardalai/status/1311478459588177925,Wed Mar 27 03:57:57 +0000 2013,2020-10-01 01:30:05,1,0,rep1311477621230833664,AdamDayNYC,False,"@AdamDayNYC With your level of knowledge, there should not be any doubt. Our best wishes to you."
https://twitter.com/akbardalai/status/1311278049950724096,Wed Mar 27 03:57:57 +0000 2013,2020-09-30 12:13:44,1,0,rep1311277696161206272,akbardalai,False,Oil pipe lines through South Caucasus https://t.co/bRHxG1I4m8
https://twitter.com/akbardalai/status/1311277696161206272,Wed Mar 27 03:57:57 +0000 2013,2020-09-30 12:12:19,0,0,rep1311273234256465921,akbardalai,False,Strategic importance of Caucasus https://t.co/lXgsx4zXdF
https://twitter.com/akbardalai/status/1311273234256465921,Wed Mar 27 03:57:57 +0000 2013,2020-09-30 11:54:35,1,0,rep1311272860132888581,akbardalai,False,"Armenia claims there are 4,000 pro-Turkish militants from Syria now deployed in Azerbaijan. Turkey, in turn, argues that Kurdish and other pro-Armenian Middle Eastern groups have been spotted fighting for Armenia and training its forces."
https://twitter.com/akbardalai/status/1311272860132888581,Wed Mar 27 03:57:57 +0000 2013,2020-09-30 11:53:06,1,0,rep1311270469077622784,akbardalai,False,Turkey traditionally supports Azerbaijan. It is slightly tricky for Russia - it sells arms to Azerbaijan but gurantees security to Armenia under Collective Security Treaty Organization
https://twitter.com/akbardalai/status/1311270469077622784,Wed Mar 27 03:57:57 +0000 2013,2020-09-30 11:43:36,1,0,repNone,,False,"Simple background to Nagorono-Karabakh conflict. Turkey, Russia and Iran seem to be everywhere  https://t.co/a3Ped6gNt5 via @CFR_org"
https://twitter.com/akbardalai/status/1311268880916992002,Wed Mar 27 03:57:57 +0000 2013,2020-09-30 11:37:18,1,0,repNone,,False,https://t.co/i1SZpvSJfq
https://twitter.com/akbardalai/status/1310528858135736320,Wed Mar 27 03:57:57 +0000 2013,2020-09-28 10:36:42,0,0,repNone,,False,US and China: Great Power Competition   1. https://t.co/gIWa8pMOCO  2. https://t.co/2MbxGlI5xJ
https://twitter.com/akbardalai/status/1310245840724746240,Wed Mar 27 03:57:57 +0000 2013,2020-09-27 15:52:06,0,10,repNone,,False,"RT @SushantSin: ""Sitting on the glaciated heights of Saltoro ridge since 1984, the Indian Army will surely give a run for money to the adve…"
https://twitter.com/akbardalai/status/1310160127278817282,Wed Mar 27 03:57:57 +0000 2013,2020-09-27 10:11:30,1,0,repNone,,False,"Too much pushing does not help! China, which already has a foothold in the ME,  is now getting closer to Iran  https://t.co/oghtI3OzZi"
https://twitter.com/akbardalai/status/1310157818310217730,Wed Mar 27 03:57:57 +0000 2013,2020-09-27 10:02:20,0,0,repNone,AmbedkarnagarDM,False,"@AmbedkarnagarDM, @ChouhanShivraj   Dear DM,   This garbage dump is just 50 yards in front of the New Era Degree College Mhow 453 441. They will only listen to you. Warm regards https://t.co/ZSSDoOHeUS"
https://twitter.com/akbardalai/status/1310151863212285952,Wed Mar 27 03:57:57 +0000 2013,2020-09-27 09:38:40,2,0,rep1310151741522939905,akbardalai,False,"4/4. There is no incentive to anyone including the veterans, who served the nation in uniform for close to four decades and embraced the noble initiative of the PM for sharing the surplus energy with the grid. Appealed at every level but failed to get a satisfactory response."
https://twitter.com/akbardalai/status/1310151741522939905,Wed Mar 27 03:57:57 +0000 2013,2020-09-27 09:38:11,2,0,rep1310151627718815744,akbardalai,False,"3/4. Those who share the surplus energy are now made to pay additional fixed charges on the total import from the grid and NOT on the actual import, in addition to the scheduled energy tariff for the actual consumption from the grid."
https://twitter.com/akbardalai/status/1310151627718815744,Wed Mar 27 03:57:57 +0000 2013,2020-09-27 09:37:44,1,0,rep1310151475348140032,akbardalai,False,"2/4. The state governments at least in MP, seem to be afraid of losing its revenue and hence instituted a policy to indirectly discourage the citizens for sharing the surplus power with the grid."
https://twitter.com/akbardalai/status/1310151475348140032,Wed Mar 27 03:57:57 +0000 2013,2020-09-27 09:37:07,2,0,repNone,ChouhanShivraj,False,"@ChouhanShivraj, @PowMin,@mnreindia,@PMOIndia   Dear Chief Minister, 1/4. With encouragement from the PM, more and more people are beginning to use solar power. Many have installed solar panels at their residences to produce solar energy and share the surplus power with the grid."
https://twitter.com/akbardalai/status/1310140630945865728,Wed Mar 27 03:57:57 +0000 2013,2020-09-27 08:54:02,0,0,rep1310140430697156608,akbardalai,False,"2/4. The state governments at least in MP, seem to be afraid of loosing its revenue and hence instituted a policy to indirectly discourage the citizens for sharing the surplus power with the grid."
https://twitter.com/akbardalai/status/1310034256240861184,Wed Mar 27 03:57:57 +0000 2013,2020-09-27 01:51:20,1,0,rep1309920872656855040,jmuthukrishnan,False,@jmuthukrishnan @MoCA_GoI @Arogyasetu @PMOIndia @ICMRDELHI True! Those who are against it have to simply either off load the app or turn off the blue tooth once it is used and down load it again just before its mandatory use. There will be no data. Why have a policy if it cannot be implemented?
https://twitter.com/akbardalai/status/1309819930720649218,Wed Mar 27 03:57:57 +0000 2013,2020-09-26 11:39:41,1,0,rep1309742311132200960,jmuthukrishnan,False,@jmuthukrishnan What a feat! Our best compliments to Muthu the great
