id,Account Created At(same for all rows),status created_at,Fav_cont,retweeted_count,reply_to_status,reply_to_screen,quote,text
https://twitter.com/AllstarsFC_PFH/status/1212078717511487488,Thu Aug 09 09:55:49 +0000 2012,2019-12-31 18:31:00,27,7,repNone,,False,"All Stars Football Club wishes all of our followers a very Happy New Year 2020! New Year, new beginning but the passion for football remains the same! . . #AllStarsFC #PlayingForHumanity #ASFC #PFH #Football #Bollywood #Celebrities #Actors #LetsPlay #HappyNewYear #Welcome2020 https://t.co/CjESuDfi6E"
https://twitter.com/AllstarsFC_PFH/status/1211595282129002497,Thu Aug 09 09:55:49 +0000 2012,2019-12-30 10:30:00,8,4,repNone,,False,"Train Hard, Play Hard! Catch a glimpse into our training session as the All Stars sweatit out on the pitch. . . #AllStarsFC #PlayingForHumanity #ASFC #Football #TheBeautifulGame #Celebrities #Celebs #Bollywood #LetsPlay https://t.co/fEzCs9QrYW"
https://twitter.com/AllstarsFC_PFH/status/1210927341305659392,Thu Aug 09 09:55:49 +0000 2012,2019-12-28 14:15:50,40,23,repNone,,False,Wishing a very #HappyBirthday to our All Star #AhanShetty! Have a great day and year ahead!! . . #HappyBirthdayAhan #AhanShetty #AllStarsFC #PlayingForHumanity  #football #Bollywood #actors  #Celebrities #LetsPlay https://t.co/kIT4MsouCY
https://twitter.com/AllstarsFC_PFH/status/1210749710811746304,Thu Aug 09 09:55:49 +0000 2012,2019-12-28 02:30:00,10,1,repNone,,False,Wishing our All Star @KaranVeerMehra a very #HappyBirthday! Have a great day and year ahead! . . #AllStarsFC #PlayingForHumanity #ASFC #Football #TheBeautifulGame #Celebrities #Celebs #Bollywood #LetsPlay https://t.co/p7fs5Y0fy7
https://twitter.com/AllstarsFC_PFH/status/1210523217883885569,Thu Aug 09 09:55:49 +0000 2012,2019-12-27 11:30:00,18,1,repNone,Abhimannyu_D,False,@Abhimannyu_D made quite a splash in the midfield for the All Stars FC when we faced the Army &amp; Navy Stars  #FlashbackFriday  . . #AllStarsFC #PlayingForHumanity #ASFC #Football #TheBeautifulGame #Celebrities #Celebs #Bollywood #LetsPlay https://t.co/TgwZol2XwD
https://twitter.com/AllstarsFC_PFH/status/1209654997266374656,Thu Aug 09 09:55:49 +0000 2012,2019-12-25 02:00:00,5,0,repNone,,False,"Wishing the @AllstarsFC_PFH #Bossman , Bunty Walia a very #HappyBirthday! Have a great year ahead!  Swipe right to catch him in action on the football field. . . #HappyBirthdayBunty #AllStarsFC #PlayingForHumanity #ASFC  #Football #Celebrities  #Celebs #Bollywood #LetsPlay https://t.co/kdAb5rPpiu"
https://twitter.com/AllstarsFC_PFH/status/1209542002452221952,Thu Aug 09 09:55:49 +0000 2012,2019-12-24 18:31:00,17,4,repNone,,False,"May your world be filled with warmth and good cheer this Holy season, we wish you a joy-filled Christmas. . #MerryChristmas #Christmas #AllStarsFC #ASFC #PlayingForHumanity #Football #Bollywood #Celebs #Celebrities https://t.co/9IsUS1UUrO"
https://twitter.com/AllstarsFC_PFH/status/1209413328583442437,Thu Aug 09 09:55:49 +0000 2012,2019-12-24 09:59:42,28,4,repNone,,False,"Congratulations to our All Star @jimSarbh for his short film, ""Sometimes I Think About Dying"" getting shortlisted for the 92nd @TheAcademy Oscars Awards!!  All the best for the Oscars, Jim!! . . #oscars2020 #theacademy #theacademyawards #oscars #jimsarbh #actor #AllStarsFC https://t.co/8cJ34VuSBC"
https://twitter.com/AllstarsFC_PFH/status/1209073667155488768,Thu Aug 09 09:55:49 +0000 2012,2019-12-23 11:30:00,16,2,repNone,,False,When @arjunk26 decided to take up the role of the gaffer! . . #AllStarsFC #PlayingForHumanity #ASFC #Football #TheBeautifulGame #LetsPlay #Celebrities #Celebs #Bollywood https://t.co/DgIASarl4D
https://twitter.com/AllstarsFC_PFH/status/1208348891030183936,Thu Aug 09 09:55:49 +0000 2012,2019-12-21 11:30:00,13,3,repNone,,False,"“Come what may, we’re all set to play”  . . #AllStarsFC #PlayingForHumanity #ASFC #Football #TheBeautifulGame #Celebrities #Celebs #Bollywood #LetsPlay  @DinoMorea9 https://t.co/Vc83OG1lQm"
https://twitter.com/AllstarsFC_PFH/status/1207624114799697921,Thu Aug 09 09:55:49 +0000 2012,2019-12-19 11:30:00,11,1,repNone,,False,#Throwback to when the All Stars FC played a friendly match against the team from Dream 11. . #ThrowbackThursday  #AllStarsFC #PlayingForHumanity #ASFC #Football #TheBeautifulGame #Celebrities #Celebs #Bollywood #LetsPlay https://t.co/JjqVesg7rj
https://twitter.com/AllstarsFC_PFH/status/1207261727827513344,Thu Aug 09 09:55:49 +0000 2012,2019-12-18 11:30:00,12,2,repNone,,False,“Teamwork makes the dream work” That’s the mantra of the All Stars. . . #AllStarsFC #PlayingForHumanity #ASFC #Football #TheBeautifulGame #LetsPlay #Celebrities #Celebs #Bollywood https://t.co/DFFXdG0CfI
https://twitter.com/AllstarsFC_PFH/status/1206401056223182848,Thu Aug 09 09:55:49 +0000 2012,2019-12-16 02:30:00,3,1,repNone,,False,Caption This! What is Armaan Jain trying to say to the ref here?  Comment your answers down below!  #AllStarsFC #PlayingForHumanity #ASFC #Football #TheBeautifulGame #LetsPlay #Celebrities #Celebs #Bollywood https://t.co/lrQdfyackO
https://twitter.com/AllstarsFC_PFH/status/1205676280420679681,Thu Aug 09 09:55:49 +0000 2012,2019-12-14 02:30:00,8,2,repNone,,False,"“Most kids dream of scoring the perfect goal, I’ve always dreamed of stopping it.” – Iker Casillas   That seems to be the mantra for All Stars goalkeeper @marcrobinsonomg as well.  #AllStarsFC #PlayingForHumanity #ASFC #Football #TheBeautifulGame #Celebrities #Celebs #Bollywood https://t.co/q0Cadirdif"
https://twitter.com/AllstarsFC_PFH/status/1204951504370618368,Thu Aug 09 09:55:49 +0000 2012,2019-12-12 02:30:00,4,1,repNone,,False,Guess the All-Star! Can you name the All-Star who makes the tackle here?  Let us know in the comments section.  #AllStarsFC #PlayingForHumanity #ASFC #Football #TheBeautifulGame #Celebrities #Celebs #Bollywood #LetsPlay https://t.co/5NqmXcXX32
https://twitter.com/AllstarsFC_PFH/status/1203864340899782656,Thu Aug 09 09:55:49 +0000 2012,2019-12-09 02:30:00,6,1,repNone,,False,Wishing a very #HappyBirthday to our All-Star @DinoMorea9! Have a great day and year ahead!  #AllStarsFC #PlayingForHumanity #ASFC #Football #TheBeautifulGame #LetsPlay #Celebrities #Celebs #Bollywood https://t.co/o9xAsTssKv
https://twitter.com/AllstarsFC_PFH/status/1202844134089748480,Thu Aug 09 09:55:49 +0000 2012,2019-12-06 06:56:03,145,76,repNone,,False,Congratulations to our All Star @VivianDsena01 on being named among the Sexiest Asian Men in the World for 2019 and the Decade!! . . #AllStarsFC #PlayingForHumanity #ASFC #VivianDSena #SexiestMeninAsia #Celebrities #Football #LetsPlay https://t.co/SYvYNELMkE
https://twitter.com/AllstarsFC_PFH/status/1202547134345515009,Thu Aug 09 09:55:49 +0000 2012,2019-12-05 11:15:53,4,0,repNone,,False,"Wishing our All Star @Aparshakti all the best for the release of his latest movie, #PatiPatniAurWoh  . . #AllStarsFC #PlayingForHumanity #ASFC #Football #Celebrities  #Bollywood #LetsPlay https://t.co/oq5ywKbFBu"
https://twitter.com/AllstarsFC_PFH/status/1202505387607388160,Thu Aug 09 09:55:49 +0000 2012,2019-12-05 08:30:00,13,2,repNone,,False,"#ChintuTyagi is ready to hit the big screen tomorrow! Wishing our All Star @TheAaryanKartik all the very best for the release of his latest move, #PatiPatniAurWoh. . . #AllStarsFC #PlayingForHumanity #ASFC #Football #LetsPlay  #KartikAaryan #PatiPatniAurWoh  #Bollywood #Celebs https://t.co/6J3y9rleYo"
https://twitter.com/AllstarsFC_PFH/status/1202505387250987010,Thu Aug 09 09:55:49 +0000 2012,2019-12-05 08:30:00,13,5,repNone,,False,"उद्या सदाशिवराव भाऊ यांचे आगमन होईल!! Wishing our All Star @arjunk26 all the very best for the release of his latest movie, #Panipat.   #AllStarsFC #PlayingForHumanity #ASFC #ArjunKapoor #panipatmovie #Bollywood  #Celebs #Football #LetsPlay https://t.co/1t5wkP3twS"
https://twitter.com/AllstarsFC_PFH/status/1202429888969560066,Thu Aug 09 09:55:49 +0000 2012,2019-12-05 03:30:00,5,1,repNone,,False,"#Throwback to when the All Stars played against the Army &amp; Navy Stars on the Kargil Vijay Diwas.  The match took place at the Cooperage Football Ground in Churchgate, Mumbai.  #ThrowbackThursday #AllStarsFC #PlayingForHumanity #ASFC #Football #Celebs  #Bollywood #LetsPlay https://t.co/GW8izP0NUs"
https://twitter.com/AllstarsFC_PFH/status/1201350275853770752,Thu Aug 09 09:55:49 +0000 2012,2019-12-02 04:00:00,4,3,repNone,,False,Kickstart your week on the perfect note!  Sending some #MondayMotivation towards all of you!  #AllStarsFC #PlayingForHumanity #ASFC #Football #TheBeautifulGame #Celebrities #Celebs #Bollywood #LetsPlay @karan009wahi https://t.co/OYnZ2ICRls
https://twitter.com/AllstarsFC_PFH/status/1200640598610366465,Thu Aug 09 09:55:49 +0000 2012,2019-11-30 05:00:00,80,29,repNone,,False,The art of beating a defender ft. Ranbir Kapoor  #AllStarsFC #PlayingForHumanity #ASFC #Football #TheBeautifulGame  #Celebrities #Celebs  #Bollywood #LetsPlay https://t.co/GdRxHEY5LX
https://twitter.com/AllstarsFC_PFH/status/1199530787269308416,Thu Aug 09 09:55:49 +0000 2012,2019-11-27 03:30:00,5,1,repNone,,False,Wishing a very #HappyBirthday to our All-Star @imkarandeol! Have a great year ahead! . . #AllStarsFC #PlayingForHumanity #ASFC #Football #TheBeautifulGame #Celebrities #Celebs #Bollywood #LetsPlay https://t.co/C9RmQR4e3p
https://twitter.com/AllstarsFC_PFH/status/1198831534318374913,Thu Aug 09 09:55:49 +0000 2012,2019-11-25 05:11:25,6,1,repNone,,False,Wishing our All Star @TheArmaanJain a very #HappyBirthday ! Have a great year ahead!  #HappyBirthday #ArmaanJain #AllStarsFC #PlayingForHumanity #Bollywood #Celebrities https://t.co/lk24iaK2cE
https://twitter.com/AllstarsFC_PFH/status/1198828659366400001,Thu Aug 09 09:55:49 +0000 2012,2019-11-25 05:00:00,77,39,repNone,,False,Good vibes only! Begin your week on a bright note!  #AllStarsFC #PlayingForHumanity #ASFC #Football #TheBeautifulGame #Celebrities #Celebs #Bollywood #LetsPlay https://t.co/KmrgAzAX18
https://twitter.com/AllstarsFC_PFH/status/1197741495727452161,Thu Aug 09 09:55:49 +0000 2012,2019-11-22 05:00:00,9,2,repNone,,False,Wishing a very #HappyBirthday to our All-Star @TheAaryanKartik! Have a great year ahead!  #AllStarsFC #PlayingForHumanity #ASFC #Football #TheBeautifulGame #Celebrities #Celebs #Bollywood #LetsPlay https://t.co/UdUzdfDnVx
https://twitter.com/AllstarsFC_PFH/status/1197016720705249281,Thu Aug 09 09:55:49 +0000 2012,2019-11-20 05:00:00,28,2,repNone,,False,Caption This! What do you think @ShashankKhaitan is saying to his fellow All-Stars Armaan Ralhan and @Abhimannyu_D here?  #AllStarsFC #PlayingForHumanity #ASFC #Football #TheBeautifulGame #Celebrities #Celebs #Bollywood #LetsPlay https://t.co/4vbAG55Sq0
https://twitter.com/AllstarsFC_PFH/status/1196291945083101191,Thu Aug 09 09:55:49 +0000 2012,2019-11-18 05:00:00,4,1,repNone,,False,Wishing a very #HappyBirthday to our All-Star Armaan Ralhan! Have a great year ahead!  #AllStarsFC #PlayingForHumanity #ASFC #Football #TheBeautifulGame #Celebrities #Celebs #Bollywood #LetsPlay https://t.co/XZk4YN8XkK
https://twitter.com/AllstarsFC_PFH/status/1196291944290377728,Thu Aug 09 09:55:49 +0000 2012,2019-11-18 05:00:00,7,1,repNone,,False,Wishing a very #HappyBirthday to our All-Star @Aparshakti! Have a great year ahead!  #AllStarsFC #PlayingForHumanity #ASFC #Football #TheBeautifulGame #Celebrities #Celebs #Bollywood #LetsPlay https://t.co/ziDGpcBzTN
https://twitter.com/AllstarsFC_PFH/status/1195567169251069952,Thu Aug 09 09:55:49 +0000 2012,2019-11-16 05:00:00,9,1,repNone,,False,Wishing a very #HappyBirthday to our All Star #AdityaRoyKapur ! Have a great year ahead!  #AllStarsFC #PlayingForHumanity #ASFC #Football #TheBeautifulGame #Celebrities #Celebs  #Bollywood #LetsPlay https://t.co/yVL5jwmLfx
https://twitter.com/AllstarsFC_PFH/status/1194842393888952321,Thu Aug 09 09:55:49 +0000 2012,2019-11-14 05:00:00,15,4,repNone,,False,Caption This! What do you think skipper @juniorbachchan is speaking to his troops here?  Let us know in the comments!  #AllStarsFC #PlayingForHumanity #ASFC #Football #TheBeautifulGame #Celebrities #Celebs #Bollywood #LetsPlay @ShashankKhaitan @RohanShrestha @sachiinjoshi https://t.co/l6ppHosQfl
https://twitter.com/AllstarsFC_PFH/status/1193755230430781440,Thu Aug 09 09:55:49 +0000 2012,2019-11-11 05:00:00,4,3,repNone,TheAaryanKartik,False,@TheAaryanKartik slugging it out on the pitch at one of our training sessions  #AllStarsFC #PlayingForHumanity #ASFC #Football #TheBeautifulGame #Celebrities #Celebs #Bollywood #LetsPlay https://t.co/yEjz35VTny
https://twitter.com/AllstarsFC_PFH/status/1193030454221262848,Thu Aug 09 09:55:49 +0000 2012,2019-11-09 05:00:00,3,0,repNone,DinoMorea9,False,@DinoMorea9 taking on his opposition with full force  #AllStarsFC #PlayingForHumanity #ASFC #Football #TheBeautifulGame #Celebrities #Celebs #Bollywood #LetsPlay https://t.co/5kVh6PNHSt
https://twitter.com/AllstarsFC_PFH/status/1191943291266199552,Thu Aug 09 09:55:49 +0000 2012,2019-11-06 05:00:00,11,1,repNone,,False,When the ball lines up perfectly for the shot!   #AllStarsFC #PlayingForHumanity #ASFC #Football #TheBeautifulGame #Celebrities #Celebs #Bollywood #LetsPlay @Aparshakti https://t.co/U4LpVNB7zq
https://twitter.com/AllstarsFC_PFH/status/1191218514536943616,Thu Aug 09 09:55:49 +0000 2012,2019-11-04 05:00:00,18,1,repNone,,False,Focus Level = 💯  #AllStarsFC #PlayingForHumanity  #ASFC #Football #TheBeautifulGame  #Celebrities #Celebs #Bollywood #LetsPlay @arjunk26 https://t.co/RZQWRmAEi7
https://twitter.com/AllstarsFC_PFH/status/1190101151523278848,Thu Aug 09 09:55:49 +0000 2012,2019-11-01 03:00:00,9,1,repNone,,False,Wishing a very #HappyBirthday to our All-Star Ishaan Khatter! Have a great year ahead!  #AllStarsFC #PlayingForHumanity #ASFC #Football #TheBeautifulGame #Celebrities #Celebs #Bollywood #LetsPlay https://t.co/pKzy90fILN
https://twitter.com/AllstarsFC_PFH/status/1189875751513817088,Thu Aug 09 09:55:49 +0000 2012,2019-10-31 12:04:20,6,1,repNone,,False,Wishing our All Star @sikandarkher a very Happy Birthday! Have a great year ahead!  #HappyBirthdaySikandar #SikandarKher #AllStarsFC #ASFC #PlayingForHumanity #football #Bollywood #Celebrities #Celebs https://t.co/z1ZHPkHFVz
https://twitter.com/AllstarsFC_PFH/status/1189414124876374016,Thu Aug 09 09:55:49 +0000 2012,2019-10-30 05:30:00,4,1,repNone,,False,Stretch it out before you hit the field! #WorkoutWisdom  #AllStarsFC #PlayingForHumanity #ASFC #Football #TheBeautifulGame #Celebrities #Celebs #Bollywood #LetsPlay https://t.co/ELxIQ6DQgd
https://twitter.com/AllstarsFC_PFH/status/1188715772886929408,Thu Aug 09 09:55:49 +0000 2012,2019-10-28 07:15:00,17,2,repNone,,False,The struggle for winning the possession is on! Who do you think won the battle?  #AllStarsFC #PlayingForHumanity #ASFC #Football #TheBeautifulGame #Celebrities #Celebs #Bollywood #LetsPlay https://t.co/LvhdLaNLkc
https://twitter.com/AllstarsFC_PFH/status/1188302045175898112,Thu Aug 09 09:55:49 +0000 2012,2019-10-27 03:50:59,19,2,repNone,,False,"May this Diwali, come with a beautiful beginning, fresh hope, bright days and new dreams. Wishing you a Happy and Prosperous Diwali!  #AllStarsFC #PlayingForHumanity #HappyDiwali #Diwali #Football #Bollywood #AllStars #TheBeautifulGame #LetsPlay #Festivals https://t.co/7oByFcCdxQ"
https://twitter.com/AllstarsFC_PFH/status/1187960798179553282,Thu Aug 09 09:55:49 +0000 2012,2019-10-26 05:15:00,24,3,repNone,,False,Can the wall stop RK from scoring?  #AllStarsFC #PlayingForHumanity #ASFC #Football #TheBeautifulGame #Celebrities #Celebs #Bollywood #LetsPlay https://t.co/REe4CRYU2n
https://twitter.com/AllstarsFC_PFH/status/1187236022536548354,Thu Aug 09 09:55:49 +0000 2012,2019-10-24 05:15:00,7,1,repNone,,False,All eyes on the prize!  #AllStarsFC #PlayingForHumanity #ASFC #Football #TheBeautifulGame #Celebrities #Celebs #Bollywood #LetsPlay https://t.co/WpiQiVwmJz
https://twitter.com/AllstarsFC_PFH/status/1185420308854870016,Thu Aug 09 09:55:49 +0000 2012,2019-10-19 05:00:00,11,1,repNone,,False,Pass and move! That’s the way to play!  #AllStarsFC #PlayingForHumanity #ASFC #Football #TheBeautifulGame #Celebrities #Celebs #Bollywood #LetsPlay https://t.co/mHXkfLGDuY
https://twitter.com/AllstarsFC_PFH/status/1181085299020947456,Thu Aug 09 09:55:49 +0000 2012,2019-10-07 05:54:13,28,6,repNone,,False,A great weekend football session for the All Stars as we were joined by Indian sporting legends @msdhoni and @Leander  #AllStarsFC #PlayingForHumanity #ASFC #AllStars #football #thebeautifulgame #letsplay #sports #dhoni #leanderpaes #legends https://t.co/C5iHFvV37Q
https://twitter.com/AllstarsFC_PFH/status/1177877183827562497,Thu Aug 09 09:55:49 +0000 2012,2019-09-28 09:26:19,14,4,repNone,,False,Time for some weekend footie ⚽  #AllStars #ASFC #PlayingForHumanity #Football #PFH #thebeautifulgame #letsplay #play #footie #weekend #saturday https://t.co/0OMVBmOfQJ
https://twitter.com/AllstarsFC_PFH/status/1171433750246199297,Thu Aug 09 09:55:49 +0000 2012,2019-09-10 14:42:24,7,1,repNone,,False,⚽ = 👍🏽  #AllStarsFC #PlayingForHumanity #AllStars #ASFC #Football #LetsPlay #TheBeautifulGame #Game #Sports #Celebs #Celebrities #Play https://t.co/xQ5qX4Fb7Q
https://twitter.com/AllstarsFC_PFH/status/1165137082093694976,Thu Aug 09 09:55:49 +0000 2012,2019-08-24 05:41:42,7,1,repNone,,False,Weekend Vibes ft. @KaranVeerMehra   #AllStarsFC #PlayingForHumanity #ASFC #football #training #play #Bollywood #Celebs #thebeautifulgame https://t.co/9dBiGe8lnZ
https://twitter.com/AllstarsFC_PFH/status/1159733711094472705,Thu Aug 09 09:55:49 +0000 2012,2019-08-09 07:50:38,40,19,repNone,,False,"🚨 Match Announcement 🚨  The All Stars will take on the Dream XI football team in an exhibition match at the Jamnabai Narsee Ground in Mumbai.  The match will take place on Sunday, 11th August, 2019 at 6pm IST.  #AllStarsFC #PlayingForHumanity #DreamXI #ASFC #football https://t.co/Sa6tyLrnYU"
https://twitter.com/AllstarsFC_PFH/status/1157951825300996096,Thu Aug 09 09:55:49 +0000 2012,2019-08-04 09:50:03,383,69,repNone,,False,All Stars FC = Major friendship goals.  Wishing everyone a very Happy Friendship Day!!  #happyfriendshipday #friendshipday #AllStarsFC #ASFC #PlayingForHumanity #AllStars #Football #letsplay #thebeautifulgame https://t.co/nvfHb6TSqe
https://twitter.com/AllstarsFC_PFH/status/1154789767579668480,Thu Aug 09 09:55:49 +0000 2012,2019-07-26 16:25:10,129,45,repNone,,False,The All Stars squad with the medals from the Kargil Cup Exhibition Match.  #AllStarsFC #ASFC #Army #Navy #KargilCup #KargilVijayDiwas https://t.co/LbczgsRTsA
https://twitter.com/AllstarsFC_PFH/status/1154773151508848641,Thu Aug 09 09:55:49 +0000 2012,2019-07-26 15:19:08,47,21,repNone,,False,We've scored!! RK pulls one back through a spot-kick.  ASFC 1-3 Army &amp; Navy Stars
https://twitter.com/AllstarsFC_PFH/status/1154771933025771520,Thu Aug 09 09:55:49 +0000 2012,2019-07-26 15:14:18,3,0,repNone,,False,Half Time: Allstars FC 0 - 2 Army &amp; Navy Stars  We trail but have shown great spirit despite the pouring rain in Mumbai.
https://twitter.com/AllstarsFC_PFH/status/1154756731458740224,Thu Aug 09 09:55:49 +0000 2012,2019-07-26 14:13:53,77,16,repNone,,False,Pre-match discussion as the All Stars are set to take on the Army &amp; Navy Stars in the Kargil Cup Exhibition Match. https://t.co/5aMgfMZJnP
https://twitter.com/AllstarsFC_PFH/status/1154286755404800000,Thu Aug 09 09:55:49 +0000 2012,2019-07-25 07:06:22,21,6,repNone,,False,🚨 Squad Announcement 🚨  Presenting the final team list of All Stars FC that will take on the Army &amp; Navy Stars Football team in the Kargil Cup Exhibition Match.  The match will be held at the Cooperage Stadium in Mumbai on 26th July 2019 from 6pm onwards  #AllStarsFC #KargilCup https://t.co/PlDWU8TeLV
https://twitter.com/AllstarsFC_PFH/status/1154251270070210560,Thu Aug 09 09:55:49 +0000 2012,2019-07-25 04:45:22,0,5,repNone,,False,RT @TheVikramThapa: 🚨 Match Announcement 🚨  The All Stars will take on the Army &amp; Navy Stars Football team in the Kargil Cup Exhibition Foo…
https://twitter.com/AllstarsFC_PFH/status/1154227245247950849,Thu Aug 09 09:55:49 +0000 2012,2019-07-25 03:09:54,37,21,repNone,,False,"🚨 Match Announcement 🚨  The All Stars will take on the Army &amp; Navy Stars Football team in the Kargil Cup Exhibition Football Match on the momentous occasion of Kargil Vijay Diwas.  The match will be played at the Cooperage Ground, Mumbai on 26th July 2019. #AllStars #KargilCup https://t.co/nvxrmgtF0j"
https://twitter.com/AllstarsFC_PFH/status/1149701354278965254,Thu Aug 09 09:55:49 +0000 2012,2019-07-12 15:25:37,8,1,repNone,,False,When you spot the run ⚽  #AllStars #AllStarsFC #PlayingForHumanity #football #game #thebeautifulgame #celebs #celebrities #letsplay #kickit https://t.co/rTpMo8mmyy
https://twitter.com/AllstarsFC_PFH/status/1126412895779033088,Thu Aug 09 09:55:49 +0000 2012,2019-05-09 09:05:36,119,50,repNone,,False,"#ThrowbackThursday to when the All Stars played a friendly match against @tellystrikersfc at the Jamnabai Narsee Ground in Mumbai.  At the stroke of full time, the All Stars emerged victorious with a margin of 9-1 over TSFC.  #AllStarsFC #TellyStrikersFC #PlayingForHumanity https://t.co/EmgBaXgyzf"
https://twitter.com/AllstarsFC_PFH/status/1099195877980233728,Thu Aug 09 09:55:49 +0000 2012,2019-02-23 06:34:54,2,0,repNone,,False,We wish @csgonsalves a very happy birthday! Have a blast!🥳🥳🥳 https://t.co/Vnj7DYcr2k
https://twitter.com/AllstarsFC_PFH/status/1092618564778033153,Thu Aug 09 09:55:49 +0000 2012,2019-02-05 02:59:00,73,21,repNone,,False,"The #AllStars captain, @juniorbachchan celebrates his birthday today! Join us in wishing him his 43rd! Have a blast cap! Let's win some more ⚽ matches and ❤️ as you always do!  . #Bollywood #AllStarsFootballClub #ASFC #PlayingForHumanity https://t.co/r7b0XitRP4"
https://twitter.com/AllstarsFC_PFH/status/1091921047924793344,Thu Aug 09 09:55:49 +0000 2012,2019-02-03 04:47:19,5,1,repNone,,False,"Wishing the goalie and our saviour, @marcrobinsonomg a very #HappyBirthday! . #Bollywood #Model #PlayingForHumanity #ASFC #AllStars #MarcRobinson https://t.co/DPm6gnJC1l"
https://twitter.com/AllstarsFC_PFH/status/1080802226153623552,Thu Aug 09 09:55:49 +0000 2012,2019-01-03 12:25:05,112,35,repNone,,False,#Throwback to the last friendly game of 2018 that we played on Jamnabai Narsee Playground in Mumbai! 🙌 if you want to see more from this day!!🤩 . #FootballLove #ASFC #AllStars #AbhishekBachchan #ThrowbackThursday #Mumbai #Celebrities #Bollywood #Football https://t.co/xzpI6JphGn
https://twitter.com/AllstarsFC_PFH/status/1079809054397120512,Thu Aug 09 09:55:49 +0000 2012,2018-12-31 18:38:35,116,49,repNone,,False,A very #HappyNewYear to all of you!  Our goal for 2019 is #PlayingForHumanity! What are your resolutions for this year? . #Bollywood #Celebrities #football #FootballLove #asfc #AllStars https://t.co/BqLJJ84s6p
https://twitter.com/AllstarsFC_PFH/status/1078522482901041152,Thu Aug 09 09:55:49 +0000 2012,2018-12-28 05:26:12,13,4,repNone,,False,Happy Birthday @KaranVeerMehra! We're all big fans of your sense of humour and football skills! Keep it up champion!  . #FootballLove #Bollywood #Actor #KaranveerMehra #KVM #PlayingForHumanity #ASFC #AllStars https://t.co/lhbYJqgWuk
https://twitter.com/AllstarsFC_PFH/status/1077424203601727488,Thu Aug 09 09:55:49 +0000 2012,2018-12-25 04:42:02,149,64,repNone,,False,#ASFC family wishes all of you a very happy #Christmas! Have a blast this season! ❄️🎄 . #Bollywood #AllStars #AllStarsFootballClub #Football #FootballLove https://t.co/bhU70Zq3zT
https://twitter.com/AllstarsFC_PFH/status/1071674717159878656,Thu Aug 09 09:55:49 +0000 2012,2018-12-09 07:55:37,4,1,repNone,,False,#HappyBirthday @DinoMorea9! Keep giving us those fitness and football goals until next one! 🙌Have a blast!🎉 . #PlayingForHumanity #Football #DinoMorea #ASFC #AllStars https://t.co/k4S2KlAVDH
https://twitter.com/AllstarsFC_PFH/status/1066570968561147904,Thu Aug 09 09:55:49 +0000 2012,2018-11-25 05:55:09,10,3,repNone,,False,#HappyBirthday @TheArmaanJain! Stay blessed and have a blast until the next one! . #Bollywood #Celebrities #ArmaanJain #HappyBirthday #PlayingForHumanity https://t.co/z3KGPgzNkW
https://twitter.com/AllstarsFC_PFH/status/1065469891594018818,Thu Aug 09 09:55:49 +0000 2012,2018-11-22 04:59:52,50,4,repNone,,False,A very #HappyBirthday @TheAaryanKartik! Have a great year ahead!  . #Bollywood #Celebrities #KartikAaryan #PlayingForHumanity https://t.co/9WnWNsQyyw
https://twitter.com/AllstarsFC_PFH/status/1064198154306781184,Thu Aug 09 09:55:49 +0000 2012,2018-11-18 16:46:26,221,72,repNone,,False,Sunday done right! 💪😎 . @msdhoni and two birthday boys - @Aparshakti and Armaan Ralhan! Good game ⭐⭐⭐⭐⭐!!! . #Bollywood #AllStars #ASFC #Football⚽ #footballLove #PlayingForHumanity https://t.co/VPBePXlDrS
https://twitter.com/AllstarsFC_PFH/status/1064001636371128321,Thu Aug 09 09:55:49 +0000 2012,2018-11-18 03:45:32,12,1,repNone,,False,The team wishes @Aparshakti a very #HappyBirthday! Have a blast ⭐! . #Aparshakti #Bollywood #PlayingForHumanity #Celebrities #ASFC #AllStars https://t.co/EuEXBeYhyk
https://twitter.com/AllstarsFC_PFH/status/1063998495219048448,Thu Aug 09 09:55:49 +0000 2012,2018-11-18 03:33:04,10,2,repNone,,False,Happy Birthday Armaan Ralhan! Have a great year ahead! 💪😎 . #Bollywood #ASFC #AllStars #Celebrities #PlayingForHumanity https://t.co/6hqrZfikLR
https://twitter.com/AllstarsFC_PFH/status/1063272949434732549,Thu Aug 09 09:55:49 +0000 2012,2018-11-16 03:30:00,40,8,repNone,,False,We wish Aditya roy kapur a very #HappyBirthday! Have a blast until next one!  . #HapppyBirthday #Birthday #AdityaRoyKapoor #AdityaKapur #Bollywood #PlayingForHumanity #Celebrities #ASFC #AllStars https://t.co/ThnjUJKThX
