id,Account Created At(same for all rows),status created_at,Fav_cont,retweeted_count,reply_to_status,reply_to_screen,quote,text
https://twitter.com/AllstarsFC_PFH/status/1354080726510166018,Thu Aug 09 09:55:49 +0000 2012,2021-01-26 14:56:17,2,1,repNone,,False,Good session with the ASFC boys  #Asfc #PlayingForHumanity #celebrities #LetsFootball #footballislife https://t.co/E7AUYXpvjW
https://twitter.com/AllstarsFC_PFH/status/1350819407723974662,Thu Aug 09 09:55:49 +0000 2012,2021-01-17 14:56:58,2,1,repNone,,False,Just posted a photo https://t.co/E1Ed0xJsyM
https://twitter.com/AllstarsFC_PFH/status/1349717323247185923,Thu Aug 09 09:55:49 +0000 2012,2021-01-14 13:57:41,1,1,repNone,,False,Asfc played their first practice session at jamnabai ground on Sunday  Stay tuned for more action packed photos and news for this year  #Asfc #PlayingForHumanity #practice #football #Celebrities #LetsFootball https://t.co/VZ0RRGSJvX
https://twitter.com/AllstarsFC_PFH/status/1344893076477800448,Thu Aug 09 09:55:49 +0000 2012,2021-01-01 06:27:50,7,1,repNone,,False,Wishing all of our fans a very happy and a prosperous new year  #asfc #PlayingForHumanity #Celebrities #football #newyear https://t.co/lJzcCfS1ZV
https://twitter.com/AllstarsFC_PFH/status/1343380723831549952,Thu Aug 09 09:55:49 +0000 2012,2020-12-28 02:18:18,0,0,repNone,,False,RK vs VK back in 2016  Throwback to the Clasico we played in 2016  Comment us below on how your experience was for this one of a kind match  #Asfc #PlayingForHumanity #football #RK #VK #LetsFootball https://t.co/M9kHfzwG87
https://twitter.com/AllstarsFC_PFH/status/1342283268369113088,Thu Aug 09 09:55:49 +0000 2012,2020-12-25 01:37:24,0,0,repNone,,False,Wishing our very own allstars boss @walia_bunty a very happy birthday  #Allstars #PlayingForHumanity #Celebrities #football #birthdaypost🎂 https://t.co/uQqIZJCqbF
https://twitter.com/AllstarsFC_PFH/status/1340914572207808513,Thu Aug 09 09:55:49 +0000 2012,2020-12-21 06:58:41,4,0,repNone,,False,Did Ranbir get past the defender  Swipe left to check it out   #ASFC #PlayingForHumanity #Allstars  #football #Celebrities #LetsFootball  #footballskills #footballislife #asfc https://t.co/swPAqR2Tso
https://twitter.com/AllstarsFC_PFH/status/1340913761230741504,Thu Aug 09 09:55:49 +0000 2012,2020-12-21 06:55:28,4,0,repNone,,False,Did Ranbir manage to get past the defender?  Swipe right to check it out   #ASFC #Allstars #PlayingForHumanity #Football #LetsFootball #Celebrities #Bollywood #stars https://t.co/83DWJfmKLQ
https://twitter.com/AllstarsFC_PFH/status/1339830428769931265,Thu Aug 09 09:55:49 +0000 2012,2020-12-18 07:10:41,1,0,repNone,,False,Head away your problems cause it's TGIF   Allstars #ASFC #PlayingForHumanity #Football #LetsFootball #LetsPlay #Bollywood #Celebrities #Celebs https://t.co/THJPCHp1ME
https://twitter.com/AllstarsFC_PFH/status/1338824815139049473,Thu Aug 09 09:55:49 +0000 2012,2020-12-15 12:34:44,1,0,repNone,,False,Our Captain and Vice-captain Leading from the front for the match Against Dream 11  #Allstars #ASFC #PlayingForHumanity #Football #LetsFootball #LetsPlay #Bollywood #Celebrities #Celebs https://t.co/5cbdcGSOS0
https://twitter.com/AllstarsFC_PFH/status/1338392308815978497,Thu Aug 09 09:55:49 +0000 2012,2020-12-14 07:56:07,0,0,repNone,,False,Remove your Monday blues with our All-star duo  Allstars #ASFC #PlayingForHumanity #Football #LetsFootball #LetsPlay #Bollywood #Celebrities #Celebs https://t.co/aNNNlXyGV4
https://twitter.com/AllstarsFC_PFH/status/1337669079289704448,Thu Aug 09 09:55:49 +0000 2012,2020-12-12 08:02:15,2,0,repNone,,False,The Art 🖼️ Swipe ⬅️  The Artist 🖌️    Allstars #ASFC #PlayingForHumanity #Football #LetsFootball #LetsPlay #Bollywood #Celebrities #Celebs https://t.co/10n79QSCzr
https://twitter.com/AllstarsFC_PFH/status/1336915702003998722,Thu Aug 09 09:55:49 +0000 2012,2020-12-10 06:08:36,3,0,repNone,,False,"Guess where the ball is A, B, C  Comment us in the comment section below   Allstars #ASFC #PlayingForHumanity #Football #LetsFootball #LetsPlay #Bollywood #Celebrities #Celebs @ St. Andrews Turf Park https://t.co/gjv3IoiZHf"
https://twitter.com/AllstarsFC_PFH/status/1336646974066528260,Thu Aug 09 09:55:49 +0000 2012,2020-12-09 12:20:46,1,0,repNone,,False,Do you think Dino scored that penalty ?  Swipe left to check it out!   #ASFC #Allstars #PlayingForHumanity  #Celebrities #Bollywood #football #LetsFootball https://t.co/an1QzjKjvD
https://twitter.com/AllstarsFC_PFH/status/1336202695879749632,Thu Aug 09 09:55:49 +0000 2012,2020-12-08 06:55:22,2,0,repNone,,False,Bend it like Ranbir  #Allstars #ASFC #PlayingForHumanity #Football #LetsFootball #LetsPlay #Bollywood #Celebrities #Celebs @ Cooperage Stadium https://t.co/Npt33S29lo
https://twitter.com/AllstarsFC_PFH/status/1335851770363392000,Thu Aug 09 09:55:49 +0000 2012,2020-12-07 07:40:55,1,0,repNone,,False,Our very Own Star Studded line up Catch them soon for some action packed games   #Allstars #ASFC #PlayingForHumanity #Football #LetsFootball #LetsPlay #Bollywood #Celebrities #Celebs @ Cooperage Stadium https://t.co/fFzWfz9hD2
https://twitter.com/AllstarsFC_PFH/status/1333391579147546625,Thu Aug 09 09:55:49 +0000 2012,2020-11-30 12:45:00,2,1,repNone,marcrobinsonomg,False,"@marcrobinsonomg, the custodian of the All Stars FC side is inching to be back between the goal!  Catch Marc and all your favourite All Stars back in action very soon!  #AllStarsFC #ASFC #PlayingForHumanity  #Football #LetsFootball #LetsPlay  #Bollywood #Celebrities #Celebs https://t.co/Ymgxcmp2xh"
https://twitter.com/AllstarsFC_PFH/status/1333029191130836995,Thu Aug 09 09:55:49 +0000 2012,2020-11-29 12:45:00,17,3,repNone,aapkakarandeol,False,@aapkakarandeol is keen to be back on the field for the All Stars Football Club!  Catch Karan and all your favourite All Stars in action very soon!  #AllStarsFC #ASFC #PlayingForHumanity  #Football #LetsFootball #LetsPlay  #Bollywood #Actor #Celebs #Celebrities https://t.co/PujgPCXfxN
https://twitter.com/AllstarsFC_PFH/status/1332666802929766401,Thu Aug 09 09:55:49 +0000 2012,2020-11-28 12:45:00,4,0,repNone,,False,The All Stars FC team is eager to see @samirkochhar  Kochhar back on the field!  Catch Samir and all your favourite All Stars in action very soon!  #AllStarsFC #ASFC #PlayingForHumanity  #Football #LetsFootball #LetsPlay  #Bollywood #Celebrities #Celebs https://t.co/YPIyJmtnQY
https://twitter.com/AllstarsFC_PFH/status/1332304415244443649,Thu Aug 09 09:55:49 +0000 2012,2020-11-27 12:45:00,7,1,repNone,MeezaanJ,False,@MeezaanJ is raring to be back up and running for the All Stars FC side!  Catch Meezaan and the rest of your favourite All Stars back in action on the field very soon!  #AllStarsFC #ASFC #PlayingForHumanity     #Football #LetsFootball #LetsPlay     #Bollywood #Actor #Celebrities https://t.co/HjHxTlj4xn
https://twitter.com/AllstarsFC_PFH/status/1331942027160735746,Thu Aug 09 09:55:49 +0000 2012,2020-11-26 12:45:00,1,0,repNone,AdityaSeal_,False,@AdityaSeal_ will be back on the field for the All Stars with his intensity!   Catch Aditya and all your favourite All Stars back in action very soon!  #AllStarsFC #ASFC #PlayingForHumanity  #Football #LetsFootball #LetsPlay  #Bollywood #Actors #Celebs #Celebrities https://t.co/Z8fwlkM791
https://twitter.com/AllstarsFC_PFH/status/1331669285790494720,Thu Aug 09 09:55:49 +0000 2012,2020-11-25 18:41:13,7,0,repNone,,False,One of the best ever to grace the football pitch.  Diego Armando Maradona was synonymous with magic on the field  The entire footballing fraternity mourns the loss of the Argentine legend  Rest in Peace 🙏🏼  #diegomaradona #diego  #AllStarsFC #ASFC #Playinforhumanity https://t.co/hgQFNWb6ig
https://twitter.com/AllstarsFC_PFH/status/1331579584240783363,Thu Aug 09 09:55:49 +0000 2012,2020-11-25 12:44:47,31,21,repNone,,False,We can't wait to see #AhanShetty back in the @allstarsfc_pfh colors out on the field!   Catch Ahan and the rest of your favourite #AllStars back in action very soon!  #AllStarsFC #ASFC #PlayingForHumanity     #Football #LetsFootball #LetsPlay   #Bollywood #Actors #Celebs https://t.co/oekxk8F8v5
https://twitter.com/AllstarsFC_PFH/status/1331217251786125312,Thu Aug 09 09:55:49 +0000 2012,2020-11-24 12:45:00,10,1,repNone,Abhimannyu_D,False,@Abhimannyu_D and his deft touch will be back in action for the @AllstarsFC_PFH!   Catch him and all your favourite All Stars on the field very soon!  #AllStarsFC #ASFC #PlayingForHumanity  #Football #LetsFootball #Sports  #Bollywood #Celebs #Celebrities https://t.co/QMvGWaS4dj
https://twitter.com/AllstarsFC_PFH/status/1330854863916453889,Thu Aug 09 09:55:49 +0000 2012,2020-11-23 12:45:00,4,1,repNone,,False,#JimSarbh is inching to be back in action for the @AllstarsFC_PFH!    Catch Jim and all your other favourite All Stars back in action very soon!  #AllStarsFC #ASFC #PFH   #Football #LetsFootball #Play   #Bollywood #Actor #Celebs #Celebrities   #Sports #India #FitIndia https://t.co/v21Sq6pIFA
https://twitter.com/AllstarsFC_PFH/status/1330492475778105344,Thu Aug 09 09:55:49 +0000 2012,2020-11-22 12:45:00,6,1,repNone,,False,#ArmaanRalhan is pumped to be back on the field for the @AllstarsFC_PFH!  Catch Armaan and the rest of your favourite All Stars back in action very soon!  #AllStarsFC #ASFC #PlayingForHumanity  #Bollywood #Celebrities #Celebs  #Football #LetsFootball #Play https://t.co/cGTXvc45jd
https://twitter.com/AllstarsFC_PFH/status/1330130087996399617,Thu Aug 09 09:55:49 +0000 2012,2020-11-21 12:45:00,0,0,repNone,AadarJain,False,@AadarJain  can't wait to get back to scoring goals for the @AllstarsFC_PFH!    Catch Aadar and all your favourite ASFC players back in action on the field very soon!  #AllStarsFC #ASFC #PlayingForHumanity  #Football #LetsFootball #LetsPlay  #Bollywood #Celebs #celebrities #actor https://t.co/nXMAcKae7g
https://twitter.com/AllstarsFC_PFH/status/1329767700067880969,Thu Aug 09 09:55:49 +0000 2012,2020-11-20 12:45:00,0,0,repNone,TheArmaanJain,False,@TheArmaanJain is eager to be up and running for the @AllstarsFC_PFH team!  Catch Armaan and all your favourite All Stars in action very soon!  #AllStarsFC #ASFC #PlayingForHumanity  #Football #LetsFootball #Bollywood  #FitIndia #Celebs #Celebrities https://t.co/6J3NMEUhhE
https://twitter.com/AllstarsFC_PFH/status/1329405312156262401,Thu Aug 09 09:55:49 +0000 2012,2020-11-19 12:45:00,3,2,repNone,,False,#ShashankKhaitan is raring to be back on the field for the All Stars!  Catch Shashank and all your favourite ASFC players back in action very soon!  #AllStarsFC #ASFC #PlayingForHumanity   #Football #Bollywood #Celebs #Celebrities    #letsfootball #india #Sports #FitIndia https://t.co/9MS8HtOfBq
https://twitter.com/AllstarsFC_PFH/status/1329070350424961024,Thu Aug 09 09:55:49 +0000 2012,2020-11-18 14:33:59,0,1,repNone,,True,RT @RohanShrestha: Can't wait to get back on the field!! https://t.co/w6CqzC4SrA
https://twitter.com/AllstarsFC_PFH/status/1329058024082853888,Thu Aug 09 09:55:49 +0000 2012,2020-11-18 13:45:00,3,0,repNone,RohanShrestha,False,@RohanShrestha  always brings intensity whenever he gets on the football pitch for the @AllstarsFC_PFH  !   Catch Rohan and all your other favourite All Stars back in action very soon! #AllStarsFC #ASFC #Playingforhumanity   #fitness #football #fitindia  #sports #LetsFootball https://t.co/w6X087WpPq
https://twitter.com/AllstarsFC_PFH/status/1328680536441647106,Thu Aug 09 09:55:49 +0000 2012,2020-11-17 12:45:00,0,0,repNone,csgonsalves,False,"@csgonsalves' got magic in his feet, on and off the pitch!  Catch him and rest of your favourite All Stars in action very soon as we get back in training!   #AllStarsFC #ASFC #Football  #Football #Sports #India  #PlayingForHumanity #LetsFootball  #Bollywood #Celebs #Celebrities https://t.co/4sDO4DVEyJ"
https://twitter.com/AllstarsFC_PFH/status/1328318148555116544,Thu Aug 09 09:55:49 +0000 2012,2020-11-16 12:45:00,1,0,repNone,KaranVeerMehra,False,@KaranVeerMehra can't wait to be back again on the field for the All Stars Football Club!   Catch KVM and rest of your favourite All Stars in action very soon!  #AllStarsFC #ASFC #PlayingForHumanity  #Football #Charity #Bollywood #Actors  #Celebrities #Celebrity #Celebs #india https://t.co/IruHcj2KGr
https://twitter.com/AllstarsFC_PFH/status/1327955760945442818,Thu Aug 09 09:55:49 +0000 2012,2020-11-15 12:45:00,8,3,repNone,,False,Hands up if you are excited to see the All Stars back in action on the field!  We know for sure that @karan009wahi is very excited! Catch him and rest of your favourite All Stars back in training very soon!  #AllStarsFC #ASFC #Football  #Bollywood #Actor #PlayingForHumanity https://t.co/ldD0v4XX73
https://twitter.com/AllstarsFC_PFH/status/1327589599737114624,Thu Aug 09 09:55:49 +0000 2012,2020-11-14 12:30:00,14,2,repNone,,False,"A bundle of energy on and off the pitch, @Aparshakti is eager to get going again for the @AllstarsFC_PFH!  Catch him and all your favourite All Stars back in action on a field very soon!  #AllStarsFC #ASFC #PlayingForHumanity  #PFH #Football #Celebs  #Bollywood #Actor #Celebrity https://t.co/0BXDQ4WPdB"
https://twitter.com/AllstarsFC_PFH/status/1327227210365685762,Thu Aug 09 09:55:49 +0000 2012,2020-11-13 12:30:00,90,47,repNone,VivianDsena01,False,@VivianDsena01 is raring to be back on the field again for the @AllstarsFC_PFH!   Stay tuned as Vivian and the rest of your favourite All Stars will be back in action very soon!  #AllStarsFC #ASFC #PFH  #PlayingForHumanity #Charity  #Football #LetsFootball  #Celebrity #Celebs https://t.co/eZYhWRMbMz
https://twitter.com/AllstarsFC_PFH/status/1326868597570985985,Thu Aug 09 09:55:49 +0000 2012,2020-11-12 12:45:00,7,2,repNone,,False,#ShoojitSircar is one of the most skilful players in the All Stars Football Club team!   Get ready to watch him bring out his best with the rest of the All Stars as we are back in training very soon!  #AllStarsFC #ASFC #Football  #PlayingForHumanity #PFH  #Bollywood #Director https://t.co/QZai9U6qfX
https://twitter.com/AllstarsFC_PFH/status/1326506209864785920,Thu Aug 09 09:55:49 +0000 2012,2020-11-11 12:45:00,13,2,repNone,,False,"The right mix of youth and talent on the pitch, #IshaanKhatter is ready to get going!  Catch him and all your favourite #AllStars in action very soon!  #AllStarsFC #ASFC #PFH  #PlayingForHumanity #Football #LetsFootball  #Bollywood #Actor #Celebs #Celebrities https://t.co/aNCMf2nzKw"
https://twitter.com/AllstarsFC_PFH/status/1326147597673717762,Thu Aug 09 09:55:49 +0000 2012,2020-11-10 13:00:00,7,2,repNone,,False,Are you as pumped up as @DinoMorea9  for our return on the pitch!  Stay tuned as the All Stars Football Club will be back in training very soon!  #AllStarsFC #ASFC #PFH #PlayingForHumanity  #Football #LetsFootball #Play  #bollywood #actor #celebrity  #celebs  #DinoMorea #Sports https://t.co/wZLZ46ksk3
https://twitter.com/AllstarsFC_PFH/status/1325781433621774336,Thu Aug 09 09:55:49 +0000 2012,2020-11-09 12:45:00,4,2,repNone,,False,"A legend on the tennis circuit, he has got some 'legendary' moves on the football field as well!  Catch @Leander in action for the @AllstarsFC_PFH as we are back in training very soon!  #AllStarsFC #ASFC #PlayingForHumanity  #Football #PFH #LetsFootball  #Play #LeanderPaes https://t.co/LMXTYCGLWW"
https://twitter.com/AllstarsFC_PFH/status/1325422915299373062,Thu Aug 09 09:55:49 +0000 2012,2020-11-08 13:00:22,1,0,rep1325052884753416192,AllstarsFC_PFH,False,@AdityaRoyKFans @Adityaroykworld
https://twitter.com/AllstarsFC_PFH/status/1325422818301935618,Thu Aug 09 09:55:49 +0000 2012,2020-11-08 12:59:59,48,21,repNone,SHABIRAHLUWALIA,False,@SHABIRAHLUWALIA personifies intensity and passion on the field.  Catch him and the rest of your favourite All Stars in action very soon! #AllStars #ASFC #PFH  #PlayingForHumanity #Football  #shabirahluwalia #actor #celebs  #celebs #Celebrities #tvshows #bollywood #india #sports https://t.co/Y4zjgRa08q
https://twitter.com/AllstarsFC_PFH/status/1325052884753416192,Thu Aug 09 09:55:49 +0000 2012,2020-11-07 12:30:00,24,5,repNone,,False,"#AdityaRoyKapoor gives his all whenever he takes the field, and you can catch him soon in action for the All Stars!  Stay tuned to see your favourite team back in training very soon!  #AllStarsFC #ASFC #PFH #PlayingForHumanity #Football #Bollywood #Celebs #Actors https://t.co/6t4DrRhyo0"
https://twitter.com/AllstarsFC_PFH/status/1324707989106745344,Thu Aug 09 09:55:49 +0000 2012,2020-11-06 13:39:31,1,0,rep1324697066233237504,AllstarsFC_PFH,False,@ArjunK_Universe @AkEncyclopedia @ArjunFanBase @arjungalaxy @Arjunk26style @ArjunK_FCPeru @arjunkdaily @Arjunkisena @ArjunKapoor_FC @arjunkusafc @ArjunkOnline @ArjunKapoorCafe @ArjunKapoorFC RT and show some love!
https://twitter.com/AllstarsFC_PFH/status/1324697066233237504,Thu Aug 09 09:55:49 +0000 2012,2020-11-06 12:56:06,14,5,repNone,arjunk26,False,@arjunk26 looks all set to go and so are the All Stars!  @AllstarsFC_PFH will be back in action soon! Stay tuned to this space for more updates!  #AllStars #ASFC #PFH  #PlayingForHumanity #Football  #Bollywood #Celebrities #Celebs  #Actor #ArjunKapoor #Kapoor https://t.co/0DyiR4MHnu
https://twitter.com/AllstarsFC_PFH/status/1323985711708610561,Thu Aug 09 09:55:49 +0000 2012,2020-11-04 13:49:26,42,16,repNone,,False,Get ready to be back in the groove like @TheAaryanKartik  ASFC are all set to be back in training soon! Catch all your favourite All Stars in action!  #AllStarsFC #ASFC #PFH  #PlayingForHumanity #football #kartikaaryan #kartikaryan #kartikaaryanfans #bollywood https://t.co/LfqQq3y2u9
https://twitter.com/AllstarsFC_PFH/status/1323603333177729024,Thu Aug 09 09:55:49 +0000 2012,2020-11-03 12:30:00,78,34,repNone,,False,We can't wait to see RK back in action for the All Stars!  But we are glad we don't have to wait much longer! ASFC is back in training very soon!!  #AllStarsFC #ASFC #PFH  #PlayingForHumanity #Football  #Bollywood #Actors #Celebs  #Celebrities #LetsFootball https://t.co/VpgUcFegfW
https://twitter.com/AllstarsFC_PFH/status/1323583234727276546,Thu Aug 09 09:55:49 +0000 2012,2020-11-03 11:10:08,28,14,repNone,,False,It's been a looonnggg time since we have seen the All Stars in action!!  But the wait is finally over!!  Training sessions begin on 15th November with all your favourite stars in action!  #AllStarsFC #ASFC #PFH  #PlayingForHumanity #Football  #Bollywood #Actors #Celebs https://t.co/g9Br7siPL7
https://twitter.com/AllstarsFC_PFH/status/1322613189666766848,Thu Aug 09 09:55:49 +0000 2012,2020-10-31 18:55:32,10,1,repNone,,False,Wishing our All Star #IshaanKhatter a very #HappyBirthday! Stay healthy and have a great year ahead . . #happybirthdayishaan #ishaankhattar  #ishaankhatter #AllStars #ASFC #PlayingForHumanity #PFH #football #celebs #actor #bollywood #Celebrities #LetsFootball #play https://t.co/h1Y578rTLc
https://twitter.com/AllstarsFC_PFH/status/1319624617577730049,Thu Aug 09 09:55:49 +0000 2012,2020-10-23 13:00:00,15,3,repNone,,False,Guess the All Star in action with the ball here! Let us know the answers in the comments section below! . . #AllStarsFC #PlayingForHumanity #ASFC #Football #TheBeautifulGame #LetsPlay #LetsFootball #Sports  #Celebrities #Bollywood #Celebs #Actors https://t.co/uetMp9CgAz
https://twitter.com/AllstarsFC_PFH/status/1318909077947183104,Thu Aug 09 09:55:49 +0000 2012,2020-10-21 13:36:42,23,11,repNone,,False,Can’t wait to see the skipper @juniorbachchan  back on the field for the All Stars! . . #AllStarsFC #PlayingForHumanity #ASFC #Football #TheBeautifulGame #LetsPlay #Sports #Celebrities #LetsFootball #Bollywood #Celebs #Actors #AbhishekBachchan https://t.co/XhbTKmfUuy
https://twitter.com/AllstarsFC_PFH/status/1316725512014884867,Thu Aug 09 09:55:49 +0000 2012,2020-10-15 13:00:00,22,4,repNone,,False,how it started                            how it's going https://t.co/klqXNNqEG1
https://twitter.com/AllstarsFC_PFH/status/1310469149072605184,Thu Aug 09 09:55:49 +0000 2012,2020-09-28 06:39:27,0,34,repNone,,False,"RT @MagicBusIndia: You’ve won hearts, both onscreen and in real life! Thank you for all your support, Ranbir Kapoor. Wishing you a magical…"
https://twitter.com/AllstarsFC_PFH/status/1310286080848076801,Thu Aug 09 09:55:49 +0000 2012,2020-09-27 18:32:00,98,49,repNone,,False,Wishing our All Stars FC vice-captain Ranbir Kapoor a very Happy Birthday! Keep smiling and have a great day and year ahead! . . #RanbirKapoor #RK #Ranbir #AllStarsFC #ASFC #PFH  #Football #LetsFootball #Play  #Bollywood #BollywoodBirthdays #Celebs https://t.co/jZB7huWw37
https://twitter.com/AllstarsFC_PFH/status/1306546490911801345,Thu Aug 09 09:55:49 +0000 2012,2020-09-17 10:52:12,35,17,rep1306545985116467206,AllstarsFC_PFH,False,"@juniorbachchan was the manager of the All Stars as the team was captained by @DinoMorea9 against the opponents, who were led by Indian football legend @bhaichung15   #AllStarsFC #AllStars #PFH  #PlayingForHumanity #Charity  #Football #Bollywood #Actors #Celebs https://t.co/ZvqN1fGZ3i"
https://twitter.com/AllstarsFC_PFH/status/1306545985116467206,Thu Aug 09 09:55:49 +0000 2012,2020-09-17 10:50:11,69,32,repNone,,False,#ThrowbackThursday  A look back at 2017 when the All Stars FC side faced off in an exhibition match against Bhaichung XI at the Cooperage Football Stadium in Mumbai.  #AllStarsFC #AllStars #PFH  #PlayingForHumanity #Charity  #Football #Bollywood #Actors #Celebs https://t.co/h4IZQPiX0m
https://twitter.com/AllstarsFC_PFH/status/1301767694266413056,Thu Aug 09 09:55:49 +0000 2012,2020-09-04 06:22:58,54,4,repNone,,False,Wishing our All Star @TheVikramThapa a very #HappyBirthday! Have a great day and year ahead!  #vikramthapa #AllStars  #AllStarsFC #ASFC #PFH #PlayingForHumanity #Charity  #football #bollywood #actor https://t.co/ESF4bMbfzx
https://twitter.com/AllstarsFC_PFH/status/1300191973224062976,Thu Aug 09 09:55:49 +0000 2012,2020-08-30 22:01:37,13,3,repNone,,False,"May the festival of Onam be a harbinger of cheer, peace and prosperity in all your lives! Wish everyone a very Happy Onam!  #Onam2020 #Onam #Onamwishes  #OnamFestKerala #OnamSpecial #onamashamsakal #onamsadhya  #AllStarsFC #asfc #playingforhumanity https://t.co/6ObPksAcrS"
https://twitter.com/AllstarsFC_PFH/status/1299591746892959745,Thu Aug 09 09:55:49 +0000 2012,2020-08-29 06:16:32,14,6,repNone,,False,"On #NationalSportsDay, we celebrate the memory of Major Dhyan Chand, a true Indian sporting legend who won laurels for India.  Let us salute all Indian sportspersons who work hard to achieve glory for our dear nation.  Wish everyone a very Happy National Sports Day! https://t.co/yQyTVNzWsI"
https://twitter.com/AllstarsFC_PFH/status/1298712018606649351,Thu Aug 09 09:55:49 +0000 2012,2020-08-26 20:00:48,9,1,repNone,,False,Wishing a very Happy Birthday to our All Star @jimSarbh! Have a great day and year ahead!  #AllStars #ASFC #PFH #jimsarbh #bollywood #actor  #football #footie #letsplay  #Celebrities #celebs #play  #stayhomestaysafe https://t.co/fKJwLWnQpv
https://twitter.com/AllstarsFC_PFH/status/1296895180117696512,Thu Aug 09 09:55:49 +0000 2012,2020-08-21 19:41:20,9,2,repNone,,False,"On this festive occasion of Ganesh Chaturthi, may Ganpati Bappa shower prosperity and good health upon all  @allstarsfc_pfh wishes everyone a very Happy Ganesh Chaturthi!  #AllStarsFC #ASFC #PFH  #PlayingForHumanity #GaneshChaturthi #Ganesha  #GaneshaChaturthi #Ganeshotsav2020 https://t.co/wdFrqPB8Vl"
https://twitter.com/AllstarsFC_PFH/status/1296756725916119040,Thu Aug 09 09:55:49 +0000 2012,2020-08-21 10:31:10,31,13,rep1296756208276140033,AllstarsFC_PFH,False,"It proved to be a goal-fest as the All Heart side overcame the All Stars with a 7-3 margin at full time. Ranbir Kapoor, @shabirahluwalia, and @aadarjain got on the scoresheet for the All Stars  #AllStarsFC #ASFC #PFH  #AllHeartFC #Cricket #bollywood  #Football #LetsPlay #India https://t.co/J4zZW4EloD"
https://twitter.com/AllstarsFC_PFH/status/1296756208276140033,Thu Aug 09 09:55:49 +0000 2012,2020-08-21 10:29:07,55,27,repNone,,False,#FlashbackFriday   A look back at the #CelebrityClasico 2017 when the All Stars again faced off against All Heart FC at the Mumbai Football Arena  @juniorbachchan captained the All Stars side whereas @imVkohli led the charge for the All Heart FC team https://t.co/f1odaRLql6
https://twitter.com/AllstarsFC_PFH/status/1295857859343732736,Thu Aug 09 09:55:49 +0000 2012,2020-08-18 22:59:24,3,1,repNone,,False,Can you correctly identify the All Star?  Let us know your answers in the comments!  #GuesstheAllStar #ASFC  #AllStarsFC #AllStars #PFH  #PlayingForHumanity #football #bollywood #Celebrities #celebs https://t.co/3cQSYIIxdj
https://twitter.com/AllstarsFC_PFH/status/1295131273640341506,Thu Aug 09 09:55:49 +0000 2012,2020-08-16 22:52:12,113,51,repNone,,False,"Football always manages to bring the brightest smiles on our All Stars' faces.  Even though we can't go out and play right now, we can cherish the past memories and hopefully soon, create even more new ones.  #AllStarsFC #ASFC #PFH #Football #TheBeautifulGame  #bollywood #celebs https://t.co/ROD7EATbqP"
https://twitter.com/AllstarsFC_PFH/status/1294763212747882496,Thu Aug 09 09:55:49 +0000 2012,2020-08-15 22:29:40,6,2,repNone,,False,"When you realise that there is no football session again on the weekend!  We feel your pain, @ShashankKhaita1  All jokes aside, #stayhomestaysafe   #AllStarsFC #ASFC #PFH  #football #footie #practice  #bollywood #celebrities #celeb https://t.co/vz868UGnyH"
https://twitter.com/AllstarsFC_PFH/status/1294368549427765248,Thu Aug 09 09:55:49 +0000 2012,2020-08-14 20:21:25,6,1,repNone,,False,May the Indian tricolour always fly high. Wishing every Indian on the grand occasion of Independence Day!  #happyindependenceday #india #AllStarsFC #AllStars #PFH #PlayingForHumanity #football  #Bollywood #celebs #actors https://t.co/5wsEOO0bPt
