id,Account Created At(same for all rows),status created_at,Fav_cont,retweeted_count,reply_to_status,reply_to_screen,quote,text
https://twitter.com/AnaBotin/status/1046127776095457280,Fri Jul 25 10:20:02 +0000 2014,2018-09-29 20:01:12,54,4,rep1046126326355243008,AnaBotin,False,"This is why Santander, and @SantanderPT, have been a part of this project from the beginning. Parabéns aos responsáveis da @NovaSBE pela excepcional realização: são um exemplo a nível internacional. Desejam-vos os mayores êxitos. https://t.co/VkduqKJhwN"
https://twitter.com/AnaBotin/status/1046126326355243008,Fri Jul 25 10:20:02 +0000 2014,2018-09-29 19:55:26,42,6,rep1046075288197779458,AnaBotin,False,"Focused on creating knowledge and supporting the development of people and business, the values of @NovaSBE are our values. After 40 years they are moving to this new campus, pursuing excellence but doing so with a commitment to transform the world in a responsible, inclusive way https://t.co/BAPk5b711N"
https://twitter.com/AnaBotin/status/1046075288197779458,Fri Jul 25 10:20:02 +0000 2014,2018-09-29 16:32:38,112,10,repNone,,False,"Today I am in Carcavelos, close to Lisbon. The students of the new campus @NovaSBE are privileged: beautiful beaches and access to a great education. https://t.co/pGrYD6SHu3"
https://twitter.com/AnaBotin/status/1045989833204805636,Fri Jul 25 10:20:02 +0000 2014,2018-09-29 10:53:04,1,0,rep1045608741792624641,andycxz,False,"@andycxz @openbank_es Ayúdanos a mejorar, ahora podemos introducir rápidamente cambios que nuestros clientes valoran. Y gracias por confiar en Openbank."
https://twitter.com/AnaBotin/status/1045602075525226497,Fri Jul 25 10:20:02 +0000 2014,2018-09-28 09:12:15,46,8,repNone,,True,"Jon Rahm being very Seve like in his debut. Check this out, never seen this before. https://t.co/YPJ4Z2P1eN"
https://twitter.com/AnaBotin/status/1045374983638257664,Fri Jul 25 10:20:02 +0000 2014,2018-09-27 18:09:52,173,27,repNone,,True,Seve loved the Ryder Cup. He is still an inspiration for many of us. https://t.co/FB09KWSmCv
https://twitter.com/AnaBotin/status/1045344898445180928,Fri Jul 25 10:20:02 +0000 2014,2018-09-27 16:10:20,6,0,rep1045277771361136644,ibeliot,False,"@ibeliot @SantanderGolf Sí, está al lado de la Casa club, cerca del hoyo 18."
https://twitter.com/AnaBotin/status/1045277068425154560,Fri Jul 25 10:20:02 +0000 2014,2018-09-27 11:40:48,682,122,repNone,,False,"Desde ayer, este roble recuerda a Celia Barquín en nuestra sede de Boadilla. Gracias a las jugadoras de @SantanderGolf Tour por este gesto. https://t.co/SY4LRjlCfM"
https://twitter.com/AnaBotin/status/1045026265844060161,Fri Jul 25 10:20:02 +0000 2014,2018-09-26 19:04:12,45,11,rep1045025956363161600,AnaBotin,False,"@Openbank_es is one, but perhaps the best example of what we are doing across Santander group to become the open and responsible financial platform that empowers our customers.  Well done Eze and team for leading the way to better banking for all. https://t.co/KVSA5p719g"
https://twitter.com/AnaBotin/status/1045025956363161600,Fri Jul 25 10:20:02 +0000 2014,2018-09-26 19:02:58,31,5,rep1045025748208308228,AnaBotin,False,"In traditional banks, these are capabilities that only premium clients have access to. But even then not in such a hands-on, granular way. Other new features include a best-in-class password vault. Going forward, all you need to remember is your bank password. https://t.co/RQhbn7FHsp"
https://twitter.com/AnaBotin/status/1045025748208308228,Fri Jul 25 10:20:02 +0000 2014,2018-09-26 19:02:08,26,5,rep1045025296318107649,AnaBotin,False,"Today Openbank announced several new services, like robo-advisor. It lets you set up multiple savings goals, for a holiday, a car. It lets you save as you prefer (even a Euro a day is ok), and on top of this you chose the risk and return profile of each savings goal. https://t.co/gzPZSaDgXO"
https://twitter.com/AnaBotin/status/1045025296318107649,Fri Jul 25 10:20:02 +0000 2014,2018-09-26 19:00:20,16,3,rep1045025083822153728,AnaBotin,False,"Openbank also does everything fintech “Apps” do. One example: It aggregates more than 70 financial entities in Spain into your personal financial dashboard, including mortgages, current accounts, credit cards for a unified view of your finances. https://t.co/HG8kkNPVCJ"
https://twitter.com/AnaBotin/status/1045025083822153728,Fri Jul 25 10:20:02 +0000 2014,2018-09-26 18:59:30,18,3,rep1045024950200029185,AnaBotin,False,"Openbank does everything your bank can do, mortgages, payments, it takes deposits, and it does so with no commissions and backed by the Santander Group. All this with only one showcase bank branch."
https://twitter.com/AnaBotin/status/1045024950200029185,Fri Jul 25 10:20:02 +0000 2014,2018-09-26 18:58:58,19,3,rep1045024736873517057,AnaBotin,False,This year Openbank is the fastest growing bank in Spain:  26% new customers;  20% growth in deposits (1.1 billion YoY growth);  And 25% growth is customers calling it their primary bank.
https://twitter.com/AnaBotin/status/1045024736873517057,Fri Jul 25 10:20:02 +0000 2014,2018-09-26 18:58:07,19,4,rep1045024474716753920,AnaBotin,False,"Remarkably, even if it is only available in Spain at the moment, Openbank is Europe’s largest purely digital bank with 9 billion Euro’s in deposits, and over a million customers."
https://twitter.com/AnaBotin/status/1045024474716753920,Fri Jul 25 10:20:02 +0000 2014,2018-09-26 18:57:05,19,2,rep1045024300389060608,AnaBotin,False,"The event is timely. Yesterday we appointed Andrea Orcel as the new Group CEO. He will help accelerate execution of our strategy to integrate these kinds of leading-edge digital services, as we have in Openbank, throughout Santander."
https://twitter.com/AnaBotin/status/1045024300389060608,Fri Jul 25 10:20:02 +0000 2014,2018-09-26 18:56:23,80,17,repNone,,False,"I have just attended the annual product showcase of @Openbank_es.  As a 100% digital Bank, with 1 million customers, the largest in Europe – Openbank is the bank of the future today. The bank we want to be. https://t.co/OUulO9bjLG"
https://twitter.com/AnaBotin/status/1044615103654625292,Fri Jul 25 10:20:02 +0000 2014,2018-09-25 15:50:23,42,5,rep1044614843523829760,AnaBotin,False,Delighted that Andrea Orcel is joining us as Group CEO. As we continue to transform Santander his experience is invaluable. Welcome Andrea.
https://twitter.com/AnaBotin/status/1044614843523829760,Fri Jul 25 10:20:02 +0000 2014,2018-09-25 15:49:21,44,4,rep1044614679740518401,AnaBotin,False,"José Antonio ha sido un pilar fundamental para el Santander y para mí estos últimos años. Y lo seguirá siendo, ahora como único vicepresidente del Grupo con funciones ejecutivas y como Presidente de Santander España."
https://twitter.com/AnaBotin/status/1044614679740518401,Fri Jul 25 10:20:02 +0000 2014,2018-09-25 15:48:42,27,3,rep1044614486689292289,AnaBotin,False,Rodrigo Echenique ha sido clave en el éxito del Santander durante los últimos 30 años. Ha sido un privilegio contar con él y ha sido mi persona de confianza. Seguirá en el Consejo. Le deseo todo lo mejor.
https://twitter.com/AnaBotin/status/1044614486689292289,Fri Jul 25 10:20:02 +0000 2014,2018-09-25 15:47:56,91,28,repNone,,True,"Santander’s aim is to continue to deliver on our strategy, growing loyal customers and accelerating our digital transformation. https://t.co/WZDkYmyYVW"
https://twitter.com/AnaBotin/status/1044232347141509120,Fri Jul 25 10:20:02 +0000 2014,2018-09-24 14:29:27,702,183,repNone,,False,"Bonita sorpresa el #GoogleDoodle de hoy.  Se cumplen 139 años del día en que mi tatarabuelo Marcelino y su hija María fueron a la Cueva de Altamira buscando restos de huesos y sílex, y se encontraron con nuestra joya del arte paleolítico: https://t.co/fX1rboTxi4."
https://twitter.com/AnaBotin/status/1042019226800803841,Fri Jul 25 10:20:02 +0000 2014,2018-09-18 11:55:18,291,67,repNone,,True,"A los padres, hermano y todos los amigos de Celia Barquín un gran abrazo en estos momentos tan difíciles. Una  irreparable pérdida que sentimos también quienes, aún sin conocerla personalmente, compartíamos amigos y pasión por el golf. https://t.co/sWPgGG7x1G"
https://twitter.com/AnaBotin/status/1040572384934330371,Fri Jul 25 10:20:02 +0000 2014,2018-09-14 12:06:04,126,36,repNone,,True,"La universidad aporta gran valor y valores a la sociedad. Necesita más recursos, más sostenibles y un sistema eficiente para desarrollar todo su potencial. Desde @fundacion_CyD, y con el #InformeCYD, aportamos análisis y datos para ayudar a tomar decisiones que permitan mejorar. https://t.co/0nUOgA1gMm"
https://twitter.com/AnaBotin/status/1040291396127739904,Fri Jul 25 10:20:02 +0000 2014,2018-09-13 17:29:31,7,1,rep1039848087999602690,AngelaDSaini,False,"@AngelaDSaini Angela, like you, I believe in science and the importance of facts. Your approach and rigour are what we need to move the cause forward. My article explaining my feminism follows the same approach: https://t.co/p1UY6OUiTU"
https://twitter.com/AnaBotin/status/1040290788004044801,Fri Jul 25 10:20:02 +0000 2014,2018-09-13 17:27:06,127,33,repNone,,True,"It’s the 18th year in a row that Santander is ranked as one of the world’s most sustainable banking institutions, and this is our best result to date. Congratulations to all staff. https://t.co/M3FEqplKpo"
https://twitter.com/AnaBotin/status/1039957455558598656,Fri Jul 25 10:20:02 +0000 2014,2018-09-12 19:22:33,52,9,rep1039956761040576512,AnaBotin,False,Here we are plotting the next Internet with Santander Young Leaders. ;) They are part of a group of 250 from each Santander Group country. #SantanderPolska https://t.co/WGOOvmoS8g
https://twitter.com/AnaBotin/status/1039956761040576512,Fri Jul 25 10:20:02 +0000 2014,2018-09-12 19:19:47,34,8,rep1039956172705550337,AnaBotin,False,"Santander Polska has best practice across our Group in Mobile Banking, customer experience and is bringing huge value to Santander. You can now can benefit more from Santander Group’s scale, as leading bank in Europe and Americas with 140 million customers. We are proud of you."
https://twitter.com/AnaBotin/status/1039956172705550337,Fri Jul 25 10:20:02 +0000 2014,2018-09-12 19:17:27,104,18,repNone,,False,"I’m in Warsaw celebrating the rebranding of Santander Polska with their management team. There are 120 in total, and 50% are women - a meritocracy as these are top performers and managers.  Gratulacje dla wszystkich za przeprowadzenie rebrandingu w tak doskonały sposób. https://t.co/kq7I7TY2oJ"
https://twitter.com/AnaBotin/status/1039599715766153216,Fri Jul 25 10:20:02 +0000 2014,2018-09-11 19:41:01,76,9,rep1039598203455397889,AnaBotin,False,A delightful surprise. Members of the Santander Orchestra in Poland playing... which famous song?   Can you guess? https://t.co/3V7XFo52Ll
https://twitter.com/AnaBotin/status/1039598203455397889,Fri Jul 25 10:20:02 +0000 2014,2018-09-11 19:35:01,86,6,repNone,,False,"I’m in Poland tonight and just visited our largest Warsaw branch, serving 15,000 customers. Thank you to Agnieszka and staff for the tour, and the hard work."
https://twitter.com/AnaBotin/status/1037706930423246848,Fri Jul 25 10:20:02 +0000 2014,2018-09-06 14:19:46,247,67,repNone,,True,"Europa es más inclusiva y más fuerte con programas como Erasmus+.  Las becas #SantanderErasmus quieren reconocer esta labor, que se inició hace 30 años, y mostrar el compromiso del Santander con la igualdad de oportunidades y la excelencia educativa. https://t.co/UZLpNlJlcS"
https://twitter.com/AnaBotin/status/1035188828401807360,Fri Jul 25 10:20:02 +0000 2014,2018-08-30 15:33:44,66,9,repNone,,True,Hello @ChampionsLeague We’re excited to be a part of this great competition.  Good luck to all at the draw today #UCLDraw https://t.co/VElVteM5AX
https://twitter.com/AnaBotin/status/1035188542249545729,Fri Jul 25 10:20:02 +0000 2014,2018-08-30 15:32:36,84,20,repNone,,True,Hola @LigadeCampeones  Estamos encantados de unirnos a este gran torneo.   Buena suerte a todos en el sorteo de hoy #SorteoChampions https://t.co/5Tgruu4FGv
https://twitter.com/AnaBotin/status/1034136893473153024,Fri Jul 25 10:20:02 +0000 2014,2018-08-27 17:53:43,132,29,repNone,,False,"Great insights from @Brianbehlendorf at @Linuxfoundation about @Hyperledger and blockchain technologies for business. “Twitter for payments and Gmail for health records, and a network of networks” his way of helping us visualise blockchain technologies and their potential. Simple https://t.co/K08hZpvcQH"
https://twitter.com/AnaBotin/status/1032688072847249408,Fri Jul 25 10:20:02 +0000 2014,2018-08-23 17:56:37,98,22,repNone,,True,"Gracias por compartir la inspiradora historia de Gennet, @ma_tobias. Siempre digo que la educación es la mejor manera de construir un futuro más inclusivo para todos. https://t.co/x7rYq4w5E6"
https://twitter.com/AnaBotin/status/1031853958757863424,Fri Jul 25 10:20:02 +0000 2014,2018-08-21 10:42:09,0,28,repNone,,False,RT @bancosantander: Santander ha sido reconocida como empresa que ayuda a cambiar el mundo por su contribución a la #educación y es el únic…
https://twitter.com/AnaBotin/status/1031853942462967808,Fri Jul 25 10:20:02 +0000 2014,2018-08-21 10:42:05,0,14,repNone,,False,RT @bancosantander: Santander recognized for its social impact through its support of #education and is the only bank in the Eurozone to be…
https://twitter.com/AnaBotin/status/1031235696630087682,Fri Jul 25 10:20:02 +0000 2014,2018-08-19 17:45:24,443,172,repNone,,False,If you asked me 10 years ago I would not have called myself a feminist. Now I do. And you should too:  https://t.co/GHhHKHFaAt
https://twitter.com/AnaBotin/status/1031235286364246020,Fri Jul 25 10:20:02 +0000 2014,2018-08-19 17:43:46,553,295,rep1031235064250724352,AnaBotin,False,"Al contrario de lo que se ha especulado, en este tiempo no he pasado por ningún proceso de conversión.  Por qué me considero feminista y tú también deberías: https://t.co/ordg3TjAe2"
https://twitter.com/AnaBotin/status/1031235064250724352,Fri Jul 25 10:20:02 +0000 2014,2018-08-19 17:42:53,307,103,repNone,,False,"Cuando antes de verano @PepaBueno me preguntó en @HoyPorHoy si era feminista, de forma instintiva respondí que sí. La verdad, no lo dudé.   De hecho, como le dije en aquella entrevista, si me hubiera hecho la misma pregunta hace 10 años, probablemente habría contestado que no."
https://twitter.com/AnaBotin/status/1029809587275354112,Fri Jul 25 10:20:02 +0000 2014,2018-08-15 19:18:33,26,3,rep1029751358570868741,AnaBotin,False,"My apologies, it was of course the London Symphony Orchestra (LSO) that performed last night and not the London Philharmonic."
https://twitter.com/AnaBotin/status/1029752949319389190,Fri Jul 25 10:20:02 +0000 2014,2018-08-15 15:33:29,31,4,rep1029752093261873155,AnaBotin,False,"Thanks also to @JaimeMartin17 the Festival Internacional de Santander Director for bringing us this unique performance, orchestra and program.   The festival continues till the 25th of August. Come join us.   https://t.co/KsSLIz7mdi"
https://twitter.com/AnaBotin/status/1029752093261873155,Fri Jul 25 10:20:02 +0000 2014,2018-08-15 15:30:05,39,2,rep1029751358570868741,AnaBotin,False,"Sir Simon and Giovanni said it was a very special Mahler experience, as the audience was so much part of the performance. There was 30 seconds of silence at the end - until the Conductor dropped his hands not a sound to be heard, it showed the Santander public's musical maturity."
https://twitter.com/AnaBotin/status/1029751358570868741,Fri Jul 25 10:20:02 +0000 2014,2018-08-15 15:27:10,127,19,repNone,,False,"Tremendous concert last night at the Festival Internacional de Santander. Simon Rattle leading the London Philharmonic in a rendition of Mahler’s 9th symphony was magnificent. Here he is with my mother, and lead violinist Giovanni Guzzo, an alumna of the Reina Sofia School. https://t.co/6X3E00t10T"
https://twitter.com/AnaBotin/status/1029446652090834945,Fri Jul 25 10:20:02 +0000 2014,2018-08-14 19:16:22,23,5,rep1029078306291937280,AnaBotin,False,Rosling’s book makes the point well. The correct answer is the UN estimates the world will have 2 billion children by 2100. But most people guess differently. https://t.co/nT5VeUBWKa
https://twitter.com/AnaBotin/status/1029078306291937280,Fri Jul 25 10:20:02 +0000 2014,2018-08-13 18:52:42,23,3,rep1029077215718375427,AnaBotin,False,"Try answer this: There are currently 2 billion children aged 0 to 15 in the world. By 2100, how many children will there be predicts the UN?"
https://twitter.com/AnaBotin/status/1029077215718375427,Fri Jul 25 10:20:02 +0000 2014,2018-08-13 18:48:22,62,11,rep1029076897823645696,AnaBotin,False,Having the facts straight are a pre-condition for being able to make the right decisions. It’s the only way to progress. Hans Rosling offers a picture of the world and how to evaluate where we are based on facts in a way that is surprising and informative. Timely book. https://t.co/FhUVSAs1uH
https://twitter.com/AnaBotin/status/1029076897823645696,Fri Jul 25 10:20:02 +0000 2014,2018-08-13 18:47:06,83,15,rep1029076567027265536,AnaBotin,False,"Hombres y mujeres: Angela resume al final del epílogo algo que siempre he defendido : “Son los hechos los que nos permitirán ir transformando la sociedad para mejor, hasta que todos seamos tratados como iguales”. Y añade “Eso nos convierte en seres civilizados…”. https://t.co/uUNJ1bwQXe"
https://twitter.com/AnaBotin/status/1029076567027265536,Fri Jul 25 10:20:02 +0000 2014,2018-08-13 18:45:47,123,15,repNone,,False,Some books I am reading this summer: Leave you mind behind is a simple guide to help you relax - learning to focus on your breathing - sort of an introduction to meditation. Recommended. https://t.co/lwCEU5TcxO
https://twitter.com/AnaBotin/status/1027155256407412736,Fri Jul 25 10:20:02 +0000 2014,2018-08-08 11:31:11,77,18,repNone,,False,"Guillermo con David - ademas de todo tipo de carnes , encontramos uno de los mejores quesos de oveja https://t.co/cMCXBCwbme"
https://twitter.com/AnaBotin/status/1027154947094274048,Fri Jul 25 10:20:02 +0000 2014,2018-08-08 11:29:57,135,33,repNone,,False,Aquí estamos con David y Coro en Carnicería Magaldi . Además de Vaca vieja tienen chorizo picante de leon y muchas más cosas . Lastima no coincidir con Javier https://t.co/8nra8Ljcld
https://twitter.com/AnaBotin/status/1027141855526432768,Fri Jul 25 10:20:02 +0000 2014,2018-08-08 10:37:56,0,7,repNone,,False,"RT @JManuelCendoya: Acompañamos al arquitecto David Chipperfield en su visita a nuestra sede de @BancoSantander, uno de los edificios más s…"
https://twitter.com/AnaBotin/status/1027141692418387968,Fri Jul 25 10:20:02 +0000 2014,2018-08-08 10:37:17,0,35,repNone,,False,"RT @123acorrer: Por transmitirnos vuestra fuerza, superación y constancia...En #123acorrer os damos las gracias por enseñarnos que no impor…"
https://twitter.com/AnaBotin/status/1027141598801522688,Fri Jul 25 10:20:02 +0000 2014,2018-08-08 10:36:55,0,8,repNone,,False,"RT @JManuelCendoya: Gracias a los más de 100 voluntarios de @santander_es; empleados, jubilados y clientes que han participado en la limpie…"
https://twitter.com/AnaBotin/status/1027140884419227654,Fri Jul 25 10:20:02 +0000 2014,2018-08-08 10:34:04,1,0,repNone,,False,@JaviGarcia23 Que horario teneis?
https://twitter.com/AnaBotin/status/1026786525873418240,Fri Jul 25 10:20:02 +0000 2014,2018-08-07 11:05:59,0,0,rep1026047331341402112,robertofcb1985,False,"@robertofcb1985 La próxima vez pasaremos por ahí, gracias."
https://twitter.com/AnaBotin/status/1026786179339956224,Fri Jul 25 10:20:02 +0000 2014,2018-08-07 11:04:36,1,0,repNone,,False,"@JaviGarcia23 Apuntado, cuando pasemos por Alceda haremos una parada. Gracias."
https://twitter.com/AnaBotin/status/1026177248297136128,Fri Jul 25 10:20:02 +0000 2014,2018-08-05 18:44:56,351,90,repNone,,False,"Momento único: los 6 finalistas del Concurso Internacional de #PianoSantnader interpretando a 12 manos “Danza del sable”, de A. Khachaturian. https://t.co/k9v6fnJ8bG"
https://twitter.com/AnaBotin/status/1026175979948072960,Fri Jul 25 10:20:02 +0000 2014,2018-08-05 18:39:53,91,10,rep1026175124867895302,AnaBotin,False,"Desde 1972, #PianoSantander llena las salas de conciertos durante el Concurso.  Mi madre siempre ha sido una inspiración para mi, por su trabajo por la cultura y su compromiso con la música, la educación musical de excelencia y la igualdad de oportunidades. https://t.co/2jUTHnoKLd"
https://twitter.com/AnaBotin/status/1026175124867895302,Fri Jul 25 10:20:02 +0000 2014,2018-08-05 18:36:29,46,4,rep1026173959442767874,AnaBotin,False,"Acercar la música a la gente y dar oportunidades a los jóvenes músicos son los objetivos principales de este Concurso. Los 6 finalistas han estado fantásticos, pero solo uno puede ser el ganador del primer premio de #PianoSantander.  Enhorabuena al ucraniano Dmytro Choni. https://t.co/HXa5BwCnJs"
https://twitter.com/AnaBotin/status/1026173959442767874,Fri Jul 25 10:20:02 +0000 2014,2018-08-05 18:31:51,75,10,repNone,,False,"Hoy termina la edición nº 19 del Concurso Internacional de #PianoSantander con récord de candidaturas -243 jóvenes pianistas de 44 nacionalidades. El maestro Gómez Martínez, al frente de la @OCRTVE ha acompañado estos días a los 6 finalistas en sus conciertos. https://t.co/03NUV7pG4k"
https://twitter.com/AnaBotin/status/1026037931155316736,Fri Jul 25 10:20:02 +0000 2014,2018-08-05 09:31:20,350,41,repNone,,False,"Trekking in Vega de Pas, Cantabria. https://t.co/sX8Gx46oC3"
https://twitter.com/AnaBotin/status/1025436789195112448,Fri Jul 25 10:20:02 +0000 2014,2018-08-03 17:42:36,120,22,repNone,,False,"Hoy estamos escuchando en concierto a 3 de los 6 jóvenes finalistas del Concurso Internacional de #PianoSantander. Si no puedes acercarte a Santander a verlo en directo, merece la pena seguirlo aquí: https://t.co/eQOA5VRxan https://t.co/QsASGuVZhk"
https://twitter.com/AnaBotin/status/1024737571400765440,Fri Jul 25 10:20:02 +0000 2014,2018-08-01 19:24:10,202,43,repNone,,True,"Estamos acelerando el cambio. Entre el nombramiento de la 1ª mujer territorial de Banesto y esta foto han pasado 15 años. Siempre digo que ellos son los directivos más importantes, porque trabajan a pie de calle, más cerca de los clientes. Enhorabuena a todos y a @santander_es. https://t.co/abjbJfVY3g"
https://twitter.com/AnaBotin/status/1023626486249607168,Fri Jul 25 10:20:02 +0000 2014,2018-07-29 17:49:07,192,35,repNone,,False,"This morning, I found this quote on a bench under a big leafy tree in Central Park. (Sojourner Truth has a remarkable life story https://t.co/EsAmLfGxkl) https://t.co/lc9fnidhId"
https://twitter.com/AnaBotin/status/1022096862533373952,Fri Jul 25 10:20:02 +0000 2014,2018-07-25 12:30:56,67,15,repNone,,False,"Sergio was a force of nature, an outstanding leader and a great friend of Santander and our family. Like many others we will miss him. https://t.co/fIx9TLHLV2"
https://twitter.com/AnaBotin/status/1022029873693556738,Fri Jul 25 10:20:02 +0000 2014,2018-07-25 08:04:44,42,12,repNone,,True,The rapid adoption of digital services by our customers continues. https://t.co/GowBeTqm63
https://twitter.com/AnaBotin/status/1022029564585943040,Fri Jul 25 10:20:02 +0000 2014,2018-07-25 08:03:31,0,7,repNone,,False,"RT @bancosantander: José Antonio Álvarez, CEO de @BancoSantander, repasa en 60 segundos las claves de los resultados del primer semestre de…"
https://twitter.com/AnaBotin/status/1022028399718662144,Fri Jul 25 10:20:02 +0000 2014,2018-07-25 07:58:53,38,6,rep1022027318024450048,AnaBotin,True,"A pesar del cargo de 300 millones, el segundo de tres por la adquisición de Popular, el segundo trimestre ha sido bueno. https://t.co/0fQ5Y6TqmK"
https://twitter.com/AnaBotin/status/1022027318024450048,Fri Jul 25 10:20:02 +0000 2014,2018-07-25 07:54:35,95,27,repNone,,True,"Our quarterly results are out. We have done well across Europe and the Americas, with the United States growing attributable profit by 54% YoY. Congratulations to all the teams. https://t.co/Gk8dQTAMwQ"
https://twitter.com/AnaBotin/status/1021663520230985728,Fri Jul 25 10:20:02 +0000 2014,2018-07-24 07:48:59,826,149,repNone,,False,"Ni siquiera es agosto, queda mucho verano por delante. Un amigo aterrizó ayer sobre el Golfo de Vizcaya e hizo esta foto de la bahía de Santander. https://t.co/TrZiMpa6vq"
https://twitter.com/AnaBotin/status/1021142890460925952,Fri Jul 25 10:20:02 +0000 2014,2018-07-22 21:20:11,145,23,repNone,,False,"Tonight architecture meets music in Santander. Renzo Piano designed this venue and the great composers of his generation, Pierre Boulez and Luciano Berio provide the music #EncuentroSantander2018. https://t.co/E9gresBxG1 https://t.co/50TqWIZj3x"
https://twitter.com/AnaBotin/status/1019686282417573888,Fri Jul 25 10:20:02 +0000 2014,2018-07-18 20:52:09,185,40,repNone,,False,The USA is doing great for Santander. But we are even more excited about how much we can still do. I enjoyed being with you guys today. Thank you @SantanderBankUS. https://t.co/PvvB70RXKM
https://twitter.com/AnaBotin/status/1018075415657795584,Fri Jul 25 10:20:02 +0000 2014,2018-07-14 10:11:08,164,75,repNone,,True,Supporting woman and diversity in general is the right thing and good for business. As this McKinsey study shows diverse companies do better: https://t.co/xxQJZilQYh #OxfordInspires #1millionwomentotech https://t.co/GQK7TIBt5p
https://twitter.com/AnaBotin/status/1018075141396459525,Fri Jul 25 10:20:02 +0000 2014,2018-07-14 10:10:03,71,18,repNone,,True,In the UK we have more than 400 openings for 5-year digital apprenticeships. We are working hard to become an open platform by transforming our infrastructure. We offer blockchain based FX payments and more to come. Join us. #OxfordInspires https://t.co/6bNp1vK0Nn
