id,Account Created At(same for all rows),status created_at,Fav_cont,retweeted_count,reply_to_status,reply_to_screen,quote,text
https://twitter.com/AnaBotin/status/1237288816920100864,Fri Jul 25 10:20:02 +0000 2014,2020-03-10 08:06:56,14,7,rep1237288401709215745,AnaBotin,False,"We believe that the most prudent action is to ask our employees at our largest centres in Madrid to work from home at this stage. This follows other Group-wide measures, including the restricting of non-essential employee travel and meetings involving a large number of people."
https://twitter.com/AnaBotin/status/1237288401709215745,Fri Jul 25 10:20:02 +0000 2014,2020-03-10 08:05:17,49,14,repNone,,False,"The health of our employees, customers and shareholders is of utmost priority. Yesterday, the board of the bank held an extraordinary meeting to discuss our response to the coronavirus outbreak. https://t.co/Lhqp7B4045"
https://twitter.com/AnaBotin/status/1236267200618659840,Fri Jul 25 10:20:02 +0000 2014,2020-03-07 12:27:24,5,0,rep1235692775867285505,tanzitiff,False,"@tanzitiff Happy #IWD2020, Tiff, Jamillah, Betina, Susan, Alex and Ray. LOVE the purple... and thanks :):)"
https://twitter.com/AnaBotin/status/1236246521622007809,Fri Jul 25 10:20:02 +0000 2014,2020-03-07 11:05:13,11,1,rep1234923127098028033,LomanaGloria,False,"@LomanaGloria Gloria, gracias por tu apoyo, un abrazo"
https://twitter.com/AnaBotin/status/1235638425753137152,Fri Jul 25 10:20:02 +0000 2014,2020-03-05 18:48:52,42,5,rep1235637801481203712,AnaBotin,False,"Almost 700 women have already gone through this program. In this video, some tell you more about the #SantanderW50 experience. Share this with any dynamic women leaders you know. https://t.co/3z49LSXQkE"
https://twitter.com/AnaBotin/status/1235637801481203712,Fri Jul 25 10:20:02 +0000 2014,2020-03-05 18:46:23,83,17,repNone,,False,"Santander is giving 50 scholarships to help equip future top women leaders with the skills, tools, networks to lead in an ever more complex and fast-paced world. This year, for the first time, #SantanderW50 will take place in London at the @LSEnews: https://t.co/zvdHcWY6U3"
https://twitter.com/AnaBotin/status/1235279078506274822,Fri Jul 25 10:20:02 +0000 2014,2020-03-04 19:00:57,50,7,rep1235251866931355648,bancosantander,False,"@bancosantander Gender equality is the right thing to do and it is also good for business. Each of us matter and studies show that women and men complement each other, at work &amp; home. Thanks, Chris &amp; Dawn, from our Customer Service Center in the US for joining me in the picture. #EachforEqual https://t.co/lAFwQEfx7O"
https://twitter.com/AnaBotin/status/1234918556703260672,Fri Jul 25 10:20:02 +0000 2014,2020-03-03 19:08:22,134,27,repNone,,False,"Hoy @LomanaGloria me ha contado que el #8M2020 va a correr por la igualdad en la II Carrera Solidaria #PorunMundo5050, con el apoyo de @santander_es. Puedes ir con tus hijos, apúntate.  https://t.co/B37cG3kNwg https://t.co/OZgIzYuwX1"
https://twitter.com/AnaBotin/status/1233440520011210752,Fri Jul 25 10:20:02 +0000 2014,2020-02-28 17:15:10,4,0,rep1233330216766001152,RamonLarramendi,False,"@RamonLarramendi Gracias por venir, Ramón. ¡Y me encantó conocer a tu hermana!"
https://twitter.com/AnaBotin/status/1233439848083664896,Fri Jul 25 10:20:02 +0000 2014,2020-02-28 17:12:30,10,0,rep1233355169083150337,camorris,False,"@camorris Loved the portrait, thank you!"
https://twitter.com/AnaBotin/status/1233098473177829377,Fri Jul 25 10:20:02 +0000 2014,2020-02-27 18:36:00,25,4,rep1231934067563737090,gemaigual,False,"@gemaigual @FBancoSantander Gracias a ti por acompañarnos, Gema. Cuando terminemos Pereda, intentaremos tener estas exhibiciones en Santander! Un abrazo."
https://twitter.com/AnaBotin/status/1233097574900473857,Fri Jul 25 10:20:02 +0000 2014,2020-02-27 18:32:26,2,0,rep1231214691600535554,AngelKompli,False,@AngelKompli Me gustan los de Richard Feynman. Un abrazo.
https://twitter.com/AnaBotin/status/1233079935444672513,Fri Jul 25 10:20:02 +0000 2014,2020-02-27 17:22:20,133,11,repNone,,False,"Since joining @bancosantander in 2015, Sergio Rial has led @santander_br transformation, fostered cultural change, and increased profitability from 14% to 21%. Today, we are making this announcement.  https://t.co/mcynagBDG6 https://t.co/rVRcmA0g5C"
https://twitter.com/AnaBotin/status/1232772522317357059,Fri Jul 25 10:20:02 +0000 2014,2020-02-26 21:00:47,0,101,repNone,,False,RT @SantanderMx: #UnDiaSinNosotras https://t.co/RzJwE2595m
https://twitter.com/AnaBotin/status/1232756114623778818,Fri Jul 25 10:20:02 +0000 2014,2020-02-26 19:55:35,21,1,rep1232755835434078210,AnaBotin,False,"And although it is true that ""Walking"" is something I do very often -and I love it- I am not sure I can accept Erling’s invitation (see the picture of the dedication)... What I am sure of is that I will also read that book about walking with great interest, thank you! https://t.co/NcuXzH1dc4"
https://twitter.com/AnaBotin/status/1232755835434078210,Fri Jul 25 10:20:02 +0000 2014,2020-02-26 19:54:29,24,3,rep1232755743511711745,AnaBotin,False,"If you are curious to know more about Erling's Silence, here is an extract published several years ago: https://t.co/wjm1bxF0UX"
https://twitter.com/AnaBotin/status/1232755743511711745,Fri Jul 25 10:20:02 +0000 2014,2020-02-26 19:54:07,17,2,rep1232755610778849283,AnaBotin,False,"I choose silence because it is essential for creativity and seeing clearly, and increasingly rare. In this world of constant change, we should all spend some time reflecting on what we do and why we do it. To do that, we need silence. I'm very much looking forward to reading it."
https://twitter.com/AnaBotin/status/1232755610778849283,Fri Jul 25 10:20:02 +0000 2014,2020-02-26 19:53:35,8,0,rep1232753257245814787,AnaBotin,False,"It is not easy picking just one thing. Erling is famous for being the first man ever to reach the North Pole unsupported. He is also a lawyer, an editor, a businessman, a leading collector of international contemporary art, and of course, a writer."
https://twitter.com/AnaBotin/status/1232753257245814787,Fri Jul 25 10:20:02 +0000 2014,2020-02-26 19:44:14,98,7,repNone,,False,"I told Erling Kagge when we met the other day that if I could take only one thing from his many interests and the themes he has lived his life by, it will be his book on the value of silence. https://t.co/J9JYWm6m5v"
https://twitter.com/AnaBotin/status/1232034136879222785,Fri Jul 25 10:20:02 +0000 2014,2020-02-24 20:06:42,2,0,rep1230870530556866566,CNBCJulianna,False,"@CNBCJulianna @TridentBooks Amazing variety and atmosphere, love it."
https://twitter.com/AnaBotin/status/1232017749536395264,Fri Jul 25 10:20:02 +0000 2014,2020-02-24 19:01:35,29,2,rep1232016902639292417,AnaBotin,False,"This is a great exhibition that is worth your time. Organized by @FBancoSantander, it is the first time that Erling Kagge’s collection can be seen outside Norway. You can visit it at the Art Room of the Santander Headquarters in Boadilla (Madrid) until September."
https://twitter.com/AnaBotin/status/1232016902639292417,Fri Jul 25 10:20:02 +0000 2014,2020-02-24 18:58:14,29,4,rep1232016381853523968,AnaBotin,False,"And, finally, if I had to choose one work to ""keep"" for myself it would be that of Josh Smith, because of the energy, sincerity and curiosity that it exhibits. Attractive and colorful, it moves us to action. https://t.co/2ahUkQdAYt"
https://twitter.com/AnaBotin/status/1232016381853523968,Fri Jul 25 10:20:02 +0000 2014,2020-02-24 18:56:09,12,1,rep1232015641806352385,AnaBotin,False,"I am also drawn to @olafureliasson, and his way of incorporating the public into his art and his use of art as a force for change. We are in a moment of significant change in society, the economy, and business, and to me, he expresses this critical moment better than anyone else. https://t.co/bym7HAixX2"
https://twitter.com/AnaBotin/status/1232015641806352385,Fri Jul 25 10:20:02 +0000 2014,2020-02-24 18:53:13,11,2,rep1232014912702046214,AnaBotin,False,"Firstly, Raymond Pettibon, a nonconformist and intellectual who speaks out, something we try to encourage at @bancosantander. https://t.co/gd2nAxogrf"
https://twitter.com/AnaBotin/status/1232014912702046214,Fri Jul 25 10:20:02 +0000 2014,2020-02-24 18:50:19,65,6,repNone,,False,"Through his art collection, writer, entrepreneur and explorer #ErlingKagge shows us not only his personality, his interests, but also what moves him. Each artist in it has a very particular message and their work a unique appeal. To mention three: https://t.co/cn0I1ZU933"
https://twitter.com/AnaBotin/status/1231943734348189696,Fri Jul 25 10:20:02 +0000 2014,2020-02-24 14:07:29,21,5,rep1231943439819956226,AnaBotin,False,"Santander is already among the top acquirers (a provider of payment infrastructure to sellers of all kinds) in the world. Buying Elavon Mexico will help us extend our infrastructure globally, through a single platform, in the cloud and open to third-party services. https://t.co/oGybYfaTGU"
https://twitter.com/AnaBotin/status/1231943439819956226,Fri Jul 25 10:20:02 +0000 2014,2020-02-24 14:06:19,89,19,repNone,,True,"Digital payments are fast displacing cash. With an expected double digit annual revenue growth rate, payments are also cornerstone of our digital transformation. This acquisition is another important step in this strategy. https://t.co/ztnsCECyw9"
https://twitter.com/AnaBotin/status/1230869393179107328,Fri Jul 25 10:20:02 +0000 2014,2020-02-21 14:58:26,176,13,repNone,,False,"I was in Boston for a couple of days and had some time to visit @TridentBooks on Newbury. Two floors with books for everyone, from physics to music, the latest best sellers, fun gift cards and a coffee shop with a great atmosphere. https://t.co/IQBQcYNu05"
https://twitter.com/AnaBotin/status/1227303965550940160,Fri Jul 25 10:20:02 +0000 2014,2020-02-11 18:50:42,107,21,repNone,,False,"La @EscuelaRSofia, referente de excelencia e inclusión y de colaboración público-privada, cumplirá 30 años en 2021. Todos los alumnos son becados y a partir de ahora con matrícula gratuita. Abierta la inscripción hasta 16/2. El vídeo es un resumen de 2019 https://t.co/GlvU3oUBUe"
https://twitter.com/AnaBotin/status/1225887886819708928,Fri Jul 25 10:20:02 +0000 2014,2020-02-07 21:03:42,8,0,rep1224784290149367808,juanjogarau,False,"@juanjogarau @SantanderUni @MITProfessional Thank you Juanjo. I'll be around soon, maybe you can join an event we will organize over there."
https://twitter.com/AnaBotin/status/1225460700585320448,Fri Jul 25 10:20:02 +0000 2014,2020-02-06 16:46:13,58,9,repNone,,False,Well done to all the @santanderpb teams https://t.co/GxyoJuPhnI
https://twitter.com/AnaBotin/status/1224776273102282752,Fri Jul 25 10:20:02 +0000 2014,2020-02-04 19:26:33,161,37,repNone,,False,"Proud to announce that @SantanderUni now has made 2,500 scholarships available, to study Digital Transformation through @MITProfessional in areas like AI, Blockchain and Cloud. This is an online course for smart, forward-thinking, leaders of the future.  https://t.co/kXcKg365MA https://t.co/IE6CKHrn98"
https://twitter.com/AnaBotin/status/1224386263123402753,Fri Jul 25 10:20:02 +0000 2014,2020-02-03 17:36:47,84,11,repNone,,True,Laura es una empresaria líder –con más de 25 años de experiencia- y muy reconocida en México. Es la elección correcta para el momento y los retos que tiene por delante @SantanderMx https://t.co/3xzcAysa4h
https://twitter.com/AnaBotin/status/1224382791372152832,Fri Jul 25 10:20:02 +0000 2014,2020-02-03 17:23:00,49,10,repNone,,True,"Totalmente de acuerdo con Alex , gracias Júlia por compartir https://t.co/XMvJm8oNl3"
https://twitter.com/AnaBotin/status/1224248107199881217,Fri Jul 25 10:20:02 +0000 2014,2020-02-03 08:27:48,25,3,repNone,,False,A video from the @WHO with all they currently know about the new Corona virus. https://t.co/P4s0Vt3d8N
https://twitter.com/AnaBotin/status/1224025684739227649,Fri Jul 25 10:20:02 +0000 2014,2020-02-02 17:43:59,0,0,rep1221175281265803266,josemarioacosta,False,@josemarioacosta @s_sommaruga Jose Mario: My views as well as what Santander is doing I wrote about here. Best regards. https://t.co/eUPbbcnG8Z
https://twitter.com/AnaBotin/status/1223585952561606656,Fri Jul 25 10:20:02 +0000 2014,2020-02-01 12:36:38,67,22,repNone,,False,"This is an excellent summary of the facts, the risks, and the potential impact of the outbreak of the coronavirus. https://t.co/lEZLX6nALM"
https://twitter.com/AnaBotin/status/1223303139882946561,Fri Jul 25 10:20:02 +0000 2014,2020-01-31 17:52:51,107,8,repNone,,False,"At the @Hegraconference (Saudi Arabia) of Nobel laureates with @Yunus_Centre. Global issues related to unity, international cooperation, innovation and sustainability to be discussed here, with more than 20 nobel laureates and over 100 prominent scientist and leaders. https://t.co/vHYqsiWVq7"
https://twitter.com/AnaBotin/status/1222401614658646017,Fri Jul 25 10:20:02 +0000 2014,2020-01-29 06:10:30,25,2,rep1222401613022801920,AnaBotin,False,"Throughout the Group we see significant opportunities to continue growing our business in a responsible way, and we are well on track to achieve our medium-term goals. Congratulations to all the teams. https://t.co/arNQQYrnmA"
https://twitter.com/AnaBotin/status/1222401613022801920,Fri Jul 25 10:20:02 +0000 2014,2020-01-29 06:10:30,24,2,rep1222401610808250369,AnaBotin,False,"We had strong performance across all regions driven by our focus on customer loyalty, diversification and scale. Because of this we are proposing to increase the cash dividend per share again, to €0.20, more than double what it was in 2014."
https://twitter.com/AnaBotin/status/1222401610808250369,Fri Jul 25 10:20:02 +0000 2014,2020-01-29 06:10:29,92,12,repNone,,True,"Our 2019 results show we are generating predictable, sustainable and balanced growth - delivering record annual revenues and a particularly strong fourth quarter, while further strengthening our capital. https://t.co/7xpURMeLiw"
https://twitter.com/AnaBotin/status/1221886480563560451,Fri Jul 25 10:20:02 +0000 2014,2020-01-27 20:03:33,106,12,repNone,,False,"I met Leila Janah several times and I'm shocked to hear of her death at only 37. She was a serial entrepreneur, who combined boundless energy, empathy and was a visionary for the promise and pitfalls of new technologies. A real loss, she will be missed. https://t.co/MxdK3UbfT6"
https://twitter.com/AnaBotin/status/1221087149216423936,Fri Jul 25 10:20:02 +0000 2014,2020-01-25 15:07:17,447,62,repNone,,False,"Las 8.000 personas que trabajamos en Boadilla hoy tenemos una comida más sana. No solo es bueno para la salud, sino que además ayuda a reducir emisiones, menos proteína animal, menos azúcar, menos plástico –1 millón de botellas de plástico menos en un año. https://t.co/xok9wWERq3"
https://twitter.com/AnaBotin/status/1220335771938365442,Fri Jul 25 10:20:02 +0000 2014,2020-01-23 13:21:35,2,0,rep1219632876427382793,car_sheridan,True,"@MelHamilton1987 Me interesa la historia, todos los temas relacionados con la nueva economía digital, la igualdad de oportunidades, la educación, la salud, la alimentación... Aquí puedes ver los últimos que he estado leyendo: https://t.co/jgSMz8Bjo8"
https://twitter.com/AnaBotin/status/1219702978313179137,Fri Jul 25 10:20:02 +0000 2014,2020-01-21 19:27:05,175,28,repNone,,True,"I am proud to announce that @bancosantander is once again at the top of the Bloomberg Gender-Equality Index. The Index is a comprehensive evaluation of 75 metrics, and this year assessed 325 companies, up from 230 last year. https://t.co/5Ivwy5uOUN"
https://twitter.com/AnaBotin/status/1219584711028285442,Fri Jul 25 10:20:02 +0000 2014,2020-01-21 11:37:08,15,2,rep1219583745998688256,AnaBotin,False,Politicians must take the lead but all of society -including business- have to take action. “So let us make use of our time here together to engage in a dialogue and to seek a balance that benefit all of us”. You can watch @s_sommaruga full speech here: https://t.co/GcoGS42HH6
https://twitter.com/AnaBotin/status/1219583745998688256,Fri Jul 25 10:20:02 +0000 2014,2020-01-21 11:33:18,21,7,rep1219583622778363904,AnaBotin,False,"""We cannot longer stand by and watch… We need politicians to take action in their own countries and internationally to ensure that ecological balance is restored and that global warming is stopped.”"
https://twitter.com/AnaBotin/status/1219583622778363904,Fri Jul 25 10:20:02 +0000 2014,2020-01-21 11:32:49,11,1,rep1219583460546875393,AnaBotin,False,She goes on to stress that we must engage in dialogue with politicians and society to seek a balance that benefits all.
https://twitter.com/AnaBotin/status/1219583460546875393,Fri Jul 25 10:20:02 +0000 2014,2020-01-21 11:32:10,64,8,repNone,,False,Very inspirational opening from @s_sommaruga at #Davos2020. Biodiversity is crucial she says and finding the right balance for our common future when the world is on fire. https://t.co/gIkva089Zj
https://twitter.com/AnaBotin/status/1219291762969268224,Fri Jul 25 10:20:02 +0000 2014,2020-01-20 16:13:04,51,5,repNone,,False,"Agree here (but less reluctantly) with Michael Steinberger @WineDiarist in the NYTimes, Rafa is the GOAT.  And he is that on so many levels, not just tennis. It's an honor to have him as Santander Ambassador.  https://t.co/7NvqZRLcmq"
https://twitter.com/AnaBotin/status/1218625486261080065,Fri Jul 25 10:20:02 +0000 2014,2020-01-18 20:05:31,89,6,rep1218625146367479808,AnaBotin,False,"As a European, I am very sorry -although I respect- the decision that the United Kingdom has made. Now we have to look to the future and build a new relationship that is good for everyone. I took these photos this week at Hyde Park and from some offices in front of St. Paul's. https://t.co/iPJHHTe739"
https://twitter.com/AnaBotin/status/1218625146367479808,Fri Jul 25 10:20:02 +0000 2014,2020-01-18 20:04:10,168,20,repNone,,False,"In London, one of my favourite cities. Although negotiations on the trade agreement and the future relationship between the United Kingdom and Europe have not begun, and the detail will be key, at least today we know that Brexit will take place on 31 January. https://t.co/AtWOeFgrFd"
https://twitter.com/AnaBotin/status/1218624869513953280,Fri Jul 25 10:20:02 +0000 2014,2020-01-18 20:03:04,450,28,repNone,,True,"Enhorabuena @JesusCalleja y Jaume. Terminar el Dakar y hacerlo en esa posición... Enorme éxito por lo que supone de trabajo, preparación y tesón, nos alegramos mucho. Y enhorabuena a @CSainz_oficial, gran victoria! https://t.co/Xus0Oo3rFZ"
https://twitter.com/AnaBotin/status/1218515548318961665,Fri Jul 25 10:20:02 +0000 2014,2020-01-18 12:48:40,12,5,rep1215919581744783361,RebecaGimeno,False,"@RebecaGimeno @agvicente @jones_lucia @elkkana_ @olgacanto @Lucia_Gorjon @AntoniaDiazRod Será interesante ver cómo el equipo del laboratorio de la pobreza @JPAL aplica su método de pruebas aleatorias controladas en el ámbito del Cambio climático. Sobre todo si eso permite que los gobiernos tomen decisiones basadas en datos. Gracias por compartirlo, Rebeca."
https://twitter.com/AnaBotin/status/1218164438001496064,Fri Jul 25 10:20:02 +0000 2014,2020-01-17 13:33:29,25,1,rep1218163249000173568,AnaBotin,False,"Garrett, thank you for your courage and your support for a great cause . Welcome back! https://t.co/g9FLT6q6Ih"
https://twitter.com/AnaBotin/status/1218163249000173568,Fri Jul 25 10:20:02 +0000 2014,2020-01-17 13:28:45,32,2,rep1218162843507396609,AnaBotin,False,"The team experienced extreme weather conditions: temperatures of -20 to -45 degrees. The wind was up to 35 knots. Several of them suffered altitude sickness, blisters, sun blindness, and hypothermia… an eventful journey. https://t.co/klQYQb8YX4"
https://twitter.com/AnaBotin/status/1218162843507396609,Fri Jul 25 10:20:02 +0000 2014,2020-01-17 13:27:08,85,7,repNone,,False,"Garrett Curran is back from his expedition to the South Pole, raising funds for @CRISCancer research into brain-tumours in children. In ten days, they walked 115km, around 250,000 steps in the snow. https://t.co/oHyqHAc6w3"
https://twitter.com/AnaBotin/status/1217733670095785985,Fri Jul 25 10:20:02 +0000 2014,2020-01-16 09:01:46,115,18,repNone,,True,"Diversity and inclusion are essential in @bancosantander’s agenda. Joining the #Valuable500 is part of our commitment to embed a truly inclusive workplace and to promote quality education for people with disabilities. Last year we helped 43,000 people in different programs. https://t.co/UKPyPg18tl"
https://twitter.com/AnaBotin/status/1217358664346099712,Fri Jul 25 10:20:02 +0000 2014,2020-01-15 08:11:37,52,9,repNone,,True,"The European Green Deal Investment Plan with its Just Transition Mechanism, can be a signal of a change to much greater European solidarity. And it can help with the biggest challenge we face today, a changing climate.  https://t.co/EFjnYeEyIy"
https://twitter.com/AnaBotin/status/1217155745894019072,Fri Jul 25 10:20:02 +0000 2014,2020-01-14 18:45:18,270,60,repNone,,False,"Con solo 43 años, Pablo Jarillo ha ganado el Premio Wolf de física. Muchos consiguen después el Nobel.  Además de su importante trabajo con el grafeno está impulsando mucho el talento femenino.   Enhorabuena, Pablo, un orgullo para España 🇪🇸 https://t.co/X1t8tJPPt8"
https://twitter.com/AnaBotin/status/1216756612255354880,Fri Jul 25 10:20:02 +0000 2014,2020-01-13 16:19:17,52,11,repNone,,True,"Thanks for sharing Bradley, interested in branding and design? Do have a look at this by @Lucasoldier on Santander's identity shift. https://t.co/L3FXV47l7I"
https://twitter.com/AnaBotin/status/1214954151630770176,Fri Jul 25 10:20:02 +0000 2014,2020-01-08 16:56:57,1417,238,repNone,,False,Cuando visité Groenlandia el verano pasado pude comprobar de primera mano el impacto del cambio climático. Esta noche se emitirá en @mediasetcom el programa sobre aquel viaje al que me invitaron a participar @JesusCalleja y el equipo de #PlanetaCalleja. https://t.co/eds1AncL91 https://t.co/1LjO8HnErR
https://twitter.com/AnaBotin/status/1213373053096353792,Fri Jul 25 10:20:02 +0000 2014,2020-01-04 08:14:13,37,6,rep1213373051464822785,AnaBotin,False,"Together with Lewis Moody’s Foundation, the fundraising for research into brain-tumours in children has so far generated 400,000 Euros. Do remember that for every pound or euro donated, the likes of Santander and Garreth will match it with two.  https://t.co/TW3fx4UJvi"
https://twitter.com/AnaBotin/status/1213373051464822785,Fri Jul 25 10:20:02 +0000 2014,2020-01-04 08:14:13,20,2,rep1213373049518612480,AnaBotin,False,"The download speeds of satellite phones will mean there will not be that much by way of pictures and video until they get back from Antarctica - but there will be some updates on their position, progress with some photos. I’m looking forward to following their progress."
https://twitter.com/AnaBotin/status/1213373049518612480,Fri Jul 25 10:20:02 +0000 2014,2020-01-04 08:14:13,4,1,rep1213373046758789127,AnaBotin,False,"The last few days Garrett’s expedition has been based in Chile's Punta Arenas, the world southernmost city. It’s the same city Shackleton used as his base for two rescue missions following his fateful Trans-Antarctic Expedition."
https://twitter.com/AnaBotin/status/1213373046758789127,Fri Jul 25 10:20:02 +0000 2014,2020-01-04 08:14:12,105,8,repNone,,False,"Garrett Curran sent me these pictures, looking south over the Straight of Magellan - which separates Latin America from Tierra del Fuego archipelago at 5am Chilean time, yesterday. And later his team took off, destination Union Glacier, Antarctica. https://t.co/SKjrdiqz81"
https://twitter.com/AnaBotin/status/1211957366641614850,Fri Jul 25 10:20:02 +0000 2014,2019-12-31 10:28:47,781,91,repNone,,True,".@RafaelNadal is not “only” one of the greatest athletes of the world and the best Spanish athlete of all time. What really makes him special are his values. And this is the reason why today I'm happy to say Welcome to Santander, Rafa. https://t.co/kPqZNK6ZG2"
https://twitter.com/AnaBotin/status/1211957133102735361,Fri Jul 25 10:20:02 +0000 2014,2019-12-31 10:27:52,472,76,repNone,,True,"Hoy damos la bienvenida de nuevo a uno de los mejores deportistas del mundo y al mejor deportista español de todos los tiempos, @RafaelNadal. Pero lo que le hace especial son sus valores y su #EspírituGanador, que compartimos. https://t.co/aolyumkzod"
https://twitter.com/AnaBotin/status/1211356406969962503,Fri Jul 25 10:20:02 +0000 2014,2019-12-29 18:40:47,32,5,rep1211356047736287232,AnaBotin,False,"In @bancosantander we are also doing our part. We are already using 100% green energy in all our facilities in Spain, Germany and the UK and recently committed to become carbon neutral in 2020 in the whole Group, and to cut total emissions by a further 46% from 2019 to 2025."
https://twitter.com/AnaBotin/status/1211356047736287232,Fri Jul 25 10:20:02 +0000 2014,2019-12-29 18:39:22,33,8,rep1211355719963947011,AnaBotin,False,"Coal as a source of Spanish energy has declined to 5% from 14% just in the last year, according to @RedElectricaREE. Another important milestone in the UK, where renewable sources provided more electricity than fossil fuels for the first time, during the third quarter of 2019. https://t.co/pnKwqcd1oU"
https://twitter.com/AnaBotin/status/1211355719963947011,Fri Jul 25 10:20:02 +0000 2014,2019-12-29 18:38:04,93,18,repNone,,False,"On 13 December, for 45 hours, Spain went without any coal power in its power generation mix. This was due to maintenance of one of its lasts coal power plants. It’s an important step, Spain now has the spare capacity to go coal free. https://t.co/IIP05hzDnt"
