id,Account Created At(same for all rows),status created_at,Fav_cont,retweeted_count,reply_to_status,reply_to_screen,quote,text
https://twitter.com/AnaBotin/status/1159488402510602241,Fri Jul 25 10:20:02 +0000 2014,2019-08-08 15:35:52,99,25,repNone,,False,. @SantanderBankUS is launching a program for mid-career professionals — primarily women — who left the workforce at least two years ago and want to make a return. A great initiative to diversify our management ranks. Apply.   https://t.co/yVGRAiAlfv
https://twitter.com/AnaBotin/status/1158763030081134593,Fri Jul 25 10:20:02 +0000 2014,2019-08-06 15:33:29,36,1,rep1158763019171717120,AnaBotin,False,"Siempre me han gustado los libros de física -Richard Feynman, por ejemplo- que explican las leyes del Universo con lenguaje cotidiano. https://t.co/LWFgomMMj2"
https://twitter.com/AnaBotin/status/1158763019171717120,Fri Jul 25 10:20:02 +0000 2014,2019-08-06 15:33:27,48,5,rep1158763008572702721,AnaBotin,False,Estoy convencida de que Melinda Gates cuenta historias de mujeres que dejan huella. Y estoy de acuerdo con ella: las mujeres no podemos esperar más. https://t.co/HS1nW4IKdP
https://twitter.com/AnaBotin/status/1158763008572702721,Fri Jul 25 10:20:02 +0000 2014,2019-08-06 15:33:24,56,5,repNone,,False,"The Plant Paradox has split public opinion, intrigued, I chose it as one of my #SummerReads. I’m trying its recommendations regarding lectins and sugar/sucrose. https://t.co/FfgIZ4X2ce"
https://twitter.com/AnaBotin/status/1156653081058324486,Fri Jul 25 10:20:02 +0000 2014,2019-07-31 19:49:18,113,31,repNone,,True,"Proud of having completed our first BPU #blockchain based transaction through @we_dot_trade between a customer of  @Santander_es and a customer of @Nordea in Sweden. BPU is similar to a letter of credit but the financing and payment is automated via a ""Smart Contract”. #DLT https://t.co/2AFiL9ghZc"
https://twitter.com/AnaBotin/status/1155380281538416641,Fri Jul 25 10:20:02 +0000 2014,2019-07-28 07:31:39,144,29,rep1155377480766775296,AnaBotin,False,"Cada vez hacemos más gestiones sin “tener que ir” a la oficina del banco. Por eso Pereda, nuestra sede social, y Hernán Cortés serán espacios a los que la gente querrá venir. Sitios donde aprender, conectar, encontrar inspiración, nuevas ideas y apoyo para negocios y proyectos. https://t.co/sFEpYSuAaL"
https://twitter.com/AnaBotin/status/1155377480766775296,Fri Jul 25 10:20:02 +0000 2014,2019-07-28 07:20:31,220,50,repNone,,True,"Con estos proyectos el objetivo es crear espacios para atender a clientes y no clientes -en Hernán Cortés- adecuados a un mundo digital y, en el caso de Pereda, un espacio innovador y abierto que refleje las tradiciones y valores del banco. Queremos traer el mundo a la ciudad. https://t.co/jecEQOpuCq"
https://twitter.com/AnaBotin/status/1153554110102343680,Fri Jul 25 10:20:02 +0000 2014,2019-07-23 06:35:06,151,26,repNone,,True,"Una gran manera de empezar el día. Hoy presentamos resultados y el banco ha obtenido su mejor beneficio ordinario trimestral en ocho años, lo que refleja el progreso de nuestra transformación digital. https://t.co/bllXEh3i1C"
https://twitter.com/AnaBotin/status/1153553936089042944,Fri Jul 25 10:20:02 +0000 2014,2019-07-23 06:34:25,37,9,repNone,,True,"A great way to start my day. It’s results day and news is the bank has delivered its strongest underlying quarterly performance in eight years, proof of the progress we are making in our digital transformation. https://t.co/Br0WspnKJQ"
https://twitter.com/AnaBotin/status/1151809552175763456,Fri Jul 25 10:20:02 +0000 2014,2019-07-18 11:02:51,40,5,repNone,,False,"For a one minute break in your day... enjoy Tiger’s sense of humour. Brooksie of course is Koepka, the man who lately wins it all. https://t.co/EGQ8ZnJwsn"
https://twitter.com/AnaBotin/status/1151543695042326528,Fri Jul 25 10:20:02 +0000 2014,2019-07-17 17:26:26,12,4,rep1151541267978948608,AnaBotin,True,"And @vonderleyen is calling for European ""technological sovereignty"". Big data, AI is creating monopolies through economies of scale, scope: I do hope the Commission looks at Furman's equally ambitious UK Digital Competition Report's data-sharing proposals https://t.co/ui5CF07f9m"
https://twitter.com/AnaBotin/status/1151541267978948608,Fri Jul 25 10:20:02 +0000 2014,2019-07-17 17:16:47,11,3,repNone,vonderleyen,False,"@vonderleyen's agenda is ambitious &amp; bold. On the European economy, we share her prioritisation of SME funding &amp; finishing unfinished business: Full Capital Markets, Monetary &amp; Banking Union. Her call for fair taxation (below) echoes what I have been calling for. https://t.co/6Oeg31yYOZ"
https://twitter.com/AnaBotin/status/1150953158551752716,Fri Jul 25 10:20:02 +0000 2014,2019-07-16 02:19:51,3,1,rep1150939664116781056,TinaBrownLM,False,"@TinaBrownLM @bancosantander Thanks Tina for bringing together such a great group , a fun and interesting evening"
https://twitter.com/AnaBotin/status/1150438223635763201,Fri Jul 25 10:20:02 +0000 2014,2019-07-14 16:13:41,158,15,repNone,,False,Whether on a deserted beach in Cantabria to a Sunday in New York’s Central Park. You can find silence and your own space to recharge. https://t.co/K4xRe2yGni
https://twitter.com/AnaBotin/status/1149365665167486976,Fri Jul 25 10:20:02 +0000 2014,2019-07-11 17:11:43,50,8,repNone,,True,Very proud of all our teams’ hard work and delivering results the right way for our customers. https://t.co/mbsgpbXsHH
https://twitter.com/AnaBotin/status/1147939499055431681,Fri Jul 25 10:20:02 +0000 2014,2019-07-07 18:44:38,41,7,repNone,,True,The USA female football squad is a fantastic team. A great victory #FIFAWWC https://t.co/DIGnoJatvT
https://twitter.com/AnaBotin/status/1147880288321703937,Fri Jul 25 10:20:02 +0000 2014,2019-07-07 14:49:21,1,0,rep1147575745033752577,pvilchezp,False,@pvilchezp @FBancoSantander Lo puedes comprar en la web de @FBancoSantander https://t.co/7y7ClLS5Py
https://twitter.com/AnaBotin/status/1147475068563460098,Fri Jul 25 10:20:02 +0000 2014,2019-07-06 11:59:10,120,18,repNone,,False,"Pionera del feminismo en España, Ana María Martínez Sagi dedicó su vida al deporte, la poesía y el periodismo.   @FBancoSantander acaba de publicar este libro que recoge lo mejor de su poesía y artículos. https://t.co/ropchSR7fq"
https://twitter.com/AnaBotin/status/1147129835145375744,Fri Jul 25 10:20:02 +0000 2014,2019-07-05 13:07:19,90,21,repNone,,False,I once set up my own company and realized how difficult it was for banks and today’s new companies to understand each other. We are trying hard to change that. Our partnership with @FactumArte and Adam Lowe is one example. https://t.co/R2PySmopQ2
https://twitter.com/AnaBotin/status/1146890701118066693,Fri Jul 25 10:20:02 +0000 2014,2019-07-04 21:17:06,64,4,repNone,,False,"Clear blue skies. Took this on Long Island today. America, happy Independence Day. #4thofJuly #FourthofJuly2019 https://t.co/BUb8PTauOF"
https://twitter.com/AnaBotin/status/1146140322352816134,Fri Jul 25 10:20:02 +0000 2014,2019-07-02 19:35:21,75,9,repNone,,True,Ursula von der Leyen y @Lagarde! https://t.co/GisXNiznUG
https://twitter.com/AnaBotin/status/1145324441213255683,Fri Jul 25 10:20:02 +0000 2014,2019-06-30 13:33:20,19,1,rep1145313267453222912,Abascal9,False,"@Abascal9 Es la costumbre .. y esta bien la aclaración , Langre y Somo están en Ribamontan al Mar"
https://twitter.com/AnaBotin/status/1145271538612166656,Fri Jul 25 10:20:02 +0000 2014,2019-06-30 10:03:07,154,13,rep1145271243995844609,AnaBotin,False,"La playa estaba desierta, solo unos pocos surfistas y nosotros. https://t.co/mGcw4CHgM8"
https://twitter.com/AnaBotin/status/1145271243995844609,Fri Jul 25 10:20:02 +0000 2014,2019-06-30 10:01:57,516,47,repNone,,False,"Temprano en Santander, la playa. https://t.co/XRKUrDbREP"
https://twitter.com/AnaBotin/status/1145006320334069760,Fri Jul 25 10:20:02 +0000 2014,2019-06-29 16:29:14,199,24,repNone,,False,"Mientras en casi toda España se pasa calor, así estamos hoy 29 de junio en Santander. Y algunas valientes en el mar. https://t.co/1VwxfsR2x7"
https://twitter.com/AnaBotin/status/1144689705415581696,Fri Jul 25 10:20:02 +0000 2014,2019-06-28 19:31:07,81,15,repNone,,True,"Our diversity makes us stronger. Today is the 50th anniversary of the Stonewall riots, which brought visibility to the gay rights movement. Best wishes to everyone, especially the Santander employees, taking part in the activities in NY, London and Madrid over the coming week. https://t.co/jr0doA4PWz"
https://twitter.com/AnaBotin/status/1144611845162045441,Fri Jul 25 10:20:02 +0000 2014,2019-06-28 14:21:44,58,13,repNone,,False,"Our @santanderpb team has been working on two apps: a private banking front end for customers, called Virginia, which takes us to a new level in customer functionality, and a tool for bankers called SPiRIT. They are now live and just won the @FT #WealthTechAwards. Well done! https://t.co/jIPae0yCcm"
https://twitter.com/AnaBotin/status/1144515508433276929,Fri Jul 25 10:20:02 +0000 2014,2019-06-28 07:58:55,142,14,repNone,,False,Banco Santander was born in 1857 financing seaborne trade to and from the city of Santander. We finished our management team meeting connecting with our maritime roots. https://t.co/DofRs265TJ
https://twitter.com/AnaBotin/status/1143939271822381056,Fri Jul 25 10:20:02 +0000 2014,2019-06-26 17:49:10,29,3,rep1143613049661771776,AnaBotin,False,"Muchas gracias a la Alcaldesa, Mª Teresa Noceda, y a la Comunidad de Cantabria por acogernos y acompañarnos en la Universidad y en el Palacio de Sobrellano. https://t.co/dBa0QbFQ2q"
https://twitter.com/AnaBotin/status/1143613049661771776,Fri Jul 25 10:20:02 +0000 2014,2019-06-25 20:12:52,219,30,repNone,,False,"Comillas is one of Cantabria’s gems. It is one of the few places outside Catalonia featuring Gaudí's architecture. It was also the first Spanish town -in 1880- to get electric light. Today, our top management is meeting here at the university. https://t.co/0Bd7hzKVAd"
https://twitter.com/AnaBotin/status/1143177516179439619,Fri Jul 25 10:20:02 +0000 2014,2019-06-24 15:22:13,32,2,repNone,,True,"May the team that cried the most in the beginning, smile at the end.   All the best to @SeFutbolFem in their match against favourites @USWNT. #FIFAWWC https://t.co/bMKlhBj91P"
https://twitter.com/AnaBotin/status/1142838687660724224,Fri Jul 25 10:20:02 +0000 2014,2019-06-23 16:55:50,164,21,repNone,,True,Love Seve’s mega swing. https://t.co/J726nsa7ky
https://twitter.com/AnaBotin/status/1142761775684829193,Fri Jul 25 10:20:02 +0000 2014,2019-06-23 11:50:13,0,100,repNone,,False,RT @JesusCalleja: Usamos dos helicópteros para tener las imágenes increíbles que luego veis en el programa. @luisrjordan y yo  sincronizamo…
https://twitter.com/AnaBotin/status/1142130773509771264,Fri Jul 25 10:20:02 +0000 2014,2019-06-21 18:02:50,458,66,repNone,,False,"Hoy estamos celebrando que hace 40 años que @Policia tiene #mujeresdeazul. Gracias a todas las que, junto con vuestros compañeros, hacéis de España uno de los países más seguros del mundo.  No soy muy de gifs, pero creo que la ocasión lo merece. #Respect. https://t.co/ArOP6Hx2if"
https://twitter.com/AnaBotin/status/1141338714821541888,Fri Jul 25 10:20:02 +0000 2014,2019-06-19 13:35:29,102,23,repNone,,True,"The elephant in the room for all companies in all sectors -including banks- is that we need to redraw the rules for a digital market economy. And to agree to do it based on one principle: FAIR competition, on regulation, on taxes, in competition rules. https://t.co/Q8xUt6b6ls"
https://twitter.com/AnaBotin/status/1140264713831550987,Fri Jul 25 10:20:02 +0000 2014,2019-06-16 14:27:47,280,28,repNone,,False,"Un acebo centenario esta mañana, en una de las muchas rutas que hay en Ribamontán al Mar. Al fondo una iglesia del siglo XVII y varios quejigos impresionantes en el bosque. https://t.co/y1g1N5HcT0"
https://twitter.com/AnaBotin/status/1140213341459222528,Fri Jul 25 10:20:02 +0000 2014,2019-06-16 11:03:39,46,9,repNone,,True,A more assertive Spain in Europe is good for Europe.   Next steps needed are breaking the link between sovereign risk and the banking sector. And creating a truly common market for services. https://t.co/Z589eDuJZ4
https://twitter.com/AnaBotin/status/1140198722816610304,Fri Jul 25 10:20:02 +0000 2014,2019-06-16 10:05:34,56,8,repNone,,True,"Histórica victoria de los @Raptors e histórica también la hazaña de los hermanos Gasol. Los primeros hermanos en conseguir el anillo de la NBA, con 10 años de diferencia. ¡Bravo! Un orgullo poder contar el talento de Pau en la @PauGasolAcademy by @Santander_es https://t.co/dWHlvOJj6a"
https://twitter.com/AnaBotin/status/1139127029805309952,Fri Jul 25 10:20:02 +0000 2014,2019-06-13 11:07:02,15,3,rep1138715043779022849,JdR_Tech,False,"@JdR_Tech @bankofengland @bancosantander @Founders_Forum Jacqueline, whether it is in tech or in banking or even in academia, gender diversity remains a challenge, so it is important to remind everyone it is not only the right thing to do, it is good for business."
https://twitter.com/AnaBotin/status/1138472645706600448,Fri Jul 25 10:20:02 +0000 2014,2019-06-11 15:46:45,74,7,repNone,,True,"Light Cycle race!  MotoE is a zero-emission engine clash. Two top-level bikers, @MariiaHerrera_6 (the only female also in the World Championship) &amp; @nicoterol, represents the new #OpenbankMotoE @AngelNietoTeam  Well done @Openbank_es! https://t.co/N3Erwb1yMp"
https://twitter.com/AnaBotin/status/1138108183401115649,Fri Jul 25 10:20:02 +0000 2014,2019-06-10 15:38:30,159,50,repNone,,False,"Durante el encuentro #WiCS (Women in Cyber Security of Spain) que hemos acogido en @bancosantander, me recordaban que “no puedes ser lo que no puedes ver”. Enhorabuena, Karen, Yoya, Julia e Idoia por ayudar a visibilizar el talento femenino en ciberseguridad con esta iniciativa. https://t.co/pbF3rywui8"
https://twitter.com/AnaBotin/status/1137770232465035264,Fri Jul 25 10:20:02 +0000 2014,2019-06-09 17:15:36,1,0,rep1137763495674556423,jpoustman,False,"@jpoustman Así es, no soy yo. Gracias por la información."
https://twitter.com/AnaBotin/status/1137756385268158465,Fri Jul 25 10:20:02 +0000 2014,2019-06-09 16:20:35,331,33,repNone,,False,"Rafa, emocionante victoria. Eres el mejor.   A legend."
https://twitter.com/AnaBotin/status/1137292910586675200,Fri Jul 25 10:20:02 +0000 2014,2019-06-08 09:38:54,54,16,repNone,,True,Como dice @VeroBoquete en @el_pais es hora de hablar y disfrutar de lo que las mujeres podemos hacer sobre el terreno de juego en el #FIFAWWC ... y no solo en este. https://t.co/ygJMNbUdRr
https://twitter.com/AnaBotin/status/1137065566257197057,Fri Jul 25 10:20:02 +0000 2014,2019-06-07 18:35:31,67,10,repNone,,True,Vamos Rafa! https://t.co/VSnsAZCh0w
https://twitter.com/AnaBotin/status/1136878207360208896,Fri Jul 25 10:20:02 +0000 2014,2019-06-07 06:11:01,118,27,repNone,,False,"Cuando el Vicerrector de la @UPV se convierte en el mejor embajador de tu producto. Gracias y enhorabuena, @carfega por @closcadesign, es una botella muy “cool”. En @bancosantander ya nos hemos sumado al reto #mylastplasticbottle. https://t.co/qgxjR1CjL4"
https://twitter.com/AnaBotin/status/1136699670716194819,Fri Jul 25 10:20:02 +0000 2014,2019-06-06 18:21:35,66,8,rep1136696128265736193,AnaBotin,False,"Paula quiere cambiar el mundo, Almu dice que ella no va para atrás ni para coger impulso, Alejandro va por la vida con la mente abierta, Rafa quiere ser libre antes que valiente y María está convencida de que la juventud es un estado del alma. Todos son becarios Santander. https://t.co/rLUezvLNES"
https://twitter.com/AnaBotin/status/1136696128265736193,Fri Jul 25 10:20:02 +0000 2014,2019-06-06 18:07:30,164,27,repNone,,False,"El mundo financiero y el mundo de la educación son de los que más capacidad tienen de cambiar el mundo. Por eso el decidido apoyo del Santander a la educación. Hoy lo hemos ratificado en la Junta de @Universia, con 150 becarios Santander Erasmus como invitados especiales. https://t.co/FrFUlmMzKp"
https://twitter.com/AnaBotin/status/1136371898630246402,Fri Jul 25 10:20:02 +0000 2014,2019-06-05 20:39:08,117,26,rep1136371753234698240,AnaBotin,False,"En realidad esta mujer no existe. La ha creado con Inteligencia Artificial @sergioalbiac, sumando valores como liderazgo, esfuerzo o pasión. La exposición #Protagonistasdelaño muestra que el éxito no tiene género y ayuda a visibilizar referentes femeninos. https://t.co/M7nOEBSslK"
https://twitter.com/AnaBotin/status/1136371753234698240,Fri Jul 25 10:20:02 +0000 2014,2019-06-05 20:38:33,75,16,repNone,,False,"Esta es la protagonista del año, ¿la reconoces? https://t.co/VFKLh618hs"
https://twitter.com/AnaBotin/status/1136242253565964291,Fri Jul 25 10:20:02 +0000 2014,2019-06-05 12:03:58,42,13,repNone,,False,Why banks matter? Stablecoin https://t.co/HRhTXAawX0
https://twitter.com/AnaBotin/status/1136195289268785152,Fri Jul 25 10:20:02 +0000 2014,2019-06-05 08:57:21,21,3,rep1136194849517031425,AnaBotin,False,"For those around #Money2020EU on it's last day, don't miss the opportunity to meet Asto's teem to learn more about what they do."
https://twitter.com/AnaBotin/status/1136194849517031425,Fri Jul 25 10:20:02 +0000 2014,2019-06-05 08:55:36,59,20,repNone,,False,"Santander tightly integrates via @meet_asto, with eBay. Asto uses an AI credit scoring model built in Santander data labs, to be able to provide credit - in minutes - to small businesses in the UK. It’s launching soon.  https://t.co/jLkfsIinR8"
https://twitter.com/AnaBotin/status/1135100994122067968,Fri Jul 25 10:20:02 +0000 2014,2019-06-02 08:29:00,28,2,rep1132304476940001280,gary_tapas,False,"@gary_tapas Gary, hope you enjoyed Madrid and celebrated your team’s success, it was great football and two outstanding teams."
https://twitter.com/AnaBotin/status/1134924722213392386,Fri Jul 25 10:20:02 +0000 2014,2019-06-01 20:48:34,226,19,repNone,,False,Gran ambiente y gran fútbol. No he conseguido que @Ronaldo me diga quién es su favorito para llevarse esta #UCLfinal. https://t.co/chh0HkWad6
https://twitter.com/AnaBotin/status/1134492506975088641,Fri Jul 25 10:20:02 +0000 2014,2019-05-31 16:11:06,97,16,repNone,,False,"We love football in Madrid. But we also have many things to do and see. If you are around for the #UCLfinal, have a look at the map and find our volunteers in the center to help you with directions and advice. My choice: the walking tours and “tapas”. https://t.co/taLVsak9qz https://t.co/by2XQksUkK"
https://twitter.com/AnaBotin/status/1133107455016210432,Fri Jul 25 10:20:02 +0000 2014,2019-05-27 20:27:24,620,143,repNone,,True,¿Por qué no mujeres en todas las presidencias de la UE? https://t.co/NshQkgLNiP
https://twitter.com/AnaBotin/status/1131275192813195266,Fri Jul 25 10:20:02 +0000 2014,2019-05-22 19:06:38,125,7,repNone,,False,"On my run this morning I passed the Konzerthaus Berlin, heavily damaged during allied bombing and the Battle of Berlin in WWII, it has been classed as one of the best concert venues for music and opera in the world. https://t.co/U9BA6rusvc"
https://twitter.com/AnaBotin/status/1130790343971102720,Fri Jul 25 10:20:02 +0000 2014,2019-05-21 11:00:01,148,31,repNone,,False,Vale la pena escuchar la versión de “La tarara” y “Entre dos aguas” con la que #Lamúsicadelreciclaje ha cerrado el acto de #ProyectosSociales2019. Increíble lo bien que suenan los instrumentos reciclados. Gran proyecto de formación musical para ayudar a la inclusión de menores. https://t.co/BjXYzapNdf
https://twitter.com/AnaBotin/status/1130788044250992641,Fri Jul 25 10:20:02 +0000 2014,2019-05-21 10:50:53,52,8,rep1130787599466074113,AnaBotin,False,"Ana Bella ha ayudado ya a 25.000 mujeres víctimas de violencia de género con su Fundación @Fund_Ana_Bella. En la foto también Graciela, la madrina del proyecto y empleada del banco. https://t.co/dfIKYIRZoD"
https://twitter.com/AnaBotin/status/1130787599466074113,Fri Jul 25 10:20:02 +0000 2014,2019-05-21 10:49:07,94,9,rep1130787234469298181,AnaBotin,False,"Alonso, que hoy tiene 10 años, superó una leucemia gracias al empeño de @unoentrecienmil por encontrar una cura contra esta enfermedad. Hoy nos ha dicho que está “genial”. https://t.co/XLQCC4HJUP"
https://twitter.com/AnaBotin/status/1130787234469298181,Fri Jul 25 10:20:02 +0000 2014,2019-05-21 10:47:40,103,12,repNone,,True,"Nuestros empleados apoyan a las ONG que eligen ellos mismos mediante votación con parte de su nómina (cantidad que el banco duplica). Ayer premiamos a las ganadoras, pero a las más de 300 que se presentaron y que cada día trabajan para ayudar a los más desfavorecidos, ¡gracias!. https://t.co/o2POwScBFL"
https://twitter.com/AnaBotin/status/1130508270924439552,Fri Jul 25 10:20:02 +0000 2014,2019-05-20 16:19:10,30,8,rep1130493477085700096,AnaBotin,False,The chairman of Letter One has committed to work to eliminate discrimination between Dia's bondholders and lenders which we believe is the fair thing to do. Santander will continue to act responsibly in supporting Dia and its employees.
https://twitter.com/AnaBotin/status/1130493477085700096,Fri Jul 25 10:20:02 +0000 2014,2019-05-20 15:20:23,158,58,repNone,,False,"Finalmente el Presidente de Letter One se ha comprometido a trabajar para eliminar la discriminación entre bonistas y bancos de Dia, lo que creemos es un tratamiento justo. Santander de manera responsable ha decidido apoyar a Dia y sus empleados. https://t.co/Atju6ifKOm"
https://twitter.com/AnaBotin/status/1129280365821140992,Fri Jul 25 10:20:02 +0000 2014,2019-05-17 06:59:54,24,2,repNone,,True,Fascinating. No I did not. https://t.co/VJcKVZkbRq
https://twitter.com/AnaBotin/status/1129280205888151552,Fri Jul 25 10:20:02 +0000 2014,2019-05-17 06:59:16,4,0,rep1128998497112526848,cdndebs,False,@cdndebs Thank you. Do you have a specific question?
https://twitter.com/AnaBotin/status/1129279966661758976,Fri Jul 25 10:20:02 +0000 2014,2019-05-17 06:58:19,16,4,rep1128995550454603776,medifferenta,False,"@medifferenta @BloombergLive Yes, unfortunately it is a ""motherhood"" and not a ""parenting"" tax, as this graph shows. In spite of Denmark's laws men leave child rearing to women. https://t.co/q4oiyntm0F"
https://twitter.com/AnaBotin/status/1129279105025957888,Fri Jul 25 10:20:02 +0000 2014,2019-05-17 06:54:54,4,2,rep1129005847206612992,lreasor,False,@lreasor @BloombergLive @SupraFin_global Enjoyed meeting you yesterday.
https://twitter.com/AnaBotin/status/1129278461237977094,Fri Jul 25 10:20:02 +0000 2014,2019-05-17 06:52:20,53,8,repNone,,True,"Thank you. If you are interested, this is the study I was referring to. https://t.co/Z1J8k8FAYC #BloombergEquality https://t.co/SVEmpfD0Gz"
https://twitter.com/AnaBotin/status/1128987638118133760,Fri Jul 25 10:20:02 +0000 2014,2019-05-16 11:36:43,0,8,repNone,,False,"RT @bancosantander: Diversity matters and we believe it's good for everyone, including businesses. Today @AnaBotin will be participating in…"
https://twitter.com/AnaBotin/status/1126848667867070464,Fri Jul 25 10:20:02 +0000 2014,2019-05-10 13:57:12,105,22,repNone,,False,"To be able to serve all customers, we have to do so in all channels. And the only way to do that profitably, is through digital. That's why we are making this big push. https://t.co/oBKQKj8EST"
https://twitter.com/AnaBotin/status/1126567737214603265,Fri Jul 25 10:20:02 +0000 2014,2019-05-09 19:20:53,50,7,rep1126567360188624901,AnaBotin,False,"Aquí nuestro equipo de riesgos y comercial con Elisabet Cañigueral, CEO del Grup Costa Brava Foods y sus compañeros. Entender de verdad el negocio de nuestros clientes visitándolos en persona es el camino a seguir, enhorabuena. https://t.co/VHetOqrx2w"
https://twitter.com/AnaBotin/status/1126567360188624901,Fri Jul 25 10:20:02 +0000 2014,2019-05-09 19:19:23,69,3,rep1126566928464658433,AnaBotin,False,"María José, nuestra directora territorial, tiene a Jihane, una de nuestras ""young leaders"" como mentora. Esta ""tutoría inversa"" nos ayuda a entender a las nuevas generaciones de clientes. En la foto también Daniel y Naira. https://t.co/V45JQ5jqdC"
https://twitter.com/AnaBotin/status/1126566928464658433,Fri Jul 25 10:20:02 +0000 2014,2019-05-09 19:17:41,99,9,repNone,,False,"Hoy en el @Liceu_cat, con el equipo de Santander Cataluña. Moltes gràcies a tots por el gran trabajo y por aportar ideas para mejorar. https://t.co/NbhiVaNd1i"
https://twitter.com/AnaBotin/status/1126077813050806272,Fri Jul 25 10:20:02 +0000 2014,2019-05-08 10:54:06,20,3,rep1125833072711294977,PalomadelrioTVE,False,"@PalomadelrioTVE Era el mejor y le recordaremos siempre. Miguel, gracias por compartir esta foto, sólo él sabía hacer estos golpes. https://t.co/R7T2BDcJcG"
https://twitter.com/AnaBotin/status/1126074737854164992,Fri Jul 25 10:20:02 +0000 2014,2019-05-08 10:41:53,44,5,repNone,,True,"Los resultados de @SantanderPT muestran que cada vez cuenta con la confianza de más clientes: aumentan un 7% los clientes que nos consideran su primer banco. Parabéns, Pedro e equipe. https://t.co/kHdHrBybvW"
https://twitter.com/AnaBotin/status/1126072997234839552,Fri Jul 25 10:20:02 +0000 2014,2019-05-08 10:34:58,139,27,repNone,,False,"Desde Veracruz (México), donde nació, hasta el Metropolitan de NY, donde ha sido gran triunfador. Siempre maravilloso @tenorjcamarena, esta vez con bises de canciones de su tierra. ¡Gracias Javier! Y a Enrique, la @EscuelaSMRSofia y el Círculo Internacional por hacerlo posible. https://t.co/3cp3TwOHGI"
https://twitter.com/AnaBotin/status/1125686819104940032,Fri Jul 25 10:20:02 +0000 2014,2019-05-07 09:00:26,91,22,repNone,,True,Un placer compartir con @manuelmunizv y un grupo de jóvenes emprendedores y directivos (mayoría mujeres) ideas sobre cómo redefinir el papel de las empresas y los gobiernos para lograr crecimiento sostenible en el mundo digital. Necesitamos competencia justa y equidad social. https://t.co/SlrIa2rG3a
