id,Account Created At(same for all rows),status created_at,Fav_cont,retweeted_count,reply_to_status,reply_to_screen,quote,text
https://twitter.com/AnaBotin/status/1356978230687899650,Fri Jul 25 10:20:02 +0000 2014,2021-02-03 14:49:56,16,3,rep1356687352241008644,sevillajordi,False,"@sevillajordi @wef Jordi, lo que añades lo suscribo al 100% y únicamente diría que cuanto antes mejor."
https://twitter.com/AnaBotin/status/1356887413705093123,Fri Jul 25 10:20:02 +0000 2014,2021-02-03 08:49:03,55,9,repNone,,True,2020 was a year like no other. Thank you to our teams for your exceptional dedication in supporting our customers. These results prove the resilience and effectiveness of our business and strategy. Coupled with a great team we're confident we can deliver on our medium-term goals. https://t.co/LMmkrpF1S2
https://twitter.com/AnaBotin/status/1355923040450785280,Fri Jul 25 10:20:02 +0000 2014,2021-01-31 16:56:59,89,9,repNone,,True,"Enhorabuena, #hispanos!!🇪🇸 Partidazo y muy merecida medalla. https://t.co/A9iSdxNxbu"
https://twitter.com/AnaBotin/status/1354839160796938240,Fri Jul 25 10:20:02 +0000 2014,2021-01-28 17:10:02,59,13,repNone,,True,"It is an honour to be part of this group. The pandemic has taught us how vulnerable we are. To build back a better, more resilient and sustainable world we must act together now. Banks have a critical role to play in powering the recovery and future prosperity. https://t.co/YLdkHEC0v4"
https://twitter.com/AnaBotin/status/1354065677028614146,Fri Jul 25 10:20:02 +0000 2014,2021-01-26 13:56:29,174,52,repNone,,True,"Las vacunas son la política económica más importante de 2021. Nuestra salud, el bienestar social y la economía dependen de la velocidad y la eficacia de su distribución en todo el mundo. Vacunar salvará vidas hoy y empleos mañana. https://t.co/kLFMHyAynN"
https://twitter.com/AnaBotin/status/1351953980432261128,Fri Jul 25 10:20:02 +0000 2014,2021-01-20 18:05:21,2,0,rep1348210690708922368,AniTa_india,False,"@AniTa_india Hola Ana, solo se quedó en la Ciudad Financiera el personal de seguridad y mantenimiento con turno de fin de semana, respetando horas de descanso y con habitaciones en la residencia en cuanto se pudo. Han sido un ejemplo de responsabilidad, solidaridad y compañerismo."
https://twitter.com/AnaBotin/status/1351076162441768961,Fri Jul 25 10:20:02 +0000 2014,2021-01-18 07:57:13,79,18,repNone,,False,"Vaccines are the most effective way of controlling the pandemic.  We should spare no effort to speed up distribution, prioritising those most at risk. @Bruegel_org  https://t.co/MNXRaN9nrB"
https://twitter.com/AnaBotin/status/1349741993631621120,Fri Jul 25 10:20:02 +0000 2014,2021-01-14 15:35:42,4,0,rep1348280189969698819,Oskar83226040,False,"@Oskar83226040 Lo intentaré el próximo verano, gracias por la invitación."
https://twitter.com/AnaBotin/status/1349740892320620546,Fri Jul 25 10:20:02 +0000 2014,2021-01-14 15:31:20,14,2,rep1348683606957428741,gemaigual,False,@gemaigual @cdiazmaza Muchas gracias a ti y a todo el equipo por el apoyo. Un abrazo.
https://twitter.com/AnaBotin/status/1348368399651500038,Fri Jul 25 10:20:02 +0000 2014,2021-01-10 20:37:32,62,10,rep1348367961057320962,AnaBotin,False,"Recuerdo una nevada menos importante en Boston, una ciudad con mucha más experiencia en estas situaciones, y el trabajo hecho aquí en las últimas 24 horas es impresionante. Así estaría todo si no se hubiera trabajado noche y día. https://t.co/CPkT4A8e43"
https://twitter.com/AnaBotin/status/1348367961057320962,Fri Jul 25 10:20:02 +0000 2014,2021-01-10 20:35:48,168,21,repNone,,False,"La coordinación entre todos los servicios de @MADRID, @ComunidadMadrid, @policia, @guardiacivil, @UMEgob @mitmagob... después de esta gran nevada ha sido fundamental para conseguir tener los accesos principales a Madrid abiertos ya esta noche. https://t.co/IrwGWPmTyN"
https://twitter.com/AnaBotin/status/1344324316972916737,Fri Jul 25 10:20:02 +0000 2014,2020-12-30 16:47:48,14,0,rep1344324309666422786,AnaBotin,False,"As you can see in the pictures, @FactumFound recorded the painting using their Lucida 3D Scanner – a mind-blowing brainchild of theirs – and panoramic composite photography to gather the data necessary to replicate it. https://t.co/yq2HJZFZxe"
https://twitter.com/AnaBotin/status/1344324309666422786,Fri Jul 25 10:20:02 +0000 2014,2020-12-30 16:47:46,14,0,rep1344324301554642944,AnaBotin,False,"The copy will also be placed where it was initially intended; the right altar of the Tavera Hospital church, besides The Concert of Angels, the other part of the painting held at the National Gallery of Athens. https://t.co/Nh7iG7WsDF"
https://twitter.com/AnaBotin/status/1344324301554642944,Fri Jul 25 10:20:02 +0000 2014,2020-12-30 16:47:44,12,0,rep1344324293707116545,AnaBotin,False,"It's one of the finest pieces in @bancosantander's collection, which the @FactumFound has digitized in high-resolution to create an exact replica. Thanks to collaboration with @FBancoSantander, we'll obtain essential material for documentation and analysis. https://t.co/n4JcvCVKih"
https://twitter.com/AnaBotin/status/1344324293707116545,Fri Jul 25 10:20:02 +0000 2014,2020-12-30 16:47:42,96,11,repNone,,False,"Adam Lowe, founder and CEO of @FactumArte, told me last year his vision of building bridges between art, craft and technology, and protecting cultural heritage. The project to digitize El Greco's The Annunciation, painted in 1614, is a perfect example. https://t.co/C5P9GCoKdA"
https://twitter.com/AnaBotin/status/1341866661050200065,Fri Jul 25 10:20:02 +0000 2014,2020-12-23 22:01:57,12,1,rep1341471556636176385,ginadiezbarroso,False,"@ginadiezbarroso @bancosantander Gina, tu criterio empresarial, conocimiento de México y Estados Unidos, dos países clave para el Grupo, y tu experiencia en el campo de la educación como fundadora de la Universidad Centro nos serán de gran valor. Bienvenida!"
https://twitter.com/AnaBotin/status/1337136550962995201,Fri Jul 25 10:20:02 +0000 2014,2020-12-10 20:46:11,4,0,rep1336443132825702411,brumeu1,False,"@brumeu1 @RevillaMiguelA @MasterChef_es @cant_infinita Enhorabuena Begoña, gracias a vosotros por invitarme."
https://twitter.com/AnaBotin/status/1337117608873701380,Fri Jul 25 10:20:02 +0000 2014,2020-12-10 19:30:55,36,6,repNone,,True,".@Openbank's 100% digital broker arrives in the Netherlands, Germany and Portugal, allowing customers to trade and save easily under one roof. It complements the existing expert robo-advisor, where customers can invest as little as €500, in addition to everyday banking services. https://t.co/d1wTj4ZqFV"
https://twitter.com/AnaBotin/status/1334483013661503489,Fri Jul 25 10:20:02 +0000 2014,2020-12-03 13:01:58,40,7,repNone,,True,Interesting debate on a very relevant topic. https://t.co/crJNWlsox9
https://twitter.com/AnaBotin/status/1334226185832763394,Fri Jul 25 10:20:02 +0000 2014,2020-12-02 20:01:26,20,1,rep1334225979271680000,AnaBotin,False,"Through innovation and cutting-edge technology, and with the best teams working together across the group, we have developed best-in-class solutions. This is how we will do more and better for our stakeholders. Thank you and congratulations to each and every one of you."
https://twitter.com/AnaBotin/status/1334225979271680000,Fri Jul 25 10:20:02 +0000 2014,2020-12-02 20:00:36,77,4,repNone,,True,"First and foremost, @TheBanker award is a tribute to all our teams, following the most difficult year in decades. The reason we exist is to help people and businesses prosper, and this prize recognizes what our teams have delivered for our customers. https://t.co/c4ohoVxtOF"
https://twitter.com/AnaBotin/status/1331693663555104770,Fri Jul 25 10:20:02 +0000 2014,2020-11-25 20:18:05,19,4,rep1328294458119565312,wasaction,False,"@wasaction @Delia_Gargo Enhorabuena a todo el equipo de @wasaction por vuestro trabajo para impulsar el compromiso de todos con la sostenibilidad. La mejor manera de acabar un evento de inspiración, sin duda, con música. Gracias por la invitación."
https://twitter.com/AnaBotin/status/1331692864905097218,Fri Jul 25 10:20:02 +0000 2014,2020-11-25 20:14:55,3,0,rep1329818283558703105,MicheleZanini,False,"@MicheleZanini @FT @MargaretAtwood I really enjoyed the book, Michele, helpful and inspirational at the same time. I highly recommend it to all of those who want to transform their business."
https://twitter.com/AnaBotin/status/1328423317666230272,Fri Jul 25 10:20:02 +0000 2014,2020-11-16 19:42:54,64,9,repNone,,True,"Payments has always been the cornerstone of our strategy to earn the loyalty of customers. The tech and talent we'll gain through this transaction will help us accelerate Getnet’s expansion plans in Europe, enhancing our capacity to deliver the best solutions for our customers. https://t.co/wTFPqZ8mmB"
https://twitter.com/AnaBotin/status/1328100679316090882,Fri Jul 25 10:20:02 +0000 2014,2020-11-15 22:20:51,58,4,repNone,,False,"Congratulations to @DJohnsonPGA, the 2020 Masters Champion. Well played! And also to @JonRahmpga for a top ten appearance. #themasters https://t.co/L1mEIF2YIb"
https://twitter.com/AnaBotin/status/1326903692138844160,Fri Jul 25 10:20:02 +0000 2014,2020-11-12 15:04:27,98,10,repNone,,True,"Uno de los grandes del golf y del deporte español de todos los tiempos. Gracias, Chema, por recordarnos lo que Seve nos hacía sentir a través de su golf en el primer día de #TheMasters. https://t.co/Yd7aoxpeQb"
https://twitter.com/AnaBotin/status/1326564496312332290,Fri Jul 25 10:20:02 +0000 2014,2020-11-11 16:36:36,26,2,rep1326564378322358272,AnaBotin,False,"Además es una muy buena noticia para España, porque nos sitúa como uno de los lugares de referencia para la innovación Fintech y permitirá atraer talento e inversión."
https://twitter.com/AnaBotin/status/1326564378322358272,Fri Jul 25 10:20:02 +0000 2014,2020-11-11 16:36:08,99,12,repNone,,False,"La aprobación del Sandbox regulatorio es un cambio de actitud vital para la innovación financiera. Supone pasar del “no se puede” al “vamos a probar”, que va a permitir hacer más pruebas de nuevos modelos de negocio y validar si sirven para el mundo real. https://t.co/Gb65tm32Er https://t.co/ot737Nc7wE"
https://twitter.com/AnaBotin/status/1326281079293157376,Fri Jul 25 10:20:02 +0000 2014,2020-11-10 21:50:25,108,10,repNone,,True,"Walking on water @JonRahmpga, vamos! https://t.co/PSPGergfMZ https://t.co/OqKxXIZlv8"
https://twitter.com/AnaBotin/status/1326162315796951046,Fri Jul 25 10:20:02 +0000 2014,2020-11-10 13:58:29,47,10,repNone,,True,Buying or selling a home is one of the most important decisions we make. But sometimes it’s painfully slow. @Clikalia_ cuts the time it takes to do it and is a good example of how digitalization can solve real problems. Happy to see @Mourocapital supporting innovation from Spain. https://t.co/PSsIydKafO
https://twitter.com/AnaBotin/status/1325502250261880835,Fri Jul 25 10:20:02 +0000 2014,2020-11-08 18:15:37,469,40,repNone,,True,I chose a historic date to return to the US after 8 months: the day @KamalaHarris became the first woman to be vice-president-elect in the White House. https://t.co/JgnA7qM1CF
https://twitter.com/AnaBotin/status/1324307226018959360,Fri Jul 25 10:20:02 +0000 2014,2020-11-05 11:07:01,61,10,repNone,,True,"Before covid, it was already clear that we needed a new social contract for the digital age, and it's now more urgent than ever.  Join us today when I'll be discussing the new role of businesses and goverments in a post-covid era with Larry Fink, @Yascha_Mounk and @NadiaCalvino. https://t.co/xGtz00cYDh"
https://twitter.com/AnaBotin/status/1324105349054500865,Fri Jul 25 10:20:02 +0000 2014,2020-11-04 21:44:50,19,3,rep1323601291210272768,CasaReal,False,@CasaReal @CruzRojaEsp @ayudaenaccion @FDadoris @fmujeres @FEDER_Org @Fund_Tambien @FundCreality @sin_dano @Acontraelhambre @itwillbeorg Proyectos sociales como estos logran que la sociedad sea mas inclusiva y mejor. Son un ejemplo del impacto positivo que podemos tener en la vida de miles de personas. Muchas gracias a SM la reina Letizia por acompañarnos.
https://twitter.com/AnaBotin/status/1320984607257448451,Fri Jul 25 10:20:02 +0000 2014,2020-10-27 07:04:07,62,9,repNone,,True,"These are solid results that highlight @bancosantander‘s enduring strengths, considering the adverse context.  We've proven that our strategy and business model position us well to continue supporting our customers and delivering results. A big thank you to all our teams. https://t.co/MDMN5vdh3a"
https://twitter.com/AnaBotin/status/1320401528633593856,Fri Jul 25 10:20:02 +0000 2014,2020-10-25 16:27:10,55,6,repNone,,True,"Ayer @JonRahmpga hizo una vuelta de auténtico número uno en @zozochamp, la mejor tarjeta del día con 63 golpes. Hoy podría volver a ser primero en el ranking mundial, el segundo español en conseguirlo después de Seve. Vamos, Jon! https://t.co/5zw3h0Spc5"
https://twitter.com/AnaBotin/status/1319330942025084933,Fri Jul 25 10:20:02 +0000 2014,2020-10-22 17:33:03,186,30,repNone,,True,"Qué buena noticia que UK haya incluido Canarias entre la lista de destinos seguros para viajar, ahora que empieza la temporada alta de invierno. Entre todos tenemos que ser conscientes de las medidas de seguridad y cumplirlas para lograr “convivir con el virus” los próximos meses https://t.co/ttVLw14PwV"
https://twitter.com/AnaBotin/status/1318989296217575425,Fri Jul 25 10:20:02 +0000 2014,2020-10-21 18:55:28,22,2,rep1318988809133051905,AnaBotin,False,"Banks are  good at delivering what Frank calls ‘slow money’ (savings, investment).  Santander is also competing in the ‘fast money’ landscape (daily expenditures, etc) investing in digitalization and leveraging our scale. Enjoy the debate here: https://t.co/BSl1wYRy2R"
https://twitter.com/AnaBotin/status/1318988809133051905,Fri Jul 25 10:20:02 +0000 2014,2020-10-21 18:53:32,20,4,rep1318988375358083072,AnaBotin,False,"At #SantanderIBC, Frank d’Souza, @Dan_Schulman and @nuriaoliver discussed about payments, platforms and their impact on people. The challenge is to build trust and loyalty while offering convenience."
https://twitter.com/AnaBotin/status/1318988375358083072,Fri Jul 25 10:20:02 +0000 2014,2020-10-21 18:51:48,77,18,repNone,,False,"We shouldn't underestimate the pace of today’s changes. 44% of @bancosantander sales are now digital (36% YoY).  Technology is driving down cost of service, big data is enhancing the customer experience while new players are entering financial services, changing the market fast."
https://twitter.com/AnaBotin/status/1317453450934947842,Fri Jul 25 10:20:02 +0000 2014,2020-10-17 13:12:34,53,6,repNone,,False,"Super proud of my cousin Marcelino Botín, principal designer of Patriot, the #AC75 racing yacht of the @NYYCAmericanMag. In Europe and Spain (and Cantabria!) we have amazing talent driving innovation across the world. Congratulations Marce and all the team https://t.co/3TGl24IRUl"
https://twitter.com/AnaBotin/status/1317145263732105216,Fri Jul 25 10:20:02 +0000 2014,2020-10-16 16:47:56,87,10,rep1317145123243819011,AnaBotin,False,Todos tenemos la responsabilidad de construir una sociedad más inclusiva y cohesionada en el marco de nuestra monarquía constitucional. Y sobre estas bases acordar principios comunes para la España del futuro.
https://twitter.com/AnaBotin/status/1317145123243819011,Fri Jul 25 10:20:02 +0000 2014,2020-10-16 16:47:23,237,26,repNone,,False,Mi enhorabuena a todos los galardonados con los #PremiosPrincesadeAsturias. En sus 40 años de vida se han convertido en un referente de los valores y principios que como sociedad debemos preservar. https://t.co/zn1qSFq7eQ
https://twitter.com/AnaBotin/status/1315338301839233024,Fri Jul 25 10:20:02 +0000 2014,2020-10-11 17:07:43,386,27,repNone,,True,"Enhorabuena, Rafa! https://t.co/fBqEqrOCqD"
https://twitter.com/AnaBotin/status/1315294393117618176,Fri Jul 25 10:20:02 +0000 2014,2020-10-11 14:13:14,869,101,repNone,,False,".@RafaelNadal ha demostrado muchas veces que es mucho más que un número uno en el tenis y hoy a por la victoria número 100! #VamosRafa, por el deporte y por la persona que eres. https://t.co/O3tysFZiOJ"
https://twitter.com/AnaBotin/status/1314904363148730376,Fri Jul 25 10:20:02 +0000 2014,2020-10-10 12:23:24,8,2,rep1314210186622509056,wendykopp,False,"@wendykopp @south_summit It was my pleasure, Wendy. You’re a truly inspirational leader and your work to give access to education to thousands of children worldwide is remarkable. Thank you for your time!"
https://twitter.com/AnaBotin/status/1314904140343062528,Fri Jul 25 10:20:02 +0000 2014,2020-10-10 12:22:31,70,2,rep1313922408282193921,anadeluis,False,"@anadeluis @bancosantander Ana, somos conscientes de la dificultad que la modernización de nuestros cajeros tiene en las personas con discapacidad visual y estamos trabajando para solucionarlo cuanto antes: tendremos un sistema de guiado por voz antes de final de febrero. Un abrazo."
https://twitter.com/AnaBotin/status/1313764328420630534,Fri Jul 25 10:20:02 +0000 2014,2020-10-07 08:53:19,75,16,repNone,,True,Banks have a major role to play to help people and businesses get back on their feet. But how the public and private sectors work together in the coming months will make the difference.  Join us today to reflect on how to rebuild better at #SantanderIBC https://t.co/b6dwSIOOKN
https://twitter.com/AnaBotin/status/1313429040548773888,Fri Jul 25 10:20:02 +0000 2014,2020-10-06 10:41:00,66,12,repNone,,False,"Join us today at @south_summit to talk about Education with the great @WendyKopp. These past 13 years, Wendy has been leading @TeachForAll, a global network that takes on the challenges of educational inequity to ensure all children have the opportunity to fulfill their potential https://t.co/zJauRdAduk"
https://twitter.com/AnaBotin/status/1312058785100333057,Fri Jul 25 10:20:02 +0000 2014,2020-10-02 15:56:05,3,1,rep1311263269689143297,mbenjucv,False,"@mbenjucv @wendykopp @TeachForAll @bancosantander Thank you, María. Looking forward to joining you in this year’s #SouthSummit2020"
https://twitter.com/AnaBotin/status/1311713650886012928,Fri Jul 25 10:20:02 +0000 2014,2020-10-01 17:04:39,47,11,repNone,,True,"The EU’s response to COVID shows that our strength is in our union. To make Europe competitive in the digital age and more resilient in the future, we must take this opportunity to integrate our market further and ensure we play by the same rules. https://t.co/iieB51RDRM"
https://twitter.com/AnaBotin/status/1310281816478285831,Fri Jul 25 10:20:02 +0000 2014,2020-09-27 18:15:03,3,1,rep1306677327473127424,cosnet_bifi,False,"@cosnet_bifi Thank you, Yamir for your work."
https://twitter.com/AnaBotin/status/1309216806004023296,Fri Jul 25 10:20:02 +0000 2014,2020-09-24 19:43:05,6,0,rep1309139410882048003,TinaBrownLM,False,"@TinaBrownLM @sirharryevans My sincere condolences to you and your family, Tina."
https://twitter.com/AnaBotin/status/1308338307386966016,Fri Jul 25 10:20:02 +0000 2014,2020-09-22 09:32:14,157,35,repNone,,True,"Only by working together -public and private sectors- will we successfully tackle global challenges, from climate change to inequality. That spirit of global co-operation is what the UN @GlobalCompact is all about and, in these uncertain times, we need it more than ever. https://t.co/8GYx4pQUnZ"
https://twitter.com/AnaBotin/status/1307366622043295745,Fri Jul 25 10:20:02 +0000 2014,2020-09-19 17:11:07,192,32,repNone,,False,"#RBG made the world a better place. In her own words to @irin we should remember her as “someone who used whatever talent she had (...) to help repair tears in her society, to make things a little better."" Thank you, Ruth.  https://t.co/Nx3XDqzjJm"
https://twitter.com/AnaBotin/status/1305910004931756032,Fri Jul 25 10:20:02 +0000 2014,2020-09-15 16:43:02,62,14,repNone,,False,"Our fintech venture capital fund is now @mourocapital. It’s time we build on its success to accelerate our digital transformation. As Manuel explains, the conversation about the pillars of banking and the boundaries of the industry has changed. So have we. https://t.co/NB1FzeKtqh"
https://twitter.com/AnaBotin/status/1305815902307471363,Fri Jul 25 10:20:02 +0000 2014,2020-09-15 10:29:06,5,2,rep1305445847476457472,a_sciammarella,False,"@a_sciammarella Bonito recuerdo, gracias por compartirlo, Agustín."
https://twitter.com/AnaBotin/status/1305815054005219329,Fri Jul 25 10:20:02 +0000 2014,2020-09-15 10:25:44,2,0,rep1304287986142543872,Amolinavarro,False,"@Amolinavarro @euromoney @bancosantander Gracias por la recomendación, Antonio. El testimonio de Tosin es muy valioso."
https://twitter.com/AnaBotin/status/1305814010558853120,Fri Jul 25 10:20:02 +0000 2014,2020-09-15 10:21:35,2,1,rep1305410440814637057,martagvalenzuel,False,"@martagvalenzuel @TalengoINT Gracias, Marta."
https://twitter.com/AnaBotin/status/1305768114735517696,Fri Jul 25 10:20:02 +0000 2014,2020-09-15 07:19:13,2,0,rep1304207134150729729,JamesCostos,False,"@JamesCostos Many thanks, James."
https://twitter.com/AnaBotin/status/1305574218667618308,Fri Jul 25 10:20:02 +0000 2014,2020-09-14 18:28:44,85,39,repNone,,False,"This article in Nature gives evidence-based clues to fight a second wave of COVID. Proactive testing, good contact tracing and selective household quarantines allow for a gradual and safe reopening of the economy without a collapse of the healthcare system https://t.co/JV9mU3J5nv"
https://twitter.com/AnaBotin/status/1304127459802128390,Fri Jul 25 10:20:02 +0000 2014,2020-09-10 18:39:50,86,20,repNone,,False,We are proud that our teams' work in diversity and inclusion has been recognised by @euromoney. We have ambitious targets and are starting to see real progress. Diversity is a must for companies. It is the right thing to do and good for business: https://t.co/opULLjIB3w
https://twitter.com/AnaBotin/status/1304099310112518146,Fri Jul 25 10:20:02 +0000 2014,2020-09-10 16:47:59,352,56,repNone,,False,This is great news. Delighted to see another female CEO in banking. Many congratulations Jane. https://t.co/eMW5B0SUpP
https://twitter.com/AnaBotin/status/1304060049128595456,Fri Jul 25 10:20:02 +0000 2014,2020-09-10 14:11:58,1,0,rep1301912706275045377,dani_tapon,False,"@dani_tapon @vbmgs Gracias, Dani. Con el BEI tenemos una oferta en línea con lo que sugieres: siempre que la inversión contribuya a mejorar la eficiencia energética, el préstamo tendrá un tipo de interés preferente. Tienes más información en la web de @santander_es"
https://twitter.com/AnaBotin/status/1301905043654938625,Fri Jul 25 10:20:02 +0000 2014,2020-09-04 15:28:45,8,1,rep1300551247662141440,vbmgs,False,"@vbmgs Gracias a ti, Valentina, por el trabajo que habéis hecho para sacar adelante el Festival en estas circunstancias y por el excelente programa! Un abrazo."
https://twitter.com/AnaBotin/status/1301904379906338817,Fri Jul 25 10:20:02 +0000 2014,2020-09-04 15:26:07,49,2,rep1301083642052182017,joaquinmencia,False,"@joaquinmencia @i_Zata @BrunoCendon Hola Joaquín, te contacta Vicky de mi equipo para que nos cuentes un poco más tu idea. Un abrazo."
https://twitter.com/AnaBotin/status/1300355014255415297,Fri Jul 25 10:20:02 +0000 2014,2020-08-31 08:49:29,6,2,rep1299274128973869056,GirlMOVEAcademy,False,@GirlMOVEAcademy @bancosantander Loved sharing time with these amazing girls. Thank you!
https://twitter.com/AnaBotin/status/1300081301932957701,Fri Jul 25 10:20:02 +0000 2014,2020-08-30 14:41:51,26,8,rep1300081097322176517,AnaBotin,False,"We all must learn to live with the virus in a responsible way. It can be done. Many thanks to Valentina for her leadership, supported by Jaime Martín, and by the Government of Cantabria, the City of Santander and all the sponsors, as well as to those attending the concerts."
https://twitter.com/AnaBotin/status/1300081097322176517,Fri Jul 25 10:20:02 +0000 2014,2020-08-30 14:41:02,29,6,rep1300080916128305152,AnaBotin,True,"Tonight it is the closing concert with the @OCNesp lead by Jaime Martín, doing a super program: “all Beethoven” with his Second and Fifth symphonies, sponsored by @FBancoSantander.  https://t.co/Zk7T0cpZe9"
https://twitter.com/AnaBotin/status/1300080916128305152,Fri Jul 25 10:20:02 +0000 2014,2020-08-30 14:40:19,67,9,repNone,,False,"On Friday we were spoilt by Marc Minkowski and the Musiciens du Louvre who played the most amazing Mozart. @FestSantander, together with Salzburg, is one of the few to go ahead this summer. https://t.co/NTZLD3Wlr2"
https://twitter.com/AnaBotin/status/1299043023448309761,Fri Jul 25 10:20:02 +0000 2014,2020-08-27 17:56:06,31,13,rep1299042911254917120,AnaBotin,False,"Persistently low rates &amp; QE are inflating stocks, house prices, but bad news for the asset poor, like young people. This is very likely to increase inequality. Other policies and reforms are needed.  https://t.co/HBJ1RuZQo0"
https://twitter.com/AnaBotin/status/1299042911254917120,Fri Jul 25 10:20:02 +0000 2014,2020-08-27 17:55:39,64,19,repNone,,False,"This year's Jackson Hole meeting of central bankers is virtual, but one of the most important in recent memory. Central banks should be commended for unprecedented measures they have taken to avert a meltdown in the global economy. But they cannot do it all alone."
https://twitter.com/AnaBotin/status/1298598307414134785,Fri Jul 25 10:20:02 +0000 2014,2020-08-26 12:28:57,169,51,repNone,,True,"Este estudio de @SJDbarcelona_Es, que hemos apoyado, es de los más amplios que se han hecho a nivel internacional para conocer cómo transmiten los niños el COVID a otros menores o adultos. Sus conclusiones pueden ayudar a que la vuelta al colegio se haga con seguridad para todos. https://t.co/c3yZ5ALVKt"
