id,Account Created At(same for all rows),status created_at,Fav_cont,retweeted_count,reply_to_status,reply_to_screen,quote,text
https://twitter.com/andreasartori94/status/1339121355237814272,Wed Jun 10 06:39:18 +0000 2015,2020-12-16 08:13:05,14,6,repNone,,False,The change in the net results of a selection of European top clubs which have published their accounts shows the massive impact of the pandemic. @Football_BM https://t.co/5errfNxTpi
https://twitter.com/andreasartori94/status/1336238632265453568,Wed Jun 10 06:39:18 +0000 2015,2020-12-08 09:18:10,4,0,repNone,,False,"I will participate in a panel discussion at the virtual week program of the @IscBiz on Thursday. Along with @Dan Jones, Global Lead Partner for Sport Business at Deloitte, we will discuss the global landscape of football finance. https://t.co/1o2XFIc7NH https://t.co/sBcebUyvv7"
https://twitter.com/andreasartori94/status/1334513317675724800,Wed Jun 10 06:39:18 +0000 2015,2020-12-03 15:02:23,2,0,repNone,,False,"Following Serie A's plans, #Bundesliga might become the next league to seek PE investments, according to the FT.  &gt; 20 firms have reportedly expressed an interest in a stake worth around EUR 200-300m in a new DFL digital media company (valued at more than EUR 1bn). #KPMGFBM https://t.co/mzT4xbsfK2"
https://twitter.com/andreasartori94/status/1333794707781029892,Wed Jun 10 06:39:18 +0000 2015,2020-12-01 15:26:53,2,2,repNone,,False,"While the 2 most prominent multi-club portfolios represent different overall strategies, they share the ambition to yield a competitive advantage from global brand exposure, synchronised business operation and player development opportunities @Football_BM: https://t.co/aIYRc5Pf7O https://t.co/UOnIeTk1b0"
https://twitter.com/andreasartori94/status/1331523154326548480,Wed Jun 10 06:39:18 +0000 2015,2020-11-25 09:00:33,0,0,rep1331523116502315008,andreasartori94,False,"Should the stadium remain closed to fans, however, the club estimates a potential loss in revenues exceeding GBP 150m for the current financial year."
https://twitter.com/andreasartori94/status/1331523116502315008,Wed Jun 10 06:39:18 +0000 2015,2020-11-25 09:00:24,2,0,rep1331522922373132288,andreasartori94,False,"Worth mentioning that in recent years THS has been one of the most profitable sports clubs globally. In contrast to most clubs whose matchday revenues decreased, Spurs were able to increase revenues from matchdays as they (partially) played their first season in their new stadium"
https://twitter.com/andreasartori94/status/1331522922373132288,Wed Jun 10 06:39:18 +0000 2015,2020-11-25 08:59:37,2,0,repNone,SpursOfficial,False,"@SpursOfficial have disclosed their financial results for the FY ending 30 June 2020 revealing a loss of GBP 64m and a 13% decrease in operating revenues, mainly because of lower Champions League receipts.  #KPMGFBM https://t.co/zXxcMqPLJG"
https://twitter.com/andreasartori94/status/1328997255551066112,Wed Jun 10 06:39:18 +0000 2015,2020-11-18 09:43:31,4,0,repNone,,False,"Although the overall impact of the coronavirus pandemic on the football ecosystem has been devastating, the transaction market remained active, albeit at a lower level, indicating longer-term investor interests in football.  #KPMGFBM https://t.co/exvWy3N8oA https://t.co/ZQ0Q2AIyk0"
https://twitter.com/andreasartori94/status/1326836769380327426,Wed Jun 10 06:39:18 +0000 2015,2020-11-12 10:38:31,0,0,repNone,ManUtd,False,"@ManUtd saw a 9% rise in their share price in the space of a few hours after a breakthrough in the Covid-19 vaccine research was reported. Similarly, the stock performance of other listed clubs across Europe, such as Juventus and Borussia Dortmund confirmed this trend. https://t.co/08IbITSB4Z"
https://twitter.com/andreasartori94/status/1326099822844256256,Wed Jun 10 06:39:18 +0000 2015,2020-11-10 09:50:10,7,0,repNone,,False,"Over the last five financial years, 7 times UCL winners @acmilan have accumulated EUR 615m in net losses. However, this season might be a turning point if the Rossoneri could keep up their strong on-pitch performance and qualify for the UCL for the first time since 2013. https://t.co/nNFljazCZp"
https://twitter.com/andreasartori94/status/1324641708559261696,Wed Jun 10 06:39:18 +0000 2015,2020-11-06 09:16:08,4,1,repNone,,False,Five out of the six largest Italian clubs suffered a significant increase in net losses after tax for the FY 2019/20.  @Football_BM https://t.co/qyMWLaWrxk
https://twitter.com/andreasartori94/status/1323905524858081280,Wed Jun 10 06:39:18 +0000 2015,2020-11-04 08:30:48,16,1,repNone,,False,"Accelerated by the pandemic, football clubs have turned to a more entertainment-focused business model – vastly different from traditional operations. Esports is a relatable and somewhat similar industry, making it a logical step in such a transformation. https://t.co/jamdpKxf6D https://t.co/HX3p9pldsG"
https://twitter.com/andreasartori94/status/1321769828198338563,Wed Jun 10 06:39:18 +0000 2015,2020-10-29 11:04:18,1,0,repNone,,False,"Decreasing revenues due to #COVID19 and non-participation in the #UCL have turned the previous FY’s profits into a GBP 23m loss after tax for 2019-20, as @ManUtd's unaudited financial statements reveal. Also, a worsening liquidity position has led to a total net debt of GBP 474m. https://t.co/sxMSXswRss"
https://twitter.com/andreasartori94/status/1321065582171705349,Wed Jun 10 06:39:18 +0000 2015,2020-10-27 12:25:53,2,1,repNone,Football_BM,False,"@Football_BM's latest player valuation update shows only a slow recovery of market values for the top 100 / 500 football players over the last valuation period, which reflects the uncertainty in the football industry due to the pandemic. https://t.co/oGXf1E2n7O"
https://twitter.com/andreasartori94/status/1316268416643276801,Wed Jun 10 06:39:18 +0000 2015,2020-10-14 06:43:40,3,0,repNone,,False,"Apart from the #EPL, all other leagues have recorded a significant drop in deal values compared to previous summer transfer windows. @ChelseaFC, EPL’s prime spender, have invested into their squad almost as much as all the clubs from the German #Bundesliga combined. @Football_BM https://t.co/lRqk5zCnIp"
https://twitter.com/andreasartori94/status/1314206124762038274,Wed Jun 10 06:39:18 +0000 2015,2020-10-08 14:08:51,7,3,repNone,,False,"The impact of Covid-19 on the financial results of @FCBarcelona and @juventusfc. Unfortunately, more negative news to come in the coming weeks☹  @Football_BM https://t.co/Rcvhmskj8L"
https://twitter.com/andreasartori94/status/1313797439074250752,Wed Jun 10 06:39:18 +0000 2015,2020-10-07 11:04:53,4,0,repNone,,False,"The first effects of the virus on football clubs’ financials become visible, as clubs start to announce draft key financials for the 2019-20 season. @FCBarcelona have reported 97m loss after tax and a 271m increase in net debt compared to the previous “Covid-free” 2018-19 season. https://t.co/q0ySsgljWE"
https://twitter.com/andreasartori94/status/1312029024479305728,Wed Jun 10 06:39:18 +0000 2015,2020-10-02 13:57:50,3,0,repNone,,False,A research by @FIFPro in coordination with @Football_BM reveals that the upcoming World Cup qualifiers in South America feature risk for players due to the significant travel burdens during Covid19 times.  Read more here: https://t.co/EfuRrfEbGR
https://twitter.com/andreasartori94/status/1311629522714988546,Wed Jun 10 06:39:18 +0000 2015,2020-10-01 11:30:21,2,0,repNone,,False,"With the last play-off matches completed yesterday, all participants to today’s #UEFA @ChampionsLeague  draw have been revealed. Interestingly, clubs in pot 2 record a higher accumulated squad market value than clubs in pot 1.  @Football_BM https://t.co/DBgMXUDEPG"
https://twitter.com/andreasartori94/status/1311196611259891712,Wed Jun 10 06:39:18 +0000 2015,2020-09-30 06:50:07,3,1,repNone,,False,"At least for some time, sponsors are not going to pay pre-Covid prices for stadium naming rights. Read more in @Football_BM’s latest article: https://t.co/atdMsuXYQo https://t.co/5bnVUlw1yS"
https://twitter.com/andreasartori94/status/1308740661559078912,Wed Jun 10 06:39:18 +0000 2015,2020-09-23 12:11:03,5,1,repNone,,False,"American based Krause Group represents the latest US investment in Italy’s Serie A with its purchase of the controlling interests in Parma Calcio 1913. In a deal that values the club reportedly at more than EUR 100 million, Krause Group has acquired 90% of the club’s shares. https://t.co/ytKPj1AEzm"
https://twitter.com/andreasartori94/status/1306507565233246210,Wed Jun 10 06:39:18 +0000 2015,2020-09-17 08:17:31,13,2,repNone,,False,"With no further pandemic pauses that led to pay cuts last spring, the 10 highest-paid footballers have increased their aggregate income from salary, bonuses and endorsements by 11% from the last season bringing it up to EUR 484m, according to a @Forbes’ ranking. https://t.co/xNj7rF542E"
https://twitter.com/andreasartori94/status/1305489097914552324,Wed Jun 10 06:39:18 +0000 2015,2020-09-14 12:50:30,6,1,repNone,,False,"The board of directors of @juventusfc has approved the financial statement for the FY ended 30 June '20, reporting a net loss of EUR 71.4m mainly due to the effects of COVID-19. While op. revenues decreased, a reduction of op. costs cushioned the financial impacts. @Football_BM https://t.co/AFLObjQN1N"
https://twitter.com/andreasartori94/status/1304347986290520065,Wed Jun 10 06:39:18 +0000 2015,2020-09-11 09:16:08,0,0,repNone,SerieA,False,@SerieA is establishing a media company - with private equity firms - overseeing the league’s media marketing rights for the next 10 years. 2 consortiums have reportedly offered EUR 1.350B (Bain/NB Renaissance) and EUR 1.625B (CVC/Advent/FSI) for a 10% stake in the joint-venture. https://t.co/Wgq2Pi3TN3
https://twitter.com/andreasartori94/status/1303250613363453954,Wed Jun 10 06:39:18 +0000 2015,2020-09-08 08:35:34,7,1,repNone,,False,City Football Group have added French side @estac_officiel  to their portfolio – the 10th club which has now become part of CFG’s investments. @Football_BM https://t.co/oOFGViwb9j
https://twitter.com/andreasartori94/status/1302171400166354944,Wed Jun 10 06:39:18 +0000 2015,2020-09-05 09:07:09,2,1,repNone,,False,"Between May and August '20, @Football_BM' player MV estimations have seen an overall increase of 3.8% taking into account players from Europe’s major 10 leagues – @FCBayern' A. Davies stands out with his stunning performance over the past months. https://t.co/EW2iQArFYN https://t.co/BxuBS8tn72"
https://twitter.com/andreasartori94/status/1301524719649292288,Wed Jun 10 06:39:18 +0000 2015,2020-09-03 14:17:28,3,0,repNone,,False,"Comparing the most recent @Football_BM player market values to pre-COVID-19 figures from February, and to May 2020, we can recognize a slight recovery of values in the major 10 European leagues. More insights: https://t.co/EW2iQArFYN https://t.co/i6H5UDfTYX"
https://twitter.com/andreasartori94/status/1300826284751233026,Wed Jun 10 06:39:18 +0000 2015,2020-09-01 16:02:09,0,2,repNone,,False,"RT @KPMG_Italy: L’effetto #Messi su #Inter e #SerieA avrebbe un impatto enorme, ben più significativo di quello su #ManchesterCity e #Premi…"
https://twitter.com/andreasartori94/status/1291679444797726722,Wed Jun 10 06:39:18 +0000 2015,2020-08-07 10:15:52,2,0,rep1291679402447822849,andreasartori94,False,The transaction will be effected through a sale to Friedkin of AS Roma SPV’s entire 86.6% shares into the club. The value of the whole operation has been disclosed to be equal to approximately EUR 591m.
https://twitter.com/andreasartori94/status/1291679402447822849,Wed Jun 10 06:39:18 +0000 2015,2020-08-07 10:15:42,5,2,repNone,,False,"AS Roma SPV, the majority shareholder of AS Roma S.p.A., will sell to American-based Friedkin Group its controlling interest in the club &amp; certain related assets, including the funds it made available to support the foreseen capitalization &amp; some liabilities assumed by the club. https://t.co/Skm9oZwdaT"
https://twitter.com/andreasartori94/status/1291264096969654272,Wed Jun 10 06:39:18 +0000 2015,2020-08-06 06:45:25,4,0,repNone,,False,Middle Eastern brands have increasingly turned to some of the most prominent football clubs for sponsorship opportunities. #Emirates has emerged as the third-largest sponsor of European football behind adidas and Nike. Read @Football_BM: https://t.co/WqVJhSvHgR https://t.co/xPmxE1nOJI
https://twitter.com/andreasartori94/status/1290663101956792320,Wed Jun 10 06:39:18 +0000 2015,2020-08-04 14:57:17,3,2,repNone,Football_BM,False,"@Football_BM's Club Finance and Operations Tool provides a newly introduced feature on sponsorships including more than 5,200 commercial deals across 400 football clubs and competitions from 35 countries Read our article covering key trends in sponsorship: https://t.co/TW91FTDkkN https://t.co/80EesUwcJ6"
https://twitter.com/andreasartori94/status/1285506548102565893,Wed Jun 10 06:39:18 +0000 2015,2020-07-21 09:26:59,6,0,repNone,,False,"The total value of sponsorship across the big five football leagues in 2020 is more than EUR 3.3 billion annually according to @Football_BM, with the top 10 clubs by shirt sponsorship and kit deal value generating more than one-third of the total.  https://t.co/TW91FTDkkN https://t.co/Pd6u0ZpZHm"
https://twitter.com/andreasartori94/status/1283708467107291137,Wed Jun 10 06:39:18 +0000 2015,2020-07-16 10:22:03,2,0,repNone,,False,Watch @TifoFootball_'s video covering @Football_BM's 2020 analysis of European’s most valuable clubs and our expectations of the devaluation of the football industry due to the impacts of the coronavirus pandemic.   https://t.co/ncFyQJCoSk
https://twitter.com/andreasartori94/status/1282709914234822657,Wed Jun 10 06:39:18 +0000 2015,2020-07-13 16:14:09,1,0,repNone,ManCity,False,"@ManCity have overturned their two-year ban from European club competitions as #CAS cleared the club of ""disguising equity funds as sponsorship contributions” and thus got cleared to play in the @ChampionsLeague next season. https://t.co/VMPoQuLt7G"
https://twitter.com/andreasartori94/status/1281130438392766465,Wed Jun 10 06:39:18 +0000 2015,2020-07-09 07:37:53,20,4,repNone,,False,"For upcoming transfer windows, we expect a decrease in the volume of transactions and in the transfer fees, as well as an increase in the number of swap and loan deals due to clubs’ financial restraints caused by the coronavirus pandemic.  @Football_BM https://t.co/OWm4BzwXOb"
https://twitter.com/andreasartori94/status/1280419679023108097,Wed Jun 10 06:39:18 +0000 2015,2020-07-07 08:33:35,2,0,repNone,,False,Our most recent article @Football_BM elaborates on the possible effects of the coronavirus on future stadia architecture and its immediate impact on matchday revenues. https://t.co/r4tKYI3ZDw https://t.co/UrdUHVPQRp
https://twitter.com/andreasartori94/status/1278956128857206784,Wed Jun 10 06:39:18 +0000 2015,2020-07-03 07:37:57,4,1,rep1278955826242301954,andreasartori94,False,"As Arthur is reportedly being sold for 72 M, Barca’s profit is around 52 M: sale price less remaining book value of 20 M – the concept of profit on disposal of players’ registrations. Pjanic is sold for 60 M bringing a profit to Juve of about 47 M (remaining book value of 13 M)."
https://twitter.com/andreasartori94/status/1278955826242301954,Wed Jun 10 06:39:18 +0000 2015,2020-07-03 07:36:45,8,7,repNone,FCBarcelona,False,@FCBarcelona and @juventusfc have boosted their profits by approximately EUR 50 M each with their Arthur-Pjanic swap for the FY 2019/20. https://t.co/sZoFSzxVlV
https://twitter.com/andreasartori94/status/1278268003281485824,Wed Jun 10 06:39:18 +0000 2015,2020-07-01 10:03:35,36,10,repNone,,False,"#Bundesliga final standing vs. individual squad market values at the beginning and at the end of the ‘19/’20 season: a very strong correlation! In simple terms: more money, better players, higher chances of success… @Football_BM https://t.co/Vtf3bXm4vZ"
https://twitter.com/andreasartori94/status/1276114729535254530,Wed Jun 10 06:39:18 +0000 2015,2020-06-25 11:27:15,1,1,repNone,LaLiga,False,"@LaLiga clubs have improved their overall financial performance in all aspects in the 2018/19 season, increasing their accumulated total operating revenues by almost 10% compared to the previous season. https://t.co/anmIBk4vRA"
https://twitter.com/andreasartori94/status/1275353663637241856,Wed Jun 10 06:39:18 +0000 2015,2020-06-23 09:03:02,2,1,repNone,,False,"Taking into account players’ devaluation and the performance of the largest listed clubs in recent months, KPMG’s forecast of the devaluation of the football sector (top end of the market) is between 20% and 25%. @Football_BM   https://t.co/162ubcz1zq"
https://twitter.com/andreasartori94/status/1272822122340024320,Wed Jun 10 06:39:18 +0000 2015,2020-06-16 09:23:36,2,0,rep1272822081315581953,andreasartori94,False,"with a 58% growth in total operating revenues last year and cumulative profits of EUR 71 million over the last 8 years, mainly driven by player trading activities. In 2019, their staff cost to total revenue ratio was only at 51.7% - the lowest among all Serie A clubs."
https://twitter.com/andreasartori94/status/1272822081315581953,Wed Jun 10 06:39:18 +0000 2015,2020-06-16 09:23:26,17,4,repNone,,False,"Since the takeover of Antonio Percassi in 2010, @Atalanta_BC Atalanta BC have developed from a Serie B club to a @ChampionsLeague quarter-finalist. The impressive growth is also reflected in their financial development:... https://t.co/pTGpRiQ1z4"
https://twitter.com/andreasartori94/status/1270611745925738498,Wed Jun 10 06:39:18 +0000 2015,2020-06-10 07:00:21,3,1,repNone,,False,Global players union for professional footballers @FIFPro in association with @Football_BM has prepared the '2020 Raising Our Game' report which analyzes challenges and opportunities in women’s football Read Football Benchmark’s article covering findings: https://t.co/KEPjPotxAe
https://twitter.com/andreasartori94/status/1269912793152618497,Wed Jun 10 06:39:18 +0000 2015,2020-06-08 08:42:58,0,1,repNone,premierleague,False,"@premierleague exhibited its dominance with 9 clubs in the top 32, accounting for 41% of total aggregate EV. @LaLiga still 2nd with 7 clubs accounting for 23%, then @Bundesliga_DE whose 3 clubs show higher aggregate EV (13%) than 6 clubs of @SerieA (12%). https://t.co/xIl3gjqV2d https://t.co/iGun7B2iYx"
https://twitter.com/andreasartori94/status/1268536220222738432,Wed Jun 10 06:39:18 +0000 2015,2020-06-04 13:32:57,0,0,rep1268536078312636421,andreasartori94,False,"Although the two Milan giants are both at the bottom of this ranking, the reasons vary significantly. @acmilan seem to be stuck after their ownership turmoil: operating revenues are at the same level as five years ago. In contrast, @Inter are slowly balancing their books."
https://twitter.com/andreasartori94/status/1268536078312636421,Wed Jun 10 06:39:18 +0000 2015,2020-06-04 13:32:23,5,0,repNone,,False,The @SpursOfficial's astonishing achievement derives from the ability to combine operating revenue growth and cost efficiency with astute player trading activities. Their new stadium will likely deliver multiple benefits for the club going forward. https://t.co/xIl3gjqV2d https://t.co/pydc0hddmf
https://twitter.com/andreasartori94/status/1268196380406960129,Wed Jun 10 06:39:18 +0000 2015,2020-06-03 15:02:33,1,0,rep1268196306201333761,andreasartori94,False,"Whether a similar development will be recorded throughout the upcoming years remains questionable, as the coronavirus pandemic heavily affects the football ecosystem. However, immediate impacts on individual clubs’ values cannot yet be quantified."
https://twitter.com/andreasartori94/status/1268196306201333761,Wed Jun 10 06:39:18 +0000 2015,2020-06-03 15:02:16,1,0,rep1268196258134573057,andreasartori94,False,"Since our first edition in 2016, the aggregate EV of the 32 clubs has grown by 51% and EUR 13.4 billion in absolute terms. To put in context the STOXX Europe 50 Index has grown by 13% in the same timeframe."
https://twitter.com/andreasartori94/status/1268196258134573057,Wed Jun 10 06:39:18 +0000 2015,2020-06-03 15:02:04,5,0,repNone,,False,"As of our valuation date January 1, 2020, the overall enterprise value of the 32 most prominent European football clubs has increased to EUR 39.7 billion which means an annual growth of 12% and an increase for the fourth consecutive year.  https://t.co/xIl3gjqV2d @Football_BM https://t.co/IViCcaCHmc"
https://twitter.com/andreasartori94/status/1266301337907552258,Wed Jun 10 06:39:18 +0000 2015,2020-05-29 09:32:20,0,1,repNone,,False,"Besides the clubs who have grown most in absolute terms 2016-2020 (@LFC 1,385M; @SpursOfficial 1,266M; @PSG_inside 1,068M), “Football Clubs’ Valuation: The European Elite” ranks the top &amp; bottom regarding relative EV growth over same period  @Football_BM https://t.co/xIl3gjIvTL https://t.co/7Laj60A4Pj"
https://twitter.com/andreasartori94/status/1265885037616082944,Wed Jun 10 06:39:18 +0000 2015,2020-05-28 05:58:06,47,26,repNone,,False,"In the just-published “Football Clubs' Valuation: The European Elite 2020”, @realmadrid and @ManUtd maintained 1st and 2nd while @FCBarcelona returned to the podium of the Enterprise Value ranking after only 1 year of absence. @Football_BM  Find out more: https://t.co/xIl3gjqV2d https://t.co/r1dxTPVj2X"
https://twitter.com/andreasartori94/status/1265511246545199110,Wed Jun 10 06:39:18 +0000 2015,2020-05-27 05:12:47,23,3,repNone,,False,"Tomorrow, KPMG Football Benchmark will publish its fifth annual report to provide an indication of the Enterprise Value (EV) of the 32 most prominent European football clubs as at 1 January 2020: “Football Clubs’ Valuation: The European Elite 2020”.  @Football_BM https://t.co/lviP9y0WK6"
https://twitter.com/andreasartori94/status/1263013187529715712,Wed Jun 10 06:39:18 +0000 2015,2020-05-20 07:46:24,0,0,repNone,,False,"Without live football, clubs face missed earnings and limited funds to invest in player trading: financial constraints are likely to lead to a decrease both in the volume of transactions and in the transfer fees. @Football_BM   https://t.co/eCBHeV3Fa7 https://t.co/PMwnc54fHE"
https://twitter.com/andreasartori94/status/1261204009597259777,Wed Jun 10 06:39:18 +0000 2015,2020-05-15 07:57:22,2,1,repNone,,False,Combined value of the squads in Europe’s 10 major football leagues will see an immense decline - regardless of whether season will be completed or canceled. @Football_BM has analyzed the impacts of #COVID19 on football players’ market values in a report: https://t.co/eCBHeV3Fa7 https://t.co/HwJqUYUa77
https://twitter.com/andreasartori94/status/1260225097434005510,Wed Jun 10 06:39:18 +0000 2015,2020-05-12 15:07:31,0,1,repNone,,False,"In case of cancellation of the 10 most prominent European leagues, clubs would see an aggregate drop in player market values of almost EUR 10 B. Watch the latest episode of SKY Football Benchmark COVID-19 special  English subtitles available @Football_BM https://t.co/uqi3gmiXiy"
https://twitter.com/andreasartori94/status/1257937737837170688,Wed Jun 10 06:39:18 +0000 2015,2020-05-06 07:38:22,3,2,repNone,,False,.@Football_BM has just issued a new report analyzing the impacts of COVID-19 on football players’ market values including two scenarios to re-estimate player values: cancellation of the season and restart with all matches played behind closed doors. https://t.co/eCBHeV3Fa7
https://twitter.com/andreasartori94/status/1257704331085832193,Wed Jun 10 06:39:18 +0000 2015,2020-05-05 16:10:54,1,0,repNone,,False,"This episode of the Sky Football Benchmark COVID-19 special covers how clubs try to ensure liquidity given the current lack of revenues. As @LucaMarchetti and I show, a common measure among all leagues are savings on staff costs.  @Football_BM  https://t.co/tYMWxCNSoq"
https://twitter.com/andreasartori94/status/1255855254157103104,Wed Jun 10 06:39:18 +0000 2015,2020-04-30 13:43:19,0,0,repNone,,False,"Once games return, tight schedules are inevitable. In the 3rd episode of Sky Football Benchmark’s #covid19 special, @LucaMarchetti and I analyze what the rescheduling of the calendars means for the resilience of players. Subtitles in English are available. https://t.co/VnFf7plUts"
https://twitter.com/andreasartori94/status/1255462140561014784,Wed Jun 10 06:39:18 +0000 2015,2020-04-29 11:41:14,0,3,repNone,,False,RT @Football_BM: 📺 Now – Sky Football Benchmark Speciale COVID-19. Our Italian speaking audience can tune into Sky Sport24 to watch the nex…
https://twitter.com/andreasartori94/status/1255085213186772992,Wed Jun 10 06:39:18 +0000 2015,2020-04-28 10:43:27,5,2,repNone,,False,"In the 2nd episode of Sky Football Benchmark’s special on #COVID19, @LucaMarchetti &amp; I analyze the effects on player trading activities. Arguably, player values will drop &amp; clubs with strong balance sheet might benefit in next transfer window @Football_BM  https://t.co/Pas25ypAMs"
https://twitter.com/andreasartori94/status/1254713637014568960,Wed Jun 10 06:39:18 +0000 2015,2020-04-27 10:06:57,0,3,repNone,,False,RT @Football_BM: Today – Sky Football Benchmark Speciale COVID-19. Our Italian speaking audience can tune into Sky Sport24 to watch the nex…
https://twitter.com/andreasartori94/status/1253973453822210054,Wed Jun 10 06:39:18 +0000 2015,2020-04-25 09:05:43,3,0,repNone,,False,"Given the current situation in professional football due to the corona-crisis, @LucaMarchetti from @SkySport and I have analyzed the impacts of the virus on revenues of football clubs.  English subtitles are available on @Football_BM's YouTube channel: https://t.co/FTFo6ZBpw0"
