id,Account Created At(same for all rows),status created_at,Fav_cont,retweeted_count,reply_to_status,reply_to_screen,quote,text
https://twitter.com/andreasartori94/status/1129295558319976448,Wed Jun 10 06:39:18 +0000 2015,2019-05-17 08:00:17,0,0,repNone,,False,"How did @ManCity and @PSG_inside become top football clubs and global brands due to Middle East investments in European football? ⚽  Antonio Di Cianni, Senior Advisor of KPMG, explains the correlation between money and sporting performance on @SkySport ➡ https://t.co/OMXTMfpaUH https://t.co/h1KZ476Pnr"
https://twitter.com/andreasartori94/status/1129042198425669633,Wed Jun 10 06:39:18 +0000 2015,2019-05-16 15:13:31,0,0,repNone,,True,"Tonight at 22.30, we will be on the air again on @SkySport 24📺  We will focus on Middle East ownership in European football,in particular on @ManCity and @PSG_inside  Antonio Di Cianni, Senior Advisor of KPMG, will analyze the correlation between money and sporting performance📊 https://t.co/7fRJhdAA4W"
https://twitter.com/andreasartori94/status/1128940894273642496,Wed Jun 10 06:39:18 +0000 2015,2019-05-16 08:30:58,1,1,repNone,,False,"Major league clubs and top teams from smaller leagues focus on the #UCL, which has increasingly been dominated by clubs from the big five European divisions ⚽  However, that also provides more chances for non-big five league clubs in the #UEL  Discover ➡ https://t.co/lbes99B3p9 https://t.co/n3N0AvYxJY"
https://twitter.com/andreasartori94/status/1128658770316406784,Wed Jun 10 06:39:18 +0000 2015,2019-05-15 13:49:54,7,2,repNone,,False,Let’s compare the total operating revenues of the big-five leagues in the 2017/2018 season 📊  @Football_BM @premierleague @LaLiga @Bundesliga_DE @Ligue1Conforama @SerieA https://t.co/kuVTBx2Hc3
https://twitter.com/andreasartori94/status/1128586237516947456,Wed Jun 10 06:39:18 +0000 2015,2019-05-15 09:01:41,1,0,repNone,,False,The difference in UEFA prize money – #UCL distributes around four times more money than the #UEL 🏆  Our chart shows only the fixed amounts for maximum sporting performance 📈Check out more ➡ https://t.co/lbes99B3p9  @Football_BM @kpmg @UEFA https://t.co/69nhQteJzZ
https://twitter.com/andreasartori94/status/1128569957565046784,Wed Jun 10 06:39:18 +0000 2015,2019-05-15 07:57:00,2,1,repNone,,False,"Spanish @LaLiga’s first division clubs altogether reached over EUR 3 bn total operating revenues in the past season, a year-on-year growth of 7% ⬆️  Aggregate staff costs and staff costs-to-revenue ratio increased, but the aggregate profit after tax remained stable at EUR 169 M📊 https://t.co/2bAxjOCafT"
https://twitter.com/andreasartori94/status/1128209187371143168,Wed Jun 10 06:39:18 +0000 2015,2019-05-14 08:03:26,3,0,repNone,,False,"Ahead of the 2018/2019 @ChampionsLeague and the @EuropaLeague finals, the KPMG Football Benchmark team have analysed some key factors that influenced the last stages of the two tournaments 🏆  Discover more ➡️https://t.co/lbes99B3p9  @Football_BM @KPMG @UEFA https://t.co/KlzIo5DxJY"
https://twitter.com/andreasartori94/status/1127879500665016320,Wed Jun 10 06:39:18 +0000 2015,2019-05-13 10:13:22,2,1,rep1127853777694941184,andreasartori94,False,"Key drivers of the 21% annual growth in revenues in the 17/18 season were broadcasting, commercial and transfer revenues 📊  The annual increase in commercial revenue was 34.1%, and 104.3% in player transfers, while audiovisual turnover surpassed the EUR 1.5bn mark ⬆️ https://t.co/AjtHw3o9ES"
https://twitter.com/andreasartori94/status/1127853777694941184,Wed Jun 10 06:39:18 +0000 2015,2019-05-13 08:31:09,4,2,repNone,,False,Spanish @LaLiga (the first and second divisions of Spain) registered revenues of EUR 4.48 billion for the 2017/18 season 📈  The 21% growth over the previous season is the largest positive annual change in recent years ⬆️  @Football_BM @kpmg https://t.co/Unsc6PYbzd
https://twitter.com/andreasartori94/status/1127159039367045121,Wed Jun 10 06:39:18 +0000 2015,2019-05-11 10:30:31,2,1,repNone,,False,"Though the La Liga title race is over, the fight for the top four spots still holds plenty of excitement.   Tomorrow, second-placed @Atleti host sixth-placed @SevillaFC in a clash that will have massive impact on the top-four race ⚽  @Football_BM @KPMG https://t.co/HFZwfxMfp3"
https://twitter.com/andreasartori94/status/1126887256487288832,Wed Jun 10 06:39:18 +0000 2015,2019-05-10 16:30:33,1,1,repNone,,False,How much do clubs in the top European leagues need to spend on staff costs to have better chances to enter the #UCL? 🏆  The @Football_BM team helps understand the context in his interview on @SkySport 24 ➡ https://t.co/0ylkXN3Jid https://t.co/m5FhuQ21AC
https://twitter.com/andreasartori94/status/1126834503660572672,Wed Jun 10 06:39:18 +0000 2015,2019-05-10 13:00:55,0,0,repNone,OfficialASRoma,False,"@OfficialASRoma will host champions @juventusfc on Sunday. The match is far more important for the hosts, as they are still battling to reach the 4° place in Serie A ⚽  The Giallorossi are in desperate need of a victory, if they still want to try to get the access to the #UCL 🏆 https://t.co/WDYkMnapTz"
https://twitter.com/andreasartori94/status/1126766661162266625,Wed Jun 10 06:39:18 +0000 2015,2019-05-10 08:31:20,1,0,repNone,,False,"It is the first time in football history that one nation sends all 4 teams to the finals of the top two European club cups ⚽  4 of the top 6 clubs of the EPL made it to the finals, making London the capital of football, represented by 3 clubs in the race for the #UCL and #UEL 🏆 https://t.co/ydfVoPDoms"
https://twitter.com/andreasartori94/status/1126537314753236993,Wed Jun 10 06:39:18 +0000 2015,2019-05-09 17:20:00,0,0,repNone,,True,"Tonight at 10.30PM, we will be on the air again on @SkySport 24 📺  The @Football_BM team will focus on the investment level needed to access the lucrative and top-flight UEFA Champions League competition 🏆 https://t.co/Hwf60z9HVZ"
https://twitter.com/andreasartori94/status/1126495318454013952,Wed Jun 10 06:39:18 +0000 2015,2019-05-09 14:33:07,2,1,repNone,,False,"✍️ @realmadrid and @adidas confirmed having renewed their kit supplier agreement.  The new deal will run until 2028 ➡️  According to media reports, the deal is worth EUR 1.1 billion – if confirmed, it will be the most lucrative kit deal in football history so far 💰  @Football_BM https://t.co/MIPcV7a4vF"
https://twitter.com/andreasartori94/status/1126418163812454405,Wed Jun 10 06:39:18 +0000 2015,2019-05-09 09:26:32,2,1,repNone,,False,"What another unbelievable match, with @SpursOfficial eliminating @AFCAjax in the #ULC semifinal ⚽  Tottenham’s first final makes them the 8th English team to play in the tournament’s final 🏆  Also, this will be the 3rd all-English final in the history of the European Cups 🏴󠁧󠁢󠁥󠁮󠁧󠁿 https://t.co/RdXDW02WC3"
https://twitter.com/andreasartori94/status/1126110349948850176,Wed Jun 10 06:39:18 +0000 2015,2019-05-08 13:03:24,1,0,repNone,,False,"AFC Ajax host Tottenham Hotspur in the Champions League semi-final second leg, with 1-0 away advantage ⚽  @AFCAjax are looking for a treble and seem to be in better form too. In contrast, @SpursOfficial won only one of their past four league games.  @Football_BM #AjaxTottenham https://t.co/RX4t1UAlKt"
https://twitter.com/andreasartori94/status/1126066872972128257,Wed Jun 10 06:39:18 +0000 2015,2019-05-08 10:10:38,2,1,repNone,,False,"And Liverpool made magic...What a football night!   @FCBarcelona had their chances, while @LFC turned their ones into goals ⚽  Goals scorers: Suarez and Messi on one side, Origi and Wijnaldum on the other – market values of the latter two may change a lot soon ⬆️  @Football_BM https://t.co/yJgD5lSzxv"
https://twitter.com/andreasartori94/status/1125748970138021893,Wed Jun 10 06:39:18 +0000 2015,2019-05-07 13:07:24,0,0,repNone,,False,"Liverpool FC would need magic to overturn a 3-0 deficit when they host FC Barcelona tonight in the #UCL semi-final second leg 🏆   @LFC will be the team having had less rest, after a tedious win at the weekend, while @FCBarcelona, rested almost all their key players on Saturday https://t.co/CnT4V4jErp"
https://twitter.com/andreasartori94/status/1125679038947786752,Wed Jun 10 06:39:18 +0000 2015,2019-05-07 08:29:31,4,1,repNone,,False,"How competitive is football in Europe? ⚽  Does @AFCAjax's remarkable performance in the #UCL say anything about the obvious dominance of the big 5 leagues?  Antonio Di Cianni, Senior Advisor of our team, helps understand the context in this interview ➡️ https://t.co/GzSXI8I4b8 https://t.co/8O8L6oZp2v"
https://twitter.com/andreasartori94/status/1125427447120506881,Wed Jun 10 06:39:18 +0000 2015,2019-05-06 15:49:47,2,2,repNone,,False,"Italian @SerieA sees a turbulent last phase of the season to decide who can join the UCL next season 🏆  @juventusfc and @sscnapoli already sealed their place, but the race among the clubs currently holding the spots 3rd-9th on the table remains fierce with just 3 games to play⚽ https://t.co/y7dTL0n5jC"
https://twitter.com/andreasartori94/status/1123989044759859201,Wed Jun 10 06:39:18 +0000 2015,2019-05-02 16:34:05,1,0,repNone,,True,"Tonight at 10.30PM, we will be on the air again on @SkySport 24 📺  The @Football_BM team will focus on the business environment of the best clubs outside of the Big 5 leagues ⚽ https://t.co/rOjYb8zvxz"
https://twitter.com/andreasartori94/status/1123859765317312513,Wed Jun 10 06:39:18 +0000 2015,2019-05-02 08:00:23,3,0,repNone,,False,"Regarding matchday revenues, @premierleague clubs earned 3 times more on aggregate than the @SerieA's ones in the past 6 seasons 🏟️  On average, EPL clubs have smaller and more modern stadia, with higher attendance and ticket prices, resulting in far better utilization, too ⬆️ https://t.co/hzUZGIZi19"
https://twitter.com/andreasartori94/status/1123613148626456577,Wed Jun 10 06:39:18 +0000 2015,2019-05-01 15:40:25,2,2,repNone,,False,"What could be a final tie, FC Barcelona host Liverpool Football Club tonight in the Champions League semi-final first leg ⚽  Can Liverpool repeat last year’s success of reaching the UCL final?   @Football_BM @FCBarcelona @LFC #BarçaLFC https://t.co/GCVyWnVvkl"
https://twitter.com/andreasartori94/status/1123520277915291648,Wed Jun 10 06:39:18 +0000 2015,2019-05-01 09:31:22,4,1,repNone,,False,"The @premierleague clubs have been cashing in three times more in operating revenues than the clubs of Italy’s @SerieA 📊  The gap has been widening – in the last 6 seasons, the EPL almost doubled their total operating revenue ⬆️  Watch ➡ https://t.co/1aSBIY7WrE  @Football_BM https://t.co/PdfNboJYKJ"
https://twitter.com/andreasartori94/status/1123229875157045251,Wed Jun 10 06:39:18 +0000 2015,2019-04-30 14:17:25,3,2,repNone,,False,UEFA Champions League and Europa League semi-finals: the four matches off the pitch 🏆   @Football_BM @SpursOfficial @AFCAjax @FCBarcelona @LFC @Arsenal @valenciacf @UEFAcom @ChampionsLeague @EuropaLeague #UCL #UEL https://t.co/aoGXZywS3B
https://twitter.com/andreasartori94/status/1123138875151593472,Wed Jun 10 06:39:18 +0000 2015,2019-04-30 08:15:49,6,1,repNone,,False,"The @premierleague has seen a spectacular development recently – in the last 5 seasons, EPL clubs almost doubled their total operating revenues, cashing in three times more in operating revenues than the clubs of @SerieA 📈  Discover more ➡ https://t.co/1aSBIY7WrE  @Football_BM https://t.co/HE6YLNtFAP"
https://twitter.com/andreasartori94/status/1122855746469879808,Wed Jun 10 06:39:18 +0000 2015,2019-04-29 13:30:46,3,1,repNone,,False,🏆@FCBarcelona sealed their eighth La Liga title in the last 11 seasons with a 1-0 win over Levante on Saturday.   The Catalans still have the chance to win the treble - they face Liverpool in the Champions League semi-final and Valencia in the Copa del Rey final⚽  @Football_BM https://t.co/49D1DFt8G1
https://twitter.com/andreasartori94/status/1122562567136862208,Wed Jun 10 06:39:18 +0000 2015,2019-04-28 18:05:46,1,0,repNone,,True,I love these football emotions...@SUFC_tweets https://t.co/MymKvC4Auo
https://twitter.com/andreasartori94/status/1121761256904511489,Wed Jun 10 06:39:18 +0000 2015,2019-04-26 13:01:39,2,1,repNone,,False,"⚽ @Inter host champions @juventusfc on Saturday night   A big game historically in the Serie A, but now Inter stand to lose more if they do not win. They pursue to secure a top-four post, also having a 5-point lead ahead of city rivals AC Milan and Atalanta.  @Football_BM https://t.co/xE4JL9284z"
https://twitter.com/andreasartori94/status/1121713508217958400,Wed Jun 10 06:39:18 +0000 2015,2019-04-26 09:51:55,1,1,repNone,,False,"⚽ @ManUtd host @ChelseaFC  on Sunday in a match that can be crucial in the race for a top-4 spot in the Premier League   4-placed Chelsea have a three-point advantage over 6-placed United, however, their remaining fixtures look tougher than those of United.  @Football_BM @KPMG https://t.co/zQ6aKcgzZv"
https://twitter.com/andreasartori94/status/1121425703097065472,Wed Jun 10 06:39:18 +0000 2015,2019-04-25 14:48:17,3,1,repNone,,True,How did @premierleague become the most important football league and a top brand in the world? ⚽  How does its development compare to the evolution of the Italian Lega @SerieA?  The @Football_BM team will try to understand the context tonight on Sky Sport 24 at 10.30PM 📺 https://t.co/RfWcjokVnK
https://twitter.com/andreasartori94/status/1120654732631080960,Wed Jun 10 06:39:18 +0000 2015,2019-04-23 11:44:43,1,1,repNone,,False,"🇮🇹 @acmilan Milan host @OfficialSSLazio in the second leg of the Coppa Italia semi-final tomorrow night, after their first leg clash in Rome ended in a 0-0 draw.   Lazio won their last domestic cup in 2013, while Milan triumphed in the Coppa Italia in 2003 🏆  @Football_BM https://t.co/aHVCo3KrpA"
https://twitter.com/andreasartori94/status/1119178997760516096,Wed Jun 10 06:39:18 +0000 2015,2019-04-19 10:00:41,1,0,repNone,,False,How many points does a football club need at the end of the season to avoid relegation? And how much do they have to invest in order to achieve that?   Are the @SerieA and the @premierleague different in this matter?   Watch our interview on @SkySport 24➡ https://t.co/8ZwdGxhkdr https://t.co/s3fUoS9g3c
https://twitter.com/andreasartori94/status/1118892292557934592,Wed Jun 10 06:39:18 +0000 2015,2019-04-18 15:01:25,3,0,repNone,,False,"Tonight at 10.30PM, we will be on the air on @SkySport 24 📺  The @Football_BM team will talk about how much a club needs to invest to avoid relegation, focusing on the @SerieA, and comparing it to the @premierleague, trying to find out the “cost of relegation” ⬇️ https://t.co/U1n8XjW9jG"
https://twitter.com/andreasartori94/status/1118816592161398785,Wed Jun 10 06:39:18 +0000 2015,2019-04-18 10:00:36,1,2,repNone,,False,"According to some reports, Paris Saint-Germain are close to extend their kit supplier contract with Nike, which could triple their current earnings from EUR 25 m/year to EUR 75 m/season. Their current deal expires in 2022 ⬇️  @Football_BM @KPMG @PSG_inside https://t.co/sAiGyqeyOC"
https://twitter.com/andreasartori94/status/1118786382640685056,Wed Jun 10 06:39:18 +0000 2015,2019-04-18 08:00:34,1,1,repNone,,False,The revenue non-big five league clubs may cash in from UEFA prize money is a significant bulk of their total income 💰  The @Football_BM chart shows the proportion of this income for non-big five contenders in the last 16 in the past three years ⚽  Read➡️ https://t.co/WrpHxA80yl https://t.co/Ns0S2gw6Yq
https://twitter.com/andreasartori94/status/1118537184896782337,Wed Jun 10 06:39:18 +0000 2015,2019-04-17 15:30:20,0,0,repNone,,False,"FC Porto should overcome a 2-0 deficit against Liverpool FC in the #UCL quarter-final second leg 🏆  @LFC are favorites, having both a squad market value and operating revenues five times the size of @FCPorto’s. Last year they eliminated Porto 5-0 on aggregate in the last 16 ⚽ https://t.co/LNyYEhWtab"
https://twitter.com/andreasartori94/status/1118500413291024385,Wed Jun 10 06:39:18 +0000 2015,2019-04-17 13:04:13,1,1,repNone,,False,"🏆 @ManCity lost 1-0 against @SpursOfficial last week in the #UCL quarter-final first leg.   The second-leg match in the Etihad tonight is likely to be a different game, as City are regarded favorites, both looking at the numbers and the current overall forms ⚽  @Football_BM https://t.co/NFYh1CDhUN"
https://twitter.com/andreasartori94/status/1118466542839185411,Wed Jun 10 06:39:18 +0000 2015,2019-04-17 10:49:38,2,0,repNone,,False,"📉@juventusfc suffered an unexpected defeat yesterday by @AFCAjax in the #UCL quarter-finals, causing a heavy drop in their share price.   Trading in Juventus Football Club was suspended for a while earlier today, as share price fell by 24 percent this morning ⬇️  @Football_BM https://t.co/mtejIeqrCd"
https://twitter.com/andreasartori94/status/1118449112293236736,Wed Jun 10 06:39:18 +0000 2015,2019-04-17 09:40:22,1,0,repNone,,False,"📰 @realmadrid are close to sign a new, EUR 100 million per year kit supplier deal with Adidas, according to media reports.   Their current long-term, EUR 40 million/season contract, runs until 2020, but it is overshadowed by some recent major rival deals across Europe ⬇️ https://t.co/Oj7suGZZH6"
https://twitter.com/andreasartori94/status/1118434896463134720,Wed Jun 10 06:39:18 +0000 2015,2019-04-17 08:43:53,0,1,repNone,,False,⚽ @AFCAjax is making history. The last club from outside the five biggest football leagues who made it to the UCL semi-finals was PSV Eindhoven in 2004/2005.   Read the @Football_BM article here ➡️ https://t.co/WrpHxA80yl https://t.co/VS8C5XJLTn
https://twitter.com/andreasartori94/status/1118137069627375616,Wed Jun 10 06:39:18 +0000 2015,2019-04-16 13:00:26,5,1,repNone,,False,"Juventus go with an away goal advantage to the #UCL quarter-final second leg against Ajax ⚽  Their squad is more than twice as valuable as the team of Ajax, and their financial supremacy is obvious too 📊  @Football_BM #JuveAjax @juventusfc @AFCAjax https://t.co/SM6PB0jF3B"
https://twitter.com/andreasartori94/status/1118092585736769536,Wed Jun 10 06:39:18 +0000 2015,2019-04-16 10:03:40,4,1,repNone,,False,"A draw tonight would take FC Barcelona to the Champions League semi-finals, as they beat Manchester United 1-0 in the quarter-final first leg last week 🏆  The away goal, the overall squad strength and current form all predict a Catalan supremacy ⚽  @Football_BM #BarçaMUFC #UCL https://t.co/I3O4ZgxghO"
https://twitter.com/andreasartori94/status/1118068872828149760,Wed Jun 10 06:39:18 +0000 2015,2019-04-16 08:29:26,1,0,repNone,,False,"Ahead of the second leg clashes in the #UCL quarter-finals, @Football_BM analyzed the chances of the non-big five contenders in the tournament   What are the key strategies they can adapt to ensure their involvement?   Read our article by clicking here  https://t.co/WrpHxA80yl https://t.co/DAroKwIVu7"
https://twitter.com/andreasartori94/status/1117817599633633282,Wed Jun 10 06:39:18 +0000 2015,2019-04-15 15:50:58,2,0,repNone,,False,"According to the latest news, @Inter and @acmilan aim to develop a new San Siro 🏟️  Build a new stadium, or renovate the existing one?  On @SkySport 24, @Football_BM analysed the pros and cons from a financial and technical point of view 📊  Watch here ➡ https://t.co/CmjH1V438w https://t.co/uMuUm56lYh"
https://twitter.com/andreasartori94/status/1117699162869571584,Wed Jun 10 06:39:18 +0000 2015,2019-04-15 08:00:20,0,0,repNone,,False,"FC Schalke 04 turned their loss after tax into profits in the past year 📈  They performed well in almost all key financial metrics, especially regarding broadcasting revenues, mainly due to the growth in the Bundesliga domestic rights and the recent participation in the #UCL ⚽ https://t.co/UdSnWhncRe"
https://twitter.com/andreasartori94/status/1116694750231502848,Wed Jun 10 06:39:18 +0000 2015,2019-04-12 13:29:10,4,1,repNone,,False,"Liverpool may sign a new long-term kit supplier deal with Nike of more than £75m per year, which would be the biggest in the #EPL ever ⬆️  @LFC’s current £45m-a-year deal with New Balance expires in the 2019/20 season, but they may extend the contract by equalling any rival offer https://t.co/vdwZA0oaon"
https://twitter.com/andreasartori94/status/1116616392898256897,Wed Jun 10 06:39:18 +0000 2015,2019-04-12 08:17:48,3,1,repNone,,False,"Liverpool host Chelsea on Sunday in the Premier League 🏴󠁧󠁢󠁥󠁮󠁧󠁿  Both teams need the three points to stay in the race – @LFC for the league title, while third-placed @ChelseaFC for securing a #UCL position 🏆  A rather balanced tie, both regarding their financial and current form ⚽ https://t.co/kNk3hxKQ77"
https://twitter.com/andreasartori94/status/1116369247926652930,Wed Jun 10 06:39:18 +0000 2015,2019-04-11 15:55:44,3,0,repNone,,True,"Tonight at 10.30PM, we will be on the air on @SkySport 24 📺  We will talk about the plans around a new San Siro stadium for @Inter and @acmilan. We will showcase the sporting and financial performances of the two clubs, trying to explain the pros and cons of a new home ground 🏟️ https://t.co/yfvAgOQJhs"
https://twitter.com/andreasartori94/status/1116341499371892736,Wed Jun 10 06:39:18 +0000 2015,2019-04-11 14:05:28,1,0,repNone,,False,"Arsenal host Napoli in their #UEL quarter-final first leg tonight   They have met only twice so far in a European competition. Now Arsenal may be considered favourites having a more valuable squad, while their current form is more balanced.  @Football_BM @Arsenal @sscnapoli https://t.co/etlRGzhYVd"
https://twitter.com/andreasartori94/status/1116257932528816129,Wed Jun 10 06:39:18 +0000 2015,2019-04-11 08:33:24,1,1,repNone,,False,"Although FC Juventus' squad value is more than double than the one of AFC Ajax, we saw a very balanced match yesterday night ⚽   @Football_BM @KPMG @AFCAjax @juventusfc #UCL https://t.co/5qkF8DZUXv"
https://twitter.com/andreasartori94/status/1115962657977270275,Wed Jun 10 06:39:18 +0000 2015,2019-04-10 13:00:05,1,0,repNone,,False,"Manchester United host FC Barcelona tonight in the #UCL quarter-final first leg ⚽  @FCBarcelona lost only one match in all competitions since 23 January, while @ManUtd won one and lost three of their matches since eliminating Paris St-Germain in the UCL last-16   #MUFCBarça https://t.co/MqFRJjPFfS"
https://twitter.com/andreasartori94/status/1115919362354028545,Wed Jun 10 06:39:18 +0000 2015,2019-04-10 10:08:03,0,0,repNone,,False,"Ajax host Juventus tonight in the #UCL quarter-final first leg ⚽  With a squad more than twice as valuable as the team of Ajax, @juventusfc may be the favourites. They reached two of the past four finals, while @AFCAjax have not made it to the last eight since 2003 🏆  #AjaxJuve https://t.co/R3xKcH7m3n"
https://twitter.com/andreasartori94/status/1115601044141031426,Wed Jun 10 06:39:18 +0000 2015,2019-04-09 13:03:10,0,0,repNone,,False,"Tottenham Hotspur host Manchester City tonight in their new stadium in the #UCL quarter-final first leg 🏆  Looking at the numbers and the current forms, City is regarded as favourites by many ⬇️  @Football_BM @SpursOfficial @ManCity #THFCVCITY https://t.co/jBsGGuM2tu"
https://twitter.com/andreasartori94/status/1115525142384345088,Wed Jun 10 06:39:18 +0000 2015,2019-04-09 08:01:34,2,0,repNone,,False,"Liverpool host Porto in the #UCL quarter-final first leg tonight🏆  Liverpool may be regarded as favourites now, also by the key metrics shown below, and they never lost against Porto in any of their six previous encounters in a European tournament ⚽  @LFC @FCPorto @Football_BM https://t.co/tnvbogHyz2"
https://twitter.com/andreasartori94/status/1115163790713208832,Wed Jun 10 06:39:18 +0000 2015,2019-04-08 08:05:41,0,0,repNone,,False,"Chelsea FC closed a great season in 2017/18, registering growth in all the revenue KPIs, especially commercial and broadcasting, and they could turn their loss after tax into profits in the past year, as well 📈  @ChelseaFC @Football_BM @KPMG https://t.co/t2QiciUmfW"
https://twitter.com/andreasartori94/status/1114167535455428609,Wed Jun 10 06:39:18 +0000 2015,2019-04-05 14:06:55,8,6,repNone,,False,The @premierleague is finalizing a reported GBP 4.05 billion (EUR 4.74 billion) deal on its 2019-2022 overseas broadcasting rights 📺  The new three-year agreement is likely to further strengthen EPL’s dominance regarding overseas rights revenues among the top five leagues ⚽ https://t.co/BMQDD37OgQ
https://twitter.com/andreasartori94/status/1114086177785749504,Wed Jun 10 06:39:18 +0000 2015,2019-04-05 08:43:38,1,0,repNone,,False,"🏆 @ChampionsLeague returns next week with the first legs of the quarter-finals  In the latest episode on @SkySport 24, the @Football_BM team analyzed the 8 clubs from a financial point of view, comparing their main KPIs 📊  Watch the interview here ➡ https://t.co/CA8SgQRnkw https://t.co/tDAxxw2FKZ"
https://twitter.com/andreasartori94/status/1113857378758352897,Wed Jun 10 06:39:18 +0000 2015,2019-04-04 17:34:28,1,0,repNone,,False,"We will be on air again on @SkySport 24 tonight at 10.30PM 📺   Watch the interview with the @Football_BM team, who will analyze the Champions League quarter-finalists from a financial point of view, and try to predict their performance on the pitch ⚽  @KPMG https://t.co/EJAcSi3Itz"
