id,Account Created At(same for all rows),status created_at,Fav_cont,retweeted_count,reply_to_status,reply_to_screen,quote,text
https://twitter.com/andreasartori94/status/1192053449527103489,Wed Jun 10 06:39:18 +0000 2015,2019-11-06 12:17:44,6,4,repNone,,False,"Match-going @premierleague fans will spend an estimated Ł1.3bn this season supporting their club. The @eToro Fan Financial Statement, in association with KPMG @Football_BM, has researched into the costs of fandom of match-going EPL fans. Read the report at https://t.co/YBTmpW95hD https://t.co/nvYiLPDsTs"
https://twitter.com/andreasartori94/status/1191686722591088640,Wed Jun 10 06:39:18 +0000 2015,2019-11-05 12:00:29,937,263,repNone,,False,Brazilian giants @Flamengo reported record revenues of EUR 142.8 million for the first nine months of 2019 📊  This has already surpassed the full year income of EUR 140.3 million for 2018 💰   @Football_BM https://t.co/8ftptEJi83
https://twitter.com/andreasartori94/status/1191643794996895744,Wed Jun 10 06:39:18 +0000 2015,2019-11-05 09:09:55,1,0,rep1191643684175040514,andreasartori94,False,"At the same time, we have launched the new, interactive Golf Participation Platform, a market intelligence tool, which allows analyses of the European supply and demand trends from 2015 ⛳  Discover the Platform ➡️ https://t.co/4bsNgZzAnW"
https://twitter.com/andreasartori94/status/1191643684175040514,Wed Jun 10 06:39:18 +0000 2015,2019-11-05 09:09:28,2,0,repNone,,False,"I am happy to share @Golf_Benchmark team’s new annual Golf Participation Report, which provides supply and demand data for the European golf business 🏌️‍♂️  Read the Report ➡️ https://t.co/pcmKvxrXbz https://t.co/VnfWaEE9gM"
https://twitter.com/andreasartori94/status/1191304657903202304,Wed Jun 10 06:39:18 +0000 2015,2019-11-04 10:42:18,0,0,repNone,,False,"German champions @FCBayern have dismissed manager Niko Kovac, after a 5-1 defeat by @Eintracht at the weekend ⬇️  The 48-year-old Croatian won 45 of his 65 games in charge of Bayern, but Saturday's defeat was their heaviest loss in 10 years in the Bundesliga ⚽  @Football_BM https://t.co/EL4ywnEJzO"
https://twitter.com/andreasartori94/status/1191262033347579904,Wed Jun 10 06:39:18 +0000 2015,2019-11-04 07:52:55,3,0,repNone,,False,"Juventus announced that they agreed with Jeep to increase the annual fixed value of their current sponsorship deal by EUR 25 M for the remaining two seasons ✍️  Now, according to @Football_BM, they will be now in the top 10 by main shirt sponsor deals as of 2019/20 in EUR M ⬇️ https://t.co/B3bMNkJTD3"
https://twitter.com/andreasartori94/status/1189906140181733376,Wed Jun 10 06:39:18 +0000 2015,2019-10-31 14:05:05,3,2,repNone,,False,"Lazio have recently released their financial statements for 2018/19 📊  The Biancocelesti registered a decrease in total operating revenues, especially in terms of matchday. They also recorded a EUR 13 M loss after tax, mainly due to a remarkable decrease in player trading 💰 https://t.co/kgofO3gxNY"
https://twitter.com/andreasartori94/status/1189839214466207745,Wed Jun 10 06:39:18 +0000 2015,2019-10-31 09:39:09,0,1,repNone,,False,"Regarding revenues,the projected USD 1 BN overall income of the esports business for this year is basically the same as the revenues of @FCBarcelona in 2018/19💰  The structure of the major revenue streams in esports reflects the fact that the industry is still in its adolescence https://t.co/KKYg6DhDuI"
https://twitter.com/andreasartori94/status/1189543931014537221,Wed Jun 10 06:39:18 +0000 2015,2019-10-30 14:05:48,8,1,repNone,,False,"Liverpool are to switch from @newbalance to @Nike as their kit supplier from the next season, having won a legal battle⚖️  @LFC wanted to switch once their current partnership expired, however, NB went to court, claiming a clause in the contract meant it could match Nike’s terms https://t.co/UskCjakkx3"
https://twitter.com/andreasartori94/status/1189468846027149312,Wed Jun 10 06:39:18 +0000 2015,2019-10-30 09:07:26,5,2,repNone,,False,"Esport has become a competitor of traditional sports, including football⚽  If we compare the average age of sports viewership, esports has the youngest fan base, while the leading sports properties are struggling with an ageing viewership🎮  @Football_BM➡️https://t.co/tK6JiQkRb7 https://t.co/mF7dqPRPvi"
https://twitter.com/andreasartori94/status/1189213718233505793,Wed Jun 10 06:39:18 +0000 2015,2019-10-29 16:13:39,2,1,repNone,,False,"Inter Milan have recently published their preliminary financial results for the 2018/19 season 📊  The club closed the year with record operating revenues of EUR 373 million, and a net loss of EUR 48 million 💰  @Inter @Football_BM https://t.co/kechIkAmoq"
https://twitter.com/andreasartori94/status/1189142598956519425,Wed Jun 10 06:39:18 +0000 2015,2019-10-29 11:31:03,4,1,repNone,,False,"Esports has become a billion-dollar global industry, offering vast opportunities for stakeholders to build engaged fan bases and monetize their passion 🎮  @Football_BM looks at the industry, the impact of the changing entertainment landscape on football ➡️https://t.co/tK6JiQkRb7 https://t.co/DdADR4PxI8"
https://twitter.com/andreasartori94/status/1188754010297241601,Wed Jun 10 06:39:18 +0000 2015,2019-10-28 09:46:56,1,0,repNone,,False,"Sporting Lisbon have recently released their financial statements for 2018/19 📊  @Sporting_CP registered a decrease in total operating revenues, mainly due to the fact that they did not participate in the #UCL in the previous, 2017/18 season, for the first time after 4 years ⬇️ https://t.co/BvS73ECLcd"
https://twitter.com/andreasartori94/status/1185222152192172039,Wed Jun 10 06:39:18 +0000 2015,2019-10-18 15:52:36,4,0,repNone,,False,"For the very first time in football history, @FCBarcelona have registered record operating revenues of over EUR 800 M 💰  @Manchester and @Real have led this ranking for the past several years, and this is the first time the Blaugrana have finished on top 📊  @Football_BM https://t.co/r5B3GzC0kD"
https://twitter.com/andreasartori94/status/1185107764772782080,Wed Jun 10 06:39:18 +0000 2015,2019-10-18 08:18:04,2,0,repNone,,False,"Manchester United host Liverpool Football Club on Sunday, traditionally the most famous rivalry in English football ⚽  Despite the lack of on-pitch success and the worst start to the season in several years, United boast much more followers on social media 📱  @Football_BM https://t.co/LG2GUIpD3o"
https://twitter.com/andreasartori94/status/1184824576171282432,Wed Jun 10 06:39:18 +0000 2015,2019-10-17 13:32:46,1,1,repNone,,False,"AC Milan have recently published their preliminary financial results for the 2018/19 season 📊  @acmilan closed the year with a massive, EUR 146 million loss in profit after tax, the worst result in the history of the club 📉  @Football_BM https://t.co/rZnf0KQC3E"
https://twitter.com/andreasartori94/status/1184770995535699968,Wed Jun 10 06:39:18 +0000 2015,2019-10-17 09:59:51,7,0,repNone,,False,"Cristiano Ronaldo – a top earner on and off the pitch as well 💰  As the most popular athlete in the social media, @Cristiano makes allegedly more money by being an Instagram influencer than by playing at @juventusfc ⚽  @Football_BM https://t.co/KNUPnPa2sW"
https://twitter.com/andreasartori94/status/1184742391372304384,Wed Jun 10 06:39:18 +0000 2015,2019-10-17 08:06:12,2,0,repNone,,False,Cristiano Ronaldo is far the most popular athlete on social media on earth. @Cristiano alone has more followers than any sports tournaments or clubs and teams 📱  Read the full article by @Football_BM here 👉 https://t.co/38rnBoRfTP https://t.co/EIVJhwzIDN
https://twitter.com/andreasartori94/status/1184378649979559937,Wed Jun 10 06:39:18 +0000 2015,2019-10-16 08:00:49,1,0,repNone,,False,Spanish giants @realmadrid and @FCBarcelona are far ahead of other football clubs considering their followership on social media 📱  Read the new article of @Football_BM about how players and clubs are performing on social media  👉 https://t.co/38rnBoRfTP https://t.co/aQ6PdMDOiz
https://twitter.com/andreasartori94/status/1184123187057086472,Wed Jun 10 06:39:18 +0000 2015,2019-10-15 15:05:42,1,0,repNone,,False,"CR 700 - with a goal scored at the Ukraine-Portugal European Championship qualifying match on Monday, @Cristiano reached the 700th goal of his professional career ⚽  @Football_BM https://t.co/cL6aKEWGr4"
https://twitter.com/andreasartori94/status/1184101238109024258,Wed Jun 10 06:39:18 +0000 2015,2019-10-15 13:38:29,0,0,repNone,,False,Football is leading the way in building worldwide audiences via social media 📱  @Football_BM looks at how players and clubs are performing on social media and how their growing global reach and popularity are impacting the business side of football 👉 https://t.co/38rnBoRfTP https://t.co/hiL84jiog0
https://twitter.com/andreasartori94/status/1183775508942721024,Wed Jun 10 06:39:18 +0000 2015,2019-10-14 16:04:09,2,1,repNone,,False,"According to media reports, @ManUtd may look for a new shirt sponsor, as US car manufacturer General Motors is reluctant to renew the current Chevrolet deal beyond 2020/21, when it expires ✍️  @Football_BM https://t.co/P9LY6mpzaO"
https://twitter.com/andreasartori94/status/1183730380077174787,Wed Jun 10 06:39:18 +0000 2015,2019-10-14 13:04:49,3,2,repNone,,False,"Sports clubs and teams enjoy massive followership on social media. The elite is dominated by football clubs – in our next article tomorrow, we reveal who leads the pack📱  Now we show the most popular non-football teams, where NBA rules with 4 out of the top 5 ⬇️ https://t.co/4e8GIzYPfs"
https://twitter.com/andreasartori94/status/1182643436421341196,Wed Jun 10 06:39:18 +0000 2015,2019-10-11 13:05:42,3,1,repNone,,False,North American soccer league @MLS has recorded growth in TV and social media ratings for this year’s regular season ⬆️  @Football_BM https://t.co/LBjhegsqQp
https://twitter.com/andreasartori94/status/1182566798304202752,Wed Jun 10 06:39:18 +0000 2015,2019-10-11 08:01:10,0,0,repNone,,False,"Check out the most valuable XI based on @Football_BM Player Valuation tool ⚽  #UCL winners @LFC boast the most players in the imaginary top XI, while reigning World Cup champions France and promising Netherlands are the most represented nationality by sending 3 players each 💰 https://t.co/V0o5oGFUs9"
https://twitter.com/andreasartori94/status/1182322891792277510,Wed Jun 10 06:39:18 +0000 2015,2019-10-10 15:51:58,2,0,repNone,,False,"The Italian @SerieA has followed the lead of its European league rivals LaLiga and Bundesliga, and just opened an office in the US in order to increase its exposure across the Atlantic 🌎  We have compared the international TV rights revenues of the “big five” leagues 📺 https://t.co/oaWs8W1PyC"
https://twitter.com/andreasartori94/status/1182204638755471361,Wed Jun 10 06:39:18 +0000 2015,2019-10-10 08:02:04,0,0,repNone,,False,The French @Ligue1Conforama Dream Team – when market value makes the line-up 🇫🇷  @PSG_inside dominate the Ligue 1 Best XI by market value with 9 players in the line-up. The average value of the players is EUR 72 million 💰  @Football_BM https://t.co/mXO15y5rTD
https://twitter.com/andreasartori94/status/1181842248390074368,Wed Jun 10 06:39:18 +0000 2015,2019-10-09 08:02:04,0,0,repNone,,False,"The German @Bundesliga_DE Dream Team – when market value makes the line-up 🇩🇪  @FCBayern rule the Best XI by market value with 8 players in the line-up. The average value of the players is EUR 69m (vs EUR 108m in the EPL, EUR 96m in the LaLiga and EUR 66m in the Serie A) 💰 https://t.co/xwy2B4cBHC"
https://twitter.com/andreasartori94/status/1181601368634793985,Wed Jun 10 06:39:18 +0000 2015,2019-10-08 16:04:54,1,0,repNone,,False,"The Italian @SerieA Dream Team – when market value makes the line-up 🇮🇹  @juventusfc dominate the Serie A Best XI by market value, with 4 players in the line-up. The average value of the players is EUR 66m (vs EUR 108m in the Premier League and EUR 96m in the Spanish LaLiga) 💰 https://t.co/jakhBNeHRW"
https://twitter.com/andreasartori94/status/1181194632937590784,Wed Jun 10 06:39:18 +0000 2015,2019-10-07 13:08:40,1,0,repNone,,False,"AS Roma have published their preliminary financial results for the 2018/19 📊  The club closed the year with a decrease of EUR 18 M in terms of total operating revenues, while staff costs increased by EUR 25 M compared to the previous season,when they reached the #UCL semi-finals https://t.co/McIZ4ylRRk"
https://twitter.com/andreasartori94/status/1181141911429685248,Wed Jun 10 06:39:18 +0000 2015,2019-10-07 09:39:10,1,0,repNone,,False,"The Spanish @LaLiga Dream Team – when market value makes the line-up 🇪🇸  @FCBarcelona dominate the La Liga Best XI by market value, with 5 players in the line-up. The average value of the players is EUR 96 million (vs EUR 108m in the English Premier League) ⚽  @Football_BM https://t.co/MGgIJICFWc"
https://twitter.com/andreasartori94/status/1180108908041519105,Wed Jun 10 06:39:18 +0000 2015,2019-10-04 13:14:23,0,0,repNone,,False,"According to media reports, the American owners of Premier League side Crystal Palace Football Club are offering the purchase of up to 90% of the club 💰  @CPFC @Football_BM https://t.co/oHIe6X1xqr"
https://twitter.com/andreasartori94/status/1180075910038540288,Wed Jun 10 06:39:18 +0000 2015,2019-10-04 11:03:16,0,0,repNone,,False,"The Italian @SerieA will see the match of the autumn, when @Inter host @juventusfc on Sunday. Inter lead the table having won all their six matches in the season, followed by champions Juventus, who have two points less ⚽  @Football_BM #InterJuve #inter #juve https://t.co/gXcmAsI2P9"
https://twitter.com/andreasartori94/status/1180029927808262145,Wed Jun 10 06:39:18 +0000 2015,2019-10-04 08:00:33,0,0,repNone,,False,"Having looked at the aggregate squad values of the “big five” leagues, now the @Football_BM team ranked the next six major “non-big five” leagues, according to their combined squad values ⚽ https://t.co/Yc6NimSsUK"
https://twitter.com/andreasartori94/status/1179743138484817923,Wed Jun 10 06:39:18 +0000 2015,2019-10-03 13:00:57,0,0,repNone,,False,"We have updated the aggregate squad values of the “big five” leagues with our latest Player Valuation Tool estimates ⚽  The EPL is still the leader of this special ranking, worth over three billion and half more than second-placed LaLiga and three times more than the Ligue 1 ⬇️ https://t.co/usX3liE7Ze"
https://twitter.com/andreasartori94/status/1179691400859914240,Wed Jun 10 06:39:18 +0000 2015,2019-10-03 09:35:22,3,1,repNone,,False,"The @premierleague Dream Team – when market value makes the line-up ⚽  The best XI in the #EPL, selected according to our latest players valuations, can boast an aggregate value of almost EUR 1,2 billion 💰  @Football_BM https://t.co/Y8tn0jf0wK"
https://twitter.com/andreasartori94/status/1179423920493137920,Wed Jun 10 06:39:18 +0000 2015,2019-10-02 15:52:29,1,0,repNone,,False,"Dutch champions @AFCAjax have just released their preliminary financial figures for the 2018/19 financial year, reporting a massive growth in turnover ⬆️  Here, the @Football_BM team have compared how Ajax’s total operating revenues have grown in the past 5 seasons 📊 https://t.co/HNq0ONtJaE"
https://twitter.com/andreasartori94/status/1179399746693353473,Wed Jun 10 06:39:18 +0000 2015,2019-10-02 14:16:26,3,3,repNone,,False,AC Milan and Inter Milan are considering two shortlisted designs for their new stadium to be built in the parking area next to their iconic San Siro home in three years 🏟️  @Football_BM @acmilan @Inter https://t.co/COdPcezbUS
https://twitter.com/andreasartori94/status/1179327961377509381,Wed Jun 10 06:39:18 +0000 2015,2019-10-02 09:31:11,1,1,repNone,,False,"Yet another disappointing #UCL night for Zidane’s team: @realmadrid had to battle back from 2-0 down to draw with @ClubBrugge on home ground yesterday ⚽  On paper, Blancos have the most valuable squad in group A, but did the pitch really reflect such a huge difference? https://t.co/7v9SVwM9mU"
https://twitter.com/andreasartori94/status/1179041882632081419,Wed Jun 10 06:39:18 +0000 2015,2019-10-01 14:34:25,2,0,repNone,,False,"Manchester United have released their financial statement for the 2018/19 season 📊  The club closed the year with positive results, mainly due to a better performance in the #UCL last year, where they reached the quarter-finals⚽  @Football_BM @ManUtd https://t.co/N1YTUPGToQ"
https://twitter.com/andreasartori94/status/1178966480337215489,Wed Jun 10 06:39:18 +0000 2015,2019-10-01 09:34:47,1,0,repNone,,False,"With the closing of the 2019 summer transfer period, the @Football_BM team have released their updated market value estimates for over 4,800 football players from 12 leagues based on their latest sporting statistics provided by Opta ⚽  Discover more 👉 https://t.co/rI9At4UABF https://t.co/sN8lmMpU80"
https://twitter.com/andreasartori94/status/1178588536179740672,Wed Jun 10 06:39:18 +0000 2015,2019-09-30 08:32:58,1,0,repNone,,False,"Now, that the @Football_BM team has released the Player Valuation Tool update, they look again at the aggregate squad value of each @ChampionsLeague groups 🏆  Which do you think is now the most exciting one? 👇  #football #kpmgfootballbenchmark #player #valuation #UCL https://t.co/SBTeau5yZz"
https://twitter.com/andreasartori94/status/1174607900574146560,Wed Jun 10 06:39:18 +0000 2015,2019-09-19 08:55:21,0,0,repNone,,False,"Spectacular #UCL performance can significantly increase the popularity of a club ⬆️  In their latest article, the @Football_BM team looks at the participants and the great potential the competition offers to clubs 👉 https://t.co/25TAojSXH5 https://t.co/mLANPPiTx0"
https://twitter.com/andreasartori94/status/1174240108398223361,Wed Jun 10 06:39:18 +0000 2015,2019-09-18 08:33:52,3,1,repNone,,False,"The prize-money on offer in the @ChampionsLeague is staggering: this season’s winners could cash in a total of EUR 82.45 million, by winning all their matches 💰  Read the @Football_BM full article 👉 https://t.co/25TAojSXH5 https://t.co/7VXyMFGkDc"
https://twitter.com/andreasartori94/status/1173884849494667264,Wed Jun 10 06:39:18 +0000 2015,2019-09-17 09:02:12,2,0,repNone,,False,"The @ChampionsLeague is back, with the first matches of the group stage starting today ⚽  In this article, the @Football_BM team looks at the participants and the great potential the competition offers to clubs in raising their revenues and popularity 👉 https://t.co/25TAojSXH5 https://t.co/S4TjNP1GCx"
https://twitter.com/andreasartori94/status/1173578295788675072,Wed Jun 10 06:39:18 +0000 2015,2019-09-16 12:44:04,0,0,repNone,,False,"The @ChampionsLeague and @EuropaLeague are back, with the first matches of the group stages starting this week   32 teams compete in the UCL groups until mid-December, and the bests proceed to the knockout stage with games through April-May next year   @Football_BM https://t.co/3wYFtgWcT8"
https://twitter.com/andreasartori94/status/1172423632435335168,Wed Jun 10 06:39:18 +0000 2015,2019-09-13 08:15:51,0,0,repNone,,False,"This Saturday, @valenciacf take on @FCBarcelona, and with a new manager: they sacked Marcelino García Toral on Wednesday and replaced him with former Barcelona player and Real Madrid assistant Albert Celades ⚽  @Football_BM https://t.co/jJ6QQ02CwT"
https://twitter.com/andreasartori94/status/1172140455657713664,Wed Jun 10 06:39:18 +0000 2015,2019-09-12 13:30:36,0,0,repNone,,False,"On Saturday, @DieRotenBullen host @FCBayern in the German Bundesliga Official ⚽  Bayern spent big in the summer and had a major reshuffle of the whole squad. However, Leipzig won all their three matches in the running campaign and lead the table ahead of Bayern ⬇️  @Football_BM https://t.co/Nqak5e7ABO"
https://twitter.com/andreasartori94/status/1172058506880606209,Wed Jun 10 06:39:18 +0000 2015,2019-09-12 08:04:58,2,3,repNone,,False,What are the salaries of Italy’ top footballers and squads? ⚽  Italian magazine @Gazzetta_it has published an article about Serie A clubs’ salary expenditures 💰  Here the link to their article ➡️ https://t.co/6ECji16GdO  Via @Football_BM https://t.co/KOYi3Y1r2p
https://twitter.com/andreasartori94/status/1171696015419858944,Wed Jun 10 06:39:18 +0000 2015,2019-09-11 08:04:33,0,0,repNone,,False,"In their previous posts, the @Football_BM team listed the top 5 summer transfers by position according to the fees paid, and also the top 5 loan deals and free transfers by their KPMG values 📊  Now, they compared the average values of the top 5 transfers by the type of deals ✍️ https://t.co/Rya7EgR9wj"
https://twitter.com/andreasartori94/status/1171335225563123712,Wed Jun 10 06:39:18 +0000 2015,2019-09-10 08:10:54,0,1,repNone,,False,"In our previous posts, we listed the top five summer transfer deals by position. In the chart below, now we compared the average fees and values (based on @Football_BM ’s value estimates) of the top five transfers by position ⚽ https://t.co/LLc63uFpf0"
https://twitter.com/andreasartori94/status/1170970407769391104,Wed Jun 10 06:39:18 +0000 2015,2019-09-09 08:01:15,1,1,repNone,,False,"Clubs in the “big five” leagues altogether spent a reported record of EUR 5.5 billion on new players in the summer transfer window, about EUR 900 million more than in 2018 📈  @Football_BM https://t.co/J9R7jAeo93"
https://twitter.com/andreasartori94/status/1169974345327939584,Wed Jun 10 06:39:18 +0000 2015,2019-09-06 14:03:15,0,0,repNone,,False,"Three deals in the recent summer transfer window exceeded the EUR 100m threshold. Unsurprisingly, all of them are forwards ⚽  ctually, these three transfers have also made the top 10 most expensive deals in football history 💰  @Football_BM https://t.co/8ZAOzOFcwj"
https://twitter.com/andreasartori94/status/1169918744619114496,Wed Jun 10 06:39:18 +0000 2015,2019-09-06 10:22:19,0,0,repNone,,False,"English clubs took the lead in signing midfielders in the recent summer window 🏴󠁧󠁢󠁥󠁮󠁧󠁿  Nevertheless, @FCBarcelona made probably the best value for money deal recruiting Dutch talent Frenkie de Jong ⚽  @Football_BM https://t.co/QxrakOEJo1"
https://twitter.com/andreasartori94/status/1169884478744842248,Wed Jun 10 06:39:18 +0000 2015,2019-09-06 08:06:09,1,1,repNone,,False,"The 2019 summer transfer window in the “big five” football leagues brought three transfers - Harry Maguire, Antoine Griezmann and Frankie de Jong – that also became the most expensive deals by the age of the player at the time of the transfer 💰  Discover👉https://t.co/swYayjg75E https://t.co/PzLaJoBHqR"
https://twitter.com/andreasartori94/status/1169611779867119617,Wed Jun 10 06:39:18 +0000 2015,2019-09-05 14:02:33,1,1,repNone,,False,"The 2019 summer window has seen a price increase in signing defenders, especially centre-backs. @ManUtd spent big on Harry Maguire and Aaron Wan-Bissaka to strengthen their defence ⚽  Maguire has also become the most expensive defender ever bought 💰  @Football_BM https://t.co/XmQAmBXqJu"
https://twitter.com/andreasartori94/status/1169554049340968961,Wed Jun 10 06:39:18 +0000 2015,2019-09-05 10:13:09,1,0,repNone,,False,"Italian clubs were active in transferring goalkeepers this summer, but the most spectacular deal was the exchange of keepers between @FCBarcelona and @valenciacf ↔️  @Football_BM https://t.co/dzo6A0a26j"
https://twitter.com/andreasartori94/status/1169520895691558912,Wed Jun 10 06:39:18 +0000 2015,2019-09-05 08:01:24,1,1,repNone,,False,"In their latest article, the @Football_BM team looks at the major transfers of the summer, providing some additional context to the numbers ⚽  The chart below shows the top 20 transfers based on the transfer fee figures, excluding loans ➡️  Discover 👉 https://t.co/swYayjxIue https://t.co/FEwnPcK2qm"
https://twitter.com/andreasartori94/status/1169233816126447617,Wed Jun 10 06:39:18 +0000 2015,2019-09-04 13:00:39,1,1,repNone,,False,"The 2019 summer transfer window in the “big five” football leagues saw a growing tendency of loaning players ⚽  In their latest article, @Football_BM looks at the major summer transfers and at how loans deals have become more popular ⬇️ https://t.co/wRmsv7vFEv"
https://twitter.com/andreasartori94/status/1169201451861721088,Wed Jun 10 06:39:18 +0000 2015,2019-09-04 10:52:03,0,0,repNone,,False,The 2019 summer transfer window has closed for all the European “big five” football leagues recently – the period ended without a last-day frenzy and brought only modest changes to the players’ landscape for the next season ⚽  Go to @Football_BM article ➡️https://t.co/swYayjxIue https://t.co/eFCN5KXCAR
https://twitter.com/andreasartori94/status/1168901637827641344,Wed Jun 10 06:39:18 +0000 2015,2019-09-03 15:00:42,0,0,repNone,,False,"The 2019 summer transfer window in the “big five” football leagues saw some big names changing clubs in a free transfer ⚽   Here we have listed the top free transfers of the summer, also indicating the worth of the players at their new clubs ⬇️  @Football_BM @KPMG https://t.co/5kCDsLT2bs"
https://twitter.com/andreasartori94/status/1168435137526337538,Wed Jun 10 06:39:18 +0000 2015,2019-09-02 08:06:59,2,0,repNone,,False,"Red Star Belgrade reached the UCL group stage and they will play against Tottenham, Bayern Munchen and Olympiacos 🏆  @Football_BM have recently published their official financial statements, introducing Serbia as a new country represented in the Club Finance &amp; Operations tool 📊 https://t.co/MyN15Ld7l5"
