id,Account Created At(same for all rows),status created_at,Fav_cont,retweeted_count,reply_to_status,reply_to_screen,quote,text
https://twitter.com/AnilKokil/status/1357393464653012995,Mon Mar 20 17:20:53 +0000 2017,2021-02-04 18:19:55,11,2,repNone,,False,"उद्याची पूर्व तयारी.. केंद्र सरकारच्या घरगुती गॅस, पेट्रोल, डिझेल दरवाढ व महागाई विरोधात आंदोलना संदर्भात शिवसेना शाखा क्र.२०४ मधील सर्व पदाधिकाऱ्यांन समवेत चर्चा करताना.. @ShivSena @AUThackeray @AjayChoudhariSS https://t.co/qp8JJ3yJ1E"
https://twitter.com/AnilKokil/status/1357380596775882753,Mon Mar 20 17:20:53 +0000 2017,2021-02-04 17:28:47,5,0,repNone,,False,माझ्या प्रभागतील राजकमल स्‍टुडिओ कॉम्‍प्‍लेक्‍सकडे जाणारा राजकमल लेन या रस्‍त्‍याच्‍या रुंदीकरणाबाबत @mybmc चे उपायुक्त (परिमंडळ-२) विजयजी बालमवार यांनी पाहणी भेट केली आणि त्या विषयी चर्चा केली. त्यावेळेस संबंधित अधिकारी आणि स्थानिक रहिवाशी उपस्थित होते.. @AjayChoudhariSS https://t.co/xOqwdpFpHC
https://twitter.com/AnilKokil/status/1357336972704972805,Mon Mar 20 17:20:53 +0000 2017,2021-02-04 14:35:27,0,0,rep1357241716248465409,DineshS93351439,False,@DineshS93351439 @mybmcWardFS @mybmc @MCGM_BMC @KishoriPednekar @AjayChoudhariSS @AGSawant @CMOMaharashtra @OfficeofUT @DineshS93351439 Kindly provide your contact details..
https://twitter.com/AnilKokil/status/1357017703991574529,Mon Mar 20 17:20:53 +0000 2017,2021-02-03 17:26:47,12,0,repNone,,False,"बेस्ट कर्मचारी वसाहत, परळ येथील विविध समस्या आणि विकास कामे संदर्भात आज बेस्ट समिती अध्यक्ष प्रवीणजी शिंदे यांच्या दालनात बैठक आयोजित करण्यात आली. त्यावेळीं त्या बैठकीस उपमहापौर @AdvSuhasWadkar जी आणि परळ वसाहतीतील पदाधिकारी उपस्थित होते. @ShivSena https://t.co/UMvaw8G9Vx"
https://twitter.com/AnilKokil/status/1356496933200613376,Mon Mar 20 17:20:53 +0000 2017,2021-02-02 06:57:26,38,2,repNone,,False,शिवसेना शाखा क्र.२०४ .. नागरिकांच्या समस्या जाणून घेताना.. @ShivSena https://t.co/dsLIZ7C7VZ
https://twitter.com/AnilKokil/status/1355533244058357761,Mon Mar 20 17:20:53 +0000 2017,2021-01-30 15:08:04,8,2,rep1355533218384998405,AnilKokil,False,"त्याप्रसंगी विभाग प्रमुख @AshishChemburk1 जी, शिवडी विधान संघटक सुधीरजी साळवी, नगरसेवक @PongadeDattaram जी, नगरसेवक @SachinPadwal206 जी, नगरसेविका सिंधुताई मसुरकर, शाखाप्रमुख किरण तावडे, महिला शाखा संघटक सौ.कांचन घाणेकर, तसेच सर्व शिवसैनिक आणि पदाधिकारी उपस्थित होते.. @ShivSena https://t.co/ta55BH79R7"
https://twitter.com/AnilKokil/status/1355533218384998405,Mon Mar 20 17:20:53 +0000 2017,2021-01-30 15:07:58,60,5,repNone,,False,"शाखा क्र.२०४ आयोजित आणि माझ्या नगरसेवक निधीतून नूतनीकरण करण्यात आलेल्या बेस्ट कर्मचारी वसाहत, परळ उद्यानाचे लोकार्पण सोहळ्याचे उद्घाटन शिवसेना आमदार @AjayChoudhariSS जी यांच्या हस्ते करण्यात आले. @ShivSena @OfficeofUT @AUThackeray https://t.co/v2Y6hfWeAK"
https://twitter.com/AnilKokil/status/1355174566453149696,Mon Mar 20 17:20:53 +0000 2017,2021-01-29 15:22:49,38,1,repNone,,False,नीती आयोगामार्फत दिल्या जाणऱ्या #इंडिया_इनोव्हेशन_इंडेक्स मध्ये महाराष्ट्र राज्याची दुसऱ्या स्थानी झेप... मा.मुख्यमंत्री श्री.उद्धवजी बाळासाहेब ठाकरे यांचे हार्दिक अभिनंदन!! @ShivSena @OfficeofUT @AUThackeray https://t.co/zs7DlEbXlK
https://twitter.com/AnilKokil/status/1355078373815451652,Mon Mar 20 17:20:53 +0000 2017,2021-01-29 09:00:35,0,87,repNone,,False,RT @AUThackeray: या अद्ययावत नियंत्रण कक्षात ITMS (Intelligent Transport Management System) चा वापर केला आहे. यामुळे बसेसचं ट्रॅकिंग करणे श…
https://twitter.com/AnilKokil/status/1355078348938964992,Mon Mar 20 17:20:53 +0000 2017,2021-01-29 09:00:29,0,145,repNone,,False,RT @AUThackeray: आज वडाळा येथील BEST डेपो येथे मुख्यमंत्री उद्धव बाळासाहेब ठाकरे जी यांच्या हस्ते अद्ययावत बस नियंत्रण कक्षाचे उद्घाटन कर…
https://twitter.com/AnilKokil/status/1355076815375663105,Mon Mar 20 17:20:53 +0000 2017,2021-01-29 08:54:23,0,70,repNone,,False,RT @OfficeofUT: बेस्ट उपक्रमाच्या अद्ययावत बस नियंत्रण कक्षाचे उद्घाटन- LIVE https://t.co/g5shLntuTV
https://twitter.com/AnilKokil/status/1354454416623947783,Mon Mar 20 17:20:53 +0000 2017,2021-01-27 15:41:12,39,4,repNone,,False,शिवसेना आमदार @AjayChoudhariSS जी यांच्या मार्गदर्शनाखाली आणि माझ्या  नगरसेवक निधीतून नूतनीकरण करण्यात आलेल्या बेस्ट वसाहतीतील उद्यानांचा लोकार्पण सोहळा संपन्न होणार आहे. त्यापूर्वी होणाऱ्या सोहळ्या संदर्भात पदाधिकाऱ्यांन बरोबर आढावा बैठक. @ShivSena @AUThackeray https://t.co/49uPG0q3o9
https://twitter.com/AnilKokil/status/1354103392612741120,Mon Mar 20 17:20:53 +0000 2017,2021-01-26 16:26:21,21,0,repNone,,False,"बृहन्मुंबई महानगरपालिकेच्या एफ/दक्षिण विभागाच्या वतीने वार्ड ऑफिसर स्वप्नजा क्षीरसागरजी यांच्या हस्ते ध्वजारोहण करण्यात आला. त्यावेळी नगरसेवक दत्ताजी पोंगडे, माजी नगरसेवक सुनीलजी मोरे आणि मान्यवर उपस्थित होते. https://t.co/irgUbndSwU"
https://twitter.com/AnilKokil/status/1353933129682046977,Mon Mar 20 17:20:53 +0000 2017,2021-01-26 05:09:47,15,0,repNone,,False,आपणां सर्वांना प्रजासत्ताक दिनाच्या हार्दिक शुभेच्छा!  Wishing you all a Happy Republic Day! #RepublicDay2021 #प्रजासत्ताकदिन 🇮🇳 https://t.co/fPXJEifVTk
https://twitter.com/AnilKokil/status/1352985068981997573,Mon Mar 20 17:20:53 +0000 2017,2021-01-23 14:22:32,40,2,repNone,,False,वंदनीय हिंदुहृदसम्राट शिवसेनाप्रमुख श्रीमान बाळासाहेब ठाकरे 🙏🙏🙏 #BalasahebThackeray https://t.co/moGT1L72Ej
https://twitter.com/AnilKokil/status/1352818067844124672,Mon Mar 20 17:20:53 +0000 2017,2021-01-23 03:18:56,87,11,repNone,,False,वंदनीय हिंदूहदयसम्राट शिवसेनाप्रमुख बाळासाहेब ठाकरे यांच्या जयंतीनिमित्त विनम्र अभिवादन! #साहेब 🙏 https://t.co/qxctGqoscW
https://twitter.com/AnilKokil/status/1351837893644357635,Mon Mar 20 17:20:53 +0000 2017,2021-01-20 10:24:04,51,0,repNone,,False,ग्रामपंचायत निवडणुकीमध्ये निवडून आलेल्या सर्व विजयी उमेदवाराचे हार्दिक अभिनंदन!! @ShivSena https://t.co/vLcmNXDQBv
https://twitter.com/AnilKokil/status/1351498137257447427,Mon Mar 20 17:20:53 +0000 2017,2021-01-19 11:54:00,22,1,repNone,,False,"बाळ गोपाळ मंडळ, गणेशगल्ली चौक येथील वाचनालय दुरूस्ती संदर्भात रहिवाश्यांनी माझ्याकडे तक्रार करताच तातडिने सदर ठिकाणी मनपा सबंधित विभागाच्या अधिकाऱ्यांन समवेत पाहणी करुन दुरूस्तीबाबत जाणून घेताना.. @ShivSena https://t.co/bygzU38Hqo"
https://twitter.com/AnilKokil/status/1351153872811782148,Mon Mar 20 17:20:53 +0000 2017,2021-01-18 13:06:01,48,1,repNone,,False,"सिद्धिविनायक न्यास अध्यक्ष, शिवसेना सचिव व राज्यमंत्री नामदार श्री.आदेश बांदेकर साहेबांना वाढदिवसाच्या हार्दिक शुभेच्छा!! @aadeshbandekar https://t.co/1ASnOY16p1"
https://twitter.com/AnilKokil/status/1350422639727177731,Mon Mar 20 17:20:53 +0000 2017,2021-01-16 12:40:21,36,2,repNone,,False,#ABPNews सर्वे नुसार देशातील टॉप ५ लोकप्रिय मुख्यमंत्री यादीत महाराष्ट्राचे कुटुंबप्रमुख आदरणीय उद्धवजी बाळासाहेब ठाकरे यांचा समावेश झाल्याबद्दल.. त्यांचे हार्दिक अभिनंदन!! @ShivSena @OfficeofUT @AUThackeray https://t.co/k3HmiSeysM
https://twitter.com/AnilKokil/status/1350125452057214977,Mon Mar 20 17:20:53 +0000 2017,2021-01-15 16:59:26,7,0,rep1350125448064237573,AnilKokil,False,"त्याप्रसंगी शाखाप्रमुख किरण तावडे, महिला शाखासंघटक सौ.कांचन घाणेकर व स्थानिक रहिवाशी उपस्थित होते.."
https://twitter.com/AnilKokil/status/1350125448064237573,Mon Mar 20 17:20:53 +0000 2017,2021-01-15 16:59:25,30,3,repNone,,False,नागरी विकास कामांचा शुभारंभ..! आमदार @AjayChoudhariSS जी यांच्या मार्गदर्शनाखाली आणि माझ्या नगरसेवक निधितुन परळ येथील रायगड टॉवर येथे भिंतीची उंची वाढविण्याच्या कामाचा शुभारंभ करण्यात आला.. @ShivSena https://t.co/uBYpcDMhIV
https://twitter.com/AnilKokil/status/1350120762993123329,Mon Mar 20 17:20:53 +0000 2017,2021-01-15 16:40:48,0,18,repNone,,False,RT @Manshreepathak: कलियुगातली संजीवनी - मुंबईतली कोविड लस लसिकरण केंद्रांवर रवाना... औक्षण करुन लसीचं स्वागत...@abpmajhatv @mybmc https://…
https://twitter.com/AnilKokil/status/1350115616473055234,Mon Mar 20 17:20:53 +0000 2017,2021-01-15 16:20:21,24,0,repNone,,False,"स्थनिक रहिवाशी यांनी रेशन कार्ड विषयी माझ्याकडे तक्रार करताच, मी स्वतः परळ येथील शिधावाटप कार्यालय येथे भेट देऊन रेशन धारकाची समस्या सोडवली..@ShivSena @AjayChoudhariSS https://t.co/GPIJWYk7ee"
https://twitter.com/AnilKokil/status/1350114701208768512,Mon Mar 20 17:20:53 +0000 2017,2021-01-15 16:16:43,0,0,repNone,mybmcWardFS,False,@mybmcWardFS मधील आपत्कालीन कक्ष खात्याचे अधिकारी सावंत मॅडम यांची भेट घेऊन प्रभाग क्र.२०४ (लालबाग-परळ-काळाचौकी) परिसरात येणाऱ्या अनेक आपत्कालीन विषयी तक्रारी कसे सुरळीत होईल याची चर्चा केली.. @ShivSena https://t.co/PMsW52Ah6P
https://twitter.com/AnilKokil/status/1350091360326410242,Mon Mar 20 17:20:53 +0000 2017,2021-01-15 14:43:58,0,6,repNone,,False,RT @KishoriPednekar: औक्षण नवसंजीवनी लसीचे ...! सन्मा महापौर सौ किशोरी किशोर पेडणेकर  यांच्या उपस्थितीत नवसंजीवनी लसीचे महापालिका स्तरावर…
https://twitter.com/AnilKokil/status/1349973756861534208,Mon Mar 20 17:20:53 +0000 2017,2021-01-15 06:56:39,28,2,repNone,,False,नागरी विकास कामांचा शुभारंभ..! आमदार @AjayChoudhariSS जी यांच्या मार्गदर्शनाखाली आणि माझ्या नगरसेवक निधितुन परळ येथील बेस्ट वसाहत मधील 'ई' व 'बी' विंग इमारतीच्या ड्रेनेज लाईन व प्यासेज लाईनच्या कामाचा शुभारंभ करण्यात आला.. @ShivSena https://t.co/eiNZiLOwvr
https://twitter.com/AnilKokil/status/1349685328764813314,Mon Mar 20 17:20:53 +0000 2017,2021-01-14 11:50:32,20,1,repNone,,False,"घाबरू नका, जागरूक रहा ! आपल्या सभोवताली आणि इमारतीच्या आवारात मृत पक्षी आढळेल्यास १९१६ या हेल्पलाईन वर कळवा. स्वतः उचलू नका आणि लहान मुलांनाही उचलण्यास सांगू नका! #BirdFlu #Dial1916 https://t.co/5sy36Zvpep"
https://twitter.com/AnilKokil/status/1349598540775866368,Mon Mar 20 17:20:53 +0000 2017,2021-01-14 06:05:41,25,0,repNone,,False,"तिळगुळ घ्या, गोड गोड बोला... #मकरसंक्रांत च्या हार्दिक शुभेच्छा!  #HappyMakarSankranti https://t.co/o0ts4uOXlH"
https://twitter.com/AnilKokil/status/1349399118754369536,Mon Mar 20 17:20:53 +0000 2017,2021-01-13 16:53:15,45,3,repNone,,False,परळ येथील एस.एस.राव रोड वरील फुटपाथ च्या चालू असलेल्या कामाची पाहाणी करताना.. @ShivSena @AjayChoudhariSS https://t.co/hAe884mOMR
https://twitter.com/AnilKokil/status/1349281546394427392,Mon Mar 20 17:20:53 +0000 2017,2021-01-13 09:06:03,39,0,repNone,,False,शिवडी विधानसभा शिवसेना आमदार अजयजी चौधरी यांच्या मार्गदर्शनाखाली शाखा क्र.२०४ च्या पदाधिकाऱ्यांन समवेत आढावा बैठक घेतली..  Under the guidance of MLA Ajay Choudhari ji held review meeting with shakha kra.204 office bearers.. @ShivSena @AjayChoudhariSS https://t.co/szgTGZWpqM
https://twitter.com/AnilKokil/status/1347914039364444161,Mon Mar 20 17:20:53 +0000 2017,2021-01-09 14:32:04,133,5,repNone,,False,कोल्हापूरचे शिवसेना आमदार @abitkar_prakash जी यांची सदिच्छा भेट घेतली.. https://t.co/8P8Vw67l8T
https://twitter.com/AnilKokil/status/1347205038167318535,Mon Mar 20 17:20:53 +0000 2017,2021-01-07 15:34:45,29,0,repNone,,False,"आपले सरकार, ठाकरे सरकार..! https://t.co/fff8M1dywd"
https://twitter.com/AnilKokil/status/1347203479874412545,Mon Mar 20 17:20:53 +0000 2017,2021-01-07 15:28:34,0,143,repNone,,False,"RT @AUThackeray: This morning, Minister @advanilparab ji and I visited the @mybmc HQ to hold consultations and reviews on various issues.…"
https://twitter.com/AnilKokil/status/1347203307219996672,Mon Mar 20 17:20:53 +0000 2017,2021-01-07 15:27:52,37,0,repNone,,False,अंधेरी येथील मरोळ आगार येथे भेट देऊन तेथील कर्मचारी वर्गाशी संवाद साधला आणि समस्या जाणून घेतल्या! @ShivSena @AUThackeray https://t.co/QLDjWqdKYN
https://twitter.com/AnilKokil/status/1347199941127532545,Mon Mar 20 17:20:53 +0000 2017,2021-01-07 15:14:30,35,1,repNone,,False,Parel BEST colony visit to check on-going Garden work with BEST officers.. https://t.co/81ttQfF7KX
https://twitter.com/AnilKokil/status/1347139055620747267,Mon Mar 20 17:20:53 +0000 2017,2021-01-07 11:12:34,0,9,repNone,,False,RT @AjayChoudhariSS: काल वर्षा बंगला येथे शिवडी विधानसभेतील विविध प्रलंबित प्रश्नावर चर्चा करण्यासाठी महाराष्ट्र राज्याचे मुख्यमंत्री @Offi…
https://twitter.com/AnilKokil/status/1346860504719921157,Mon Mar 20 17:20:53 +0000 2017,2021-01-06 16:45:42,16,1,rep1346860501758746625,AnilKokil,False,यावेळी शिवडी विधानसभा आमदार @AjayChoudhariSS जी तसेच विधानसभेतील आम्ही सर्व नगरसेवक उपस्थित होतो. धन्यवाद उद्धव साहेब आणि आदित्य साहेब (२/२)
https://twitter.com/AnilKokil/status/1346860501758746625,Mon Mar 20 17:20:53 +0000 2017,2021-01-06 16:45:41,146,7,repNone,,False,आज वर्षा बंगला येथे शिवडी विधानसभेतील विविध प्रलंबित प्रश्नावर चर्चा करण्यासाठी  महाराष्ट्र राज्याचे मुख्यमंत्री @OfficeofUT साहेब तसेच महाराष्ट्र राज्याचे पर्यावरणमंत्री @AUThackeray साहेब यांच्यासोबत बैठक संपन्न झाली. (१/२) @ShivSena https://t.co/XORpuTxjF2
https://twitter.com/AnilKokil/status/1346702234122297346,Mon Mar 20 17:20:53 +0000 2017,2021-01-06 06:16:47,16,1,repNone,,False,"आज ममता दिनानिमित्त शिवसेना शाखा क्र.२०४ च्या वतीनं वात्सल्यमूर्ती माँसाहेब मीनाताई ठाकरे यांच्या पवित्र स्मृतीस विनम्र अभिवादन करताना. त्याप्रसंगी आमदार @AjayChoudhariSS जी, शाखाप्रमुख किरण तावडे, व महिला शिवसैनिक पदाधिकारी उपस्थित होते.. @AUThackeray #ममतादिन #६जानेवारी https://t.co/MtDW6zGjqm"
https://twitter.com/AnilKokil/status/1346672553327149057,Mon Mar 20 17:20:53 +0000 2017,2021-01-06 04:18:51,63,2,repNone,,False,"तमाम शिवसैनिकांची माऊली, वात्सल्यमूर्ती मॉंसाहेब मीनाताई ठाकरे यांच्या पवित्र स्मृतीस विनम्र अभिवादन ! #ममतादिन #६जानेवारी https://t.co/1CUtsUGbEB"
https://twitter.com/AnilKokil/status/1346425093224730624,Mon Mar 20 17:20:53 +0000 2017,2021-01-05 11:55:32,38,0,repNone,,False,प्रभाग मधील डॉ. विजय वाळिंबे रोड वरील स्पीड ब्रेकर वरती झेब्राक्रॉसिंग च्या पट्टाच्या कामाची पाहणी करताना.. @ShivSena @AjayChoudhariSS https://t.co/rpbldPBpR3
https://twitter.com/AnilKokil/status/1346415693823057921,Mon Mar 20 17:20:53 +0000 2017,2021-01-05 11:18:11,4,0,repNone,ShivSena,False,@ShivSena @ShivsenaComms https://t.co/Ie2MMEgY0a
https://twitter.com/AnilKokil/status/1346113196856205312,Mon Mar 20 17:20:53 +0000 2017,2021-01-04 15:16:10,5,0,rep1346113178334240768,AnilKokil,False,"या कार्यक्रमाला प्रभाग समिती अध्यक्ष रामदास कांबळे जी, शाखाप्रमुख किरण तावडे, महिला शाखा संघटक सौ.कांचन घाणेकर, माजी नगरसेविका ममता चेंबूरकर जी, प्रभागातील रहिवाशी उपस्थित होते.. @ShivSena https://t.co/2zhgCOeY3Z"
https://twitter.com/AnilKokil/status/1346113178334240768,Mon Mar 20 17:20:53 +0000 2017,2021-01-04 15:16:05,44,2,repNone,,False,"आज @mybmc च्या सहयोगाने आपत्तीशी लढण्याकरता मुंबईत प्रथमचं 'आपत्ती व्यवस्थापन प्रशिक्षण शिबीर' प्रभाग क्र.२०४ मधे आयोजित करण्यात आले.या कार्यक्रमाचे उद्घाटन अतिरिक्त आयुक्त सुरेश काकाणी जी, खासदार @AGSawant जी,आमदार @AjayChoudhariSS जी यांच्या उपस्थितीत करण्यात आले. @AUThackeray https://t.co/b1827HhgFQ"
https://twitter.com/AnilKokil/status/1345623714059042816,Mon Mar 20 17:20:53 +0000 2017,2021-01-03 06:51:08,20,2,repNone,,False,"आपत्ती व्यवस्थापन प्रशिक्षण शिबीर..! आमदार @AjayChoudhariSS जी यांच्या मार्गदर्शनाखाली सर्व नागरिकांसाठी आपत्कालीन व्यवस्थापन प्रशिक्षण शिबीर आयोजित करण्यात आले आहे.प्रभागतील इच्छुक नागरीकांनी आपले नाव शिवसेना शाखा,परळगांव येथे नोंदवावे. @ShivSena @OfficeofUT @AUThackeray @mybmc https://t.co/TvSj1Nd5sO"
https://twitter.com/AnilKokil/status/1345394524739174401,Mon Mar 20 17:20:53 +0000 2017,2021-01-02 15:40:25,15,0,repNone,,False,आपत्ती घडल्यास आता मुंबईकर वाचवू शकणार इतरांचा जीव; प्रत्येक प्रभागात आपत्कालीन प्रशिक्षण https://t.co/ayZkuOBSPN  @ShivSena @OfficeofUT @AUThackeray @AjayChoudhariSS @AGSawant
https://twitter.com/AnilKokil/status/1345237433672060929,Mon Mar 20 17:20:53 +0000 2017,2021-01-02 05:16:12,40,1,repNone,,False,"माझे सहकारी मित्र, शिवसेना नगरसेवक सचिनजी पडवळ यांस वाढदिवसाच्या हार्दिक शुभेच्छा!! @SachinPadwal206 https://t.co/8vERQAfYW4"
https://twitter.com/AnilKokil/status/1345053082154012673,Mon Mar 20 17:20:53 +0000 2017,2021-01-01 17:03:39,3,0,repNone,,True,I take #Epledge on https://t.co/KvQUnm0g05 to protect and preserve our 🌏 https://t.co/b8I6Ua04Rg https://t.co/CBTDqtaliU
