id,Account Created At(same for all rows),status created_at,Fav_cont,retweeted_count,reply_to_status,reply_to_screen,quote,text
https://twitter.com/AntiqueLyrics/status/412247313944297472,Sun Mar 17 15:36:08 +0000 2013,2013-12-15 15:46:33,3,10,repNone,,False,"Infant this eve, the music mixer hath thou and I becoming enamoured with one another once more."
https://twitter.com/AntiqueLyrics/status/412190795014209536,Sun Mar 17 15:36:08 +0000 2013,2013-12-15 12:01:58,9,28,repNone,,False,Can we not imagine that aircraft carriers in the twilight's atmostphere are similar to flying celestial orbs? One desires a wish presently.
https://twitter.com/AntiqueLyrics/status/412158994807930880,Sun Mar 17 15:36:08 +0000 2013,2013-12-15 09:55:36,7,10,repNone,,False,"I would have refrained from slumber 'til the morn, if I possessed the knowledge of how to preserve life."
https://twitter.com/AntiqueLyrics/status/412110254931861504,Sun Mar 17 15:36:08 +0000 2013,2013-12-15 06:41:56,2,3,repNone,,False,"Despite it being a burden, female partners I have had plenty, alas none similar to Miss Mackenzie, that's the reason I doth enter education."
https://twitter.com/AntiqueLyrics/status/412066887615262721,Sun Mar 17 15:36:08 +0000 2013,2013-12-15 03:49:36,2,10,repNone,,False,"Continue working, and continue pursuing, even if thou art fashioning Louis Vuitton or Reebok."
https://twitter.com/AntiqueLyrics/status/412030659754872832,Sun Mar 17 15:36:08 +0000 2013,2013-12-15 01:25:39,8,14,repNone,,False,"What thou fails to comprehend is that I would seize explosive munitions for thou, thrust my metacarpus on a scythe for thou."
https://twitter.com/AntiqueLyrics/status/411996653860573184,Sun Mar 17 15:36:08 +0000 2013,2013-12-14 23:10:31,5,5,repNone,,False,"And thou can proclaim to the entire populace, that this song belongs to thee."
https://twitter.com/AntiqueLyrics/status/411960523488391168,Sun Mar 17 15:36:08 +0000 2013,2013-12-14 20:46:57,1,9,repNone,,False,"L-I-F-E-P-R-O-C-E-E-D-S, thou possess more currency than logic, my companion."
https://twitter.com/AntiqueLyrics/status/411901016636813312,Sun Mar 17 15:36:08 +0000 2013,2013-12-14 16:50:29,1,7,repNone,,False,"I hath ruined my life in previous times, correct I hath been depressed, I am presently a different gentleman, Christopher Brown."
https://twitter.com/AntiqueLyrics/status/411841473542230016,Sun Mar 17 15:36:08 +0000 2013,2013-12-14 12:53:53,8,16,repNone,,False,"Doth thou ever feel, similar to a satchel of the plastic variety?"
https://twitter.com/AntiqueLyrics/status/411799136128598016,Sun Mar 17 15:36:08 +0000 2013,2013-12-14 10:05:39,13,20,repNone,,False,"Rah rah, similar to a mythical beast."
https://twitter.com/AntiqueLyrics/status/411749949572120576,Sun Mar 17 15:36:08 +0000 2013,2013-12-14 06:50:12,7,14,repNone,,False,"Lay hands on a desirable member of the opposite sex and announce, GREETINGS! I wish to have everything by the morn."
https://twitter.com/AntiqueLyrics/status/411700713941512192,Sun Mar 17 15:36:08 +0000 2013,2013-12-14 03:34:33,9,10,repNone,,False,"Beg thy pardon, Sir Skrillex, could I trouble thee to suddenly increase ye lower frequency tones?"
https://twitter.com/AntiqueLyrics/status/411635658675871745,Sun Mar 17 15:36:08 +0000 2013,2013-12-13 23:16:03,2,16,repNone,,False,Maintain thy status as 'dench' or face the consequences of Emmanuel Frimpong.
https://twitter.com/AntiqueLyrics/status/411578871465512960,Sun Mar 17 15:36:08 +0000 2013,2013-12-13 19:30:24,8,7,repNone,,False,"I'm strolling upon the light which the sun is emitting, Whoa-oa."
https://twitter.com/AntiqueLyrics/status/411526444469067776,Sun Mar 17 15:36:08 +0000 2013,2013-12-13 16:02:04,7,8,repNone,,False,I do not wish to be or not to be an ignoramus hailing from America.
https://twitter.com/AntiqueLyrics/status/411365466251067392,Sun Mar 17 15:36:08 +0000 2013,2013-12-13 05:22:24,4,11,repNone,,False,Why it's lubricated thunderbolts!
https://twitter.com/AntiqueLyrics/status/411332617217118209,Sun Mar 17 15:36:08 +0000 2013,2013-12-13 03:11:52,17,43,repNone,,False,"Taylor I beg thy pardon, and I shall let thee commence thy address, but Miss Beyonc� has the finest musical moving picture of all eternity."
https://twitter.com/AntiqueLyrics/status/411286895042121728,Sun Mar 17 15:36:08 +0000 2013,2013-12-13 00:10:11,7,10,repNone,,False,Presently thee are an individual whom I no longer class as an acquaintance.
https://twitter.com/AntiqueLyrics/status/411252223859892224,Sun Mar 17 15:36:08 +0000 2013,2013-12-12 21:52:25,21,52,repNone,,False,Wouldst thou do me the honour of instructing me how to Douglas?
https://twitter.com/AntiqueLyrics/status/411033122331836416,Sun Mar 17 15:36:08 +0000 2013,2013-12-12 07:21:47,8,27,repNone,,False,"Thou shall escort thee to ye olde confectionery store, I shalt allow thou to lick the popsicle stick."
https://twitter.com/AntiqueLyrics/status/410986969653448705,Sun Mar 17 15:36:08 +0000 2013,2013-12-12 04:18:23,2,5,repNone,,False,"It's vacant in the canyon of thy cardiac organ, the sun doth arises steadily whilst thou strolls."
https://twitter.com/AntiqueLyrics/status/410631744845381633,Sun Mar 17 15:36:08 +0000 2013,2013-12-11 04:46:51,6,7,repNone,,False,"This dwelling was previously one of amusement, alas now it has become overrun with devious jesters."
https://twitter.com/AntiqueLyrics/status/410572868016414720,Sun Mar 17 15:36:08 +0000 2013,2013-12-11 00:52:54,5,9,repNone,,False,"Thou art aboard a sailing vessel, mother fornicator, observe me."
https://twitter.com/AntiqueLyrics/status/410546520182648834,Sun Mar 17 15:36:08 +0000 2013,2013-12-10 23:08:12,0,20,repNone,,False,RT @SarahWalshXoX: Every guy should dress like @JustinBieber so #Swaggy! http://t.co/ocrcjjTktQ
https://twitter.com/AntiqueLyrics/status/410534985435590656,Sun Mar 17 15:36:08 +0000 2013,2013-12-10 22:22:22,3,15,repNone,,False,I only wishe to make thou moist.
https://twitter.com/AntiqueLyrics/status/410498045109731329,Sun Mar 17 15:36:08 +0000 2013,2013-12-10 19:55:35,3,6,repNone,,False,Each 24 hour period I rearrange.
https://twitter.com/AntiqueLyrics/status/410456064421687296,Sun Mar 17 15:36:08 +0000 2013,2013-12-10 17:08:46,14,25,repNone,,False,"'Tis the fifth hour of the morn, and conversation has become drone."
https://twitter.com/AntiqueLyrics/status/410395000262762496,Sun Mar 17 15:36:08 +0000 2013,2013-12-10 13:06:07,9,13,repNone,,False,"Cheerio, cheerio, Madame American Pastry."
https://twitter.com/AntiqueLyrics/status/410351682904543233,Sun Mar 17 15:36:08 +0000 2013,2013-12-10 10:13:59,2,4,repNone,,False,Every sharp intake of air thou grasps.
https://twitter.com/AntiqueLyrics/status/410320798574837760,Sun Mar 17 15:36:08 +0000 2013,2013-12-10 08:11:16,14,28,repNone,,False,"Fornicate that negro gentleman that thou adores greatly, I am sure thou still ponders about the memories we shared as one."
https://twitter.com/AntiqueLyrics/status/410259925697179648,Sun Mar 17 15:36:08 +0000 2013,2013-12-10 04:09:23,2,1,repNone,,False,"Thou releases it downward similar to New York City, I refrain from sleeping. Barbaric similar to Los Angeles, my ideal illusion."
https://twitter.com/AntiqueLyrics/status/410217470645911553,Sun Mar 17 15:36:08 +0000 2013,2013-12-10 01:20:41,10,6,repNone,,False,"Previously I controlled the planet, the oceans wouldst arise when I proclaimed my command."
https://twitter.com/AntiqueLyrics/status/410166508510531585,Sun Mar 17 15:36:08 +0000 2013,2013-12-09 21:58:10,6,5,repNone,,False,"The way thou makes one feel, thou provokes sexually excitement from me."
https://twitter.com/AntiqueLyrics/status/410133874975711233,Sun Mar 17 15:36:08 +0000 2013,2013-12-09 19:48:30,15,15,repNone,,False,"Mother Mia, we shall proceed once more."
https://twitter.com/AntiqueLyrics/status/410093611145912320,Sun Mar 17 15:36:08 +0000 2013,2013-12-09 17:08:30,7,19,repNone,,False,To what depth is your infatuation?
https://twitter.com/AntiqueLyrics/status/410038399051911169,Sun Mar 17 15:36:08 +0000 2013,2013-12-09 13:29:07,10,14,repNone,,False,I enjoy the manner in which thou moves.
https://twitter.com/AntiqueLyrics/status/409985716400054272,Sun Mar 17 15:36:08 +0000 2013,2013-12-09 09:59:46,1,5,repNone,,False,"A handful of people estimate that I am crazy, alas personally I believe I am of liberty."
https://twitter.com/AntiqueLyrics/status/409948414239977472,Sun Mar 17 15:36:08 +0000 2013,2013-12-09 07:31:33,9,8,repNone,,False,"I attempted to imitate Grace Kelly, alas her visage was too melancholy."
https://twitter.com/AntiqueLyrics/status/409901609938722816,Sun Mar 17 15:36:08 +0000 2013,2013-12-09 04:25:34,9,18,repNone,,False,"Teller of untruths, thy pantaloons hath ignited."
https://twitter.com/AntiqueLyrics/status/409847690302730241,Sun Mar 17 15:36:08 +0000 2013,2013-12-09 00:51:18,10,13,repNone,,False,"Disregard land, I am aboard a sailing vessel, fornicator of mothers."
https://twitter.com/AntiqueLyrics/status/409803644179988480,Sun Mar 17 15:36:08 +0000 2013,2013-12-08 21:56:17,12,13,repNone,,False,She is in possession of a posterior that is capable of engulfing a small pair of women's undergarments.
https://twitter.com/AntiqueLyrics/status/408591416097390592,Sun Mar 17 15:36:08 +0000 2013,2013-12-05 13:39:19,2,5,repNone,,False,"Let's have a jolly good time, this harmoney is miraculous, I would like to take a journey upon thy masquerade shaft."
https://twitter.com/AntiqueLyrics/status/408547950348869632,Sun Mar 17 15:36:08 +0000 2013,2013-12-05 10:46:36,2,7,repNone,,False,"If thou art partaking in an English literature exam in the 'morrow, I wish thee the best of fortune. Write well, quote I."
https://twitter.com/AntiqueLyrics/status/408516060652924928,Sun Mar 17 15:36:08 +0000 2013,2013-12-05 08:39:53,10,16,repNone,,False,All the folk in the boardroom get tipsy.
https://twitter.com/AntiqueLyrics/status/408466956035964928,Sun Mar 17 15:36:08 +0000 2013,2013-12-05 05:24:45,17,34,repNone,,False,"I have the ability to operate my two-wheeled mode of transport with the absence of handlebars, absence of handlebars, absence of handlebars."
https://twitter.com/AntiqueLyrics/status/408410415920467969,Sun Mar 17 15:36:08 +0000 2013,2013-12-05 01:40:05,8,19,repNone,,False,Infant thou art a pyrotechnic explosives display.
https://twitter.com/AntiqueLyrics/status/408375550286114816,Sun Mar 17 15:36:08 +0000 2013,2013-12-04 23:21:33,8,22,repNone,,False,Wouldst thou accompany me to Funky village?
https://twitter.com/AntiqueLyrics/status/408323535409410048,Sun Mar 17 15:36:08 +0000 2013,2013-12-04 19:54:51,3,6,repNone,,False,Alas fornicate with whom thou doth desire and fornicate with whom thou art fond of.
https://twitter.com/AntiqueLyrics/status/408278946833121280,Sun Mar 17 15:36:08 +0000 2013,2013-12-04 16:57:41,20,38,repNone,,False,"I am at a payphone, attempting to contact thy home, the entirety of my currency hath been squandered upon thou."
https://twitter.com/AntiqueLyrics/status/408233528912904192,Sun Mar 17 15:36:08 +0000 2013,2013-12-04 13:57:12,7,13,repNone,,False,"Rest in peace to the maiden thee previously observed, her time hath finished, infant she hath finished."
https://twitter.com/AntiqueLyrics/status/408188454749872128,Sun Mar 17 15:36:08 +0000 2013,2013-12-04 10:58:06,5,6,repNone,,False,"Greetings I hearkened that thou art an erratic one, ooooooooh!"
https://twitter.com/AntiqueLyrics/status/408134566059048960,Sun Mar 17 15:36:08 +0000 2013,2013-12-04 07:23:57,6,11,repNone,,False,"I observe shrubs of green, crimson roses also."
https://twitter.com/AntiqueLyrics/status/408095180344918016,Sun Mar 17 15:36:08 +0000 2013,2013-12-04 04:47:27,11,10,repNone,,False,"We are gliding, flying, there art not a celestial orb in Canaan that we coulst not grasp."
https://twitter.com/AntiqueLyrics/status/408058586418257921,Sun Mar 17 15:36:08 +0000 2013,2013-12-04 02:22:03,36,42,repNone,,False,"If I lounge here, if I merely lounge here, wouldst thou lounge in my presence and simply neglect the world?"
https://twitter.com/AntiqueLyrics/status/407999029184700417,Sun Mar 17 15:36:08 +0000 2013,2013-12-03 22:25:23,3,5,repNone,,False,"The entirety of my life, observing America."
https://twitter.com/AntiqueLyrics/status/407939280149835776,Sun Mar 17 15:36:08 +0000 2013,2013-12-03 18:27:58,5,0,repNone,,False,"Harmony upward, A-Town!"
https://twitter.com/AntiqueLyrics/status/407905709938851840,Sun Mar 17 15:36:08 +0000 2013,2013-12-03 16:14:34,7,12,repNone,,False,"Every time we doth caress, I experience such a feeling, and every time we doth kiss I believe I have the ability to fly."
https://twitter.com/AntiqueLyrics/status/407844270049992704,Sun Mar 17 15:36:08 +0000 2013,2013-12-03 12:10:26,3,8,repNone,,False,"Greetings, I am Luke, my age is five and mine father art known as Bruce Lee. Parades me around within thy JCB."
https://twitter.com/AntiqueLyrics/status/407795485529747456,Sun Mar 17 15:36:08 +0000 2013,2013-12-03 08:56:34,5,3,repNone,,False,"I hath fashioned these same pantaloons, for four days presently."
https://twitter.com/AntiqueLyrics/status/407746581287272448,Sun Mar 17 15:36:08 +0000 2013,2013-12-03 05:42:15,1,4,repNone,,False,"I art randy, randy randy randy. So randy, I art randy randy randy this eve."
https://twitter.com/AntiqueLyrics/status/407694622803369984,Sun Mar 17 15:36:08 +0000 2013,2013-12-03 02:15:47,14,25,repNone,,False,"Thou and I infant, art naught but creatures of mammalia, therefore let us engage in behavior imitated by subjects on The Discovery Channel."
https://twitter.com/AntiqueLyrics/status/407658688837451776,Sun Mar 17 15:36:08 +0000 2013,2013-12-02 23:53:00,8,19,repNone,,False,"I had intended to engage in paid labor, alas instead became intoxicated."
https://twitter.com/AntiqueLyrics/status/407609213624389632,Sun Mar 17 15:36:08 +0000 2013,2013-12-02 20:36:24,6,38,repNone,,False,"I desire the funds, funds &amp; the automobiles, automobiles &amp; the garments, the wenches, I suppose, I desire to be, I desire to be prosperous."
https://twitter.com/AntiqueLyrics/status/407563809696403456,Sun Mar 17 15:36:08 +0000 2013,2013-12-02 17:35:59,18,82,repNone,,False,Thou hath to check thyself before thou wrecks thyself.
https://twitter.com/AntiqueLyrics/status/407532707585855489,Sun Mar 17 15:36:08 +0000 2013,2013-12-02 15:32:23,4,18,repNone,,False,"Barney art a pre-historic, extinct beast originating from thy imagination."
https://twitter.com/AntiqueLyrics/status/407479581197606912,Sun Mar 17 15:36:08 +0000 2013,2013-12-02 12:01:17,15,27,repNone,,False,"Art thou able to exhale my whistle, infant, whistle, infant? Inform me."
https://twitter.com/AntiqueLyrics/status/407443986274455552,Sun Mar 17 15:36:08 +0000 2013,2013-12-02 09:39:50,10,36,repNone,,False,Express thyself.
https://twitter.com/AntiqueLyrics/status/407395403269541888,Sun Mar 17 15:36:08 +0000 2013,2013-12-02 06:26:47,8,9,repNone,,False,"It is something completely unforseeable, alas to finish with it is correct. One hopes thou experienced the best time of thy life."
https://twitter.com/AntiqueLyrics/status/407351502588493824,Sun Mar 17 15:36:08 +0000 2013,2013-12-02 03:32:21,24,54,repNone,,False,"Thou art enraged, brethren?"
https://twitter.com/AntiqueLyrics/status/407309128231432193,Sun Mar 17 15:36:08 +0000 2013,2013-12-02 00:43:58,6,21,repNone,,False,The tavern art unable to control me at this present moment in time.
https://twitter.com/AntiqueLyrics/status/407274060234911744,Sun Mar 17 15:36:08 +0000 2013,2013-12-01 22:24:37,5,28,repNone,,False,Youthful Currency Sterling Currency Billionaires. YCSCB.
https://twitter.com/AntiqueLyrics/status/407213030334685184,Sun Mar 17 15:36:08 +0000 2013,2013-12-01 18:22:06,12,22,repNone,,False,"Remove thy nose off of my organ, for what reason art thou pestering I? There art a room filled with negro gentlemen."
https://twitter.com/AntiqueLyrics/status/407168166360391680,Sun Mar 17 15:36:08 +0000 2013,2013-12-01 15:23:50,9,10,repNone,,False,"Jonathan, la gente est� muy loca. What the intercourse?"
https://twitter.com/AntiqueLyrics/status/407120344898490368,Sun Mar 17 15:36:08 +0000 2013,2013-12-01 12:13:48,5,8,repNone,,False,"What art incorrect with the planet, mother? Thine inhabitants existing as if they were motherless."
https://twitter.com/AntiqueLyrics/status/407063738160660480,Sun Mar 17 15:36:08 +0000 2013,2013-12-01 08:28:52,7,9,repNone,,False,One art feeling sassy and liberal.
https://twitter.com/AntiqueLyrics/status/407024336688537600,Sun Mar 17 15:36:08 +0000 2013,2013-12-01 05:52:18,9,7,repNone,,False,"Life art abominable, and then thou expires."
https://twitter.com/AntiqueLyrics/status/406987473663700992,Sun Mar 17 15:36:08 +0000 2013,2013-12-01 03:25:49,9,18,repNone,,False,"What thou fails to comprehend is that I wouldst seize explosive munitions for thou, thrust my metacarpus on a scythe for thou."
https://twitter.com/AntiqueLyrics/status/406954017357856769,Sun Mar 17 15:36:08 +0000 2013,2013-12-01 01:12:53,3,7,repNone,,False,"She hath a posterior capable of englufing women's small undergarments, and also her breasts seem to have been stung by bees."
https://twitter.com/AntiqueLyrics/status/406906143630323714,Sun Mar 17 15:36:08 +0000 2013,2013-11-30 22:02:39,11,26,repNone,,False,"Possess my negro acquaintances in Paris, and thine art behaving similar to apes."
https://twitter.com/AntiqueLyrics/status/406875311024779264,Sun Mar 17 15:36:08 +0000 2013,2013-11-30 20:00:08,17,40,repNone,,False,"Greetings, Jude. Do not make thy present situation worse. Take a melancholy tune, and improve its quality."
https://twitter.com/AntiqueLyrics/status/406829489595752448,Sun Mar 17 15:36:08 +0000 2013,2013-11-30 16:58:03,13,18,repNone,,False,"Recently, I engaged in intercourse, and the feeling was one of delight. A wench gave me permission to insert my penis into thine vagina."
https://twitter.com/AntiqueLyrics/status/403535709266382849,Sun Mar 17 15:36:08 +0000 2013,2013-11-21 14:49:45,6,10,repNone,,False,Strike my wench upward.
https://twitter.com/AntiqueLyrics/status/403498114742374400,Sun Mar 17 15:36:08 +0000 2013,2013-11-21 12:20:21,15,42,repNone,,False,"It is the alternative composition of Ignition, sweltering and newly produced from the canteen."
https://twitter.com/AntiqueLyrics/status/403464451661123584,Sun Mar 17 15:36:08 +0000 2013,2013-11-21 10:06:35,14,20,repNone,,False,"I wish to become a possessor of one billion sterling coins, so darned much."
https://twitter.com/AntiqueLyrics/status/403417337895718912,Sun Mar 17 15:36:08 +0000 2013,2013-11-21 06:59:23,2,9,repNone,,False,"Interesting tale, brethren. Requires more mythical flying beasts and faeces."
https://twitter.com/AntiqueLyrics/status/403375747336650752,Sun Mar 17 15:36:08 +0000 2013,2013-11-21 04:14:07,20,19,repNone,,False,Harrison Potter and thy Chalice of Flames.
https://twitter.com/AntiqueLyrics/status/403324933217869824,Sun Mar 17 15:36:08 +0000 2013,2013-11-21 00:52:12,4,10,repNone,,False,"I shalt refrain from ever proclaiming the word ""never""."
https://twitter.com/AntiqueLyrics/status/403268888743276544,Sun Mar 17 15:36:08 +0000 2013,2013-11-20 21:09:30,20,33,repNone,,False,Merely a smalltown wench. Existing within a lonesome parish.
https://twitter.com/AntiqueLyrics/status/403207248698023936,Sun Mar 17 15:36:08 +0000 2013,2013-11-20 17:04:33,8,15,repNone,,False,"Simply a civilised gentleman, conceived and established within the southern region of Detroit."
https://twitter.com/AntiqueLyrics/status/403153121825660928,Sun Mar 17 15:36:08 +0000 2013,2013-11-20 13:29:29,3,16,repNone,,False,Infant allow me to love thou downward. There art numerous means of loving thee.
https://twitter.com/AntiqueLyrics/status/403100665246797826,Sun Mar 17 15:36:08 +0000 2013,2013-11-20 10:01:02,7,12,repNone,,False,"Proceed, impolite young gentleman: art thou capable of sufficient elevation? Proceed, impolite young gentleman: is its size acceptable?"
https://twitter.com/AntiqueLyrics/status/403061903615737857,Sun Mar 17 15:36:08 +0000 2013,2013-11-20 07:27:01,4,15,repNone,,False,"Prior to one's departure, I cleanse my dental fixtures with a container of thine finest whiskey."
https://twitter.com/AntiqueLyrics/status/403010790824759297,Sun Mar 17 15:36:08 +0000 2013,2013-11-20 04:03:54,26,67,repNone,,False,Fornicate the authorities.
https://twitter.com/AntiqueLyrics/status/402965045287469057,Sun Mar 17 15:36:08 +0000 2013,2013-11-20 01:02:08,17,17,repNone,,False,I hath passion within my pantaloons and one is not in fear or thou witnessing it. I am sexually attractive and aware of it.
https://twitter.com/AntiqueLyrics/status/402922743319904256,Sun Mar 17 15:36:08 +0000 2013,2013-11-19 22:14:02,11,17,repNone,,False,Harrison Potter and thy Dungeon of Mysterious Truths.
https://twitter.com/AntiqueLyrics/status/402878024770543616,Sun Mar 17 15:36:08 +0000 2013,2013-11-19 19:16:20,31,58,repNone,,False,Which individual takes residence within thy subaquatic pineapple fruit? Sponge Robert Square Pantaloons.
https://twitter.com/AntiqueLyrics/status/402844304277639168,Sun Mar 17 15:36:08 +0000 2013,2013-11-19 17:02:21,8,36,repNone,,False,All I am bothered with is currency and the village from which I originate.
https://twitter.com/AntiqueLyrics/status/402789997813575680,Sun Mar 17 15:36:08 +0000 2013,2013-11-19 13:26:33,12,22,repNone,,False,I mortally wounded the constable. Alas one firmly denies any involvement in the shooting of his deputy.
https://twitter.com/AntiqueLyrics/status/402758404369678336,Sun Mar 17 15:36:08 +0000 2013,2013-11-19 11:21:01,14,12,repNone,,False,"I wish to be intoxicated when I arise, on the correct half of the incorrect bed."
https://twitter.com/AntiqueLyrics/status/402697876821647360,Sun Mar 17 15:36:08 +0000 2013,2013-11-19 07:20:30,19,44,repNone,,False,"African American, I beg of thee."
https://twitter.com/AntiqueLyrics/status/402646845039468544,Sun Mar 17 15:36:08 +0000 2013,2013-11-19 03:57:43,17,56,repNone,,False,"I fail to perceive how thou art able to detest from outside of the establishment, thou art not even able to gain access within."
https://twitter.com/AntiqueLyrics/status/402068857042382849,Sun Mar 17 15:36:08 +0000 2013,2013-11-17 13:41:00,20,50,repNone,,False,My patience hath reached its maximum! I shall no longer tolerate these mother fornicating reptiles upon this mother fornicating aircraft.
https://twitter.com/AntiqueLyrics/status/402020639462023168,Sun Mar 17 15:36:08 +0000 2013,2013-11-17 10:29:24,10,34,repNone,,False,I enjoy large posteriors and I am unable to deceive.
https://twitter.com/AntiqueLyrics/status/401962736537440256,Sun Mar 17 15:36:08 +0000 2013,2013-11-17 06:39:19,30,55,repNone,,False,"Goodness gracious, Rebecca, observe her gluteus maximus. Tunechi."
https://twitter.com/AntiqueLyrics/status/401902442872176640,Sun Mar 17 15:36:08 +0000 2013,2013-11-17 02:39:44,17,47,repNone,,False,"Infant, infant, infant oh, infant, infant, infant, oh, infant, infant, infant oh, forsaw that thou wouldst always belong to me."
https://twitter.com/AntiqueLyrics/status/401851679156338689,Sun Mar 17 15:36:08 +0000 2013,2013-11-16 23:18:01,11,31,repNone,,False,Thine faeces cray.
https://twitter.com/AntiqueLyrics/status/401805733605281792,Sun Mar 17 15:36:08 +0000 2013,2013-11-16 20:15:26,11,26,repNone,,False,"Fornicate that negro gentleman that thou beest so fond of, I am sure that thee still ponders about the experiences we shared."
https://twitter.com/AntiqueLyrics/status/401755068082290688,Sun Mar 17 15:36:08 +0000 2013,2013-11-16 16:54:07,25,68,repNone,,False,"I shan't make the claim this female is a chaser of currency. Alas, she is not found in the company of negro gentleman who art not wealthy."
https://twitter.com/AntiqueLyrics/status/401719015459926017,Sun Mar 17 15:36:08 +0000 2013,2013-11-16 14:30:51,55,116,repNone,,False,"My smooth dairy product attracts all the gentlemen to the recreational field and they annouce ""It's superior to thine""."
https://twitter.com/AntiqueLyrics/status/401682056872091648,Sun Mar 17 15:36:08 +0000 2013,2013-11-16 12:03:59,5,11,repNone,,False,"It doth not regard the currency, currency, currency, we don't require thy currency, currency, currency."
https://twitter.com/AntiqueLyrics/status/401644659354517505,Sun Mar 17 15:36:08 +0000 2013,2013-11-16 09:35:23,12,21,repNone,,False,"Miya hee, miya haa, miya hoo, miya haa haa... Thou."
https://twitter.com/AntiqueLyrics/status/401597094395265024,Sun Mar 17 15:36:08 +0000 2013,2013-11-16 06:26:23,34,80,repNone,,False,"Disregard wenches, aqcuire currency."
https://twitter.com/AntiqueLyrics/status/401549089944244225,Sun Mar 17 15:36:08 +0000 2013,2013-11-16 03:15:38,15,40,repNone,,False,"Simply going to stand there and observe me ignite, fear not, as I enjoy the matter in which it pains me."
https://twitter.com/AntiqueLyrics/status/401492599195713536,Sun Mar 17 15:36:08 +0000 2013,2013-11-15 23:31:09,13,36,repNone,,False,"Pantaloons upon the floor, pantaloons upon the floor, thou hath the appearance of a jester with thy pantaloons upon the floor."
https://twitter.com/AntiqueLyrics/status/401443378593669121,Sun Mar 17 15:36:08 +0000 2013,2013-11-15 20:15:34,24,45,repNone,,False,"The temperature in this vicinity hath risen, promptly remove thy garments."
https://twitter.com/AntiqueLyrics/status/401391341747183616,Sun Mar 17 15:36:08 +0000 2013,2013-11-15 16:48:48,19,21,repNone,,False,"Gesturing with my cranium like ""Aye"". Rapidly positioning my pelvic arch like ""Aye""."
https://twitter.com/AntiqueLyrics/status/401336093099827200,Sun Mar 17 15:36:08 +0000 2013,2013-11-15 13:09:15,7,17,repNone,,False,Thou can go in thy own direction.
https://twitter.com/AntiqueLyrics/status/401303557317468160,Sun Mar 17 15:36:08 +0000 2013,2013-11-15 10:59:58,14,18,repNone,,False,"Boom badoom boom, boom badoom, thy hath that magnificent baritone."
https://twitter.com/AntiqueLyrics/status/401244256171335680,Sun Mar 17 15:36:08 +0000 2013,2013-11-15 07:04:20,19,34,repNone,,False,"I art at a payphone attempting to contact home, all of my currency I hath squandered upon thou."
