id,Account Created At(same for all rows),status created_at,Fav_cont,retweeted_count,reply_to_status,reply_to_screen,quote,text
https://twitter.com/AntiqueLyrics/status/437269549868519424,Sun Mar 17 15:36:08 +0000 2013,2014-02-22 16:55:59,12,20,repNone,,False,My former female partners habituate thineselves in Texas similar to if I were Sir George Strait.
https://twitter.com/AntiqueLyrics/status/437228546767859714,Sun Mar 17 15:36:08 +0000 2013,2014-02-22 14:13:03,6,16,repNone,,False,25 years of age atop of 25 million shillings.
https://twitter.com/AntiqueLyrics/status/437181414446866432,Sun Mar 17 15:36:08 +0000 2013,2014-02-22 11:05:46,16,19,repNone,,False,"No new negro gentleman, negro, we art not at ease with that. Fornicate a false companion, wherefore art thy real companions?"
https://twitter.com/AntiqueLyrics/status/437146438644944896,Sun Mar 17 15:36:08 +0000 2013,2014-02-22 08:46:47,12,17,repNone,,False,"She taketh my currency, when I require it."
https://twitter.com/AntiqueLyrics/status/437090053072773120,Sun Mar 17 15:36:08 +0000 2013,2014-02-22 05:02:44,11,45,repNone,,False,"I desire the currency, currency &amp; the automobiles, automobiles &amp; the robes, the wenches, I suppose, I long to be, I long to be prosperous."
https://twitter.com/AntiqueLyrics/status/437052032911155200,Sun Mar 17 15:36:08 +0000 2013,2014-02-22 02:31:39,4,5,repNone,,False,Reclining aside a fire whilst we doth snack on fondue.
https://twitter.com/AntiqueLyrics/status/436993229666263040,Sun Mar 17 15:36:08 +0000 2013,2014-02-21 22:37:59,11,14,repNone,,False,"Thou wouldst not give credence to thine eyes, if ten million fireflies illuminated the planet as I doth fall into a slumber."
https://twitter.com/AntiqueLyrics/status/436951093898010624,Sun Mar 17 15:36:08 +0000 2013,2014-02-21 19:50:33,4,3,repNone,,False,"Wherefore art thou? And I apologise profusely. I am unable to rest, I am unable to dream this eve."
https://twitter.com/AntiqueLyrics/status/436914599892246529,Sun Mar 17 15:36:08 +0000 2013,2014-02-21 17:25:32,9,28,repNone,,False,"Observe thou, now observe us. All of my negro acquaintances appear to be affluent."
https://twitter.com/AntiqueLyrics/status/436867236813611008,Sun Mar 17 15:36:08 +0000 2013,2014-02-21 14:17:20,8,9,repNone,,False,"Constructed an abode upon thy posterior, that is known as an Asstate."
https://twitter.com/AntiqueLyrics/status/436810581853483008,Sun Mar 17 15:36:08 +0000 2013,2014-02-21 10:32:12,4,5,repNone,,False,Increase the altitude of thy hands in respect to Detroit; one adores this settlement.
https://twitter.com/AntiqueLyrics/status/436766970760146944,Sun Mar 17 15:36:08 +0000 2013,2014-02-21 07:38:55,16,16,repNone,,False,And the entire female populace proclaimed I am rather trendy for a Caucasian fellow.
https://twitter.com/AntiqueLyrics/status/436721939776688128,Sun Mar 17 15:36:08 +0000 2013,2014-02-21 04:39:59,37,107,repNone,,False,"My apologies Lady Jackson, I am quite sincere. It was not in my wishes to provoke thy daughter's sadness, I apologised numerous times."
https://twitter.com/AntiqueLyrics/status/436688409222840321,Sun Mar 17 15:36:08 +0000 2013,2014-02-21 02:26:44,15,29,repNone,,False,"Thy face downward, thy posteriors risen, tis the way we doth enjoy procreating."
https://twitter.com/AntiqueLyrics/status/436648052569296896,Sun Mar 17 15:36:08 +0000 2013,2014-02-20 23:46:22,4,4,repNone,,False,"Ahoy, ahoy, the gentleman has the appearance of a maiden."
https://twitter.com/AntiqueLyrics/status/436592116483895296,Sun Mar 17 15:36:08 +0000 2013,2014-02-20 20:04:06,18,32,repNone,,False,I shall share with thou the tale of how I emerged as the youthful heir to the throne of Bel-Air.
https://twitter.com/AntiqueLyrics/status/436557894201266177,Sun Mar 17 15:36:08 +0000 2013,2014-02-20 17:48:07,12,18,repNone,,False,"Thou and I, infant, are naught but creatures of mammalia thus let us engage in behaviour mirrored by subjects on The Discovery Channel."
https://twitter.com/AntiqueLyrics/status/436499893121986560,Sun Mar 17 15:36:08 +0000 2013,2014-02-20 13:57:38,21,33,repNone,,False,Two females originating from the Trailer Park relocate around the circumference.
https://twitter.com/AntiqueLyrics/status/436460449681661952,Sun Mar 17 15:36:08 +0000 2013,2014-02-20 11:20:54,43,68,repNone,,False,Poppeth thy genitalia for a real negro.
https://twitter.com/AntiqueLyrics/status/436415832327856128,Sun Mar 17 15:36:08 +0000 2013,2014-02-20 08:23:37,2,1,repNone,,False,"'Tis not the measure of the canine in the fray, 'tis the measure of the fray in the canine."
https://twitter.com/AntiqueLyrics/status/436378365319458816,Sun Mar 17 15:36:08 +0000 2013,2014-02-20 05:54:44,0,225,repNone,,False,RT @YouPlayin: #ThisCouldBeUsButYouPlayin.. http://t.co/1nAQf0a2T4
https://twitter.com/AntiqueLyrics/status/436358857581789185,Sun Mar 17 15:36:08 +0000 2013,2014-02-20 04:37:13,9,9,repNone,,False,Wenches adore Beyonc�
https://twitter.com/AntiqueLyrics/status/436358228361089024,Sun Mar 17 15:36:08 +0000 2013,2014-02-20 04:34:43,0,39,repNone,,False,RT @DogFails: http://t.co/zgGCdGNlGH
https://twitter.com/AntiqueLyrics/status/436307477479428096,Sun Mar 17 15:36:08 +0000 2013,2014-02-20 01:13:03,8,9,repNone,,False,"Thou doth hail from the 70s, alas I am a 90s wench."
https://twitter.com/AntiqueLyrics/status/436265960001896448,Sun Mar 17 15:36:08 +0000 2013,2014-02-19 22:28:04,15,31,repNone,,False,"I adore troublesome wenches that is my fornicating predicament... And indeed, I enjoy to fornicate, that is my fornicating predicament."
https://twitter.com/AntiqueLyrics/status/436216932312678400,Sun Mar 17 15:36:08 +0000 2013,2014-02-19 19:13:15,5,15,repNone,,False,"Fornicate all of thy Negroes, aside from my Negroes."
https://twitter.com/AntiqueLyrics/status/436156633735917568,Sun Mar 17 15:36:08 +0000 2013,2014-02-19 15:13:39,9,20,repNone,,False,I doth detest these blurred lines. I am aware that thou desires it. Alas thou art an innocent wench.
https://twitter.com/AntiqueLyrics/status/436112259631169537,Sun Mar 17 15:36:08 +0000 2013,2014-02-19 12:17:19,1,5,repNone,,False,"We hath progressed too far, to release whom we art. So allow us to raiseth the bar and our goblets to the celestial orbs."
https://twitter.com/AntiqueLyrics/status/436073214238662657,Sun Mar 17 15:36:08 +0000 2013,2014-02-19 09:42:10,7,17,repNone,,False,"These shoes are worth one thousand shillings, thou OENO."
https://twitter.com/AntiqueLyrics/status/436028410184216576,Sun Mar 17 15:36:08 +0000 2013,2014-02-19 06:44:08,8,11,repNone,,False,Thine intercourse is ablaze.
https://twitter.com/AntiqueLyrics/status/435982592199114753,Sun Mar 17 15:36:08 +0000 2013,2014-02-19 03:42:04,11,21,repNone,,False,I hath passion within my pantaloons and I hath no fear in allowing thee to witness it... I am sexually attractive and I am aware of it.
https://twitter.com/AntiqueLyrics/status/435945064519307264,Sun Mar 17 15:36:08 +0000 2013,2014-02-19 01:12:57,10,20,repNone,,False,"Open thy mind up and hearken me, Kendrick. I am inside of thy conscious if thou art unable to hearken then thou shalt be history, Kendrick."
https://twitter.com/AntiqueLyrics/status/435909227622567936,Sun Mar 17 15:36:08 +0000 2013,2014-02-18 22:50:33,5,19,repNone,,False,"I struck it, I struck it, I struck it, I struck it, I struck it, I struck it first."
https://twitter.com/AntiqueLyrics/status/435871681031069696,Sun Mar 17 15:36:08 +0000 2013,2014-02-18 20:21:21,25,36,repNone,,False,Bitch don't kill my scribe.
https://twitter.com/AntiqueLyrics/status/435826148262424576,Sun Mar 17 15:36:08 +0000 2013,2014-02-18 17:20:25,1,2,repNone,,False,She doth strut in a similar fashion to Rihanna.
https://twitter.com/AntiqueLyrics/status/435791186356211712,Sun Mar 17 15:36:08 +0000 2013,2014-02-18 15:01:30,14,20,repNone,,False,Only know thy lover when thou doth release her.
https://twitter.com/AntiqueLyrics/status/435754236261842944,Sun Mar 17 15:36:08 +0000 2013,2014-02-18 12:34:40,14,31,repNone,,False,"Greetings! I doth go by, what? I doth go by, who? I doth go by the name Slim Shady."
https://twitter.com/AntiqueLyrics/status/435546123042709504,Sun Mar 17 15:36:08 +0000 2013,2014-02-17 22:47:42,21,46,repNone,,False,"She hath a large posterior, so I call her large posterior."
https://twitter.com/AntiqueLyrics/status/435493108709863424,Sun Mar 17 15:36:08 +0000 2013,2014-02-17 19:17:02,48,99,repNone,,False,"If thou art having lady problems, my sympathy goes out unto thee. I hath 99 predicaments, alas a wench is not among them."
https://twitter.com/AntiqueLyrics/status/435433063267319808,Sun Mar 17 15:36:08 +0000 2013,2014-02-17 15:18:26,4,5,repNone,,False,The majority of our lives thus far hath been spent living in a utopia for undesirable hoodlums.
https://twitter.com/AntiqueLyrics/status/435394537502961664,Sun Mar 17 15:36:08 +0000 2013,2014-02-17 12:45:21,11,28,repNone,,False,I cause a downpour of precipitation upon them wenches.
https://twitter.com/AntiqueLyrics/status/435346261500104704,Sun Mar 17 15:36:08 +0000 2013,2014-02-17 09:33:31,23,53,repNone,,False,Shillings shalt make her jive. Shillings shalt make her jive.
https://twitter.com/AntiqueLyrics/status/435306038607110144,Sun Mar 17 15:36:08 +0000 2013,2014-02-17 06:53:41,16,33,repNone,,False,We art unable to halt. And we shalt not halt.
https://twitter.com/AntiqueLyrics/status/435257339650666496,Sun Mar 17 15:36:08 +0000 2013,2014-02-17 03:40:11,31,32,repNone,,False,"Infant, thou art a melody. Thou increase my desire to descend my windows, and cruise."
https://twitter.com/AntiqueLyrics/status/435198588214194176,Sun Mar 17 15:36:08 +0000 2013,2014-02-16 23:46:43,18,36,repNone,,False,I slipped an ecstasy tablet into her beverage; she was unaware. I proceeded to taketh her back to my abode and enjoy that; she was unaware.
https://twitter.com/AntiqueLyrics/status/435145746611200001,Sun Mar 17 15:36:08 +0000 2013,2014-02-16 20:16:45,22,53,repNone,,False,No new companions.
https://twitter.com/AntiqueLyrics/status/435101994953347072,Sun Mar 17 15:36:08 +0000 2013,2014-02-16 17:22:54,16,21,repNone,,False,"Female genitalia, currency, herbs, prescription painkillers."
https://twitter.com/AntiqueLyrics/status/434907623813431297,Sun Mar 17 15:36:08 +0000 2013,2014-02-16 04:30:32,2,2,repNone,,False,I hath been anticipating all night for thou to exclaim thy love for myself.
https://twitter.com/AntiqueLyrics/status/434857767145193472,Sun Mar 17 15:36:08 +0000 2013,2014-02-16 01:12:25,3,5,repNone,,False,"Everybody at this instance art thou able to hearken me? Increase the decibels of the speakers if thou hearken me. Ayayaya, ayayaya."
https://twitter.com/AntiqueLyrics/status/434799530404372481,Sun Mar 17 15:36:08 +0000 2013,2014-02-15 21:21:00,25,46,repNone,,False,Halt! The time of hammer is upon us.
https://twitter.com/AntiqueLyrics/status/434739798352199682,Sun Mar 17 15:36:08 +0000 2013,2014-02-15 17:23:39,3,14,repNone,,False,"Back with thou, fornicator of mother. For thou hath no knowledge of me like that."
https://twitter.com/AntiqueLyrics/status/434616658317942784,Sun Mar 17 15:36:08 +0000 2013,2014-02-15 09:14:20,13,23,repNone,,False,Couldst thou escort me to the town of Funky?
https://twitter.com/AntiqueLyrics/status/434469391179059200,Sun Mar 17 15:36:08 +0000 2013,2014-02-14 23:29:09,15,25,repNone,,False,"My automobile collided with the bridge, I am not bothered in the slightest."
https://twitter.com/AntiqueLyrics/status/434440109262254080,Sun Mar 17 15:36:08 +0000 2013,2014-02-14 21:32:48,0,391,repNone,,False,RT @YouPlayin: This could be us but you playin.. http://t.co/jCz1gp1BZy
https://twitter.com/AntiqueLyrics/status/434414597638864896,Sun Mar 17 15:36:08 +0000 2013,2014-02-14 19:51:25,7,13,repNone,,False,"Rouse me from my slumber when it hath finished. When I hath gained more knowledge, and hath aged."
https://twitter.com/AntiqueLyrics/status/434360332320907264,Sun Mar 17 15:36:08 +0000 2013,2014-02-14 16:15:47,33,58,repNone,,False,Couldst thou instruct me how to Douglas?
https://twitter.com/AntiqueLyrics/status/434199272163385344,Sun Mar 17 15:36:08 +0000 2013,2014-02-14 05:35:48,0,240,repNone,,False,RT @YouPlayin: Happy Valentine's Day! http://t.co/YI9dw50wNI
https://twitter.com/AntiqueLyrics/status/433872821119250432,Sun Mar 17 15:36:08 +0000 2013,2014-02-13 07:58:36,15,14,repNone,,False,"Can thou blow my whistle, infant, whistle, infant? Inform me."
https://twitter.com/AntiqueLyrics/status/433834754090475520,Sun Mar 17 15:36:08 +0000 2013,2014-02-13 05:27:20,35,49,repNone,,False,"My conscious is instructing me no. Alas my body, my body is giving me affirmative thoughts."
https://twitter.com/AntiqueLyrics/status/433788481882451968,Sun Mar 17 15:36:08 +0000 2013,2014-02-13 02:23:28,34,61,repNone,,False,Arose from my slumber within a new Bugatti.
https://twitter.com/AntiqueLyrics/status/433735937915240448,Sun Mar 17 15:36:08 +0000 2013,2014-02-12 22:54:40,45,68,repNone,,False,"Consumed a Molly, I doth perspire."
https://twitter.com/AntiqueLyrics/status/433718438755057664,Sun Mar 17 15:36:08 +0000 2013,2014-02-12 21:45:08,0,309,repNone,,False,RT @YouPlayin: #ThisCouldBeUsButYouPlayin.. http://t.co/ZtW7WPLWsl
https://twitter.com/AntiqueLyrics/status/433700335891144704,Sun Mar 17 15:36:08 +0000 2013,2014-02-12 20:33:12,31,61,repNone,,False,Which individual takes residence within thy sub-aquatic pineapple fruit? Sponge Robert Square Pantaloons.
https://twitter.com/AntiqueLyrics/status/433645014917210112,Sun Mar 17 15:36:08 +0000 2013,2014-02-12 16:53:22,25,41,repNone,,False,Do not release that thun thun thun from thy grasp.
https://twitter.com/AntiqueLyrics/status/431946551372423168,Sun Mar 17 15:36:08 +0000 2013,2014-02-08 00:24:17,11,22,repNone,,False,"Somewhere far along this trail he lost his soul, to a wench lacking in a vital organ."
https://twitter.com/AntiqueLyrics/status/431897486647504896,Sun Mar 17 15:36:08 +0000 2013,2014-02-07 21:09:19,6,16,repNone,,False,We all reside in a vessel that submerges under the ocean sharing its colour with the Sun.
https://twitter.com/AntiqueLyrics/status/431864428309381120,Sun Mar 17 15:36:08 +0000 2013,2014-02-07 18:57:58,5,18,repNone,,False,"Proceed, person of small stature, as if 'twere the day of thy birth."
https://twitter.com/AntiqueLyrics/status/431856317918363648,Sun Mar 17 15:36:08 +0000 2013,2014-02-07 18:25:44,0,406,repNone,,False,RT @YouPlayin: #ThisCouldBeUsButYouPlayin.. http://t.co/7hdWB5VI6J
https://twitter.com/AntiqueLyrics/status/431833675219496960,Sun Mar 17 15:36:08 +0000 2013,2014-02-07 16:55:45,17,32,repNone,,False,"Greetings, I have recently been in your acquaintance and this is absurd, alas I present to thee my contact details, so telephone me perhaps."
https://twitter.com/AntiqueLyrics/status/431788266518368257,Sun Mar 17 15:36:08 +0000 2013,2014-02-07 13:55:19,18,28,repNone,,False,"They attempted to force me into rehabilitation alas I proclaimed nay, nay, nay."
https://twitter.com/AntiqueLyrics/status/431742065743904768,Sun Mar 17 15:36:08 +0000 2013,2014-02-07 10:51:44,25,27,repNone,,False,"Four go out to thee, Glen Coco. Thou doth succeed, Glen Coco!"
https://twitter.com/AntiqueLyrics/status/431692582519709696,Sun Mar 17 15:36:08 +0000 2013,2014-02-07 07:35:06,28,53,repNone,,False,"Frozen water, frozen water, infant."
https://twitter.com/AntiqueLyrics/status/431647568733302784,Sun Mar 17 15:36:08 +0000 2013,2014-02-07 04:36:14,17,17,repNone,,False,Rouse me from my slumber when the ninth month of the calendar hath come to an end.
https://twitter.com/AntiqueLyrics/status/431613862363013120,Sun Mar 17 15:36:08 +0000 2013,2014-02-07 02:22:18,11,23,repNone,,False,"Sphere with such vigour fornicators of mothers wish to persecute me. Alas firstly, Negros must locate me."
https://twitter.com/AntiqueLyrics/status/431567433573228544,Sun Mar 17 15:36:08 +0000 2013,2014-02-06 23:17:48,16,29,repNone,,False,"Wench, thou doth look splendid reverse thy posterior, refer to me as Big Daddy reverse thy posterior."
https://twitter.com/AntiqueLyrics/status/431510238332596224,Sun Mar 17 15:36:08 +0000 2013,2014-02-06 19:30:32,22,27,repNone,,False,"#RapLikeLilWayne Almost drowned in her vaginal juices, alas I paddled toward her posterior."
https://twitter.com/AntiqueLyrics/status/431467446973648896,Sun Mar 17 15:36:08 +0000 2013,2014-02-06 16:40:30,2,6,repNone,,False,"Thou wouldst remove the garments from my body, and I would alloweth thee."
https://twitter.com/AntiqueLyrics/status/431163822208868353,Sun Mar 17 15:36:08 +0000 2013,2014-02-05 20:34:00,1,1,repNone,,False,Change    Keep tailored Trends
https://twitter.com/AntiqueLyrics/status/431162737499340800,Sun Mar 17 15:36:08 +0000 2013,2014-02-05 20:29:41,0,300,repNone,,False,RT @YouPlayin: This could be us but you playin.. http://t.co/yUpzQm2h73
https://twitter.com/AntiqueLyrics/status/431117857976758272,Sun Mar 17 15:36:08 +0000 2013,2014-02-05 17:31:21,1,2,repNone,,False,Trends offer a unique way to get closer to what you care about. They are tailored for you based on your location and who you follow.
https://twitter.com/AntiqueLyrics/status/431079106017370112,Sun Mar 17 15:36:08 +0000 2013,2014-02-05 14:57:22,22,48,repNone,,False,"Rack Village, wench"
https://twitter.com/AntiqueLyrics/status/430991966927474688,Sun Mar 17 15:36:08 +0000 2013,2014-02-05 09:11:07,1,1,repNone,,False,Keyboard shortcuts are available for common actions and site navigation.View Keyboard ShortcutsDismiss this message
https://twitter.com/AntiqueLyrics/status/430942556206030848,Sun Mar 17 15:36:08 +0000 2013,2014-02-05 05:54:46,3,3,repNone,,False,Forgot password?    Already using Twitter via text message?
https://twitter.com/AntiqueLyrics/status/430902801221177344,Sun Mar 17 15:36:08 +0000 2013,2014-02-05 03:16:48,1,1,repNone,,False,Forgot your password?
https://twitter.com/AntiqueLyrics/status/430857665934147584,Sun Mar 17 15:36:08 +0000 2013,2014-02-05 00:17:27,3,2,repNone,,False,Forgot your username?
https://twitter.com/AntiqueLyrics/status/430834454685560832,Sun Mar 17 15:36:08 +0000 2013,2014-02-04 22:45:13,0,473,repNone,,False,RT @YouPlayin: This could be us but you playin.. http://t.co/Bag2vCnZxn
https://twitter.com/AntiqueLyrics/status/430798364872294400,Sun Mar 17 15:36:08 +0000 2013,2014-02-04 20:21:48,0,2,repNone,,False,"Hmm, there was a problem reaching the server. Try again?"
https://twitter.com/AntiqueLyrics/status/430739558179696640,Sun Mar 17 15:36:08 +0000 2013,2014-02-04 16:28:08,0,2,repNone,,False,Add this Tweet to your website by copying the code below. Learn more
https://twitter.com/AntiqueLyrics/status/430701043509239809,Sun Mar 17 15:36:08 +0000 2013,2014-02-04 13:55:05,0,1,repNone,,False,(This can take a while if you�ve got a large address book.)
https://twitter.com/AntiqueLyrics/status/430636119869648896,Sun Mar 17 15:36:08 +0000 2013,2014-02-04 09:37:06,0,713,repNone,,False,RT @YouPlayin: #ThisCouldBeUsButYouPlayin http://t.co/KntDdJ647O
https://twitter.com/AntiqueLyrics/status/430573593576353792,Sun Mar 17 15:36:08 +0000 2013,2014-02-04 05:28:39,0,936,repNone,,False,RT @YouPlayin: This could be us but.. http://t.co/g1Yi3c8frG
https://twitter.com/AntiqueLyrics/status/430558501572993024,Sun Mar 17 15:36:08 +0000 2013,2014-02-04 04:28:40,0,1143,repNone,,False,RT @YouPlayin: #ThisCouldBeUsButYouPlayin http://t.co/s6kKjH7GJs
https://twitter.com/AntiqueLyrics/status/430539596154171392,Sun Mar 17 15:36:08 +0000 2013,2014-02-04 03:13:33,3,3,repNone,,False,This has already been marked as containing sensitive content.
https://twitter.com/AntiqueLyrics/status/430484037459648512,Sun Mar 17 15:36:08 +0000 2013,2014-02-03 23:32:47,2,1,repNone,,False,Back to top ?
https://twitter.com/AntiqueLyrics/status/430443177607049217,Sun Mar 17 15:36:08 +0000 2013,2014-02-03 20:50:25,7,12,repNone,,False,I am voluptuous and I am aware of this.
https://twitter.com/AntiqueLyrics/status/430410357329252353,Sun Mar 17 15:36:08 +0000 2013,2014-02-03 18:40:00,8,16,repNone,,False,"Madame, thou doth illuminate my planet in the manner of no other."
https://twitter.com/AntiqueLyrics/status/430350194832453632,Sun Mar 17 15:36:08 +0000 2013,2014-02-03 14:40:56,7,6,repNone,,False,You and I are capable of penning a negative romantic situation.
https://twitter.com/AntiqueLyrics/status/430317231474372608,Sun Mar 17 15:36:08 +0000 2013,2014-02-03 12:29:57,5,9,repNone,,False,"Thou hath been clouted by, thou hath been fisticuffed by, a dapper neanderthal."
https://twitter.com/AntiqueLyrics/status/430286770781974528,Sun Mar 17 15:36:08 +0000 2013,2014-02-03 10:28:55,9,7,repNone,,False,................................................................................................................... Madame Barbra Streisand.
https://twitter.com/AntiqueLyrics/status/430247737443893248,Sun Mar 17 15:36:08 +0000 2013,2014-02-03 07:53:48,3,19,repNone,,False,"Thou owns branded tinted-spectacles simply to eclipse thine's face, and thou parades in them, as if thou ist superior to thee."
https://twitter.com/AntiqueLyrics/status/430194408470740993,Sun Mar 17 15:36:08 +0000 2013,2014-02-03 04:21:54,4,3,repNone,,False,"Oh, inscribed within the celestial orbs, one million miles from here."
https://twitter.com/AntiqueLyrics/status/430137072070828032,Sun Mar 17 15:36:08 +0000 2013,2014-02-03 00:34:04,9,20,repNone,,False,"Thou was pondering about thee, ponder about thy, pondering about thine, pondering us? Bared my retinas, it was nothing short of an illusion."
https://twitter.com/AntiqueLyrics/status/430088730754285568,Sun Mar 17 15:36:08 +0000 2013,2014-02-02 21:21:58,8,11,repNone,,False,"Joyous anniversary of birth unto thee, joyous anniversary of birth unto thee."
https://twitter.com/AntiqueLyrics/status/430083374452322304,Sun Mar 17 15:36:08 +0000 2013,2014-02-02 21:00:41,0,256,repNone,,False,RT @YouPlayin: #ThisCouldBeUsButYouPlayin #SB48 http://t.co/1PFkmNoAp8
https://twitter.com/AntiqueLyrics/status/429898168139264000,Sun Mar 17 15:36:08 +0000 2013,2014-02-02 08:44:45,0,96,repNone,,False,RT @YouPlayin: #ThisCouldBeUsButYouPlayin http://t.co/RY66yY2pQE
https://twitter.com/AntiqueLyrics/status/429544673829347328,Sun Mar 17 15:36:08 +0000 2013,2014-02-01 09:20:05,2,5,repNone,,False,"Great Scott! Thou are an attractive wench, an attractive wench, an attractive wench."
https://twitter.com/AntiqueLyrics/status/429513893765840897,Sun Mar 17 15:36:08 +0000 2013,2014-02-01 07:17:46,5,9,repNone,,False,"Thee hast a grand number of scoundrels attempt to swindle your heart, yet to receive any fortune, unable to decipher ways to love."
https://twitter.com/AntiqueLyrics/status/429490332536156160,Sun Mar 17 15:36:08 +0000 2013,2014-02-01 05:44:09,0,916,repNone,,False,RT @YouPlayin: #ThisCouldBeUsButYouPlayin http://t.co/6TFjZodB1e
https://twitter.com/AntiqueLyrics/status/429465770951573504,Sun Mar 17 15:36:08 +0000 2013,2014-02-01 04:06:33,19,34,repNone,,False,"Thou whips thy locks to and fro, thou whips thy locks to and fro."
https://twitter.com/AntiqueLyrics/status/429415421523943425,Sun Mar 17 15:36:08 +0000 2013,2014-02-01 00:46:29,0,1,repNone,,False,"I possess the spiritual essence of a person that lives on after death, alas I am not a warrior in an army of any kind."
https://twitter.com/AntiqueLyrics/status/429382224568258560,Sun Mar 17 15:36:08 +0000 2013,2014-01-31 22:34:34,6,13,repNone,,False,"Proceed, person of small stature, as if 'twere the day of thine's birth."
https://twitter.com/AntiqueLyrics/status/429322575135506432,Sun Mar 17 15:36:08 +0000 2013,2014-01-31 18:37:33,0,5,repNone,,False,"If thou possessed a rifle, thou wouldst attempt to blast a cavity within the giant star known for providing the Earth with light."
https://twitter.com/AntiqueLyrics/status/429263218179985408,Sun Mar 17 15:36:08 +0000 2013,2014-01-31 14:41:41,4,31,repNone,,False,Wouldst thou be so kind as to accompany thee to the town of Funky?
https://twitter.com/AntiqueLyrics/status/429215950127128576,Sun Mar 17 15:36:08 +0000 2013,2014-01-31 11:33:51,8,15,repNone,,False,"Ergo, thine become intoxicated? Ergo, thine inhale marijuana fumes? Thine art merely enjoying a merry time, regardless of those observing."
https://twitter.com/AntiqueLyrics/status/429178838682054656,Sun Mar 17 15:36:08 +0000 2013,2014-01-31 09:06:23,4,7,repNone,,False,All of thine dwelleth in a vessel that submerges under the ocean which is the color of the sun.
https://twitter.com/AntiqueLyrics/status/429142117189832704,Sun Mar 17 15:36:08 +0000 2013,2014-01-31 06:40:28,4,7,repNone,,False,"Thou proclaim thine female belongs to the squad of Class-A, immobilised within thine's imagination."
https://twitter.com/AntiqueLyrics/status/429123068829908992,Sun Mar 17 15:36:08 +0000 2013,2014-01-31 05:24:47,0,646,repNone,,False,RT @YouPlayin: This could be us but you playin.. http://t.co/3yr2ILJ3fp
https://twitter.com/AntiqueLyrics/status/429093826566049792,Sun Mar 17 15:36:08 +0000 2013,2014-01-31 03:28:35,0,132,repNone,,False,RT @YouPlayin: This could be us but you playin.. http://t.co/k6laNVhqIz
https://twitter.com/AntiqueLyrics/status/428735793835032576,Sun Mar 17 15:36:08 +0000 2013,2014-01-30 03:45:53,0,386,repNone,,False,RT @YouPlayin: This could be us but you playin.. http://t.co/L22uabmgvI
https://twitter.com/AntiqueLyrics/status/428377854762815488,Sun Mar 17 15:36:08 +0000 2013,2014-01-29 04:03:34,0,342,repNone,,False,RT @YouPlayin: This could be us but you playin.. http://t.co/SqB9WC0RTi
https://twitter.com/AntiqueLyrics/status/428330804498817024,Sun Mar 17 15:36:08 +0000 2013,2014-01-29 00:56:36,2,2,repNone,,False,"This one belongs to those chaps sporting polos, businessmen negro gentlemen in the... moguls."
https://twitter.com/AntiqueLyrics/status/428279535289659393,Sun Mar 17 15:36:08 +0000 2013,2014-01-28 21:32:52,3,9,repNone,,False,"Thou hast to engage in a confrontation, for thou's virtue, to enjoy a festivity."
https://twitter.com/AntiqueLyrics/status/428258222353698816,Sun Mar 17 15:36:08 +0000 2013,2014-01-28 20:08:11,0,539,repNone,,False,RT @YouPlayin: This could be us but you playin.. http://t.co/4nofMdHKtU
