id,Account Created At(same for all rows),status created_at,Fav_cont,retweeted_count,reply_to_status,reply_to_screen,quote,text
https://twitter.com/AntiqueLyrics/status/387352505689964544,Sun Mar 17 15:36:08 +0000 2013,2013-10-07 23:03:28,0,1,repNone,,False,M-A-D-A-M-E N�rgaard
https://twitter.com/AntiqueLyrics/status/387306433810677761,Sun Mar 17 15:36:08 +0000 2013,2013-10-07 20:00:24,4,21,repNone,,False,"Okay, fornicate it, I deceived thou, it's drum and bass, how art thou going to respond?"
https://twitter.com/AntiqueLyrics/status/387260060025380865,Sun Mar 17 15:36:08 +0000 2013,2013-10-07 16:56:07,6,32,repNone,,False,Halt. Merge together and hearken.
https://twitter.com/AntiqueLyrics/status/387201985918676992,Sun Mar 17 15:36:08 +0000 2013,2013-10-07 13:05:21,4,3,repNone,,False,We shalt be returning for thee one day.
https://twitter.com/AntiqueLyrics/status/387163789491044352,Sun Mar 17 15:36:08 +0000 2013,2013-10-07 10:33:35,2,26,repNone,,False,"He is clambering into thy fenestration, abducting thy inhabitants."
https://twitter.com/AntiqueLyrics/status/387109569073147904,Sun Mar 17 15:36:08 +0000 2013,2013-10-07 06:58:08,38,114,repNone,,False,"Hide thy children, hide thy wife, and hide thy spouse, for they art forcing sexual intercourse upon the entire populace of this area."
https://twitter.com/AntiqueLyrics/status/387061572301881344,Sun Mar 17 15:36:08 +0000 2013,2013-10-07 03:47:24,2,19,repNone,,False,"This eve, we art swigging from the flagon."
https://twitter.com/AntiqueLyrics/status/387002421672554496,Sun Mar 17 15:36:08 +0000 2013,2013-10-06 23:52:22,3,24,repNone,,False,"I proclaimed, ""Greetings, thou, art thee going to bang though?"" No, I desire some fornicating Nando's."
https://twitter.com/AntiqueLyrics/status/386956520073617408,Sun Mar 17 15:36:08 +0000 2013,2013-10-06 20:49:58,8,41,repNone,,False,"We art not required to remove our garments, to enjoy ourselves."
https://twitter.com/AntiqueLyrics/status/386914629642756096,Sun Mar 17 15:36:08 +0000 2013,2013-10-06 18:03:30,28,135,repNone,,False,"The temperature in this vicinity hath risen, so promptly remove thy garments."
https://twitter.com/AntiqueLyrics/status/386791435569082369,Sun Mar 17 15:36:08 +0000 2013,2013-10-06 09:53:59,16,65,repNone,,False,"Twigs and rocks couldst snap my cartilage, alas shackles and lashes delight me."
https://twitter.com/AntiqueLyrics/status/386732477449924608,Sun Mar 17 15:36:08 +0000 2013,2013-10-06 05:59:42,19,65,repNone,,False,"Possess my negro acquaintances in Paris, and they art behaving similar to apes."
https://twitter.com/AntiqueLyrics/status/386673588259938304,Sun Mar 17 15:36:08 +0000 2013,2013-10-06 02:05:42,17,60,repNone,,False,What didst thy lady request? Fillet of fish.
https://twitter.com/AntiqueLyrics/status/386634785889591297,Sun Mar 17 15:36:08 +0000 2013,2013-10-05 23:31:30,19,74,repNone,,False,"Thouuuuu crank that warrior chap, thouuuuu crank that warrior chap."
https://twitter.com/AntiqueLyrics/status/386584396490223616,Sun Mar 17 15:36:08 +0000 2013,2013-10-05 20:11:17,15,81,repNone,,False,"Of what amount is 50 thousand dollars to a fornicator of mothers such as myself, couldst thou please remind me?"
https://twitter.com/AntiqueLyrics/status/386540853369393152,Sun Mar 17 15:36:08 +0000 2013,2013-10-05 17:18:15,10,53,repNone,,False,"I witness thee dancing upon the pole, I know thou art aware that I am observing thou, and thou art already aware, I wish to forniate thou."
https://twitter.com/AntiqueLyrics/status/386507001020162049,Sun Mar 17 15:36:08 +0000 2013,2013-10-05 15:03:44,5,29,repNone,,False,"Nobody wishes to see us together, alas that is not of importance, as I am in possession of thee, babe."
https://twitter.com/AntiqueLyrics/status/386303264699842560,Sun Mar 17 15:36:08 +0000 2013,2013-10-05 01:34:10,14,51,repNone,,False,"I am sapphire dabba dee dabba die, dabba dee dabba die dabba dee dabba die."
https://twitter.com/AntiqueLyrics/status/386262237897183232,Sun Mar 17 15:36:08 +0000 2013,2013-10-04 22:51:08,5,21,repNone,,False,Possess thy grandmother upon my penis.
https://twitter.com/AntiqueLyrics/status/386228062217457665,Sun Mar 17 15:36:08 +0000 2013,2013-10-04 20:35:20,7,32,repNone,,False,"Air hostess, I doth enjoy the garments in which thou dresses thyself."
https://twitter.com/AntiqueLyrics/status/386223264776732672,Sun Mar 17 15:36:08 +0000 2013,2013-10-04 20:16:16,0,23,repNone,,False,RT @RatchetHumor: Worst rappers of 2013! http://t.co/v8fgJ53ed6
https://twitter.com/AntiqueLyrics/status/386186548728717312,Sun Mar 17 15:36:08 +0000 2013,2013-10-04 17:50:22,14,50,repNone,,False,Rouse my from my slumber when the ninth month of the year hath finished.
https://twitter.com/AntiqueLyrics/status/386149651679682561,Sun Mar 17 15:36:08 +0000 2013,2013-10-04 15:23:45,6,26,repNone,,False,I estimate that thou look divine upon the floor of the ballroom.
https://twitter.com/AntiqueLyrics/status/386098463781306368,Sun Mar 17 15:36:08 +0000 2013,2013-10-04 12:00:21,10,53,repNone,,False,"Observe me presently. Observe me presently, oh. I am acquiring parchment."
https://twitter.com/AntiqueLyrics/status/386064162746421248,Sun Mar 17 15:36:08 +0000 2013,2013-10-04 09:44:03,11,28,repNone,,False,"I shalt wait, I shalt wait for thee."
https://twitter.com/AntiqueLyrics/status/386012466934583296,Sun Mar 17 15:36:08 +0000 2013,2013-10-04 06:18:38,24,114,repNone,,False,"I fail to perceive how thou can scorn from outside of the tavern, thou art unable to gain access within."
https://twitter.com/AntiqueLyrics/status/385954222086168576,Sun Mar 17 15:36:08 +0000 2013,2013-10-04 02:27:11,16,55,repNone,,False,"Observe the stars, observe the manner in which they sparkle, for thou."
https://twitter.com/AntiqueLyrics/status/385903289411203072,Sun Mar 17 15:36:08 +0000 2013,2013-10-03 23:04:48,4,19,repNone,,False,"They art aware, they art aware, they art aware."
https://twitter.com/AntiqueLyrics/status/385857253762285568,Sun Mar 17 15:36:08 +0000 2013,2013-10-03 20:01:52,7,28,repNone,,False,The temperature outside is too low for heavenly spirits to take flight.
https://twitter.com/AntiqueLyrics/status/385803526019883009,Sun Mar 17 15:36:08 +0000 2013,2013-10-03 16:28:23,21,85,repNone,,False,"I am at a pay phone attempting to call thy home, all of my currency I hath squandered upon thee."
https://twitter.com/AntiqueLyrics/status/385749643499278336,Sun Mar 17 15:36:08 +0000 2013,2013-10-03 12:54:16,6,40,repNone,,False,"Wouldst thou dance, if I requested thee to dance?"
https://twitter.com/AntiqueLyrics/status/385705251954622464,Sun Mar 17 15:36:08 +0000 2013,2013-10-03 09:57:52,10,57,repNone,,False,"She proclaims that they long for the Drake of previous times, wench, doth not incite me."
https://twitter.com/AntiqueLyrics/status/385644412312637440,Sun Mar 17 15:36:08 +0000 2013,2013-10-03 05:56:07,2,55,repNone,,False,"Shawty desires a hooligan, bottles within the tavern."
https://twitter.com/AntiqueLyrics/status/385604051452190720,Sun Mar 17 15:36:08 +0000 2013,2013-10-03 03:15:44,54,228,repNone,,False,"I hath acquired 99 predicaments, alas a wench cannot be regarded as one."
https://twitter.com/AntiqueLyrics/status/385555054557556737,Sun Mar 17 15:36:08 +0000 2013,2013-10-03 00:01:02,6,34,repNone,,False,"I long for thy affection and I long for thy vengeance, betwixt us we could pen a terrible romance."
https://twitter.com/AntiqueLyrics/status/385518710770765825,Sun Mar 17 15:36:08 +0000 2013,2013-10-02 21:36:37,28,107,repNone,,False,"I shalt pop some tags, only possess 20 shillings within my pocket."
https://twitter.com/AntiqueLyrics/status/385487815611404288,Sun Mar 17 15:36:08 +0000 2013,2013-10-02 19:33:51,26,101,repNone,,False,"They attempted to force me into rehabilitation, alas quoth I, ""Nay, nay nay""."
https://twitter.com/AntiqueLyrics/status/385449249304899586,Sun Mar 17 15:36:08 +0000 2013,2013-10-02 17:00:36,19,57,repNone,,False,"Once thou hath experienced an African American fellow, thou shalt never return."
https://twitter.com/AntiqueLyrics/status/385383795630678017,Sun Mar 17 15:36:08 +0000 2013,2013-10-02 12:40:31,5,27,repNone,,False,"This is not a melody of infatuation, this is farewell."
https://twitter.com/AntiqueLyrics/status/385332160493649920,Sun Mar 17 15:36:08 +0000 2013,2013-10-02 09:15:20,3,24,repNone,,False,Let us treasure this evening as if we were to pass as juveniles.
https://twitter.com/AntiqueLyrics/status/385270636957806592,Sun Mar 17 15:36:08 +0000 2013,2013-10-02 05:10:52,4,37,repNone,,False,"Remain dench, or face the wrath of Sir Emmanuel Frimpong."
https://twitter.com/AntiqueLyrics/status/385220907741896704,Sun Mar 17 15:36:08 +0000 2013,2013-10-02 01:53:16,11,76,repNone,,False,"No deception, no deception, no deception. Actual negro gentleman say ""Word, thou hath never made false statements""."
https://twitter.com/AntiqueLyrics/status/385199116319350784,Sun Mar 17 15:36:08 +0000 2013,2013-10-02 00:26:40,0,23,repNone,,False,RT @SarahWalshXoX: This is why Rihanna chose Drake over Chris Brown http://t.co/foiqA0X9Gt
https://twitter.com/AntiqueLyrics/status/385170316772663296,Sun Mar 17 15:36:08 +0000 2013,2013-10-01 22:32:14,1,33,repNone,,False,"We doth enjoy sleeping in the hours of the sun, and then engaging in festivities by nightfall."
https://twitter.com/AntiqueLyrics/status/385125007698833408,Sun Mar 17 15:36:08 +0000 2013,2013-10-01 19:32:11,20,75,repNone,,False,"Sir Tyler, the Architect"
https://twitter.com/AntiqueLyrics/status/385064799710617601,Sun Mar 17 15:36:08 +0000 2013,2013-10-01 15:32:57,23,101,repNone,,False,"Oh na na, what name doth I go by?"
https://twitter.com/AntiqueLyrics/status/385031491014516737,Sun Mar 17 15:36:08 +0000 2013,2013-10-01 13:20:35,22,66,repNone,,False,"'Tis a beautiful eve, we art searching for something obtuse to do. Greetings, infant! I believe I wish to join thee in holy matrimony."
https://twitter.com/AntiqueLyrics/status/384992436042215424,Sun Mar 17 15:36:08 +0000 2013,2013-10-01 10:45:24,22,60,repNone,,False,"Perchance, if I was thy boyfriend, never wouldst I release thou."
https://twitter.com/AntiqueLyrics/status/384936175112159233,Sun Mar 17 15:36:08 +0000 2013,2013-10-01 07:01:50,22,77,repNone,,False,No such festivity exists similar to an S Club festivity.
https://twitter.com/AntiqueLyrics/status/384891906880049152,Sun Mar 17 15:36:08 +0000 2013,2013-10-01 04:05:56,0,27,repNone,,False,Fail to remember thy boyfriend and unite with me at the room of the inn.
https://twitter.com/AntiqueLyrics/status/384842409051295744,Sun Mar 17 15:36:08 +0000 2013,2013-10-01 00:49:15,15,45,repNone,,False,Doth thou wish thy female companion was dazzling similar to myself?
https://twitter.com/AntiqueLyrics/status/384809047376941056,Sun Mar 17 15:36:08 +0000 2013,2013-09-30 22:36:40,45,117,repNone,,False,"I am infatuated with troublesome wenches, that is my fornicating predicament."
https://twitter.com/AntiqueLyrics/status/384759382262554624,Sun Mar 17 15:36:08 +0000 2013,2013-09-30 19:19:19,19,59,repNone,,False,Perform the shimmy originating from Harlem.
https://twitter.com/AntiqueLyrics/status/384726727294861312,Sun Mar 17 15:36:08 +0000 2013,2013-09-30 17:09:34,10,29,repNone,,False,I doth not require any speed. I doth not require any heroin. I doth not desire any cocaine. Thou canst keep thy ketamine.
https://twitter.com/AntiqueLyrics/status/384679578926477312,Sun Mar 17 15:36:08 +0000 2013,2013-09-30 14:02:13,21,73,repNone,,False,Alas she apprehended me upon the counter? 'Twasn't I.
https://twitter.com/AntiqueLyrics/status/384629821923287040,Sun Mar 17 15:36:08 +0000 2013,2013-09-30 10:44:30,58,152,repNone,,False,"Surname ""Ever"", forename ""Greatest"", similar to an injured ankle, gentleman, I shan't be toyed with."
https://twitter.com/AntiqueLyrics/status/384580999566217216,Sun Mar 17 15:36:08 +0000 2013,2013-09-30 07:30:30,1,26,repNone,,False,"What thou hast, a billion in currency could never purchase, ey ey ey. We shalt jive as if 't'were 3012 this eve."
https://twitter.com/AntiqueLyrics/status/384546488077910016,Sun Mar 17 15:36:08 +0000 2013,2013-09-30 05:13:21,11,37,repNone,,False,When thou observes my face prithee it shalt give thee hell.
https://twitter.com/AntiqueLyrics/status/384494984159694848,Sun Mar 17 15:36:08 +0000 2013,2013-09-30 01:48:42,14,47,repNone,,False,All of the folk in the boardroom get tipsy.
https://twitter.com/AntiqueLyrics/status/384164058657599488,Sun Mar 17 15:36:08 +0000 2013,2013-09-29 03:53:43,11,25,repNone,,False,"Proceed with me, Barbara, let us go and party."
https://twitter.com/AntiqueLyrics/status/384125380333801472,Sun Mar 17 15:36:08 +0000 2013,2013-09-29 01:20:02,9,39,repNone,,False,"Gesturing with my cranium like ""Aye""! Moving my hips like ""Aye""!"
https://twitter.com/AntiqueLyrics/status/384089762069372928,Sun Mar 17 15:36:08 +0000 2013,2013-09-28 22:58:29,8,50,repNone,,False,"Do not despise the racketeer, instead despise his sport."
https://twitter.com/AntiqueLyrics/status/384030254219538432,Sun Mar 17 15:36:08 +0000 2013,2013-09-28 19:02:02,8,38,repNone,,False,"'T'which location is my currency, wench?!"
https://twitter.com/AntiqueLyrics/status/383979641796431872,Sun Mar 17 15:36:08 +0000 2013,2013-09-28 15:40:55,11,70,repNone,,False,Inhale cannabis leaves every day.
https://twitter.com/AntiqueLyrics/status/383924624632733696,Sun Mar 17 15:36:08 +0000 2013,2013-09-28 12:02:18,19,67,repNone,,False,"""Greetings, Barbara!"" - ""Greetings, Kenneth!"" - ""Doth thou wish to journey in my automobile?"" - ""Indeed, Kenneth!"" - ""Enter my vehicle!"""
https://twitter.com/AntiqueLyrics/status/383881293869510656,Sun Mar 17 15:36:08 +0000 2013,2013-09-28 09:10:07,31,86,repNone,,False,"I doth enjoy it when thou refers to me as ""Large Father""."
https://twitter.com/AntiqueLyrics/status/383825008176279552,Sun Mar 17 15:36:08 +0000 2013,2013-09-28 05:26:27,9,47,repNone,,False,"I bother with, what on Earth am I saying? Thou art aware of my posse's name. Thou knoweth 2 Chainz scrrr, I am arriving in that Bruce Wayne."
https://twitter.com/AntiqueLyrics/status/383771429994373121,Sun Mar 17 15:36:08 +0000 2013,2013-09-28 01:53:33,21,135,repNone,,False,As long as my wenches art fond of me.
https://twitter.com/AntiqueLyrics/status/383731825861873664,Sun Mar 17 15:36:08 +0000 2013,2013-09-27 23:16:11,18,80,repNone,,False,"Where didst thou originate from, where didst thou flee to? Where didst thou originate from, Cotton-Eyed Joseph?"
https://twitter.com/AntiqueLyrics/status/383683620361089024,Sun Mar 17 15:36:08 +0000 2013,2013-09-27 20:04:38,20,78,repNone,,False,"A negro police informer, that is the faeces that I am not fond of."
https://twitter.com/AntiqueLyrics/status/383645921143033857,Sun Mar 17 15:36:08 +0000 2013,2013-09-27 17:34:50,27,112,repNone,,False,Began from the depths and now we art here. Began from the depths and now my entire posse is here.
https://twitter.com/AntiqueLyrics/status/383586936557826048,Sun Mar 17 15:36:08 +0000 2013,2013-09-27 13:40:27,26,82,repNone,,False,"Annabel, art thou okay? Art thou okay? Art thou okay, Annabel?"
https://twitter.com/AntiqueLyrics/status/383554030292594688,Sun Mar 17 15:36:08 +0000 2013,2013-09-27 11:29:41,35,150,repNone,,False,"Every second, every minute, Sir, I assure you she can receive it. If thou art a bad wench, flail thy hands up high."
https://twitter.com/AntiqueLyrics/status/383515495988592640,Sun Mar 17 15:36:08 +0000 2013,2013-09-27 08:56:34,7,53,repNone,,False,Thou maketh me feel as though I hath been barred from the heavenly realms for an exceedingly long amount of time.
https://twitter.com/AntiqueLyrics/status/383469967175213056,Sun Mar 17 15:36:08 +0000 2013,2013-09-27 05:55:39,3,32,repNone,,False,I be on my smart garments and neck accessory faeces.
https://twitter.com/AntiqueLyrics/status/383420316359204864,Sun Mar 17 15:36:08 +0000 2013,2013-09-27 02:38:21,4,33,repNone,,False,"I am thy property, thou art my property, thou art my sweetheart."
https://twitter.com/AntiqueLyrics/status/383069748591734784,Sun Mar 17 15:36:08 +0000 2013,2013-09-26 03:25:19,15,67,repNone,,False,"If thou permits me here's what I shalt do, I shalt take care of thee."
https://twitter.com/AntiqueLyrics/status/383031652555173888,Sun Mar 17 15:36:08 +0000 2013,2013-09-26 00:53:57,16,79,repNone,,False,"'Tis the alternate composition of Ignition, sweltering and new from the canteen."
https://twitter.com/AntiqueLyrics/status/382970135868231680,Sun Mar 17 15:36:08 +0000 2013,2013-09-25 20:49:30,3,20,repNone,,False,"I doth go by the name Jme, my name hath been inked upon the scene of grime."
https://twitter.com/AntiqueLyrics/status/382909444545187844,Sun Mar 17 15:36:08 +0000 2013,2013-09-25 16:48:20,9,41,repNone,,False,"I wish to shriek, and yelp, and release it all from within myself. We art saying ""Oh ay oh ay oh ay oh""."
https://twitter.com/AntiqueLyrics/status/382863923667431426,Sun Mar 17 15:36:08 +0000 2013,2013-09-25 13:47:27,33,93,repNone,,False,"Thou art now strutting with, Will.i.are and Britney, wench."
https://twitter.com/AntiqueLyrics/status/382803028450885632,Sun Mar 17 15:36:08 +0000 2013,2013-09-25 09:45:28,14,58,repNone,,False,"Perhaps, thou shalt be the one who rescues me. And after all, thou art my wall of wonders."
https://twitter.com/AntiqueLyrics/status/382748416209465344,Sun Mar 17 15:36:08 +0000 2013,2013-09-25 06:08:28,16,63,repNone,,False,"I am returning to my abode, I am returning to my abode, inform the world that I am returning to my abode."
https://twitter.com/AntiqueLyrics/status/382712907852554240,Sun Mar 17 15:36:08 +0000 2013,2013-09-25 03:47:22,10,39,repNone,,False,"Thou art far too dazzling, girl. This is the reason 'twill not work. Thou hast me suicidal, suicidal when thou ended our relationship."
https://twitter.com/AntiqueLyrics/status/382678133846982656,Sun Mar 17 15:36:08 +0000 2013,2013-09-25 01:29:11,25,85,repNone,,False,"Refer to me as Sir Flintstone, for I hath the ability to shake thy mattress."
https://twitter.com/AntiqueLyrics/status/382633999799037952,Sun Mar 17 15:36:08 +0000 2013,2013-09-24 22:33:49,2,28,repNone,,False,"Wouldst thou alloweth, me, to observe beneath thy resplendence?"
https://twitter.com/AntiqueLyrics/status/382592206701219841,Sun Mar 17 15:36:08 +0000 2013,2013-09-24 19:47:44,71,258,repNone,,False,"Wench, refrain from slaying my vibe."
https://twitter.com/AntiqueLyrics/status/382545407965810688,Sun Mar 17 15:36:08 +0000 2013,2013-09-24 16:41:47,3,9,repNone,,False,I hath fashioned the same pantaloons for four days now.
https://twitter.com/AntiqueLyrics/status/382509388914622464,Sun Mar 17 15:36:08 +0000 2013,2013-09-24 14:18:39,56,124,repNone,,False,"Rack village, wench, rack rack village, wench. Ten, ten, ten twenties on thy bosoms, wench."
https://twitter.com/AntiqueLyrics/status/382458809521688576,Sun Mar 17 15:36:08 +0000 2013,2013-09-24 10:57:40,20,70,repNone,,False,"Alas 'twas not thy fault but mine, and 'twas thy cardiac organ at risk, I really fornicated the situation up this time, didn't I, my dear?"
https://twitter.com/AntiqueLyrics/status/382412581362618369,Sun Mar 17 15:36:08 +0000 2013,2013-09-24 07:53:58,0,8,repNone,,False,"She is not a rockstar, alas she hath groupies. She is not a leading lady, alas she produces motion pictures."
https://twitter.com/AntiqueLyrics/status/382371269707964416,Sun Mar 17 15:36:08 +0000 2013,2013-09-24 05:09:49,12,34,repNone,,False,"My companion hath a female companion, gentleman he despises that wench. He informs me every day."
https://twitter.com/AntiqueLyrics/status/382332275058176000,Sun Mar 17 15:36:08 +0000 2013,2013-09-24 02:34:52,2,11,repNone,,False,"I an unable to achieve any satisfaction. I hath attempted, and I hath attempted, and I hath attempted, and I hath attempted. I AM UNABLE!"
https://twitter.com/AntiqueLyrics/status/382285323998203904,Sun Mar 17 15:36:08 +0000 2013,2013-09-23 23:28:18,4,47,repNone,,False,It is of no importance as to whether thy complexion be dark or pale.
https://twitter.com/AntiqueLyrics/status/382240854087180288,Sun Mar 17 15:36:08 +0000 2013,2013-09-23 20:31:35,8,47,repNone,,False,Existence is similar to a box of assorted cocoa treats. Thou art never aware of thou art next to receive.
https://twitter.com/AntiqueLyrics/status/382188398632398848,Sun Mar 17 15:36:08 +0000 2013,2013-09-23 17:03:09,8,29,repNone,,False,"I doth suspect a tremor of the Earth's plates up in here. And we toss explosive devices upon thee, toss explosive devices upon thee."
https://twitter.com/AntiqueLyrics/status/381914956045615105,Sun Mar 17 15:36:08 +0000 2013,2013-09-22 22:56:35,4,11,repNone,,False,"Alas if thou close thy eyes, doth it feel like thou hast been in this situation before?"
https://twitter.com/AntiqueLyrics/status/381879115977994240,Sun Mar 17 15:36:08 +0000 2013,2013-09-22 20:34:10,5,35,repNone,,False,"Ah, I recognise what thou hath accomplished there."
https://twitter.com/AntiqueLyrics/status/381843739238350849,Sun Mar 17 15:36:08 +0000 2013,2013-09-22 18:13:36,15,50,repNone,,False,"Sparkle, sparkle celestial orb. How I ponder thy identity."
https://twitter.com/AntiqueLyrics/status/381784144927145984,Sun Mar 17 15:36:08 +0000 2013,2013-09-22 14:16:48,39,96,repNone,,False,They see me operating my motor vehicle. They art prejudiced.
https://twitter.com/AntiqueLyrics/status/381738145663823873,Sun Mar 17 15:36:08 +0000 2013,2013-09-22 11:14:00,49,95,repNone,,False,"To thine window, to thine wall, 'til the perspiration descends downward from my genitalia."
https://twitter.com/AntiqueLyrics/status/381693018673147905,Sun Mar 17 15:36:08 +0000 2013,2013-09-22 08:14:41,74,196,repNone,,False,"My smooth dairy product attracts all the gentlemen to the recreational field and they announce ""It's superior to thine""."
https://twitter.com/AntiqueLyrics/status/381646997800751105,Sun Mar 17 15:36:08 +0000 2013,2013-09-22 05:11:49,24,44,repNone,,False,Sphere with such vigour mother fornicators wish to fine me. Alas firstly negro gentleman hath to locate me.
https://twitter.com/AntiqueLyrics/status/381588934918021120,Sun Mar 17 15:36:08 +0000 2013,2013-09-22 01:21:06,10,44,repNone,,False,I do soundly declare that it feels most outstandingly pleasant to be involved in gang-related activities.
https://twitter.com/AntiqueLyrics/status/381535578585456640,Sun Mar 17 15:36:08 +0000 2013,2013-09-21 21:49:05,6,29,repNone,,False,"Doth thou really enjoy it? Is it, is it heinous?"
https://twitter.com/AntiqueLyrics/status/381493141343178752,Sun Mar 17 15:36:08 +0000 2013,2013-09-21 19:00:27,12,59,repNone,,False,"It's thy birthday, it's thy birthday, bad wench tournament, thou art in first position."
https://twitter.com/AntiqueLyrics/status/381451318310617089,Sun Mar 17 15:36:08 +0000 2013,2013-09-21 16:14:15,30,89,repNone,,False,Wenches adore Sosa.
https://twitter.com/AntiqueLyrics/status/381415705033199617,Sun Mar 17 15:36:08 +0000 2013,2013-09-21 13:52:45,54,174,repNone,,False,"Female genitalia, currency, herbs."
https://twitter.com/AntiqueLyrics/status/381371818851848192,Sun Mar 17 15:36:08 +0000 2013,2013-09-21 10:58:21,8,62,repNone,,False,Superman that wench.
https://twitter.com/AntiqueLyrics/status/381323653280833536,Sun Mar 17 15:36:08 +0000 2013,2013-09-21 07:46:58,24,95,repNone,,False,I knew thou were a nuisance when thou entered the vicinity.
https://twitter.com/AntiqueLyrics/status/381265442544705536,Sun Mar 17 15:36:08 +0000 2013,2013-09-21 03:55:39,6,26,repNone,,False,"Greetings, dainty Porsche, I doth wish to test thee."
https://twitter.com/AntiqueLyrics/status/381234458910674945,Sun Mar 17 15:36:08 +0000 2013,2013-09-21 01:52:32,8,21,repNone,,False,"I am unaware of what thou hath hearkened about me, alas a wench is unable to extract a dollar from myself."
https://twitter.com/AntiqueLyrics/status/381179552359141376,Sun Mar 17 15:36:08 +0000 2013,2013-09-20 22:14:21,15,49,repNone,,False,"I hath mortally wounded the constable, alas I firmly deny causing bodily harm to his deputy."
https://twitter.com/AntiqueLyrics/status/381145466571739136,Sun Mar 17 15:36:08 +0000 2013,2013-09-20 19:58:55,17,67,repNone,,False,Get thy freak on.
https://twitter.com/AntiqueLyrics/status/381097083211493378,Sun Mar 17 15:36:08 +0000 2013,2013-09-20 16:46:39,14,57,repNone,,False,These females art not aware of what name my band doth go by.
https://twitter.com/AntiqueLyrics/status/381060008516939777,Sun Mar 17 15:36:08 +0000 2013,2013-09-20 14:19:20,26,72,repNone,,False,"Proceed, female of small stature, 'tis the day of thy birth. We shalt celebrate as if 'tis the day of thy birth."
https://twitter.com/AntiqueLyrics/status/381027162716774400,Sun Mar 17 15:36:08 +0000 2013,2013-09-20 12:08:49,43,113,repNone,,False,"The female hath fruit-bottomed denim pantaloons, heavy footwear adorned with animal skin."
https://twitter.com/AntiqueLyrics/status/380867196718575616,Sun Mar 17 15:36:08 +0000 2013,2013-09-20 01:33:10,8,52,repNone,,False,"Who doth thou sense thou art? Parading about leaving blemishes, accumulating thy container of cardiovascular organs."
https://twitter.com/AntiqueLyrics/status/380825247777189888,Sun Mar 17 15:36:08 +0000 2013,2013-09-19 22:46:29,15,31,repNone,,False,Somebody alert the authorities! Thine female of small stature is ablaze on the floor of the ballroom.
https://twitter.com/AntiqueLyrics/status/380779806935109632,Sun Mar 17 15:36:08 +0000 2013,2013-09-19 19:45:55,12,21,repNone,,False,"Recently, I engaged in intercourse, and the feeling was one of delight."
https://twitter.com/AntiqueLyrics/status/380739399287181313,Sun Mar 17 15:36:08 +0000 2013,2013-09-19 17:05:21,3,22,repNone,,False,"What amount of roads is a chap forced to stroll upon, before thou refer to him as a gentleman?"
https://twitter.com/AntiqueLyrics/status/380687105627676672,Sun Mar 17 15:36:08 +0000 2013,2013-09-19 13:37:33,17,50,repNone,,False,What thou fails to comprehend is that I would grasp explosive munitions for thou.
