id,Account Created At(same for all rows),status created_at,Fav_cont,retweeted_count,reply_to_status,reply_to_screen,quote,text
https://twitter.com/AntiqueLyrics/status/462470888030363649,Sun Mar 17 15:36:08 +0000 2013,2014-05-03 05:57:06,30,17,repNone,,False,It is vacant within the canyon of thy cardiac organ.
https://twitter.com/AntiqueLyrics/status/462417435078189056,Sun Mar 17 15:36:08 +0000 2013,2014-05-03 02:24:42,100,73,repNone,,False,Thou can position thyself under my umbrella-ella-ella.
https://twitter.com/AntiqueLyrics/status/462374221197238272,Sun Mar 17 15:36:08 +0000 2013,2014-05-02 23:32:59,81,81,repNone,,False,"Goodness, gracious, Rebecca, observe her gluteus maximus. Tunechi!"
https://twitter.com/AntiqueLyrics/status/462325025274462208,Sun Mar 17 15:36:08 +0000 2013,2014-05-02 20:17:30,21,12,repNone,,False,He is in possession of a newly acquired automobile... It resembles a Jaguar.
https://twitter.com/AntiqueLyrics/status/462287068844937218,Sun Mar 17 15:36:08 +0000 2013,2014-05-02 17:46:40,32,19,repNone,,False,At which location art the lassies?
https://twitter.com/AntiqueLyrics/status/462060340541276160,Sun Mar 17 15:36:08 +0000 2013,2014-05-02 02:45:44,15,7,repNone,,False,"Observe my features, I worry not."
https://twitter.com/AntiqueLyrics/status/462001288612286464,Sun Mar 17 15:36:08 +0000 2013,2014-05-01 22:51:05,33,15,repNone,,False,This female art ablaze.
https://twitter.com/AntiqueLyrics/status/461960849217695744,Sun Mar 17 15:36:08 +0000 2013,2014-05-01 20:10:23,18,10,repNone,,False,"I possess spiritual essence, alas I am not a warrior."
https://twitter.com/AntiqueLyrics/status/461922697253908481,Sun Mar 17 15:36:08 +0000 2013,2014-05-01 17:38:47,48,47,repNone,,False,"'Tis the alternate composition of Ignition, hot and fresh from the canteen."
https://twitter.com/AntiqueLyrics/status/461874339965444096,Sun Mar 17 15:36:08 +0000 2013,2014-05-01 14:26:38,71,44,repNone,,False,"I pressed my lips against those of a female, and found it to be to my liking."
https://twitter.com/AntiqueLyrics/status/461744982064259072,Sun Mar 17 15:36:08 +0000 2013,2014-05-01 05:52:37,76,60,repNone,,False,"Thou wouldst not believe thy eyes, if ten million fireflies illuminated the planet as I doth rest."
https://twitter.com/AntiqueLyrics/status/461702864239198208,Sun Mar 17 15:36:08 +0000 2013,2014-05-01 03:05:15,14,26,repNone,,False,Thine faeces cray!
https://twitter.com/AntiqueLyrics/status/461657744055873536,Sun Mar 17 15:36:08 +0000 2013,2014-05-01 00:05:58,35,27,repNone,,False,"Worry not, about anything, due to the fact that every minor thing, shalt be just fine!"
https://twitter.com/AntiqueLyrics/status/461599887591624704,Sun Mar 17 15:36:08 +0000 2013,2014-04-30 20:16:03,7,6,repNone,,False,"I am the fornicating gentleman, thou doth not understand, dost thou?"
https://twitter.com/AntiqueLyrics/status/461547084001202177,Sun Mar 17 15:36:08 +0000 2013,2014-04-30 16:46:14,5,4,repNone,,False,"Thou art required to dispute, to acquire thy moral obligation, to celebrate merrily."
https://twitter.com/AntiqueLyrics/status/461138678824189952,Sun Mar 17 15:36:08 +0000 2013,2014-04-29 13:43:23,35,25,repNone,,False,Two girls hailing from Ye Olde Trailer Park relocate around the outside.
https://twitter.com/AntiqueLyrics/status/461106710661189633,Sun Mar 17 15:36:08 +0000 2013,2014-04-29 11:36:21,17,16,repNone,,False,"I art nothing but an adolescent scoundrel, infant. Harken the melodies of Iron Maiden, infant, in my presence."
https://twitter.com/AntiqueLyrics/status/461050535362043905,Sun Mar 17 15:36:08 +0000 2013,2014-04-29 07:53:08,44,29,repNone,,False,I shalt escort thee to Ye Olde Confectionery Store. I shalt allow thee to lick thy lollipop.
https://twitter.com/AntiqueLyrics/status/460804695171137536,Sun Mar 17 15:36:08 +0000 2013,2014-04-28 15:36:15,49,37,repNone,,False,I am enamoured with large posteriors and I am unable to utter false statements.
https://twitter.com/AntiqueLyrics/status/460764473377038336,Sun Mar 17 15:36:08 +0000 2013,2014-04-28 12:56:25,14,13,repNone,,False,"Fuck thee, I shan't follow thy orders!"
https://twitter.com/AntiqueLyrics/status/460704388630061056,Sun Mar 17 15:36:08 +0000 2013,2014-04-28 08:57:40,51,42,repNone,,False,Wouldst thou escort me to the town of Funky?
https://twitter.com/AntiqueLyrics/status/460669619523440641,Sun Mar 17 15:36:08 +0000 2013,2014-04-28 06:39:30,22,14,repNone,,False,"As long as thou loveth me, we couldst be in poverty, we couldst be without an abode, we couldst be impoverished"
https://twitter.com/AntiqueLyrics/status/460616766381510656,Sun Mar 17 15:36:08 +0000 2013,2014-04-28 03:09:29,50,39,repNone,,False,"I am at a payphone attempting to contact my home, all of my currency I hath squandered upon thou."
https://twitter.com/AntiqueLyrics/status/460432692413468672,Sun Mar 17 15:36:08 +0000 2013,2014-04-27 14:58:02,41,30,repNone,,False,"Couldst thou blow my whistle, infant, whistle, infant? Inform me."
https://twitter.com/AntiqueLyrics/status/460382964719702017,Sun Mar 17 15:36:08 +0000 2013,2014-04-27 11:40:26,17,9,repNone,,False,"Fear not, I shalt locate, someone similar to thee."
https://twitter.com/AntiqueLyrics/status/460326512101584896,Sun Mar 17 15:36:08 +0000 2013,2014-04-27 07:56:07,15,26,repNone,,False,"Thou art beautiful, regardless of what they proclaim."
https://twitter.com/AntiqueLyrics/status/460294023438036992,Sun Mar 17 15:36:08 +0000 2013,2014-04-27 05:47:01,10,4,repNone,,False,"I am far more than merely an alternative, hey hey hey, refuse to slip thy mind, hey hey hey."
https://twitter.com/AntiqueLyrics/status/460232954669576193,Sun Mar 17 15:36:08 +0000 2013,2014-04-27 01:44:21,20,21,repNone,,False,"Lose thyself in the melodies, the moments, thou own it, thou should never release it."
https://twitter.com/AntiqueLyrics/status/460008651227291648,Sun Mar 17 15:36:08 +0000 2013,2014-04-26 10:53:03,15,10,repNone,,False,Thou maketh me feel as though I hath been omitted from the heavens.
https://twitter.com/AntiqueLyrics/status/459948942252183553,Sun Mar 17 15:36:08 +0000 2013,2014-04-26 06:55:47,16,29,repNone,,False,"Something is amiss, I doth hold my head. Michael Jackson is no longer here, our negro gentleman hath passed away."
https://twitter.com/AntiqueLyrics/status/459914994625150977,Sun Mar 17 15:36:08 +0000 2013,2014-04-26 04:40:54,7,5,repNone,,False,"Labrinth, enter."
https://twitter.com/AntiqueLyrics/status/459876394323812352,Sun Mar 17 15:36:08 +0000 2013,2014-04-26 02:07:31,7,8,repNone,,False,"Thou art beautiful. Thou art beautiful. Thou art beautiful, this is correct."
https://twitter.com/AntiqueLyrics/status/459827251518115842,Sun Mar 17 15:36:08 +0000 2013,2014-04-25 22:52:14,12,15,repNone,,False,And fornicators of mothers behave as if Dre hath slipped thine imaginations.
https://twitter.com/AntiqueLyrics/status/459239187401564160,Sun Mar 17 15:36:08 +0000 2013,2014-04-24 07:55:29,5,5,repNone,,False,"My infant doth not fool around due to the fact that she is infatuated with me, and this is a fact that I am certain off."
https://twitter.com/AntiqueLyrics/status/459201199967723520,Sun Mar 17 15:36:08 +0000 2013,2014-04-24 05:24:32,18,21,repNone,,False,"Yeeeeeaaaah, tis a magnificent festivity in the United States."
https://twitter.com/AntiqueLyrics/status/459155084874506240,Sun Mar 17 15:36:08 +0000 2013,2014-04-24 02:21:17,13,17,repNone,,False,I hath the ability to formulate a downpour of precipitation upon these wenches.
https://twitter.com/AntiqueLyrics/status/459099557465305088,Sun Mar 17 15:36:08 +0000 2013,2014-04-23 22:40:38,12,9,repNone,,False,"A festivity is occurring at the bar, everybody levitate thy goblets, I shalt swig to that."
https://twitter.com/AntiqueLyrics/status/459049601803120641,Sun Mar 17 15:36:08 +0000 2013,2014-04-23 19:22:08,12,18,repNone,,False,"Rah, rah, similar to a dungeon mythical beast."
https://twitter.com/AntiqueLyrics/status/458919763402432512,Sun Mar 17 15:36:08 +0000 2013,2014-04-23 10:46:12,23,15,repNone,,False,"If, perchance, I was thy boyfriend, never would I release thou."
https://twitter.com/AntiqueLyrics/status/458881580719538176,Sun Mar 17 15:36:08 +0000 2013,2014-04-23 08:14:29,4,7,repNone,,False,"If thou permits me, here's what I shalt do, I shalt look after thee."
https://twitter.com/AntiqueLyrics/status/458831414973050881,Sun Mar 17 15:36:08 +0000 2013,2014-04-23 04:55:08,9,12,repNone,,False,"If I were a gentlemen, perhaps merely for one day."
https://twitter.com/AntiqueLyrics/status/458786945808613376,Sun Mar 17 15:36:08 +0000 2013,2014-04-23 01:58:26,20,18,repNone,,False,"Simply going to stand there and observe me ignite, fear not, as I enjoy the manner in which it pains me."
https://twitter.com/AntiqueLyrics/status/458750737145540609,Sun Mar 17 15:36:08 +0000 2013,2014-04-22 23:34:33,12,2,repNone,,False,"Darkness and amber, darkness and amber, darkness and amber, darkness and amber."
https://twitter.com/AntiqueLyrics/status/458586636167557120,Sun Mar 17 15:36:08 +0000 2013,2014-04-22 12:42:28,26,32,repNone,,False,"Toward the left, toward the left. Everything thou doth possess in the encasement toward the left."
https://twitter.com/AntiqueLyrics/status/458538393358438400,Sun Mar 17 15:36:08 +0000 2013,2014-04-22 09:30:46,21,10,repNone,,False,"We discovered infatuation in a useless vicinity, we discovered infatuation in a useless vicinity."
https://twitter.com/AntiqueLyrics/status/458503082846859264,Sun Mar 17 15:36:08 +0000 2013,2014-04-22 07:10:28,66,60,repNone,,False,"If Anne hath a will, Anne Hathaway."
https://twitter.com/AntiqueLyrics/status/458470538910769153,Sun Mar 17 15:36:08 +0000 2013,2014-04-22 05:01:09,23,31,repNone,,False,"I hath the ability to operate my two-wheeled mode of transport with the absence of handlebars, absence of handlebars, absence of handlebars."
https://twitter.com/AntiqueLyrics/status/458420534657568768,Sun Mar 17 15:36:08 +0000 2013,2014-04-22 01:42:27,8,28,repNone,,False,All I am concerned with is currency and the village from which I originate.
https://twitter.com/AntiqueLyrics/status/457924907620237314,Sun Mar 17 15:36:08 +0000 2013,2014-04-20 16:53:00,0,241,repNone,,False,RT @KushGirlJess: Easter on 4/20 have me like.. http://t.co/qPGvXDg1NZ
https://twitter.com/AntiqueLyrics/status/454821408288542720,Sun Mar 17 15:36:08 +0000 2013,2014-04-12 03:20:48,6,13,repNone,,False,"I belongeth unto thee, thou belongeth unto me, thou art my sweetheart."
https://twitter.com/AntiqueLyrics/status/454783159637266433,Sun Mar 17 15:36:08 +0000 2013,2014-04-12 00:48:49,10,18,repNone,,False,"Thou shalt refer to me as Sir Flintstone, for I hath the ability to jolt thy mattress."
https://twitter.com/AntiqueLyrics/status/454728450322882561,Sun Mar 17 15:36:08 +0000 2013,2014-04-11 21:11:25,8,11,repNone,,False,Party and the faeces of a bull.
https://twitter.com/AntiqueLyrics/status/454678721878716416,Sun Mar 17 15:36:08 +0000 2013,2014-04-11 17:53:49,5,3,repNone,,False,Saint Nicholas shalt arrive within our settlement.
https://twitter.com/AntiqueLyrics/status/454243920134688769,Sun Mar 17 15:36:08 +0000 2013,2014-04-10 13:06:04,9,8,repNone,,False,"Thou art unable to rest thy head, without a hot beverage. Perhaps it is for this reason that thou mutters words whilst thou sleeps."
https://twitter.com/AntiqueLyrics/status/454193891130888192,Sun Mar 17 15:36:08 +0000 2013,2014-04-10 09:47:16,25,26,repNone,,False,Who wouldst thou call? The slayers of phantoms!
https://twitter.com/AntiqueLyrics/status/454156284544036864,Sun Mar 17 15:36:08 +0000 2013,2014-04-10 07:17:50,3,3,repNone,,False,The vessels of the stars were thus intended to soar. Raise thy hands and connect with the atmosphere.
https://twitter.com/AntiqueLyrics/status/454120235289686016,Sun Mar 17 15:36:08 +0000 2013,2014-04-10 04:54:35,6,3,repNone,,False,Do not bring an end to the festivity!
https://twitter.com/AntiqueLyrics/status/454078381319938049,Sun Mar 17 15:36:08 +0000 2013,2014-04-10 02:08:17,3,1,repNone,,False,'TIS YUUUUUUUULETIIIIIIIIIIIIDE!
https://twitter.com/AntiqueLyrics/status/453828081950552064,Sun Mar 17 15:36:08 +0000 2013,2014-04-09 09:33:41,8,12,repNone,,False,T'which location is the love?
https://twitter.com/AntiqueLyrics/status/453774216483983360,Sun Mar 17 15:36:08 +0000 2013,2014-04-09 05:59:38,3,6,repNone,,False,"Thou art unable to rest thy head, without a hot beverage. Perhaps this is the reason that thou talketh in thy sleep."
https://twitter.com/AntiqueLyrics/status/453721552035385344,Sun Mar 17 15:36:08 +0000 2013,2014-04-09 02:30:22,7,6,repNone,,False,"And here is unto thee, Madame Robinson. Jesus loveth thee in ways thou art unable to comprehend."
https://twitter.com/AntiqueLyrics/status/453669716930723840,Sun Mar 17 15:36:08 +0000 2013,2014-04-08 23:04:23,2,1,repNone,,False,"He doth not weigh in excess, he is my brethren."
https://twitter.com/AntiqueLyrics/status/452782170952572930,Sun Mar 17 15:36:08 +0000 2013,2014-04-06 12:17:36,6,5,repNone,,False,"Don't thou fret, don't thou fret, infant."
https://twitter.com/AntiqueLyrics/status/452731221861494784,Sun Mar 17 15:36:08 +0000 2013,2014-04-06 08:55:09,27,13,repNone,,False,Greetings! I go by the name of Slim Shady.
https://twitter.com/AntiqueLyrics/status/452669825047728129,Sun Mar 17 15:36:08 +0000 2013,2014-04-06 04:51:11,5,18,repNone,,False,That excrement is positively cray!
https://twitter.com/AntiqueLyrics/status/452633040603209729,Sun Mar 17 15:36:08 +0000 2013,2014-04-06 02:25:01,8,10,repNone,,False,"Wenches art not attracted to gentlemen, wenches art attracted to automobiles and affluence."
https://twitter.com/AntiqueLyrics/status/452582736419491840,Sun Mar 17 15:36:08 +0000 2013,2014-04-05 23:05:07,11,23,repNone,,False,"If thou art having lady problems, my sympathy unto thee, my old chap."
https://twitter.com/AntiqueLyrics/status/452489851053826049,Sun Mar 17 15:36:08 +0000 2013,2014-04-05 16:56:02,11,6,repNone,,False,"Fare thee well, my lover. Fare thee well, my acquaintance. Thou hath been the one, thou hath been the one for me."
https://twitter.com/AntiqueLyrics/status/452448383857205248,Sun Mar 17 15:36:08 +0000 2013,2014-04-05 14:11:15,17,18,repNone,,False,"Infant, infant, infant, oh, infant, infant infant, no, infant, infant, infant, oh, thought that thou wouldst always belong to me."
https://twitter.com/AntiqueLyrics/status/452397757077016576,Sun Mar 17 15:36:08 +0000 2013,2014-04-05 10:50:05,11,12,repNone,,False,I am able to feel thy cardiac organ pulsating to the rhythm of the drums.
https://twitter.com/AntiqueLyrics/status/452354152812003328,Sun Mar 17 15:36:08 +0000 2013,2014-04-05 07:56:49,8,8,repNone,,False,"'Twas not thy fault but mine, and 'twas thy cardiac organ at stake."
https://twitter.com/AntiqueLyrics/status/452310186737139712,Sun Mar 17 15:36:08 +0000 2013,2014-04-05 05:02:06,8,9,repNone,,False,"Disregard the currency, currency, currency. We doth not require thy currency, currency, currency."
https://twitter.com/AntiqueLyrics/status/452085186205720576,Sun Mar 17 15:36:08 +0000 2013,2014-04-04 14:08:02,12,22,repNone,,False,"Life is a wench, then thou perish."
https://twitter.com/AntiqueLyrics/status/452042879049822208,Sun Mar 17 15:36:08 +0000 2013,2014-04-04 11:19:55,3,3,repNone,,False,"Make advances toward Deborah, similar to an employer."
https://twitter.com/AntiqueLyrics/status/452000080426307584,Sun Mar 17 15:36:08 +0000 2013,2014-04-04 08:29:51,15,20,repNone,,False,Do not engage in sexual activity. Thou will reproduce. And thou will perish.
https://twitter.com/AntiqueLyrics/status/451954895893966848,Sun Mar 17 15:36:08 +0000 2013,2014-04-04 05:30:18,19,13,repNone,,False,"If thou doth hail from Africa, inform me how art thou of a pale complexion?"
https://twitter.com/AntiqueLyrics/status/451718775964827648,Sun Mar 17 15:36:08 +0000 2013,2014-04-03 13:52:03,35,25,repNone,,False,"I hath visited the year 3000 AD. Scarce has altered, alas they inhabit the waters."
https://twitter.com/AntiqueLyrics/status/451665999343804417,Sun Mar 17 15:36:08 +0000 2013,2014-04-03 10:22:20,35,47,repNone,,False,"I shan't make the claim that she is a chaser of currency, alas she is not to be found in the acquaintance of poor negro gentlemen."
https://twitter.com/AntiqueLyrics/status/451605890689282048,Sun Mar 17 15:36:08 +0000 2013,2014-04-03 06:23:29,13,9,repNone,,False,"Prior to my departure, I cleanse my dental fixtures with a container of the finest bourbon."
https://twitter.com/AntiqueLyrics/status/451562217012727808,Sun Mar 17 15:36:08 +0000 2013,2014-04-03 03:29:56,6,7,repNone,,False,"All the young folk with the air inflated shoes thou hast to dash, hast to dash, with a higher acceleration than that of my firearm."
https://twitter.com/AntiqueLyrics/status/450902133009678336,Sun Mar 17 15:36:08 +0000 2013,2014-04-01 07:47:00,13,9,repNone,,False,"So nobody informed thou that life was to turn out in this manner. Your occupation art humiliating, thou art poor."
https://twitter.com/AntiqueLyrics/status/450846150782754817,Sun Mar 17 15:36:08 +0000 2013,2014-04-01 04:04:33,6,9,repNone,,False,"I shalt be there for thee, upon the downpour of precipitation."
https://twitter.com/AntiqueLyrics/status/450809677475885056,Sun Mar 17 15:36:08 +0000 2013,2014-04-01 01:39:37,12,7,repNone,,False,"Thou art not aware of thy beauty, and it is this fact that enhances thy beauty."
https://twitter.com/AntiqueLyrics/status/450772240942891008,Sun Mar 17 15:36:08 +0000 2013,2014-03-31 23:10:51,15,24,repNone,,False,"Negro gentleman, please."
https://twitter.com/AntiqueLyrics/status/450131540748414976,Sun Mar 17 15:36:08 +0000 2013,2014-03-30 04:44:57,35,34,repNone,,False,"If I rest here, if I merely rest here, wouldst thou rest in my presence and simply neglect the world?"
https://twitter.com/AntiqueLyrics/status/450091542913359872,Sun Mar 17 15:36:08 +0000 2013,2014-03-30 02:06:00,14,14,repNone,,False,Fornicate thou.
https://twitter.com/AntiqueLyrics/status/450041620759859200,Sun Mar 17 15:36:08 +0000 2013,2014-03-29 22:47:38,7,6,repNone,,False,I desire to be a punk rocker with garlands running through my locks.
https://twitter.com/AntiqueLyrics/status/449994522454286338,Sun Mar 17 15:36:08 +0000 2013,2014-03-29 19:40:29,10,16,repNone,,False,"Oh fiery damn, this is my melody. Maintain my festivities til the morrow, ye all fail to comprehend, force me to release my hands in the air"
https://twitter.com/AntiqueLyrics/status/449934185663197184,Sun Mar 17 15:36:08 +0000 2013,2014-03-29 15:40:43,9,9,repNone,,False,"This eve, we art youthful, so let us set this planet ablaze, we art able to glow far more radiantly than the Sun."
https://twitter.com/AntiqueLyrics/status/449862826325061632,Sun Mar 17 15:36:08 +0000 2013,2014-03-29 10:57:10,18,20,repNone,,False,"Taylor I beg thy pardon, and I shall let thee commence thy address, alas Miss Beyonc� has the finest musical moving picture of all eternity."
https://twitter.com/AntiqueLyrics/status/449818852549869568,Sun Mar 17 15:36:08 +0000 2013,2014-03-29 08:02:26,17,30,repNone,,False,Thy intercourse is ablaze.
https://twitter.com/AntiqueLyrics/status/449781639829139457,Sun Mar 17 15:36:08 +0000 2013,2014-03-29 05:34:34,7,9,repNone,,False,"If thou doth not wish to proceed at a slow pace, and thou wishes to take me back to thy home, infant say yes! Yes! Allow me to kiss thou."
https://twitter.com/AntiqueLyrics/status/449734336959741952,Sun Mar 17 15:36:08 +0000 2013,2014-03-29 02:26:36,12,29,repNone,,False,"The ceiling, the ceiling, the ceiling is ablaze, we do not require water, allow the fornicator of mothers to ignite."
https://twitter.com/AntiqueLyrics/status/449694455096832001,Sun Mar 17 15:36:08 +0000 2013,2014-03-28 23:48:07,16,15,repNone,,False,Greetings Macarena!
https://twitter.com/AntiqueLyrics/status/449646972039725056,Sun Mar 17 15:36:08 +0000 2013,2014-03-28 20:39:26,5,2,repNone,,False,"It is of my opinion that thou art very attractive, thou art attractive alas goodness gracious, aren't thou aware of it?"
https://twitter.com/AntiqueLyrics/status/448857489178492928,Sun Mar 17 15:36:08 +0000 2013,2014-03-26 16:22:19,12,26,repNone,,False,"The female refers to me as Sir Boombastic, proclaims I ooze brilliance, fondles my gluteus maximus, proclaims I art Mr Rooooooomantic."
https://twitter.com/AntiqueLyrics/status/448343921307836416,Sun Mar 17 15:36:08 +0000 2013,2014-03-25 06:21:35,8,16,repNone,,False,Fornicate the constable.
https://twitter.com/AntiqueLyrics/status/448290470087503873,Sun Mar 17 15:36:08 +0000 2013,2014-03-25 02:49:11,3,4,repNone,,False,"Despite it being a burden, female partners I hast plenty, alas none similar to Miss Mackenzie, that is the reason I doth enter education."
https://twitter.com/AntiqueLyrics/status/448239328129339392,Sun Mar 17 15:36:08 +0000 2013,2014-03-24 23:25:58,6,13,repNone,,False,"Lanterns shall escort thou home, and set thy cartilage ablaze."
https://twitter.com/AntiqueLyrics/status/448188866063638528,Sun Mar 17 15:36:08 +0000 2013,2014-03-24 20:05:27,4,4,repNone,,False,I noticed that thou art a menace when thou arrived in the vicinity.
https://twitter.com/AntiqueLyrics/status/448136108510285824,Sun Mar 17 15:36:08 +0000 2013,2014-03-24 16:35:48,0,1,repNone,,False,M-A-D-A-M-E N�rgaard
https://twitter.com/AntiqueLyrics/status/448089258775953408,Sun Mar 17 15:36:08 +0000 2013,2014-03-24 13:29:39,3,6,repNone,,False,"Okay, fornicate it, I deceived thou, it's drum and bass, how art thou going to respond?"
https://twitter.com/AntiqueLyrics/status/448047893384294401,Sun Mar 17 15:36:08 +0000 2013,2014-03-24 10:45:16,4,7,repNone,,False,Halt. Merge together and hearken.
https://twitter.com/AntiqueLyrics/status/448016503367942144,Sun Mar 17 15:36:08 +0000 2013,2014-03-24 08:40:32,5,6,repNone,,False,We shalt be returning for thee one day.
https://twitter.com/AntiqueLyrics/status/447983724592766976,Sun Mar 17 15:36:08 +0000 2013,2014-03-24 06:30:17,3,4,repNone,,False,"He is clambering into thy fenestration, abducting thy inhabitants."
https://twitter.com/AntiqueLyrics/status/447951617174675456,Sun Mar 17 15:36:08 +0000 2013,2014-03-24 04:22:42,19,23,repNone,,False,"Hide thy children, hide thy wife, and hide thy spouse, for they art forcing sexual intercourse upon the entire populace of this area."
https://twitter.com/AntiqueLyrics/status/447904211590606848,Sun Mar 17 15:36:08 +0000 2013,2014-03-24 01:14:20,2,3,repNone,,False,"This eve, we art swigging from the flagon."
https://twitter.com/AntiqueLyrics/status/447865571363680256,Sun Mar 17 15:36:08 +0000 2013,2014-03-23 22:40:47,5,2,repNone,,False,"I proclaimed, ""Greetings, thou, art thee going to bang though?"" No, I desire some fornicating Nando's."
https://twitter.com/AntiqueLyrics/status/447828830279827456,Sun Mar 17 15:36:08 +0000 2013,2014-03-23 20:14:48,6,4,repNone,,False,"We art not required to remove our garments, to enjoy ourselves."
https://twitter.com/AntiqueLyrics/status/447781042183610368,Sun Mar 17 15:36:08 +0000 2013,2014-03-23 17:04:54,17,32,repNone,,False,"The temperature in this vicinity hath risen, so promptly remove thy garments."
https://twitter.com/AntiqueLyrics/status/447744865527275520,Sun Mar 17 15:36:08 +0000 2013,2014-03-23 14:41:09,12,23,repNone,,False,"Twigs and rocks couldst snap my cartilage, alas shackles and lashes delight me."
https://twitter.com/AntiqueLyrics/status/447691114242670592,Sun Mar 17 15:36:08 +0000 2013,2014-03-23 11:07:33,12,13,repNone,,False,"Possess my negro acquaintances in Paris, and they art behaving similar to apes."
https://twitter.com/AntiqueLyrics/status/447639116880936960,Sun Mar 17 15:36:08 +0000 2013,2014-03-23 07:40:56,5,7,repNone,,False,What didst thy lady request? Fillet of fish.
https://twitter.com/AntiqueLyrics/status/447586423927873537,Sun Mar 17 15:36:08 +0000 2013,2014-03-23 04:11:33,17,26,repNone,,False,"Thouuuuu crank that warrior chap, thouuuuu crank that warrior chap."
https://twitter.com/AntiqueLyrics/status/447526701317115904,Sun Mar 17 15:36:08 +0000 2013,2014-03-23 00:14:14,6,16,repNone,,False,"Of what amount is 50 thousand dollars to a fornicator of mothers such as myself, couldst thou please remind me?"
https://twitter.com/AntiqueLyrics/status/447483693997637632,Sun Mar 17 15:36:08 +0000 2013,2014-03-22 21:23:21,9,9,repNone,,False,"I witness thee dancing upon the pole, I know thou art aware that I am observing thou, and thou art already aware, I wish to forniate thou."
https://twitter.com/AntiqueLyrics/status/447437198720135168,Sun Mar 17 15:36:08 +0000 2013,2014-03-22 18:18:35,8,23,repNone,,False,"Nobody wishes to see us together, alas that is not of importance, as I am in possession of thee, babe."
https://twitter.com/AntiqueLyrics/status/447384918750806016,Sun Mar 17 15:36:08 +0000 2013,2014-03-22 14:50:51,16,6,repNone,,False,"I am sapphire dabba dee dabba die, dabba dee dabba die dabba dee dabba die."
https://twitter.com/AntiqueLyrics/status/447336401676152832,Sun Mar 17 15:36:08 +0000 2013,2014-03-22 11:38:03,3,8,repNone,,False,Possess thy grandmother upon my penis.
https://twitter.com/AntiqueLyrics/status/447275942088421376,Sun Mar 17 15:36:08 +0000 2013,2014-03-22 07:37:49,16,13,repNone,,False,"Air hostess, I doth enjoy the garments in which thou dresses thyself."
https://twitter.com/AntiqueLyrics/status/446113813965074433,Sun Mar 17 15:36:08 +0000 2013,2014-03-19 02:39:56,10,15,repNone,,False,Rouse my from my slumber when the ninth month of the year hath finished.
https://twitter.com/AntiqueLyrics/status/446082583059652610,Sun Mar 17 15:36:08 +0000 2013,2014-03-19 00:35:50,5,12,repNone,,False,I estimate that thou look divine upon the floor of the ballroom.
https://twitter.com/AntiqueLyrics/status/446026422285369345,Sun Mar 17 15:36:08 +0000 2013,2014-03-18 20:52:40,8,14,repNone,,False,"Observe me presently. Observe me presently, oh. I am acquiring parchment."
https://twitter.com/AntiqueLyrics/status/445988928764792832,Sun Mar 17 15:36:08 +0000 2013,2014-03-18 18:23:41,9,6,repNone,,False,"I shalt wait, I shalt wait for thee."
