id,Account Created At(same for all rows),status created_at,Fav_cont,retweeted_count,reply_to_status,reply_to_screen,quote,text
https://twitter.com/ArbourVW/status/581539480198238208,Mon Jun 11 17:37:48 +0000 2012,2015-03-27 19:33:11,0,0,repNone,,False,"I posted 19 photos on Facebook in the album ""2015 Golf Wagon"" http://t.co/TN36puTcpz"
https://twitter.com/ArbourVW/status/581105440102211584,Mon Jun 11 17:37:48 +0000 2012,2015-03-26 14:48:27,0,0,repNone,,False,"Voici le video de notre Concours en association avec Sylvie Schetagne, Golf-Tonus PTMT. Notre gagnant d’un voyage... http://t.co/ZUmTMrGKNJ"
https://twitter.com/ArbourVW/status/580392706754629632,Mon Jun 11 17:37:48 +0000 2012,2015-03-24 15:36:19,0,0,repNone,,False,Bien joué les Canadiens de Montréal et McDonald's!!! http://t.co/u0wt5xxypK
https://twitter.com/ArbourVW/status/579001402812420097,Mon Jun 11 17:37:48 +0000 2012,2015-03-20 19:27:46,0,0,repNone,,False,Avez-vous hâte de sortir votre #Volkswagen? Montrez-nous le vôtre!! http://t.co/ifd5z4HYGe
https://twitter.com/ArbourVW/status/577912632138682369,Mon Jun 11 17:37:48 +0000 2012,2015-03-17 19:21:23,0,0,repNone,,False,Voici notre voiture d'occasion en vedette cette semaine. #Tiguan #SuperPrix http://t.co/kApuXQWpl3
https://twitter.com/ArbourVW/status/577558946988175360,Mon Jun 11 17:37:48 +0000 2012,2015-03-16 19:55:58,0,0,repNone,,False,Notre forfait esthétique pour le printemps! #VoiturePropre http://t.co/sZfuSORoRc
https://twitter.com/ArbourVW/status/574958336631832576,Mon Jun 11 17:37:48 +0000 2012,2015-03-09 15:42:04,0,0,repNone,,False,La Subaru STI a de la compétition... http://t.co/LBYIo1mGei
https://twitter.com/ArbourVW/status/572432099963236352,Mon Jun 11 17:37:48 +0000 2012,2015-03-02 16:23:42,0,0,repNone,,False,Nous ne savons pas pour vous...Mais nous voyons que blanc et or! http://t.co/0pP5keaahV
https://twitter.com/ArbourVW/status/571056875443257344,Mon Jun 11 17:37:48 +0000 2012,2015-02-26 21:19:03,0,0,repNone,,False,"Au volant de la mainte fois récompensée Golf 2015, la vedette YouTube Thomas Gauthier... http://t.co/1ob1ZvZn7U"
https://twitter.com/ArbourVW/status/569890527090483200,Mon Jun 11 17:37:48 +0000 2012,2015-02-23 16:04:24,0,0,repNone,,False,Tanner Foust vient d'annoncer son retour dans la série de drift professionelle Formula Drift derrière le volant... http://t.co/tgybyMFgiJ
https://twitter.com/ArbourVW/status/568865286952226816,Mon Jun 11 17:37:48 +0000 2012,2015-02-20 20:10:28,0,0,repNone,,False,Voici les 2 #Volkswagen Beetle qui seront dans la série Red Bull Global Rallycross en 2015. Les pilotes seront Tanner Foust et Scott Speed.
https://twitter.com/ArbourVW/status/567353131206737920,Mon Jun 11 17:37:48 +0000 2012,2015-02-16 16:01:42,0,0,repNone,,False,"Avez-vous manqué le kiosque #Volkswagen au Salon International de l'Auto de Montréal? Si oui, ne vous en faites... http://t.co/EjlsWGvO7P"
https://twitter.com/ArbourVW/status/565953161840852993,Mon Jun 11 17:37:48 +0000 2012,2015-02-12 19:18:43,0,0,repNone,,False,Une nouveauté chez IKEA? ;) http://t.co/28WA7wIiX7
https://twitter.com/ArbourVW/status/564796708274462721,Mon Jun 11 17:37:48 +0000 2012,2015-02-09 14:43:23,0,0,repNone,,False,Arbour Laval est présentement à la recherche d'un(e) conseiller(ère) aux ventes véhicules neufs pour le début du... http://t.co/Ve8jpxgyii
https://twitter.com/ArbourVW/status/563806232944078848,Mon Jun 11 17:37:48 +0000 2012,2015-02-06 21:07:35,0,0,repNone,,False,"L’hiver est trop court pour ne pas en profiter. En tant que membre Volkswagen Plus, vous avez maintenant une... http://t.co/rCFY87saaN"
https://twitter.com/ArbourVW/status/560899036467965955,Mon Jun 11 17:37:48 +0000 2012,2015-01-29 20:35:25,0,0,repNone,,False,"Prenez le dessus sur l’hiver en Volkswagen! Jusqu’au 31 janvier, profitez de 0 % de financement jusqu’à 36 mois... http://t.co/M8WBbSTHET"
https://twitter.com/ArbourVW/status/559816091476979714,Mon Jun 11 17:37:48 +0000 2012,2015-01-26 20:52:11,0,0,repNone,,False,Dernier dernier dernier dernier jour de l’événement Les 10 jours Volkswagen. 1 250 $ de rabais sur les modèles... http://t.co/7v5NvWZYfl
https://twitter.com/ArbourVW/status/559371883385470977,Mon Jun 11 17:37:48 +0000 2012,2015-01-25 15:27:04,0,0,repNone,,False,"Dépêchez-vous! Les 10 jours Volkswagen, ça finit demain. 1 250 $ de rabais sur les modèles 2015 sélectionnés.... http://t.co/7Olx9NJYL6"
https://twitter.com/ArbourVW/status/557932036460384257,Mon Jun 11 17:37:48 +0000 2012,2015-01-21 16:05:38,0,0,repNone,,False,La nouvelle Jetta 2015 dévoile toutes ses nouvelles caractéristiques au @salonautoMTL. http://t.co/Z77HiEIMnF http://t.co/v6tOPEJLvS
https://twitter.com/ArbourVW/status/557931180457472000,Mon Jun 11 17:37:48 +0000 2012,2015-01-21 16:02:13,0,0,repNone,,False,"6 jours, ça ne vous laisse plus beaucoup de temps pour profiter de l’événement Les 10 jours Volkswagen. 1 250 $ à... http://t.co/pa0ynzONis"
https://twitter.com/ArbourVW/status/557574810617020416,Mon Jun 11 17:37:48 +0000 2012,2015-01-20 16:26:08,0,0,repNone,,False,Chanceux! 7 jours pour profiter de l’événement Les #10joursVolkswagen. 1 250 $ de rabais additionnels. http://t.co/Z77HiEIMnF
https://twitter.com/ArbourVW/status/557574196851912704,Mon Jun 11 17:37:48 +0000 2012,2015-01-20 16:23:42,0,0,repNone,,False,"Le Salon de l’auto de Montréal bat son plein! Découvrez le Tiguan, la Passat et la Jetta 2015 au Palais des... http://t.co/qTQ9CKJbCX"
https://twitter.com/ArbourVW/status/555832257295187969,Mon Jun 11 17:37:48 +0000 2012,2015-01-15 21:01:51,0,0,repNone,,False,N'oubliez pas d'aller visiter le kioske #Volkswagen au Salon International de l'Auto de Montréal/Montreal... http://t.co/DzSfQFs2bX
https://twitter.com/ArbourVW/status/554745154519592960,Mon Jun 11 17:37:48 +0000 2012,2015-01-12 21:02:06,0,0,repNone,,False,Nous avons rajouté plusieurs photos des changements de notre cabriolet. Venez nous dire vos commentaires!!! http://t.co/ol4VGlk5pL
https://twitter.com/ArbourVW/status/554744747802107904,Mon Jun 11 17:37:48 +0000 2012,2015-01-12 21:00:29,0,0,repNone,,False,"&lt;div id=""fb-root""&gt;&lt;/div&gt; &lt;script&gt;(function(d, s, id) { var js, fjs = d.getElementsByTagName(s)[0]; if... http://t.co/WciAED974w"
https://twitter.com/ArbourVW/status/554741863614541824,Mon Jun 11 17:37:48 +0000 2012,2015-01-12 20:49:01,0,0,repNone,,False,"I posted 3 photos on Facebook in the album ""Projet Cabriolet / Arbour Volkswagen"" http://t.co/uL11OgwnYn"
https://twitter.com/ArbourVW/status/554738033480577024,Mon Jun 11 17:37:48 +0000 2012,2015-01-12 20:33:48,0,0,repNone,,False,"I posted 19 photos on Facebook in the album ""Projet Cabriolet / Arbour Volkswagen"" http://t.co/cU10A8GVKZ"
https://twitter.com/ArbourVW/status/553218442435002368,Mon Jun 11 17:37:48 +0000 2012,2015-01-08 15:55:29,0,0,repNone,,False,Volkswagen démontre une conséquence de la puissante accélération de la toute nouvelle Golf GTI. Deux hommes... http://t.co/g9408ZKHOL
https://twitter.com/ArbourVW/status/549672989441003520,Mon Jun 11 17:37:48 +0000 2012,2014-12-29 21:07:07,0,0,repNone,,False,"À l’occasion de cette nouvelle année, Nous désirons vous remercier pour votre confiance, Et vous souhaiter... http://t.co/ikj3zdIN1t"
https://twitter.com/ArbourVW/status/548127590758633474,Mon Jun 11 17:37:48 +0000 2012,2014-12-25 14:46:16,1,0,repNone,,False,Arbour Volkswagen vous souhaite un joyeux temps des fêtes!!  http://t.co/ty7attn5Dt http://t.co/rX76oXguof
https://twitter.com/ArbourVW/status/543151320404750337,Mon Jun 11 17:37:48 +0000 2012,2014-12-11 21:12:20,0,0,repNone,,False,Montrez nous une photo de votre #Volkswagen dans la neige! http://t.co/Kb0IAlqcH7
https://twitter.com/ArbourVW/status/540725224954535936,Mon Jun 11 17:37:48 +0000 2012,2014-12-05 04:31:54,1,0,repNone,,False,Volkswagen Canada a confirmé son intention de commercialiser la Golf Alltrack sur le marché canadien en 2016.... http://t.co/Bly4k6t9Q0
https://twitter.com/ArbourVW/status/540595271453798400,Mon Jun 11 17:37:48 +0000 2012,2014-12-04 19:55:31,0,0,repNone,,False,Arbour Volkswagen vous offre 4 pneus d’hiver GRATUITS à l’achat d’une Jetta 2014 ou 2015 neuve tout au long du... http://t.co/HVfI7QvCuZ
https://twitter.com/ArbourVW/status/539457345563406336,Mon Jun 11 17:37:48 +0000 2012,2014-12-01 16:33:48,0,0,repNone,,False,Savez-vous comment fonctionne nos transmissions DSG? Voici comment:  https://t.co/QDL3H9upSx http://t.co/g5v6EANKTs
https://twitter.com/ArbourVW/status/534438930737680384,Mon Jun 11 17:37:48 +0000 2012,2014-11-17 20:12:25,0,0,repNone,,False,Vous avez jusqu'au 15 décembre pour installer vos pneus d'hiver. Assurez-vous que vos pneus d'hiver portent le... http://t.co/vv0OGNdiJi
https://twitter.com/ArbourVW/status/532937677910192129,Mon Jun 11 17:37:48 +0000 2012,2014-11-13 16:46:58,0,0,repNone,,False,Ne manquez pas les massages sur chaises GRATUITS!!!! Aujourd'hui et demain chez Arbour Volkswagen http://t.co/l7lTwolemg
https://twitter.com/ArbourVW/status/532278506865311745,Mon Jun 11 17:37:48 +0000 2012,2014-11-11 21:07:39,0,0,repNone,,False,***MASSAGES GRATUITS / FREE MASSAGES***  Jeudi le 13 et vendredi le 14 novembre Zen Expérience se joint à... http://t.co/kGHQh0D35K
https://twitter.com/ArbourVW/status/532278070875807748,Mon Jun 11 17:37:48 +0000 2012,2014-11-11 21:05:56,1,0,repNone,,False,***MASSAGES GRATUITS / FREE MASSAGES***  Jeudi le 13 et vendredi le 14 novembre Zen Expérience se joint à... http://t.co/qjvpYKXeDp
https://twitter.com/ArbourVW/status/530145416356966402,Mon Jun 11 17:37:48 +0000 2012,2014-11-05 23:51:31,0,0,repNone,,False,"Volkswagen avait fait de la première place mondiale un objectif pour 2018. Selon toute vraisemblance, ce but sera... http://t.co/oXZSiuk6ik"
https://twitter.com/ArbourVW/status/530145184177070081,Mon Jun 11 17:37:48 +0000 2012,2014-11-05 23:50:36,0,0,repNone,,False,"Volkswagen avait fait de la première place mondiale un objectif pour 2018. Selon toute vraisemblance, ce but sera... http://t.co/VINIA6CWa8"
https://twitter.com/ArbourVW/status/530144753057153026,Mon Jun 11 17:37:48 +0000 2012,2014-11-05 23:48:53,0,0,repNone,,False,"Volkswagen avait fait de la première place mondiale un objectif pour 2018. Selon toute vraisemblance, ce but sera... http://t.co/ExDD9VaPDL"
https://twitter.com/ArbourVW/status/528239375310942208,Mon Jun 11 17:37:48 +0000 2012,2014-10-31 17:37:35,0,0,repNone,,False,Montrez nous vos déguisements d'Halloween!!!   https://t.co/wUTyMIqY5Q http://t.co/tpchyr5inb
https://twitter.com/ArbourVW/status/527571239024353280,Mon Jun 11 17:37:48 +0000 2012,2014-10-29 21:22:39,0,0,repNone,,False,https://t.co/KAcGyFLEkK http://t.co/0N1eBplaDF
https://twitter.com/ArbourVW/status/524203906352418816,Mon Jun 11 17:37:48 +0000 2012,2014-10-20 14:22:05,0,0,repNone,,False,Faites nous parvenir une photo de votre citrouille d'halloween! http://t.co/6tHxXgLLkZ
https://twitter.com/ArbourVW/status/522044829866659841,Mon Jun 11 17:37:48 +0000 2012,2014-10-14 15:22:41,0,0,repNone,,False,"Montrez-nous votre #AMOURVW pour l""halloween. Faites-vous un #vwcarstume en utilisant ces modèles et... http://t.co/KaGqriQlT9"
https://twitter.com/ArbourVW/status/522043645240016896,Mon Jun 11 17:37:48 +0000 2012,2014-10-14 15:17:58,0,0,repNone,,False,"Montrez-nous votre #AMOURVW pour l""halloween. Faites-vous un #vwcarstume en utilisant ces modèles et... http://t.co/4pZTN6ztIw"
https://twitter.com/ArbourVW/status/518130971267592193,Mon Jun 11 17:37:48 +0000 2012,2014-10-03 20:10:24,0,0,repNone,,False,Notre forfait esthétique pour l'automne. http://t.co/arEgjEHe05
https://twitter.com/ArbourVW/status/517735777476694016,Mon Jun 11 17:37:48 +0000 2012,2014-10-02 18:00:03,0,0,repNone,,False,Volkswagen explore les conséquences de la puissante accélération de la toute nouvelle Golf GTI.... http://t.co/U8rIiHlDoH
https://twitter.com/ArbourVW/status/513000606256992256,Mon Jun 11 17:37:48 +0000 2012,2014-09-19 16:24:10,0,0,repNone,,False,Un tout nouveau concessionaire à Laval pour mieux vous servir!... http://t.co/yrlqkuZWfx
https://twitter.com/ArbourVW/status/511601333859004417,Mon Jun 11 17:37:48 +0000 2012,2014-09-15 19:43:57,0,0,repNone,,False,Qui a hâte de voir la Beetle #grc de Tanner Foust en action?!  https://t.co/0FolrJyL6G http://t.co/PrgItnSIlz
https://twitter.com/ArbourVW/status/510520935041236992,Mon Jun 11 17:37:48 +0000 2012,2014-09-12 20:10:50,0,0,repNone,,False,Quel est le kilométrage de votre Volkswagen? http://t.co/fdj3SUgHS5
https://twitter.com/ArbourVW/status/507620251324780544,Mon Jun 11 17:37:48 +0000 2012,2014-09-04 20:04:33,0,0,repNone,,False,La toute nouvelle Golf GTE!  http://t.co/fQpcxvG9Dz http://t.co/ESMXlnmZWG
https://twitter.com/ArbourVW/status/505450794439561216,Mon Jun 11 17:37:48 +0000 2012,2014-08-29 20:23:54,0,0,repNone,,False,Tanner Foust et sa nouvelle Beetle GRC ( Red Bull Global Rallycross )  https://t.co/9eHsaD8wcL http://t.co/JBYJzwSg3V
https://twitter.com/ArbourVW/status/505086074478407680,Mon Jun 11 17:37:48 +0000 2012,2014-08-28 20:14:38,0,0,repNone,,False,La toute nouvelle Volkswagen Golf 2015 à la rescousse!  https://t.co/Izh9qTYIC6 http://t.co/Ux6oSMtZEI
https://twitter.com/ArbourVW/status/504298319938465793,Mon Jun 11 17:37:48 +0000 2012,2014-08-26 16:04:23,0,0,repNone,,False,Il y a 3 voitures Volkswagen en vedette sur la liste de 24/7 Wall Street pour les 10 voitures les plus vendues de... http://t.co/zYab3cK7Ci
https://twitter.com/ArbourVW/status/498923187883630594,Mon Jun 11 17:37:48 +0000 2012,2014-08-11 20:05:32,0,0,repNone,,False,PERFEKT! Les ingénieurs allemands présentent leur première chorégraphie trépidante et parfaitement coordonnée... http://t.co/yyyWrgz8n8
https://twitter.com/ArbourVW/status/497831806075666433,Mon Jun 11 17:37:48 +0000 2012,2014-08-08 19:48:46,0,0,repNone,,False,"@MoiCelestia @FMassicotte Nous sommes désolés de votre mécontentement, nous faisons tout notre possible pour vous aider."
https://twitter.com/ArbourVW/status/497830567413829632,Mon Jun 11 17:37:48 +0000 2012,2014-08-08 19:43:51,0,0,repNone,,False,@MoiCelestia @FMassicotte Nous essayons de vous rejoindre depuis midi envoyez-moi un courriel svp k.darwish@arbourvw.com
https://twitter.com/ArbourVW/status/497830050692337664,Mon Jun 11 17:37:48 +0000 2012,2014-08-08 19:41:47,0,0,repNone,FMassicotte,False,@FMassicotte @MoiCelestia Nous avons tenté de trouver une van pour vous accommoder mais les compagnies n’ont aucune disponibilités
https://twitter.com/ArbourVW/status/497828281006424065,Mon Jun 11 17:37:48 +0000 2012,2014-08-08 19:34:46,0,0,repNone,FMassicotte,False,@FMassicotte @MoiCelestia Ceci est 15-16 heures de main d’œuvre. Nous faisons tout notre possible pour terminer les réparations au plus vite
https://twitter.com/ArbourVW/status/497827808459378688,Mon Jun 11 17:37:48 +0000 2012,2014-08-08 19:32:53,0,0,repNone,FMassicotte,False,"@FMassicotte @MoiCelestia Pour faire bonne réparation, Arbour /Volkswagen Canada ont décidés de changer le support à radiateur au complet."
https://twitter.com/ArbourVW/status/497827499074932737,Mon Jun 11 17:37:48 +0000 2012,2014-08-08 19:31:39,0,0,repNone,FMassicotte,False,@FMassicotte @MoiCelestia Pour mettre un peu de précision à la situation Nous n’avons pas 'brisé' votre voiture. Il a un boulon qui a brisé.
https://twitter.com/ArbourVW/status/497460055168413698,Mon Jun 11 17:37:48 +0000 2012,2014-08-07 19:11:34,0,0,repNone,,False,Ce soir au Orange Julep!! http://t.co/QtvmODC4wj
https://twitter.com/ArbourVW/status/497177710611804160,Mon Jun 11 17:37:48 +0000 2012,2014-08-07 00:29:37,0,0,repNone,,False,Ne manquez pas notre rencontre spéciale demain au Orange Julep! http://t.co/nLJZrb2qcE
https://twitter.com/ArbourVW/status/496732671175700482,Mon Jun 11 17:37:48 +0000 2012,2014-08-05 19:01:12,0,0,repNone,,False,Patrick Carpentier qui pratique à l' Autodrome St-Eustache avec sa Volkswagen Polo Rallycross! http://t.co/ydyRRBeQZG
https://twitter.com/ArbourVW/status/494865095797645313,Mon Jun 11 17:37:48 +0000 2012,2014-07-31 15:20:07,0,0,repNone,,False,Avez-vous déjà eu une clef Volkswagen comme celle-ci? http://t.co/vYNGTBGF0F
https://twitter.com/ArbourVW/status/492387717053829120,Mon Jun 11 17:37:48 +0000 2012,2014-07-24 19:15:54,0,0,repNone,,False,"Solde de 4 jours! Du 28 au 31 juillet, profitez d’un rabais additionnel de 1 000 $ sur tous les modèles 2014, en... http://t.co/Q2KDO7j8Ic"
https://twitter.com/ArbourVW/status/492046070546202625,Mon Jun 11 17:37:48 +0000 2012,2014-07-23 20:38:19,0,0,repNone,,False,"Ne manquez pas notre prochain Jeudi Euro, le 24 juillet 2014 chez Arbour Volkswagen! Comme la dernière fois, avec... http://t.co/iB9iliaJAy"
https://twitter.com/ArbourVW/status/491607312734617601,Mon Jun 11 17:37:48 +0000 2012,2014-07-22 15:34:51,0,0,repNone,,False,Voici le résultat du tirage pour le concours Philippe Bond! Merci pour les plusieurs partages. Félicitations!!!... http://t.co/3EZbIfbEDF
https://twitter.com/ArbourVW/status/489491505267359744,Mon Jun 11 17:37:48 +0000 2012,2014-07-16 19:27:23,0,0,repNone,,False,Le prochain Jeudi Euro sera le 24 Juillet prochain! Ne manquez pas ça! http://t.co/ufcgm0NDiq
https://twitter.com/ArbourVW/status/489045596842364928,Mon Jun 11 17:37:48 +0000 2012,2014-07-15 13:55:30,0,0,repNone,,False,Bien joué Volkswagen ;) !!  https://t.co/gb7NuGLpRf http://t.co/L3SvcN6Otv
https://twitter.com/ArbourVW/status/488765271117553664,Mon Jun 11 17:37:48 +0000 2012,2014-07-14 19:21:36,0,0,repNone,,False,http://t.co/NvYeR1rWNi http://t.co/AYW0yyVJyr
https://twitter.com/ArbourVW/status/487684374532743168,Mon Jun 11 17:37:48 +0000 2012,2014-07-11 19:46:30,0,0,repNone,,False,"I posted 53 photos on Facebook in the album ""Jeudi Euro 10/07"" http://t.co/Lu0XOJ4Lis"
https://twitter.com/ArbourVW/status/487243550833541120,Mon Jun 11 17:37:48 +0000 2012,2014-07-10 14:34:49,0,0,repNone,,False,Ne manquez pas notre rencontre Jeudi Euro demain dès 18h30! En vous présentant chez Arbour Volkswagen vous êtes... http://t.co/VUhfRM0fEf
https://twitter.com/ArbourVW/status/486899144120729600,Mon Jun 11 17:37:48 +0000 2012,2014-07-09 15:46:16,0,0,repNone,,False,"Ne manquez pas notre rencontre Jeudi Euro demain dès 18h30! La météo s'annonce bonne, et en vous présentant chez... http://t.co/V2DeuhfMxd"
https://twitter.com/ArbourVW/status/485148673848795136,Mon Jun 11 17:37:48 +0000 2012,2014-07-04 19:50:32,0,0,repNone,,False,***CONCOURS***  Courez la chance de gagner une paire de billets pour le spectacle d'humour de Philippe Bond le 24... http://t.co/AXmvxFD2pB
https://twitter.com/ArbourVW/status/485124252375330816,Mon Jun 11 17:37:48 +0000 2012,2014-07-04 18:13:29,0,0,repNone,,False,https://t.co/SquWR98uUW http://t.co/4ldWqxIQth
https://twitter.com/ArbourVW/status/484778308295348224,Mon Jun 11 17:37:48 +0000 2012,2014-07-03 19:18:50,0,0,repNone,,False,"Nous sommes désolés,  mais nous allons devoir reporter notre Jeudi Euro au 10 Juillet. Merci! http://t.co/hZyW81H9U2"
https://twitter.com/ArbourVW/status/484426427303870465,Mon Jun 11 17:37:48 +0000 2012,2014-07-02 20:00:35,0,0,repNone,,False,Jeudi Euro chez Arbour Volkswagen ce jeudi / 3 Juillet à partir de 16:30. Soyez là en grand nombre!
https://twitter.com/ArbourVW/status/484425540380545024,Mon Jun 11 17:37:48 +0000 2012,2014-07-02 19:57:03,0,0,repNone,,False,Jeudi Euro chez Arbour Volkswagen ce jeudi / 3 Juin à partir de 16:30. Soyez là en grand nombre! http://t.co/WohHj0ZuiP
https://twitter.com/ArbourVW/status/482616443729485824,Mon Jun 11 17:37:48 +0000 2012,2014-06-27 20:08:21,0,0,repNone,,False,D'autres magnifiques photos de notre Jeudi Euro!  http://t.co/Z8p78KYRtj http://t.co/Tulzb1tMbu
https://twitter.com/ArbourVW/status/482613465178066944,Mon Jun 11 17:37:48 +0000 2012,2014-06-27 19:56:31,0,0,repNone,,False,"I posted 17 photos on Facebook in the album ""Jeudi Euro 27/06"" http://t.co/kXU5x0iNn0"
https://twitter.com/ArbourVW/status/481888990300078080,Mon Jun 11 17:37:48 +0000 2012,2014-06-25 19:57:43,0,0,repNone,,False,Ne manquez pas notre Jeudi Euro demain dès 18h30! http://t.co/FwcCyvesri
https://twitter.com/ArbourVW/status/481877803860635649,Mon Jun 11 17:37:48 +0000 2012,2014-06-25 19:13:15,0,0,repNone,,False,L'Expérience de conduite Golf 2015! Les participants ont pu se renseigner sur les caractéristiques des toutes... http://t.co/MgDU7zylEZ
https://twitter.com/ArbourVW/status/479694688660647937,Mon Jun 11 17:37:48 +0000 2012,2014-06-19 18:38:20,0,0,repNone,,False,Notre prochaine rencontre Jeudi Euro sera le 26 juin! À bientôt!
https://twitter.com/ArbourVW/status/479683448274046976,Mon Jun 11 17:37:48 +0000 2012,2014-06-19 17:53:40,0,0,repNone,,False,Caméra de recul pour la Volkswagen Jetta!  https://t.co/aTf7btStlJ http://t.co/oGJo6PfpdQ
https://twitter.com/ArbourVW/status/477542254643384320,Mon Jun 11 17:37:48 +0000 2012,2014-06-13 20:05:20,0,0,repNone,,False,"Après la victoire de Sébastien Ogier et Julien Ingrassia au rallye d'Italie 2013, ils la remportent encore une... http://t.co/Gztz1iMAHq"
https://twitter.com/ArbourVW/status/477179776277311489,Mon Jun 11 17:37:48 +0000 2012,2014-06-12 20:04:58,0,0,repNone,,False,Notre rencontre Jeudi Euro est cancelé à cause de la mauvaise température! Venez visiter notre page régulièrement... http://t.co/73A0ONplr1
https://twitter.com/ArbourVW/status/476063707005730816,Mon Jun 11 17:37:48 +0000 2012,2014-06-09 18:10:07,0,0,repNone,,False,Une campagne de sensibilisation contre l'utilisation d'un téléphone mobile au volant par Volkswagen.... http://t.co/Cb7oMBMMv4
https://twitter.com/ArbourVW/status/475348082050076673,Mon Jun 11 17:37:48 +0000 2012,2014-06-07 18:46:28,0,0,repNone,,False,Bravo à Franky GTR Love d'avoir gagné les billets à l'évènement qualif Formula Drift Canada demain à l'Autodrome... http://t.co/i0nS8cd8XZ
https://twitter.com/ArbourVW/status/473558495132778497,Mon Jun 11 17:37:48 +0000 2012,2014-06-02 20:15:18,0,0,repNone,,False,***CONCOURS***  Arbour Volkswagen est fier de vous offrir la chance de gagner une paire de billets pour... http://t.co/FTfP4epqZ7
https://twitter.com/ArbourVW/status/472469785192574977,Mon Jun 11 17:37:48 +0000 2012,2014-05-30 20:09:09,0,0,repNone,,False,"I posted 11 photos on Facebook in the album ""Jeudi Euro 05/29"" http://t.co/W72C8UCK77"
https://twitter.com/ArbourVW/status/471748394101116928,Mon Jun 11 17:37:48 +0000 2012,2014-05-28 20:22:36,0,1,repNone,,False,Ne manquez pas notre Jeudi Euro demain chez Arbour Volkswagen http://t.co/14zmjvUpdl
https://twitter.com/ArbourVW/status/469936480744259584,Mon Jun 11 17:37:48 +0000 2012,2014-05-23 20:22:42,0,0,repNone,,False,"Chez Arbour Volkswagen, nous avons toujours des prix compétitifs. Maintenant pour un temps limité (jusqu'à... http://t.co/mIeUaUJ55t"
https://twitter.com/ArbourVW/status/469569671767670786,Mon Jun 11 17:37:48 +0000 2012,2014-05-22 20:05:08,0,0,repNone,,False,"I posted 16 photos on Facebook in the album ""Jetta / Championnat Sedan GT / Arbour VW"" http://t.co/l7NOjGCYvF"
https://twitter.com/ArbourVW/status/469557063329132544,Mon Jun 11 17:37:48 +0000 2012,2014-05-22 19:15:02,0,0,repNone,,False,Nous allons malheureusement reporter encore une fois le meet dû à la température. Merci de votre compréhension. http://t.co/g1yQIStE7H
https://twitter.com/ArbourVW/status/468767392084938752,Mon Jun 11 17:37:48 +0000 2012,2014-05-20 14:57:10,0,0,repNone,,False,Tanner Foust au volant de sa #Volkswagen #Polo pendant le premier évènement du Red Bull Global Rallycross. Il... http://t.co/PJRaPZoD8i
https://twitter.com/ArbourVW/status/467399183469539328,Mon Jun 11 17:37:48 +0000 2012,2014-05-16 20:20:23,0,0,repNone,,False,"I posted 10 photos on Facebook in the album ""Project Cabriolet / Arbour Volkswagen"" http://t.co/qk1IXs1UYZ"
https://twitter.com/ArbourVW/status/466972640565927937,Mon Jun 11 17:37:48 +0000 2012,2014-05-15 16:05:28,0,0,repNone,,False,Bien dit! ;) http://t.co/yvOb7p8cmE
https://twitter.com/ArbourVW/status/466303997771780096,Mon Jun 11 17:37:48 +0000 2012,2014-05-13 19:48:31,0,0,repNone,,False,Quelle est votre préférence? Manuelle ou DSG? http://t.co/tVRlYgzN66
https://twitter.com/ArbourVW/status/464862619094900736,Mon Jun 11 17:37:48 +0000 2012,2014-05-09 20:20:59,0,0,repNone,,False,"Profitez d'un décompte de plus de 1 cent par seconde, soit 1 000 $ par jour, sur une toute nouvelle Golf 2015 et... http://t.co/sE5PeV7Ynm"
https://twitter.com/ArbourVW/status/464411592499556352,Mon Jun 11 17:37:48 +0000 2012,2014-05-08 14:28:46,0,0,repNone,,False,La rencontre est reporté au 22 mai! Merci et à bientôt. http://t.co/FcnKTqpPHZ
https://twitter.com/ArbourVW/status/464134476172640256,Mon Jun 11 17:37:48 +0000 2012,2014-05-07 20:07:36,0,0,repNone,escouadeCH,False,"@escouadeCH Here at Arbour Volkswagen in Laval, we are REAL Habs fans! @CanadiensMTL  #GoHabsGo http://t.co/njsiknK4V6"
https://twitter.com/ArbourVW/status/463768595277697025,Mon Jun 11 17:37:48 +0000 2012,2014-05-06 19:53:44,0,0,repNone,,False,Les astronautes et les pilotes d'avion se préparent avant de s'exposer aux accélérations extrêmes. Il va de soi... http://t.co/lHYLmaJtnU
https://twitter.com/ArbourVW/status/462290528034648065,Mon Jun 11 17:37:48 +0000 2012,2014-05-02 18:00:25,0,0,repNone,,False,I posted a new photo to Facebook http://t.co/ka8ZKvbsYu
https://twitter.com/ArbourVW/status/461616377133293569,Mon Jun 11 17:37:48 +0000 2012,2014-04-30 21:21:35,0,0,repNone,,False,À ne pas manquer! Jeudi Euro chez Arbour Volkswagen Laval le 1er mai. Pour toutes voitures euros. Standard... http://t.co/Ld0oPUz23G
https://twitter.com/ArbourVW/status/456159744571355136,Mon Jun 11 17:37:48 +0000 2012,2014-04-15 19:58:52,0,0,repNone,,False,"Les nouvelles rencontre de voitures chez Arbour Volkswagen:  Les Jeudis Euro / Euro Thursdays  2475, boul.... http://t.co/HxxZVr7Li4"
