id,Account Created At(same for all rows),status created_at,Fav_cont,retweeted_count,reply_to_status,reply_to_screen,quote,text
https://twitter.com/ArbourVW/status/887373696393981954,Mon Jun 11 17:37:48 +0000 2012,2017-07-18 18:09:10,0,0,repNone,,False,La e-Golf nommée la plus efficace de sa catégorie par Ressources naturelles Canada.  Arbour Volkswagen https://t.co/pwDf3Al3Zu
https://twitter.com/ArbourVW/status/885559073881640961,Mon Jun 11 17:37:48 +0000 2012,2017-07-13 17:58:30,0,0,repNone,,False,"Avec ses sièges rabattables et son intérieur spacieux, l’Atlas 2018 accueillir beaucoup de choses.  Venez le voir... https://t.co/4JhhvBgTbl"
https://twitter.com/ArbourVW/status/883399938272448517,Mon Jun 11 17:37:48 +0000 2012,2017-07-07 18:58:52,0,0,repNone,,False,Profitez d’économies tout l’été avec des offres incroyables – exclusivement avec le programme de privilèges pour... https://t.co/1GwzWkivue
https://twitter.com/ArbourVW/status/883030749326323716,Mon Jun 11 17:37:48 +0000 2012,2017-07-06 18:31:51,0,0,repNone,,False,Venez chez Arbour Volkswagen pour faire l'essai de la toute nouvelle e-Golf. Complètement Golf et entièrement... https://t.co/rF9wcsxGnJ
https://twitter.com/ArbourVW/status/879791356398489600,Mon Jun 11 17:37:48 +0000 2012,2017-06-27 19:59:39,0,0,repNone,,False,"Avoir de l’espace pour les jambes est une bonne caractéristique à avoir dans une voiture et heureusement, l’Atlas... https://t.co/oKcxweTX5c"
https://twitter.com/ArbourVW/status/877972692820873216,Mon Jun 11 17:37:48 +0000 2012,2017-06-22 19:32:56,0,0,repNone,,False,Joyeuse Saint-Jean-Baptiste de l'équipe chez Arbour Volkswagen https://t.co/rDyW4efvih
https://twitter.com/ArbourVW/status/877970985735016448,Mon Jun 11 17:37:48 +0000 2012,2017-06-22 19:26:09,0,0,repNone,,False,Venez chez Arbour Volkswagen pour découvrir la facilité avec laquelle vous pouvez stationner le VUS Atlas 2018 à... https://t.co/GOEpwPRJxs
https://twitter.com/ArbourVW/status/877598068526297089,Mon Jun 11 17:37:48 +0000 2012,2017-06-21 18:44:19,1,0,repNone,,False,Arbour Volkswagen​ est un concessionnaire Volkswagen à Laval depuis 45 ans. Nous sommes présentement à la... https://t.co/oRz1p5smC9
https://twitter.com/ArbourVW/status/877243136808017920,Mon Jun 11 17:37:48 +0000 2012,2017-06-20 19:13:56,0,0,repNone,,False,https://t.co/6WWJ8UzLn1
https://twitter.com/ArbourVW/status/877148325664968706,Mon Jun 11 17:37:48 +0000 2012,2017-06-20 12:57:12,0,0,repNone,,False,Ceci n'est pas votre Beetle typique... https://t.co/sruMIQScdw
https://twitter.com/ArbourVW/status/875096291721830405,Mon Jun 11 17:37:48 +0000 2012,2017-06-14 21:03:09,0,0,repNone,,False,Il n’est pas toujours facile de trouver un VUS qui peut accueillir toute la famille et qui permet aussi de partir... https://t.co/XquOwQi6lj
https://twitter.com/ArbourVW/status/874289713032695808,Mon Jun 11 17:37:48 +0000 2012,2017-06-12 15:38:05,0,0,repNone,,False,***Voiture Occasion Vedette***  2015 Porsche Macan Mags 20'' Spyder RS design Toit Panoramique Sport Chrono Pack... https://t.co/AS3NQHMLyY
https://twitter.com/ArbourVW/status/873625854902972416,Mon Jun 11 17:37:48 +0000 2012,2017-06-10 19:40:09,0,0,repNone,,False,"""TEASER"" #2 de la voiture de promo #ArbourVolkswagen https://t.co/ietiBKmPq1"
https://twitter.com/ArbourVW/status/872531358110941184,Mon Jun 11 17:37:48 +0000 2012,2017-06-07 19:11:01,0,0,repNone,,False,Un petit ''TEASER'' de la nouvelle voiture de promo Arbour Volkswagen.  Pensez-vous savoir de quoi il s'agit?... https://t.co/660Sn4Kkye
https://twitter.com/ArbourVW/status/870368918887698435,Mon Jun 11 17:37:48 +0000 2012,2017-06-01 19:58:15,0,0,repNone,,False,N'oubliez pas de faire un tour chez Complexe Volkswagen 440 en soirée pour notre #JeudiEuro https://t.co/PyA3FVzDos
https://twitter.com/ArbourVW/status/867828782048190465,Mon Jun 11 17:37:48 +0000 2012,2017-05-25 19:44:39,0,0,repNone,,False,Les Jeudis Euros sont de retour!  Venez faire un tour!!! https://t.co/gATJqKRTD8
https://twitter.com/ArbourVW/status/866514240022224896,Mon Jun 11 17:37:48 +0000 2012,2017-05-22 04:41:08,0,0,repNone,,False,Nous avons apporté des modifications à l'horaire de demain. Voici l'horaire!  Arbour Volkswagen https://t.co/IkV3a0Bloq
https://twitter.com/ArbourVW/status/865668574634950656,Mon Jun 11 17:37:48 +0000 2012,2017-05-19 20:40:46,0,0,repNone,,False,***VOITURE D'OCCASION VEDETTE***  Audi S3 2016 31 790km TECHNIK PACKAGE https://t.co/XltCme7pY3
https://twitter.com/ArbourVW/status/865291597709180931,Mon Jun 11 17:37:48 +0000 2012,2017-05-18 19:42:47,0,0,repNone,,False,Nous sommes OUVERT lundi le 22 mai prochain.  Arbour Volkswagen https://t.co/5FihaIlRAz
https://twitter.com/ArbourVW/status/864585957290295296,Mon Jun 11 17:37:48 +0000 2012,2017-05-16 20:58:50,0,0,repNone,,False,"Sur toutes les routes et en toute saison, les systèmes Volkswagen vous prêtent main-forte. Le constructeur a... https://t.co/XMZ4AGkQX0"
https://twitter.com/ArbourVW/status/864207837504917504,Mon Jun 11 17:37:48 +0000 2012,2017-05-15 19:56:19,0,0,repNone,,False,Arbour Volkswagen​ est un concessionnaire Volkswagen à Laval depuis 45 ans. Nous sommes présentement à la... https://t.co/IxGPx4pHXN
https://twitter.com/ArbourVW/status/863132786479288321,Mon Jun 11 17:37:48 +0000 2012,2017-05-12 20:44:27,0,0,repNone,,False,Gardez votre famille en sécurité et au sec sur tout type de routes dans la Volkswagen Golf 2017 Sportwagen https://t.co/FWUPrRCTpL
https://twitter.com/ArbourVW/status/862416358415507457,Mon Jun 11 17:37:48 +0000 2012,2017-05-10 21:17:37,0,0,repNone,,False,Jetez un coup d'oeil à notre nouvelle section 2e et 3e chance au crédit chez Arbour Volkswagen https://t.co/JsqTvvma6t
https://twitter.com/ArbourVW/status/862416196104310786,Mon Jun 11 17:37:48 +0000 2012,2017-05-10 21:16:58,0,0,repNone,,False,Jetez un coup d'oeil à notre nouvelle section 2e et 3e chance au crédit chez Arbour Volkswagen  https://t.co/OgbTNOeZGs
https://twitter.com/ArbourVW/status/860593022366515202,Mon Jun 11 17:37:48 +0000 2012,2017-05-05 20:32:20,0,0,repNone,,False,AVERTISSEMENT: Le sens de l'aventure n'est pas inclus.   Venez voir la Alltrack et Golf Sportwagen disponible en... https://t.co/HQ7q6OfWXZ
https://twitter.com/ArbourVW/status/860136037301071872,Mon Jun 11 17:37:48 +0000 2012,2017-05-04 14:16:26,0,0,repNone,,False,Une coupe de cheveu pour les petits fans de #Volkswagen ?!  Arbour Volkswagen https://t.co/XkaxPqc0Hx
https://twitter.com/ArbourVW/status/859876989611773952,Mon Jun 11 17:37:48 +0000 2012,2017-05-03 21:07:04,0,0,repNone,,False,***VOITURE D'OCCASION VEDETTE***  Arbour Volkswagen https://t.co/nYJC0wbcPg
https://twitter.com/ArbourVW/status/858051681656999936,Mon Jun 11 17:37:48 +0000 2012,2017-04-28 20:13:57,0,0,repNone,,False,Saviez-vous que...? Configuration d'ouvre garage dans votre #Volkswagen https://t.co/LAFuHYEkwO
https://twitter.com/ArbourVW/status/858051324038066176,Mon Jun 11 17:37:48 +0000 2012,2017-04-28 20:12:32,0,0,repNone,,False,Saviez-vous que...? Le verrouillage de valise Passat. https://t.co/uOOBIYpRT6
https://twitter.com/ArbourVW/status/856975973501345792,Mon Jun 11 17:37:48 +0000 2012,2017-04-25 20:59:28,0,0,repNone,,False,I posted a new photo to Facebook https://t.co/QebZHFFvIx
https://twitter.com/ArbourVW/status/855569668630773760,Mon Jun 11 17:37:48 +0000 2012,2017-04-21 23:51:19,0,0,repNone,,False,"Le Groupe Volkswagen Canada est heureux d’annoncer que les tribunaux ont approuvé le Règlement visant à résoudre,... https://t.co/KbIYsU7Bny"
https://twitter.com/ArbourVW/status/855517948286513155,Mon Jun 11 17:37:48 +0000 2012,2017-04-21 20:25:48,0,0,repNone,,False,NOUS PAYONS LES TAXES!  Arbour Volkswagen https://t.co/zYEPuFdgdL
https://twitter.com/ArbourVW/status/855155418385043457,Mon Jun 11 17:37:48 +0000 2012,2017-04-20 20:25:14,0,0,repNone,,False,SAVIEZ-VOUS QUE...?  L'ouvre porte de garage #Volkswagen https://t.co/OsdV6ZnaaN
https://twitter.com/ArbourVW/status/855101458336718848,Mon Jun 11 17:37:48 +0000 2012,2017-04-20 16:50:49,0,0,repNone,,False,Quel Volkswagen aimeriez-vous conduire?  To create something like this - check https://t.co/82tMOdIvmU https://t.co/umKWAioSzg
https://twitter.com/ArbourVW/status/854817449719582723,Mon Jun 11 17:37:48 +0000 2012,2017-04-19 22:02:16,0,0,repNone,,False,La E-Golf https://t.co/EPiYIbF995
https://twitter.com/ArbourVW/status/852630653808115712,Mon Jun 11 17:37:48 +0000 2012,2017-04-13 21:12:43,0,0,repNone,,False,Ne manquez pas notre promotion de Pâques chez Arbour Volkswagen https://t.co/2IKkLAY2Zs
https://twitter.com/ArbourVW/status/851908549496242176,Mon Jun 11 17:37:48 +0000 2012,2017-04-11 21:23:20,0,0,repNone,,False,"Volkswagen #TDI 2015 NEUF maintenant disponible pour la vente chez Arbour Volkswagen. Pour plus d'informations,... https://t.co/IUrAj0MiHw"
https://twitter.com/ArbourVW/status/849361094045032448,Mon Jun 11 17:37:48 +0000 2012,2017-04-04 20:40:39,0,0,repNone,,False,Il a un petit je ne sais quoi dans chaque Volkswagen!  Arbour Volkswagen https://t.co/NsAYk24SzW
https://twitter.com/ArbourVW/status/848997729200222208,Mon Jun 11 17:37:48 +0000 2012,2017-04-03 20:36:46,0,0,repNone,,False,La #Volkswagen Atlas de 7 places.  Bientôt chez Arbour Volkswagen https://t.co/rZoUk2Yrwn
https://twitter.com/ArbourVW/status/847914386115055616,Mon Jun 11 17:37:48 +0000 2012,2017-03-31 20:51:57,0,0,repNone,,False,"La nouvelle Jetta 2016 équipée du moteur TSI de 1,4l dure extrêmement longtemps sur la route…sûrement même plus... https://t.co/dJ7yxn099J"
https://twitter.com/ArbourVW/status/847183183296770048,Mon Jun 11 17:37:48 +0000 2012,2017-03-29 20:26:25,0,0,repNone,,False,VOITURE D'OCCASION VEDETTE  2015 Audi TTS Competition 1 de 500 https://t.co/cRlEizc5Mg
https://twitter.com/ArbourVW/status/846406021631369216,Mon Jun 11 17:37:48 +0000 2012,2017-03-27 16:58:15,0,0,repNone,,False,Les offres de Printemps chez Arbour Volkswagen. Maintenant ouvert le SAMEDI! https://t.co/rVptjZFoGh
https://twitter.com/ArbourVW/status/845364539663302658,Mon Jun 11 17:37:48 +0000 2012,2017-03-24 19:59:47,0,0,repNone,,False,Qu'allez vous faire ce week-end? Arbour Volkswagen https://t.co/DDcNb3mzsp
https://twitter.com/ArbourVW/status/844642193918832642,Mon Jun 11 17:37:48 +0000 2012,2017-03-22 20:09:26,0,0,repNone,,False,***Voiture d'occasion VEDETTE de la semaine*** https://t.co/kmn4kHmjlP
https://twitter.com/ArbourVW/status/842822343449870336,Mon Jun 11 17:37:48 +0000 2012,2017-03-17 19:38:00,0,0,repNone,,False,La vente ''Ben j'te cré pas'' chez Arbour Volkswagen...  J'te l'dis!! https://t.co/uJ9p0rs5jJ
https://twitter.com/ArbourVW/status/841756613610475520,Mon Jun 11 17:37:48 +0000 2012,2017-03-14 21:03:10,0,0,repNone,,False,Tempête de neige? Pas de troubles lorsqu'on est derrière le volant d'une #Volkswagen https://t.co/bGZIJA1DqP
https://twitter.com/ArbourVW/status/840312337160667137,Mon Jun 11 17:37:48 +0000 2012,2017-03-10 21:24:08,0,0,repNone,,False,"Arbour Volkswagen, proche de vous.  https://t.co/JP3sQypXhF https://t.co/Vge8Dez4tF"
https://twitter.com/ArbourVW/status/839946335168126977,Mon Jun 11 17:37:48 +0000 2012,2017-03-09 21:09:46,0,0,repNone,,False,Avez-vous hâte de voir la Volkswagen #Atlas sur les routes au Québec?!  Arbour Volkswagen https://t.co/KvCmJh6aDS
https://twitter.com/ArbourVW/status/839232431463022592,Mon Jun 11 17:37:48 +0000 2012,2017-03-07 21:52:58,0,0,repNone,,False,"Gagnante du prix de la voiture canadienne de l'année 2017 et de la meilleure grande voiture 2017 de l’AJAC, la... https://t.co/5O922GPzOw"
https://twitter.com/ArbourVW/status/837689871959470080,Mon Jun 11 17:37:48 +0000 2012,2017-03-03 15:43:23,0,0,repNone,,False,Arbour Volkswagen​ est un concessionnaire Volkswagen à Laval depuis 45 ans. Nous sommes présentement à la... https://t.co/8rW1iGZCXf
https://twitter.com/ArbourVW/status/837046359702269954,Mon Jun 11 17:37:48 +0000 2012,2017-03-01 21:06:18,0,0,repNone,,False,Le printemps arrive et il est important de changer ses pneus.   Voici pourquoi  Arbour Volkswagen https://t.co/4fnk2czMbM
https://twitter.com/ArbourVW/status/832280094525755392,Mon Jun 11 17:37:48 +0000 2012,2017-02-16 17:26:52,0,0,repNone,,False,La Volkswagen Alltrack est voiture Canadienne de l'année.  Arbour Volkswagen https://t.co/iArv5tSgoE
https://twitter.com/ArbourVW/status/829736114416209920,Mon Jun 11 17:37:48 +0000 2012,2017-02-09 16:58:00,0,0,repNone,,False,Qui aimerait être derrière le volant d'une Beetle aussi puissante?  Arbour Volkswagen https://t.co/CuzoaGK8Sq
https://twitter.com/ArbourVW/status/829450361043812352,Mon Jun 11 17:37:48 +0000 2012,2017-02-08 22:02:31,0,0,repNone,,False,"Cet hiver, confiez-nous votre voiture pour un entretien et obtenez GRATUITEMENT une prime Prêt pour l'hiver! Seul... https://t.co/o7VRjrYjFj"
https://twitter.com/ArbourVW/status/829080537063182336,Mon Jun 11 17:37:48 +0000 2012,2017-02-07 21:32:58,0,0,repNone,,False,***Voiture d'occasion vedette de la semaine***  Arbour Volkswagen  https://t.co/GCnprFPfMY https://t.co/kOFPjfv8hD
https://twitter.com/ArbourVW/status/826545956485210113,Mon Jun 11 17:37:48 +0000 2012,2017-01-31 21:41:27,0,0,repNone,,False,Saviez-vous que...?  La clef de boulon antivol  Arbour Volkswagen https://t.co/4smApLf0em
https://twitter.com/ArbourVW/status/825102830369460224,Mon Jun 11 17:37:48 +0000 2012,2017-01-27 22:06:59,0,0,repNone,,False,La Golf SportWagen maintenant avec traction intégrale 4MOTION  Arbour Volkswagen https://t.co/DoEc6OzBow
https://twitter.com/ArbourVW/status/824727396758777856,Mon Jun 11 17:37:48 +0000 2012,2017-01-26 21:15:08,0,0,repNone,,False,Maintenant disponible chez Arbour Volkswagen  Une #Volkswagen GTI électrique pour vos enfants.  Pour plus... https://t.co/u8FCRCCtFw
https://twitter.com/ArbourVW/status/824705162140930048,Mon Jun 11 17:37:48 +0000 2012,2017-01-26 19:46:47,0,0,repNone,,False,Félicitations à Xavier Lemieux-Ferland pour avoir gagné la deuxième paire de billets. https://t.co/kAuJsaJWbA
https://twitter.com/ArbourVW/status/824318725822316544,Mon Jun 11 17:37:48 +0000 2012,2017-01-25 18:11:13,0,0,repNone,,False,Nous avons une dernière paire de billets pour le Salon International de l'Auto de Montréal/Montreal International... https://t.co/nmRQLHSRT4
https://twitter.com/ArbourVW/status/823919670713532417,Mon Jun 11 17:37:48 +0000 2012,2017-01-24 15:45:31,0,0,repNone,,False,Saviez-vous que...? Le mode service des essuies-glace #Volkswagen  Arbour Volkswagen https://t.co/Pee13NknEM
https://twitter.com/ArbourVW/status/823547077774938114,Mon Jun 11 17:37:48 +0000 2012,2017-01-23 15:04:58,0,0,repNone,,False,La gagnante des billets pour le Salon International de l'Auto de Montréal/Montreal International Auto Show est:... https://t.co/blpQiC8t7k
https://twitter.com/ArbourVW/status/822549255021850628,Mon Jun 11 17:37:48 +0000 2012,2017-01-20 20:59:59,0,0,repNone,,False,Arbour Volkswagen aimerait vous offrir la chance de gagner une paire de billets pour le Salon International de... https://t.co/lp1wwO4Yto
https://twitter.com/ArbourVW/status/822483406323847170,Mon Jun 11 17:37:48 +0000 2012,2017-01-20 16:38:19,0,0,repNone,,False,Ne manquez pas notre vente en cours!  L’offre se termine 31 janvier 2017  Arbour Volkswagen https://t.co/TwuJTnJQk6
https://twitter.com/ArbourVW/status/822221910863855619,Mon Jun 11 17:37:48 +0000 2012,2017-01-19 23:19:14,0,0,repNone,,False,"I posted 38 photos on Facebook in the album ""Volkswagen au Salon de l'auto de Montréal 2017"" https://t.co/HFceWHQnOh"
https://twitter.com/ArbourVW/status/822155566772527104,Mon Jun 11 17:37:48 +0000 2012,2017-01-19 18:55:36,0,0,repNone,,False,Kioske Volkswagen au Salon International de l'Auto de Montréal/Montreal International Auto Show https://t.co/KHRf7dEPQf
https://twitter.com/ArbourVW/status/822148777591054340,Mon Jun 11 17:37:48 +0000 2012,2017-01-19 18:28:38,0,0,repNone,,False,Dévoilements Volkswagen au Salon International de l'Auto de Montréal/Montreal International Auto Show https://t.co/yUvxao76Ky
https://twitter.com/ArbourVW/status/821800346632802307,Mon Jun 11 17:37:48 +0000 2012,2017-01-18 19:24:05,0,0,repNone,,False,À ne pas manquer  Arbour Volkswagen https://t.co/rMQj1r6STh
https://twitter.com/ArbourVW/status/821476441225363458,Mon Jun 11 17:37:48 +0000 2012,2017-01-17 21:57:00,0,0,repNone,,False,Saviez-vous que?  https://t.co/qWi3j5P8Y7 https://t.co/q6xD2QNmN9
https://twitter.com/ArbourVW/status/821370842538004481,Mon Jun 11 17:37:48 +0000 2012,2017-01-17 14:57:23,0,0,repNone,,False,On y est presque! Joignez-vous à nous au Salon International de l'Auto de Montréal/Montreal International Auto... https://t.co/V83XkM6h2I
https://twitter.com/ArbourVW/status/821112359846612992,Mon Jun 11 17:37:48 +0000 2012,2017-01-16 21:50:16,0,0,repNone,,False,Venez profiter de notre vente 10 jours chez Arbour Volkswagen  https://t.co/z2zNgki8Jx https://t.co/075KgfTPYg
https://twitter.com/ArbourVW/status/820009790638329857,Mon Jun 11 17:37:48 +0000 2012,2017-01-13 20:49:03,0,0,repNone,,False,La Golf Sportwagon  Maintenant disponible en version traction intégrale 4Motion  Arbour Volkswagen https://t.co/INEReS507i
https://twitter.com/ArbourVW/status/819601190489063428,Mon Jun 11 17:37:48 +0000 2012,2017-01-12 17:45:25,0,0,repNone,,False,"Voici le tout nouveau Tiguan 2018 de Volkswagen. Entièrement redessiné, le VUS exceptionnellement bien équipé... https://t.co/sGmoc8KKyZ"
https://twitter.com/ArbourVW/status/818864769369305088,Mon Jun 11 17:37:48 +0000 2012,2017-01-10 16:59:09,0,0,repNone,,False,Venez faire un tour chez Arbour Volkswagen afin de vous procurer un coupon rabais pour le Salon International de... https://t.co/MF82sHFust
https://twitter.com/ArbourVW/status/818574592499445760,Mon Jun 11 17:37:48 +0000 2012,2017-01-09 21:46:05,0,0,repNone,,False,Un aperçu du North American International Auto Show à Detroit dans le kioske #Volkswagen.  Arbour Volkswagen https://t.co/f9LkjPSVr8
https://twitter.com/ArbourVW/status/818478500827004930,Mon Jun 11 17:37:48 +0000 2012,2017-01-09 15:24:15,0,0,repNone,,False,En direct! https://t.co/d38SwBZ1aU
https://twitter.com/ArbourVW/status/817476987157680128,Mon Jun 11 17:37:48 +0000 2012,2017-01-06 21:04:36,0,0,repNone,,False,Ne manquez pas nos offres d'hiver chez Arbour Volkswagen https://t.co/Nr8Y4HJuZJ
https://twitter.com/ArbourVW/status/816759981127200769,Mon Jun 11 17:37:48 +0000 2012,2017-01-04 21:35:28,0,0,repNone,,False,Bonne année 2017  De toute l'équipe chez Arbour Volkswagen https://t.co/DFBv0AfgqO
https://twitter.com/ArbourVW/status/811681856244617218,Mon Jun 11 17:37:48 +0000 2012,2016-12-21 21:16:49,0,0,repNone,,False,C’est avec joie que nous vous offrons nos souhaits sincères pour une heureuse saison des fêtes. Nous tenons à... https://t.co/lsPrXK25Zn
https://twitter.com/ArbourVW/status/811351861429235712,Mon Jun 11 17:37:48 +0000 2012,2016-12-20 23:25:32,0,0,repNone,,False,Qui aimerait faire pareil?!  Arbour Volkswagen https://t.co/MElJp49PdZ
https://twitter.com/ArbourVW/status/809452452592447488,Mon Jun 11 17:37:48 +0000 2012,2016-12-15 17:37:58,0,0,repNone,,False,En panne d'inspiration pour vos idées cadeaux de Noël? Besoin de suggestions originales pour vos achats du temps... https://t.co/RxkSR4oAgg
https://twitter.com/ArbourVW/status/809156424190357504,Mon Jun 11 17:37:48 +0000 2012,2016-12-14 22:01:39,0,0,repNone,,False,Faites votre propre carte de Noël #Volkswagen  Téléchargez les instructions ici: https://t.co/uzwWrDN1Wj  Arbour... https://t.co/okrEgv0vVc
https://twitter.com/ArbourVW/status/808788859622457344,Mon Jun 11 17:37:48 +0000 2012,2016-12-13 21:41:05,0,0,repNone,,False,Arbour Volkswagen est a la recherche d’un ou une préposé(e) à la relance et prise de rendez-vous pour le... https://t.co/RdLQMGXu4S
https://twitter.com/ArbourVW/status/807328677717479424,Mon Jun 11 17:37:48 +0000 2012,2016-12-09 20:58:50,0,0,repNone,,False,Profitez de la saison avec une prime Prêt pour lhiver chez Arbour Volkswagen https://t.co/gUQgjEQBxp
https://twitter.com/ArbourVW/status/806976172441669632,Mon Jun 11 17:37:48 +0000 2012,2016-12-08 21:38:07,0,0,repNone,,False,I posted a new photo to Facebook https://t.co/0oZ9DCIQ3F
https://twitter.com/ArbourVW/status/804790528718028806,Mon Jun 11 17:37:48 +0000 2012,2016-12-02 20:53:08,0,0,repNone,,False,"Pour savoir notre horaire du temps des Fêtes, veuillez cliquez ci-dessous.  Arbour Volkswagen https://t.co/ETwo3oSPTU"
https://twitter.com/ArbourVW/status/804379184126709760,Mon Jun 11 17:37:48 +0000 2012,2016-12-01 17:38:36,0,0,repNone,,False,"Maintenant que #Volkswagen a dévoilé le tout nouvel Atlas, il est temps de révéler toutes ses couleurs. Faites... https://t.co/zJfwvG8wFO"
https://twitter.com/ArbourVW/status/803610663855816705,Mon Jun 11 17:37:48 +0000 2012,2016-11-29 14:44:47,0,0,repNone,,False,Félicitations à M. Julien. Il est le grand gagnant de notre plus gros prix après notre vente de 45e anniversaire!... https://t.co/p0z9wRAGUH
https://twitter.com/ArbourVW/status/802270456065720320,Mon Jun 11 17:37:48 +0000 2012,2016-11-25 21:59:16,0,0,repNone,,False,Il vous reste une journée pour passer voir la Boutique Arbour pour notre vente #BlackFriday!!  Arbour Volkswagen https://t.co/OURpGf88eE
https://twitter.com/ArbourVW/status/801926695188045824,Mon Jun 11 17:37:48 +0000 2012,2016-11-24 23:13:17,0,0,repNone,,False,I posted a new photo to Facebook https://t.co/SsvXIEuzKP
https://twitter.com/ArbourVW/status/801885264247394304,Mon Jun 11 17:37:48 +0000 2012,2016-11-24 20:28:39,0,0,repNone,,False,***VENTE BLACK FRIDAY***  Ne manquez pas la vente Black Friday ce vendredi et samedi chez Arbour Volkswagen.... https://t.co/G2AHfkqqCf
https://twitter.com/ArbourVW/status/801168773818515457,Mon Jun 11 17:37:48 +0000 2012,2016-11-22 21:01:35,0,0,repNone,,False,"Avez la neige qui tombe, venez faire un essai routier de la toute nouvelle Alltrack ou Sportwagen 4Motion dès... https://t.co/TBVLB54S2m"
https://twitter.com/ArbourVW/status/800817015409770496,Mon Jun 11 17:37:48 +0000 2012,2016-11-21 21:43:49,0,0,repNone,,False,"Fidèles à un engagement envers un avenir de la mobilité réinventé, nous sommes très heureux d'annoncer que la... https://t.co/OHRIRTr21r"
https://twitter.com/ArbourVW/status/799710452217446402,Mon Jun 11 17:37:48 +0000 2012,2016-11-18 20:26:44,0,0,repNone,,False,***Voiture d'occasion vedette***  2015 Audi TTS Édition Spéciale 1 de 500  Arbour Volkswagen https://t.co/s4O8JqNDhk
https://twitter.com/ArbourVW/status/799709247806328832,Mon Jun 11 17:37:48 +0000 2012,2016-11-18 20:21:57,0,0,repNone,,False,Gardez votre famille en sécurité et au sec sur tout type de routes dans la Volkswagen Golf 2017 SportWagen.... https://t.co/mjuZuaZfGY
https://twitter.com/ArbourVW/status/799366113037578241,Mon Jun 11 17:37:48 +0000 2012,2016-11-17 21:38:27,0,0,repNone,,False,La e-Golf sera des nôtres dès l'été 2017!  Arbour Volkswagen https://t.co/QsnDK6QElS
https://twitter.com/ArbourVW/status/799283722889662464,Mon Jun 11 17:37:48 +0000 2012,2016-11-17 16:11:04,0,0,repNone,,False,Découvrez l’Atlas 2018 de #Volkswagen  Arbour Volkswagen https://t.co/5jfzsCIXSx
https://twitter.com/ArbourVW/status/798975696978792448,Mon Jun 11 17:37:48 +0000 2012,2016-11-16 19:47:05,0,0,repNone,,False,Voici le tirage pour la conclusion de notre vente du 45e anniversaire d'Arbour Volkswagen!! https://t.co/nR16Zw5vAq
https://twitter.com/ArbourVW/status/798181308128079872,Mon Jun 11 17:37:48 +0000 2012,2016-11-14 15:10:28,0,0,repNone,,False,"Jusqu'à 3 ans sans frais d'entretien régulier. Recevez une carte de crédit prépayée à l'achat d'une Golf, Jetta,... https://t.co/9iS5rldZ1N"
https://twitter.com/ArbourVW/status/794651297873965056,Mon Jun 11 17:37:48 +0000 2012,2016-11-04 21:23:27,0,0,repNone,,False,Wow! GTI widebody
https://twitter.com/ArbourVW/status/794311937878204416,Mon Jun 11 17:37:48 +0000 2012,2016-11-03 22:54:58,0,0,repNone,,False,I posted a new photo to Facebook https://t.co/IaSsnYTIvb
https://twitter.com/ArbourVW/status/793244632549163008,Mon Jun 11 17:37:48 +0000 2012,2016-11-01 00:13:52,0,0,repNone,,False,Visitez notre page à tous les jours:  Nous sommes en direct à The SEMA Show à Las Vegas! https://t.co/c3nVCXdkfA
https://twitter.com/ArbourVW/status/792067553166102529,Mon Jun 11 17:37:48 +0000 2012,2016-10-28 18:16:35,0,0,repNone,,False,Nous sommes maintenant ouvert le SAMEDI chez Arbour Volkswagen dès le 5 novembre.  Pour plus d'informations... https://t.co/ElNM0ZlZb1
https://twitter.com/ArbourVW/status/792054136480997376,Mon Jun 11 17:37:48 +0000 2012,2016-10-28 17:23:16,1,0,repNone,,False,C'est officiellement la dernière journée de notre vente 45e anniversaire. Qui aimerait une belle montre #R de... https://t.co/0yJ9XVZ33I
https://twitter.com/ArbourVW/status/792053580169555968,Mon Jun 11 17:37:48 +0000 2012,2016-10-28 17:21:03,0,0,repNone,,False,"Pour notre avant-dernier concours, nous allons faire tirer un portefeuille #GTI.  Pour participer:  AIMEZ la page... https://t.co/iqiIdAyoBT"
https://twitter.com/ArbourVW/status/792053275423944704,Mon Jun 11 17:37:48 +0000 2012,2016-10-28 17:19:51,0,0,repNone,,False,"Pour notre avant-dernier concours, nous allons faire tirer un portefeuille #GTI.  Pour participer:  AIMEZ la page... https://t.co/HnzBR5IWxx"
https://twitter.com/ArbourVW/status/792004276021137413,Mon Jun 11 17:37:48 +0000 2012,2016-10-28 14:05:08,0,0,repNone,,False,I posted a new photo to Facebook https://t.co/NRCKGU1xSO
https://twitter.com/ArbourVW/status/791680459361034240,Mon Jun 11 17:37:48 +0000 2012,2016-10-27 16:38:24,0,0,repNone,,False,I posted a new photo to Facebook https://t.co/9i602xDJI4
https://twitter.com/ArbourVW/status/791679982137249792,Mon Jun 11 17:37:48 +0000 2012,2016-10-27 16:36:31,0,0,repNone,,False,I posted a new photo to Facebook https://t.co/rcZICwsBcK
