id,Account Created At(same for all rows),status created_at,Fav_cont,retweeted_count,reply_to_status,reply_to_screen,quote,text
https://twitter.com/ArbourVW/status/1356969187617484800,Mon Jun 11 17:37:48 +0000 2012,2021-02-03 14:14:00,0,0,repNone,,False,"Prenez rendez-vous avec notre département de service, nous sommes ouverts jusqu'à 17h00.   Contactez-nous!                                                                                                                                                ☎️: (450) 681-8110 https://t.co/Scwmcs5Zuk"
https://twitter.com/ArbourVW/status/1356395155226525696,Mon Jun 11 17:37:48 +0000 2012,2021-02-02 00:13:00,0,0,repNone,,False,De quoi mettre de la couleur dans votre fil d'actualité! 💛 #eGolf https://t.co/hHRhc6xFNq
https://twitter.com/ArbourVW/status/1355542537142902790,Mon Jun 11 17:37:48 +0000 2012,2021-01-30 15:45:00,1,0,repNone,,False,Quels sont vos plans pour le week-end? ⛷ #weekend #vw #fun https://t.co/GHyVEekwXD
https://twitter.com/ArbourVW/status/1354817510105735170,Mon Jun 11 17:37:48 +0000 2012,2021-01-28 15:44:00,0,0,repNone,,False,"Pour votre sécurité et celle des autres, avant de prendre la route, n'oubliez pas de déneiger votre véhicule!  😉 https://t.co/Yirf5zAAgM"
https://twitter.com/ArbourVW/status/1352642176014979072,Mon Jun 11 17:37:48 +0000 2012,2021-01-22 15:40:00,0,0,repNone,,False,Les #Québecois savent profiter de la météo! ✌🏽  #BonVendredi https://t.co/MOeJwQzYCT
https://twitter.com/ArbourVW/status/1352279033086582784,Mon Jun 11 17:37:48 +0000 2012,2021-01-21 15:37:00,0,0,repNone,,False,"Design, confort et performance. 💯 #GolfGTI https://t.co/e9EBe8mwTD"
https://twitter.com/ArbourVW/status/1351585098110554116,Mon Jun 11 17:37:48 +0000 2012,2021-01-19 17:39:33,0,3,repNone,,False,RT @VWcanada: Ne vous contentez pas de prendre le volant; prenez une longueur d’avance #VWJetta #Volkswagen   En savoir plus : https://t.co…
https://twitter.com/ArbourVW/status/1351553754340880390,Mon Jun 11 17:37:48 +0000 2012,2021-01-19 15:35:00,0,0,repNone,,False,"Être propriétaire Volkswagen : les faits. ⬇️ Avec #Volkswagen, vous obtenez un véhicule conçu pour durer, une garantie supérieure à la moyenne et un service de qualité dont l’objectif est de vous faire gagner du temps tout en vous assurant la tranquillité d’esprit. https://t.co/QfrRAoC1vp"
https://twitter.com/ArbourVW/status/1350974660448497666,Mon Jun 11 17:37:48 +0000 2012,2021-01-18 01:13:53,0,4,repNone,,False,"RT @VWcanada: Le #Tiguan 2020 de #Volkswagen est si brillant que @Wheelsca le louange en 2021! Voyez pourquoi : https://t.co/rUfF6ragGj, pu…"
https://twitter.com/ArbourVW/status/1349376155493699585,Mon Jun 11 17:37:48 +0000 2012,2021-01-13 15:22:00,0,0,repNone,,False,On ne peut jamais être trop prudent sur les routes canadiennes. C’est pourquoi #Volkswagen a conçu la traction intégrale 4MOTION. https://t.co/tj5N4R56k5
https://twitter.com/ArbourVW/status/1347925848863621125,Mon Jun 11 17:37:48 +0000 2012,2021-01-09 15:19:00,0,0,repNone,,False,"Votre satisfaction nous tient à 💙.                                                                                                                                                                                             Arbour Volkswagen, une histoire de famille. https://t.co/jweSoNLSgS"
https://twitter.com/ArbourVW/status/1347200066830827522,Mon Jun 11 17:37:48 +0000 2012,2021-01-07 15:15:00,0,0,repNone,,False,Êtes-vous bien équipé pour la nouvelle année? 😉 https://t.co/RV76cNZzsT
https://twitter.com/ArbourVW/status/1346474283917258753,Mon Jun 11 17:37:48 +0000 2012,2021-01-05 15:11:00,0,0,repNone,,False,La Volkswagen #Golf est efficace et bien adaptée à nos hivers. ❄️ https://t.co/JejTuvjw2a
https://twitter.com/ArbourVW/status/1345024732509437954,Mon Jun 11 17:37:48 +0000 2012,2021-01-01 15:11:00,0,0,repNone,,False,Profitez de vos journées de congé! Amusez-vous et vivez pleinement tous ces instants de bonheur! ❄️ https://t.co/blOZxxbjyE
https://twitter.com/ArbourVW/status/1344653285102211073,Mon Jun 11 17:37:48 +0000 2012,2020-12-31 14:35:00,0,0,repNone,,False,"Que cette nouvelle année soit pleine de sérénité, de paix et de santé.  ✨ https://t.co/8lc5GVCo14"
https://twitter.com/ArbourVW/status/1342478202870980608,Mon Jun 11 17:37:48 +0000 2012,2020-12-25 14:32:00,0,0,repNone,,False,Toute l'équipe vous souhaite de joyeuses fêtes! ✨ https://t.co/dSRcijZlq3
https://twitter.com/ArbourVW/status/1342175457903566850,Mon Jun 11 17:37:48 +0000 2012,2020-12-24 18:29:00,0,0,repNone,,False,À toute allure! 🐰 #rabbits https://t.co/1C4i1mjUbu
https://twitter.com/ArbourVW/status/1340725403007082496,Mon Jun 11 17:37:48 +0000 2012,2020-12-20 18:27:00,0,0,repNone,,False,"Juste au cas, parce qu'on en a toujours besoin! 🥶 https://t.co/15B7WgiwCS"
https://twitter.com/ArbourVW/status/1340000124030779392,Mon Jun 11 17:37:48 +0000 2012,2020-12-18 18:25:00,0,0,repNone,,False,"La #Golf GTI , conçue avec style, espace et rapidité. Tout un véhicule. 💯 https://t.co/dz84GVWVb8"
https://twitter.com/ArbourVW/status/1339636477823602688,Mon Jun 11 17:37:48 +0000 2012,2020-12-17 18:20:00,0,0,repNone,,False,Quelles jantes choisir pour votre Volkswagen ? 🚘                                                                                                                           Discutez-en avec l'un de nos conseillers en concession. https://t.co/CaXs7UunGr
https://twitter.com/ArbourVW/status/1337461144051585024,Mon Jun 11 17:37:48 +0000 2012,2020-12-11 18:16:00,1,0,repNone,,False,À la recherche d'un véhicule d'occasion?                                                                                                                                                                         ➮ Rendez-vous au 2e étage. https://t.co/Gprf25F7L5
https://twitter.com/ArbourVW/status/1337098001341267969,Mon Jun 11 17:37:48 +0000 2012,2020-12-10 18:13:00,0,0,repNone,,False,Pour vous et pour votre voiture! ✔️ https://t.co/nsyUpzyeNs
https://twitter.com/ArbourVW/status/1334923170743267335,Mon Jun 11 17:37:48 +0000 2012,2020-12-04 18:11:00,1,0,repNone,,False,Pour une expérience de concessionnaire différente. 😉 #ArbourVW https://t.co/FXNXf2VqXy
https://twitter.com/ArbourVW/status/1334704623161135105,Mon Jun 11 17:37:48 +0000 2012,2020-12-04 03:42:34,0,3,repNone,,False,"RT @VWcanada: À l’occasion de la #SemaineNationaleDeLaSécuritéRoutière, obtenez de l’aide de tous bords tous côtés dans le #Tiguan de #Volk…"
https://twitter.com/ArbourVW/status/1334560028095885322,Mon Jun 11 17:37:48 +0000 2012,2020-12-03 18:08:00,0,0,repNone,,False,"À vos skis, prêts, partez!  🎿 #eGolf https://t.co/C2qboLflCg"
https://twitter.com/ArbourVW/status/1333835000492376064,Mon Jun 11 17:37:48 +0000 2012,2020-12-01 18:07:00,0,0,repNone,,False,Il n'est jamais trop tôt pour penser à votre liste de Noël. Rendez-vous à notre boutique #VW pour plein d'idées de cadeaux!  🎁 https://t.co/ZogoU2C2qy
https://twitter.com/ArbourVW/status/1333489725311758341,Mon Jun 11 17:37:48 +0000 2012,2020-11-30 19:15:00,0,0,repNone,,False,"Pour les mordus de #Volkswagen, le style compte, mais ce n'est pas tout. Ce qui entretient la passion, c'est l'expérience de conduite. 😉 #Volkswagen https://t.co/94ZshpYlg3"
https://twitter.com/ArbourVW/status/1332718644573466625,Mon Jun 11 17:37:48 +0000 2012,2020-11-28 16:11:00,0,0,repNone,,False,"Le Tiguan de VW est un VUS intermédiaire polyvalent offrant un look sportif, un habitacle spacieux et une 3e rangée de sièges pour toutes les aventures. 💯 Venez le découvrir! Planifiez votre essai routier dès aujourd'hui. https://t.co/5TVfsLBfPE"
https://twitter.com/ArbourVW/status/1331674263112192000,Mon Jun 11 17:37:48 +0000 2012,2020-11-25 19:01:00,0,0,repNone,,False,Arbour Volkswagen est votre destination numéro un pour l’achat d’un véhicule d’occasion certifié. Venez nous rencontrer dès aujourd’hui et permettez-nous de vous aider à trouver le véhicule #Volkswagen parfait pour vous et votre famille. 👨‍👩‍👧‍👦 https://t.co/5aWXakOArC
https://twitter.com/ArbourVW/status/1330948480567799809,Mon Jun 11 17:37:48 +0000 2012,2020-11-23 18:57:00,0,0,repNone,,False,"Chez Arbour, nous avons une panoplie de services spécialisés à vous offrir, dont des pièces et accessoires d’origine #VW; un centre de réparation de la carrosserie; un département d’entretien esthétique; un centre du pneu avec service d’entreposage et plus encore! https://t.co/3qYGomKs0w"
https://twitter.com/ArbourVW/status/1330221943295934464,Mon Jun 11 17:37:48 +0000 2012,2020-11-21 18:50:00,0,0,repNone,,False,Notez bien que la date limite pour le changement de vos pneus d'été aux pneus d'hiver est le 1 décembre.   Avez-vous pris votre rendez-vous? 🤔 https://t.co/jAnRx4whiZ
https://twitter.com/ArbourVW/status/1329881701280083970,Mon Jun 11 17:37:48 +0000 2012,2020-11-20 20:18:00,0,0,repNone,,False,"Le Volkswagen Atlas 2021 est un VUS à sept places qui offre de l’espace et de nombreuses caractéristiques axées sur le transport familial. Et grâce à une traction intégrale qui peut vous aider dans des conditions routières difficiles, votre famille peut aller n’importe où. https://t.co/g0YtzmjVil"
https://twitter.com/ArbourVW/status/1329133773183565824,Mon Jun 11 17:37:48 +0000 2012,2020-11-18 18:46:00,1,0,repNone,,False,Venez rencontrer nos conseillers en toute sécurité ou magasinez votre prochaine #Volkswagen en ligne! https://t.co/50N1WCSciD
https://twitter.com/ArbourVW/status/1328407990655799296,Mon Jun 11 17:37:48 +0000 2012,2020-11-16 18:42:00,0,0,repNone,,False,"L'été c'est cool, c'est vrai mais au fond, c'est l'automne la meilleure des saisons!  🍂 https://t.co/z95i3wdj6d"
https://twitter.com/ArbourVW/status/1327274773785702400,Mon Jun 11 17:37:48 +0000 2012,2020-11-13 15:39:00,0,0,repNone,,False,C'est toujours avec un sourire chez Arbour Volkswagen! 😄    #BonneJournée                                                                                                                                                             🙋🏽‍♂️: Ray Milord https://t.co/r5tpXWblAl
https://twitter.com/ArbourVW/status/1327023057127567364,Mon Jun 11 17:37:48 +0000 2012,2020-11-12 22:58:46,0,5,repNone,,False,RT @VWcanada: Le froid se pointe le bout du nez! C’est le temps d’ajuster votre look – en commençant par vos pneus d’hiver! Rendez-vous che…
https://twitter.com/ArbourVW/status/1326619455959539712,Mon Jun 11 17:37:48 +0000 2012,2020-11-11 20:15:00,0,0,repNone,,False,"Le Volkswagen Taos 2022 est officiellement un VUS compact comme le Volkswagen Tiguan, mais il est plus petit et sera plus abordable. https://t.co/5geugbRaoP"
https://twitter.com/ArbourVW/status/1325870017334796288,Mon Jun 11 17:37:48 +0000 2012,2020-11-09 18:37:00,0,0,repNone,,False,"Vous n'êtes pas qu'un client, vous faites partie de la famille. 🥰 Photo cred: @11slady     #ArbourVW #UneAffaireDeFamille #Volkswagen #Repost"
https://twitter.com/ArbourVW/status/1325861209338503171,Mon Jun 11 17:37:48 +0000 2012,2020-11-09 18:02:00,0,0,repNone,,False,La saison du changement de pneu bat son plein. On en profite pour souligner le travail de nos équipes! 👌  Arbour VW favorise l’inclusion des femmes dans tous les domaines! 😉 https://t.co/fuDUPYgevv
https://twitter.com/ArbourVW/status/1324843784140718088,Mon Jun 11 17:37:48 +0000 2012,2020-11-06 22:39:07,0,7,repNone,,False,RT @VWcanada: Introducing the all-new 2022 #GolfR: the most powerful Golf R ever. With 315hp and 4MOTION All-Wheel Drive with rear axle tor…
https://twitter.com/ArbourVW/status/1324781595379707904,Mon Jun 11 17:37:48 +0000 2012,2020-11-06 18:32:00,0,0,repNone,,False,"En parcourant les routes, voyez les couleurs flamboyantes qui font partie des enchantements de l'automne.  🍂  #BonVendredi https://t.co/3HtPSUln2E"
https://twitter.com/ArbourVW/status/1324056317976334338,Mon Jun 11 17:37:48 +0000 2012,2020-11-04 18:30:00,0,0,repNone,,False,"Avec les fonctionnalités de VW, vous ne voudrez peut-être jamais sortir de votre véhicule. 😉 https://t.co/d17ee94eCe"
https://twitter.com/ArbourVW/status/1323330030609571841,Mon Jun 11 17:37:48 +0000 2012,2020-11-02 18:24:00,0,0,repNone,,False,Faites-vous remarquer! 🧡 https://t.co/MNlvzyLRlr
https://twitter.com/ArbourVW/status/1322523969677795328,Mon Jun 11 17:37:48 +0000 2012,2020-10-31 13:01:00,0,0,repNone,,False,On vous souhaite une belle journée d'Halloween! 🎃 https://t.co/eHPAxx4nhz
https://twitter.com/ArbourVW/status/1322267027776720897,Mon Jun 11 17:37:48 +0000 2012,2020-10-30 20:00:00,0,0,repNone,,False,"La VW Golf GTI est cool, élégante et agréable à conduire. 😎                                                                                                             Venez faire un essai routier! https://t.co/LHikY70Q1B"
https://twitter.com/ArbourVW/status/1321224657777864706,Mon Jun 11 17:37:48 +0000 2012,2020-10-27 22:58:00,0,0,repNone,,False,Vous êtes fiers de conduire une #Volkswagen?                                                                                            📸:shan_photographie https://t.co/UppkRGYTyB
https://twitter.com/ArbourVW/status/1321181470866788352,Mon Jun 11 17:37:48 +0000 2012,2020-10-27 20:06:23,1,0,repNone,,False,https://t.co/qKolYiA5k4
https://twitter.com/ArbourVW/status/1320757081574535168,Mon Jun 11 17:37:48 +0000 2012,2020-10-26 16:00:01,0,0,repNone,,False,"La toute nouvelle VW ID.4 2021 arrivera l’été prochain. Il s’agit d’un tout nouveau véhicule 100% électrique. La ID.4 promet de combiner polyvalence, puissance, performance et efficacité comme très peu de véhicules électriques sont en mesure de le faire à l’heure actuelle. https://t.co/II9ly8OJCb"
https://twitter.com/ArbourVW/status/1320000843769401344,Mon Jun 11 17:37:48 +0000 2012,2020-10-24 13:55:00,0,0,repNone,,False,Les #Volkswagen sont souvent considérées comme étant plus amusantes à conduire! 😁   Êtes-vous d'accord? https://t.co/JL7pscOobi
https://twitter.com/ArbourVW/status/1319728297983438851,Mon Jun 11 17:37:48 +0000 2012,2020-10-23 19:52:00,0,0,repNone,,False,"Un étage c'est bien, mais 2 c'est mieux! ✌🏼 https://t.co/EyloeG2s1t"
https://twitter.com/ArbourVW/status/1318217090327670784,Mon Jun 11 17:37:48 +0000 2012,2020-10-19 15:47:00,0,0,repNone,,False,"Le tout nouvel Atlas Cross Sport est conçu pour être amusant à conduire, performant et bien équipé à l'intérieur comme à l'extérieur. https://t.co/RES4Sgcj7M"
https://twitter.com/ArbourVW/status/1317129675085406210,Mon Jun 11 17:37:48 +0000 2012,2020-10-16 15:46:00,0,0,repNone,,False,Ce sentiment de vendredi! 😎 https://t.co/EzMvUm0mm6
https://twitter.com/ArbourVW/status/1316042008415350784,Mon Jun 11 17:37:48 +0000 2012,2020-10-13 15:44:00,0,0,repNone,,False,La saison froide approche. 🥶 Prévoyez le coup et planifiez votre rendez-vous pour votre changement de pneus dès aujourd'hui. https://t.co/ssIahT5HMe
https://twitter.com/ArbourVW/status/1315648666204606465,Mon Jun 11 17:37:48 +0000 2012,2020-10-12 13:41:00,0,0,repNone,,False,À chacun sa couleur! 💛🧡 https://t.co/H2vjbicmLV
https://twitter.com/ArbourVW/status/1314685108176261120,Mon Jun 11 17:37:48 +0000 2012,2020-10-09 21:52:10,0,3,repNone,,False,RT @VWcanada: On investit dans l’électromobilité pour créer un avenir #ÉlectriquePourTous  Découvrez nos objectifs en matière d’électromobi…
https://twitter.com/ArbourVW/status/1314597741859934210,Mon Jun 11 17:37:48 +0000 2012,2020-10-09 16:05:00,0,0,repNone,,False,"C’est l’événement Volksfest. Peu importe le format de votre famille, on a le VWUS qui lui convient  Financement à partir de 0% jusqu'à 72 mois sur les modèles sélectionnés.  L'entretien gratuit pendant 3 ans ou 45 000 KM.  Rendez-vous en concession pour plus d'informations. https://t.co/hARBnNN0AZ"
https://twitter.com/ArbourVW/status/1313579783805050880,Mon Jun 11 17:37:48 +0000 2012,2020-10-06 20:40:00,0,0,repNone,,False,Un centre de service à la hauteur de vos attentes. 👌🏽                                                                                                                                        Contactez-nous pour planifier votre prochain rendez-vous. https://t.co/SFqQXa43XO
https://twitter.com/ArbourVW/status/1313246839886340098,Mon Jun 11 17:37:48 +0000 2012,2020-10-05 22:37:00,0,0,repNone,,False,"Si vous êtes à la recherche d'un véhicule d'occasion, vous êtes au bon endroit!  🚘 #ArbourVW https://t.co/SdHmwxYfCh"
https://twitter.com/ArbourVW/status/1312159173178585089,Mon Jun 11 17:37:48 +0000 2012,2020-10-02 22:35:00,0,0,repNone,,False,Cette magnifique e-Golf est tout simplement électrisante! ⚡️ https://t.co/7L6Iy7Z1YM
https://twitter.com/ArbourVW/status/1312107906196623361,Mon Jun 11 17:37:48 +0000 2012,2020-10-02 19:11:17,0,3,repNone,,False,"RT @VWcanada: 7 seats, 3 rows, 1st place. The #VWAtlas is named the #2020FamilyCarOfTheYear by @carsdotcom : https://t.co/fRam1QtcSe  Check…"
https://twitter.com/ArbourVW/status/1311312846492491778,Mon Jun 11 17:37:48 +0000 2012,2020-09-30 14:32:00,0,0,repNone,,False,"La VW Golf GTI 2020 est cool, élégante et agréable à conduire. Elle est également connue sous le nom de ""hot hatch"" grâce à ses performances étonnantes. https://t.co/jfAnvQG127"
https://twitter.com/ArbourVW/status/1310586812331560960,Mon Jun 11 17:37:48 +0000 2012,2020-09-28 14:27:00,0,0,repNone,,False,La saison de pneu est déjà d'actualité! 😬 🌨 https://t.co/VoCrI5fCSl
https://twitter.com/ArbourVW/status/1309861533283790849,Mon Jun 11 17:37:48 +0000 2012,2020-09-26 14:25:00,0,0,repNone,,False,Un alignement de #VW parfait! 🥰 https://t.co/cdJRNf2SY4
https://twitter.com/ArbourVW/status/1309643929382461440,Mon Jun 11 17:37:48 +0000 2012,2020-09-26 00:00:19,0,2,repNone,,False,"RT @VWcanada: Ce vendredi 25 septembre, Pierre Boutin discute du tout nouveau tout électrique ID.4 et de la mission de VW : développer l’él…"
https://twitter.com/ArbourVW/status/1309497383865155587,Mon Jun 11 17:37:48 +0000 2012,2020-09-25 14:18:00,0,0,repNone,,False,Ici on respecte toujours les consignes et mesures de sécurité. 😷 https://t.co/ni2bwpgzXz
https://twitter.com/ArbourVW/status/1309209805291220994,Mon Jun 11 17:37:48 +0000 2012,2020-09-24 19:15:16,0,4,repNone,,False,RT @VWcanada: Entrez dans l’avenir avec Volkswagen et découvrez les nouvelles technologies que nous avons à vous offrir #ÉlectriquePourTous…
https://twitter.com/ArbourVW/status/1308817654942035968,Mon Jun 11 17:37:48 +0000 2012,2020-09-23 17:17:00,0,0,repNone,,False,"Un forfait esthétique de luxe, ça vous dit? ✨ https://t.co/zmUYl0Iu9l"
https://twitter.com/ArbourVW/status/1308481744719491072,Mon Jun 11 17:37:48 +0000 2012,2020-09-22 19:02:13,0,2,repNone,,False,"RT @VWcanada: Avec assez d’espace pour profiter à fond du #TempsDesPommes, l’Atlas 2021 est mûr pour une sortie au verger en famille. #Mang…"
https://twitter.com/ArbourVW/status/1308408710264311808,Mon Jun 11 17:37:48 +0000 2012,2020-09-22 14:12:00,0,0,repNone,,False,"À l'arrivée de l'automne, on se magasine une nouvelle voiture?  🍂 https://t.co/XfISH1IxBi"
https://twitter.com/ArbourVW/status/1307321043288305664,Mon Jun 11 17:37:48 +0000 2012,2020-09-19 14:10:00,0,0,repNone,,False,N'est-ce pas une belle vue?  💙 https://t.co/cjdlUKInUi
https://twitter.com/ArbourVW/status/1306692629120405508,Mon Jun 11 17:37:48 +0000 2012,2020-09-17 20:32:54,0,4,repNone,,False,"RT @VWcanada: Ready, set, Taos. A new SUVW is on the horizon. / À vos marques, prêts, Taos! Un nouveau VWUS se pointe à l’horizon.   #VWCan…"
https://twitter.com/ArbourVW/status/1306232873419116544,Mon Jun 11 17:37:48 +0000 2012,2020-09-16 14:06:00,0,0,repNone,,False,Saviez-vous que le R de #Golf R est l'abréviation de Racing? 🏁 https://t.co/eNDRCkru9n
https://twitter.com/ArbourVW/status/1305506839346384898,Mon Jun 11 17:37:48 +0000 2012,2020-09-14 14:01:00,0,0,repNone,,False,"Bienvenue chez nous!   Nous sommes ouverts jusqu'à 21h aujourd'hui, au plaisir de vous voir! 😀 https://t.co/hzSTGBDqxZ"
https://twitter.com/ArbourVW/status/1304478060314533892,Mon Jun 11 17:37:48 +0000 2012,2020-09-11 17:53:00,0,0,repNone,,False,"Êtes-vous aussi excité que nous de voir le nouveau modèle entièrement électrique, le Volkswagen id.4 2021? 🤩 https://t.co/NEbWPyRf6s"
https://twitter.com/ArbourVW/status/1303692131416993792,Mon Jun 11 17:37:48 +0000 2012,2020-09-09 13:50:00,0,0,repNone,,False,"Nous avons une panoplie de services spécialisés à vous offrir, dont des pièces et accessoires d’origine Volkswagen, un centre de réparation de la carrosserie, un département d’entretien esthétique, un centre du pneu avec service d’entreposage et plus encore! https://t.co/7Dbl2iKAaQ"
https://twitter.com/ArbourVW/status/1302966600950136833,Mon Jun 11 17:37:48 +0000 2012,2020-09-07 13:47:00,0,0,repNone,,False,"La saison des cotons ouatés , des doudounes et des vestes est maintenant arrivée et nous sommes équipés, venez découvrir notre collection VW! 🧥 https://t.co/IGZWZgOFxV"
https://twitter.com/ArbourVW/status/1302241825042776064,Mon Jun 11 17:37:48 +0000 2012,2020-09-05 13:47:00,0,0,repNone,,False,L'équipe Arbour VW vous souhaite un bon samedi! 💙 https://t.co/DJ6elRoz90
https://twitter.com/ArbourVW/status/1300430640786018306,Mon Jun 11 17:37:48 +0000 2012,2020-08-31 13:50:00,0,0,repNone,,False,Toute l'équipe se joint à nous pour souhaiter une bonne rentrée scolaire à tous les étudiants! 📝 https://t.co/q0bSn7FiS6
https://twitter.com/ArbourVW/status/1298724397881196544,Mon Jun 11 17:37:48 +0000 2012,2020-08-26 20:50:00,0,0,repNone,,False,C'est la journée mondiale du chien! 🐶  Montrez-nous la dernière photo que vous avez dans votre téléphone. 👇🏼  #WorldDogDay #DogDay https://t.co/xiqo6luKD3
https://twitter.com/ArbourVW/status/1297943862598656002,Mon Jun 11 17:37:48 +0000 2012,2020-08-24 17:08:26,0,0,repNone,,False,Vous pouvez maintenant magasiner dans le confort de votre foyer avec Arbour Volkswagen. ❤️  Tout commence ici 👉🏻 https://t.co/PV3QFAnMEb https://t.co/ofovWFXBjP
https://twitter.com/ArbourVW/status/1297878322865635331,Mon Jun 11 17:37:48 +0000 2012,2020-08-24 12:48:00,0,0,repNone,,False,Qu'est-ce que vous préférez de votre #VW quand vous prenez le volant? 🔎 https://t.co/aNMh0gdThr
https://twitter.com/ArbourVW/status/1297636479162650624,Mon Jun 11 17:37:48 +0000 2012,2020-08-23 20:47:00,0,0,repNone,,False,Parce que personne ne connaît votre Volkswagen mieux que nos experts. ✅ https://t.co/VQ7df24RoC
https://twitter.com/ArbourVW/status/1296971849838891008,Mon Jun 11 17:37:48 +0000 2012,2020-08-22 00:46:00,0,0,repNone,,False,Dernière chance pour cette 2019 VW Golf R 2.0T 4MOTION. 🔥  #GolfR #ArbourVW https://t.co/wmBc2vDgQJ
https://twitter.com/ArbourVW/status/1296548812404805633,Mon Jun 11 17:37:48 +0000 2012,2020-08-20 20:45:00,0,0,repNone,,False,Une occasion à ne pas manquer! 👌 https://t.co/0ESmFo0pJk
https://twitter.com/ArbourVW/status/1296186172796882944,Mon Jun 11 17:37:48 +0000 2012,2020-08-19 20:44:00,0,0,repNone,,False,Un concessionnaire moderne sur 2 étages avec un inventaire complet &amp; un service comme si vous étiez de la famille. C'est ça magasiner chez Arbour Volkswagen. 💯 https://t.co/fZRAzeYSu1
https://twitter.com/ArbourVW/status/1295521040022425602,Mon Jun 11 17:37:48 +0000 2012,2020-08-18 00:41:00,0,0,repNone,,False,On veut voir VOS plus belles photos de couchers du soleil. 👇🏼 https://t.co/FkZvlzFU70
https://twitter.com/ArbourVW/status/1294735614676475909,Mon Jun 11 17:37:48 +0000 2012,2020-08-15 20:40:00,0,0,repNone,,False,Vous hésitez encore à faire le grand saut à l'électrique? 🤔  Venez rencontrer nos conseillers dès aujourd'hui. Ils sauront vous guider pour faire le bon choix! 💚  #EGolf #VWGolf #Electric https://t.co/pNyZTBd41C
https://twitter.com/ArbourVW/status/1293889539925094403,Mon Jun 11 17:37:48 +0000 2012,2020-08-13 12:38:00,0,0,repNone,,False,Un classique qui ne se démodera jamais. ✨  #ArbourVW #GTI #TBT https://t.co/xokcoClCDd
https://twitter.com/ArbourVW/status/1292847171465863169,Mon Jun 11 17:37:48 +0000 2012,2020-08-10 15:36:00,0,0,repNone,,False,Roulez de manière encore plus sécuritaire et stylée grâce à notre Tiguan 2020 et ses judicieuses caractéristiques d’aide à la conduite. 💯  #Tiguan2020 #ArbourVW https://t.co/EktqwHu2oD
https://twitter.com/ArbourVW/status/1291714457710686209,Mon Jun 11 17:37:48 +0000 2012,2020-08-07 12:35:00,0,0,repNone,,False,Un peu de couleur pour bien partir la journée! ❤️💛💚  #ArbourVW #VW #VolksCanada #Mornings #Laval #Cars #EGolf #VW #Rainbow https://t.co/KAjUNZ9a8T
https://twitter.com/ArbourVW/status/1291355043619377154,Mon Jun 11 17:37:48 +0000 2012,2020-08-06 12:46:49,0,6,repNone,,True,RT @VWcanada: ⚽️💙 https://t.co/UIEdfTFa0y
https://twitter.com/ArbourVW/status/1290747586714808323,Mon Jun 11 17:37:48 +0000 2012,2020-08-04 20:33:00,0,0,repNone,,False,"Si vous avez déjà vu les lettres #4MOTION à l’arrière d’un produit VW, vous avez certainement déduit que cette appellation renvoyait au système à quatre roues motrices du constructeur. ✅  RDV dans notre section actualité du site web pour apprendre tout ce que vous devez savoir. https://t.co/3wZMXho3Cf"
https://twitter.com/ArbourVW/status/1289704714813108224,Mon Jun 11 17:37:48 +0000 2012,2020-08-01 23:29:00,0,0,repNone,,False,"Chez nous, vous trouverez un inventaire complet de véhicules neufs Volkswagen pour tous les besoins et à prix compétitif. ❤️  Un seul arrêt suffit. 📍  #ArbourVW #VWLaval #Laval https://t.co/GdmAfhHf2h"
