id,Account Created At(same for all rows),status created_at,Fav_cont,retweeted_count,reply_to_status,reply_to_screen,quote,text
https://twitter.com/AristocratBags/status/1081418182504542214,Thu Dec 22 08:14:44 +0000 2016,2019-01-05 05:12:41,9,2,repNone,,False,Aristocrat Grid is a colourful and stylish backpack that makes you look effortlessly cool! Add a dash of style to your backpack game with Aristocrat Grid! Shop now https://t.co/xAvIEILcrL #Backpack #AristocratBags https://t.co/Yd6Ln5F76S
https://twitter.com/AristocratBags/status/1080786519445594113,Thu Dec 22 08:14:44 +0000 2016,2019-01-03 11:22:40,4,0,repNone,,False,"The Samurai 360° is not just premium and stylish, but also offers a smooth traveling experience. Make your travel comfortable with Samurai! Shop now https://t.co/jwhbuWaUAs https://t.co/qnpaR2kmpi"
https://twitter.com/AristocratBags/status/1079940169178980352,Thu Dec 22 08:14:44 +0000 2016,2019-01-01 03:19:35,5,0,repNone,,False,Get ready to unpack your dreams in the year 2019.#NewYears2019 https://t.co/rZGsG0dJzi
https://twitter.com/AristocratBags/status/1079673425562456064,Thu Dec 22 08:14:44 +0000 2016,2018-12-31 09:39:38,120,21,repNone,,False,Warmest congratulations on the birth of your sweet baby girl! @ImRo45 May this rewarding responsibility bring an abundance of joy and prosperity in your life.
https://twitter.com/AristocratBags/status/1078890795439132672,Thu Dec 22 08:14:44 +0000 2016,2018-12-29 05:49:45,5,1,repNone,,False,"Aristocrat Estate offers added protection to your luggage with its unique anti-theft zipper and fixed combination lock. Travel care-free, only with Aristocrat! #UnpackYourDreams https://t.co/FSgcdYLKJP"
https://twitter.com/AristocratBags/status/1078252316371881985,Thu Dec 22 08:14:44 +0000 2016,2018-12-27 11:32:39,6,0,repNone,,False,The Maze 360° ensures effortless travel without having to drag your heavy luggage thanks to its swift manoeuvrability. Shop now https://t.co/wpwQm5FkcC #UnpackYourDreams https://t.co/VqLGowKyOA
https://twitter.com/AristocratBags/status/1077828861948116992,Thu Dec 22 08:14:44 +0000 2016,2018-12-26 07:30:00,5,0,repNone,,False,Enjoy a thrilling adventure experience with extremely comfortable and spacious backpacks by Aristocrat! #UnpackYourDreams #WednesdayWisdom https://t.co/X58j6KmIey
https://twitter.com/AristocratBags/status/1077421175301562370,Thu Dec 22 08:14:44 +0000 2016,2018-12-25 04:30:00,6,0,repNone,,False,Don’t be limited by the size of your bag when it comes to buying gifts for your family. Experience spacious bags with Aristocrat. #UnpackYourDreams #MerryChristmas https://t.co/5jZKw0K492
https://twitter.com/AristocratBags/status/1076343635157762053,Thu Dec 22 08:14:44 +0000 2016,2018-12-22 05:08:14,7,0,repNone,,False,"Strong, stable &amp; stylish, these are just some of the pros of having an Aristocrat Urban Pro Backpack! Buy now: https://t.co/xlqz7q3WtM  #UnpackYourDreams https://t.co/ncpzKOxHh8"
https://twitter.com/AristocratBags/status/1074543993789149184,Thu Dec 22 08:14:44 +0000 2016,2018-12-17 05:57:06,6,0,repNone,,False,Aristocrat backpacks have enough space to store your bottles so that you stay hydrated while chasing your dreams. Visit https://t.co/hpIoMuTbZH to shop now #UnpackYourDreams https://t.co/bH4TrQNaYq
https://twitter.com/AristocratBags/status/1073441253612695552,Thu Dec 22 08:14:44 +0000 2016,2018-12-14 04:55:13,9,0,repNone,,False,"Stylish, spacious and durable, the Samurai turns heads and tops every test! Visit https://t.co/jwhbuWaUAs to shop now. #UnpackYourDreams #PerthTest #INDvAUS #Stylish #AristocratBags https://t.co/WhhMKW7Gtl"
https://twitter.com/AristocratBags/status/1072820039613591552,Thu Dec 22 08:14:44 +0000 2016,2018-12-12 11:46:44,2,0,repNone,,False,"Take the stress off your back with this stylish &amp; comfy, well padded school/college backpack. Visit https://t.co/wbxkaxpf63 to shop now. #UnpackYourDreams https://t.co/647DgPUaMC"
https://twitter.com/AristocratBags/status/1072355259283136512,Thu Dec 22 08:14:44 +0000 2016,2018-12-11 04:59:51,5,0,repNone,,False,It’s a call from the mountains. Celebrate International Mountain Day with a multi-functional rucksack by Aristocrat. #UnpackYourDreams #InternationalMountainDay https://t.co/sru6rkPj9w
https://twitter.com/AristocratBags/status/1072091055229530112,Thu Dec 22 08:14:44 +0000 2016,2018-12-10 11:30:00,4,0,repNone,,False,"Wandering lets you escape the mundane, but travelling lets you do it while learning lessons along the way. #UnpackYourDreams https://t.co/fxu3M5Po6Y"
https://twitter.com/AristocratBags/status/1072057929182924801,Thu Dec 22 08:14:44 +0000 2016,2018-12-10 09:18:22,21,7,repNone,,False,"With 6 wickets under his belt, @ashwinravi99 - The Spin Doctor, helped team India secure a maiden test win in the series. #UnpackYourDreams #INDvAUS #TeamIndia #AdelaideTest #Ashwin"
https://twitter.com/AristocratBags/status/1071255705288470528,Thu Dec 22 08:14:44 +0000 2016,2018-12-08 04:10:37,4,0,repNone,,False,Make your travel effortless with the 360° maneuverability of the Maze Trolley Bag.  Visit https://t.co/wpwQm5nIO2 to shop now. #UnpackYourDreams https://t.co/1yQAbveBHZ
https://twitter.com/AristocratBags/status/1070547696342192128,Thu Dec 22 08:14:44 +0000 2016,2018-12-06 05:17:15,70,4,repNone,,False,The dynamic duo is all set and ready to take on the Aussies at Adelaide. Don’t forget to tune in to the excitement! #UnpackYourDreams #AUSvIND #DownUnder #Adelaide #RohitSharma #AshwinRavichandran https://t.co/Opgg0DI6U2
https://twitter.com/AristocratBags/status/1068111677231693824,Thu Dec 22 08:14:44 +0000 2016,2018-11-29 11:57:23,12,0,repNone,,False,Believe in the power of your dreams every step of the way and get ready to be a winner. #UnpackYourDreams #AristocratBags https://t.co/B2h0HWJ8om
https://twitter.com/AristocratBags/status/1067387561344028672,Thu Dec 22 08:14:44 +0000 2016,2018-11-27 12:00:00,9,0,repNone,,False,A half-hearted effort is just not enough to make you realise your dreams. Always work hard towards your goals. #UnpackYourDreams #AristocratBags https://t.co/m4p5CpmzG6
https://twitter.com/AristocratBags/status/1066594837695250432,Thu Dec 22 08:14:44 +0000 2016,2018-11-25 07:30:00,75,8,repNone,,False,"This #Sunday, grab a bag of popcorn and watch out for the #hitman, @ImRo45 taking on the Aussies! Comment below with your match predictions. #UnpackYourDreams #AusVsInd #TeamIndia #Australia #RohitSharma #AristocratBags https://t.co/UOVsAMVLY5"
https://twitter.com/AristocratBags/status/1065869629325639680,Thu Dec 22 08:14:44 +0000 2016,2018-11-23 07:28:17,72,6,repNone,,False,This series is already getting exciting. How much do you think will @ImRo45 score? Let us know in the comments. #UnpackYourDreams #AUSvIND #RohitSharma #Hitman #AristocratBags https://t.co/15SnLw2ZHj
https://twitter.com/AristocratBags/status/1065145285947445249,Thu Dec 22 08:14:44 +0000 2016,2018-11-21 07:30:00,147,26,repNone,,False,The hitman @ImRo45 is all set for the upcoming series in Australia. How many runs will he score today? Comment below with your predictions. #UnpackYourDreams #INDvsAUS #RohitSharma #Hitman #India #Australia #AristocratBags https://t.co/WJXXkzT4Fm
https://twitter.com/AristocratBags/status/1064474690352222208,Thu Dec 22 08:14:44 +0000 2016,2018-11-19 11:05:17,7,0,repNone,,False,The Aristocrat Maze bag is made with durable poly-carbonate and is scratch-resistant. Buy now: https://t.co/wpwQm5FkcC #AristocratBags #UnpackYourDreams https://t.co/tlsAzdszV7
https://twitter.com/AristocratBags/status/1062959319875026944,Thu Dec 22 08:14:44 +0000 2016,2018-11-15 06:43:45,5,0,repNone,,False,"With an overwhelming response to our #MyLuggageProblems contest, we have chosen not 1 but 3 lucky winners! Congratulations to the winners. Kindly message us your details. https://t.co/drhMjKmZA8"
https://twitter.com/AristocratBags/status/1062566871914954753,Thu Dec 22 08:14:44 +0000 2016,2018-11-14 04:44:18,11,1,repNone,,False,"The road to success begins with a dream. This #ChildrensDay, Aristocrat urges you to believe in the power of your dreams. #UnpackYourDreams #HappyChildrensDay https://t.co/1HvxqDUX4d"
https://twitter.com/AristocratBags/status/1060033042419458049,Thu Dec 22 08:14:44 +0000 2016,2018-11-07 04:55:46,15,2,repNone,,False,May the festival of lights #UnpackYourDreams and bring happiness into your life. #HappyDiwali https://t.co/eKCAypOvbv
https://twitter.com/AristocratBags/status/1059826437421654016,Thu Dec 22 08:14:44 +0000 2016,2018-11-06 15:14:47,135,17,repNone,,False,"With another amazing century, @ImRo45 has unpacked his dreams and is now the leading Indian T20 international scorer. #UnpackYourDreams #RohitSharma #HITMAN #INDvsWI #T20 https://t.co/5HAgXtSO7s"
https://twitter.com/AristocratBags/status/1059060190366945281,Thu Dec 22 08:14:44 +0000 2016,2018-11-04 12:30:00,220,19,repNone,,False,.@ImRo45 ready to lead Team India in the T20s against the West Indies. Good luck to the Men in Blue and Captain Hitman! #UnpackYourDreams #RohitSharma #Hitman #T20 #INDvsWI https://t.co/8NosGdjakG
https://twitter.com/AristocratBags/status/1057966656285077505,Thu Dec 22 08:14:44 +0000 2016,2018-11-01 12:04:41,41,6,repNone,,False,Team India packs away the West Indies team with a series win. Congratulations @ImRo45 for a knockout performance throughout the series. #UnpackYourDreams #RohitSharma #Hitman #INDvWI
https://twitter.com/AristocratBags/status/1057877957132324864,Thu Dec 22 08:14:44 +0000 2016,2018-11-01 06:12:14,22,5,repNone,,False,"No matter what the game is, @ImRo45 is always up for a long innings! With all-round corner guards, Aristocrat bags are designed specifically to resist any damages and are built to last a lifetime. #AsReliableAsRohit #UnpackYourDreams #RohitSharma #Htiman #INDvWI #AristocratBags https://t.co/7zH8G8PAS4"
https://twitter.com/AristocratBags/status/1057493890205401096,Thu Dec 22 08:14:44 +0000 2016,2018-10-31 04:46:05,33,4,repNone,,False,"Be it a grassy pitch or a flat track, @ImRo45 knows how to give a winning performance. Whatever be the surface, you can drag your Aristocrat bags with ease thanks to wheel guards that ensure no damages. #AsReliableAsRohit #UnpackYourDreams #RohitSharma #Hitman #AristocratBags https://t.co/E0cYRBQwaq"
https://twitter.com/AristocratBags/status/1057255821619322880,Thu Dec 22 08:14:44 +0000 2016,2018-10-30 13:00:05,36,5,repNone,,False,"A centurion in all three formats, @ImRo45 is no stranger to meeting international expectations. Made with 1680D fabric, you can rest assured that wherever you go, Aristocrat bags are #AsReliableAsRohit #UnpackYourDreams #RohitSharma #Hitman #AristocratBags https://t.co/IBbkqNYvy2"
https://twitter.com/AristocratBags/status/1056858326879866881,Thu Dec 22 08:14:44 +0000 2016,2018-10-29 10:40:35,2505,118,repNone,,False,"A stylish and solid knock, @ImRo45 unpacks his 21st ODI Century! How many more runs will he unpack in today’s match? Tell us your predictions! #INDvWI #UnpackYourDreams #Hitman #RohitSharma https://t.co/lzkOxz9kdl"
https://twitter.com/AristocratBags/status/1056442192087023616,Thu Dec 22 08:14:44 +0000 2016,2018-10-28 07:07:00,58,12,repNone,,False,"When it comes to luggage, @ImRo45 knows that he can only count on Aristocrat Bags to keep his belongings safe. Put an end to damaged luggage with bags that are #AsReliableAsRohit #RohitSharma #Hitman #Luggage #AristocratBags https://t.co/eLz9KnHmCK"
https://twitter.com/AristocratBags/status/1055443862053941248,Thu Dec 22 08:14:44 +0000 2016,2018-10-25 13:00:00,22,6,repNone,,False,"Thank you for the overwhelming response, we have heard everyone’s Luggage Problems! Winners will be announced soon! #MyLuggageProblems"
https://twitter.com/AristocratBags/status/1055428834856706048,Thu Dec 22 08:14:44 +0000 2016,2018-10-25 12:00:17,10,4,repNone,,False,Just one hour left! The #contest ends soon. Send us your entries using #MyLuggageProblems and stand a chance to win an Aristocrat backpack. Remember to tag 3 friends and RT all contest posts. Visit https://t.co/7kEY6JnzDH
https://twitter.com/AristocratBags/status/1055068859374419968,Thu Dec 22 08:14:44 +0000 2016,2018-10-24 12:09:52,8,6,repNone,,False,"Follow us, RT and tell us your luggage problems using #MyLuggageProblems to get a chance to win an Aristocrat backpack! Visit https://t.co/7kEY6JnzDH"
https://twitter.com/AristocratBags/status/1055028168443215872,Thu Dec 22 08:14:44 +0000 2016,2018-10-24 09:28:11,5,3,repNone,,False,Spoiled backpacks? Back strain? Less space? Tell us about it! Share your luggage problems with #MyLuggageProblems and win an Aristocrat Backpack ! Visit https://t.co/7kEY6JnzDH
https://twitter.com/AristocratBags/status/1054979247322869762,Thu Dec 22 08:14:44 +0000 2016,2018-10-24 06:13:47,18,16,repNone,,False,#ContestAlert : Have a bad luggage story to share? Here’s your chance to win an Aristocrat Backpack. Tell us your ruined luggage story using #MyLuggageProblems and get a chance to win! Visit https://t.co/7kEY6JnzDH
https://twitter.com/AristocratBags/status/1054726010183270403,Thu Dec 22 08:14:44 +0000 2016,2018-10-23 13:27:31,34,12,repNone,,False,Ever faced a problem with your luggage that ruined your holiday? Here’s a chance for you to win a cool Aristocrat backpack. Share your damaged luggage story with us using #MyLuggageProblems and get a chance to win. Visit https://t.co/7kEY6JnzDH https://t.co/JhB1DzqrkK
https://twitter.com/AristocratBags/status/1054021884436611072,Thu Dec 22 08:14:44 +0000 2016,2018-10-21 14:49:34,165,79,repNone,,False,.@ImRo45 delivers a knockout performance with a century! Takes the Windies by storm. How many RTs for that incredible innings from #RohitSharma?  #UnpackYourDreams #IndvsWI
https://twitter.com/AristocratBags/status/1053989931322753024,Thu Dec 22 08:14:44 +0000 2016,2018-10-21 12:42:36,39,30,repNone,,False,"Travel is all about stories. Both good &amp; bad. If you’ve ever had a bad experience with your luggage while traveling, we’d like to know. Tell us your ruined-luggage stories using #MyLuggageProblems and get a chance to win a cool Aristocrat backpack. Visit https://t.co/h8XAqU9J1V https://t.co/t6K5Fe6HlA"
https://twitter.com/AristocratBags/status/1053914614205898757,Thu Dec 22 08:14:44 +0000 2016,2018-10-21 07:43:19,48,7,repNone,,False,The Hitman is ready to take on West Indies. What are your predictions? #UnpackYourDreams  #RohitSharma https://t.co/FpTqyA4uO7
https://twitter.com/AristocratBags/status/1053253115611435008,Thu Dec 22 08:14:44 +0000 2016,2018-10-19 11:54:45,11,0,repNone,,False,Travel the world to Explore yourself! #UnpackYourDreams https://t.co/MQgvVEXnFi
https://twitter.com/AristocratBags/status/1051344348300890118,Thu Dec 22 08:14:44 +0000 2016,2018-10-14 05:30:00,1,0,repNone,,False,"Don’t bear the weight of regret. Travel light, live free and #UnpackYourDreams! https://t.co/2KvqudrVy3"
https://twitter.com/AristocratBags/status/1050613486441529345,Thu Dec 22 08:14:44 +0000 2016,2018-10-12 05:05:49,3,0,repNone,,False,"Built for long innings, Maze comes with a 5 year warranty that is valid internationally. Visit https://t.co/wpwQm5nIO2 to shop now. #UnpackYourDreams https://t.co/xZmCyTKAdm"
https://twitter.com/AristocratBags/status/1049162471204782082,Thu Dec 22 08:14:44 +0000 2016,2018-10-08 05:00:00,6,1,repNone,,False,Don’t let anything stand between you and your goals! Seize each day and #UnpackYourDreams! #MondayMotivation https://t.co/S7smzu6NNG
https://twitter.com/AristocratBags/status/1048806771102343168,Thu Dec 22 08:14:44 +0000 2016,2018-10-07 05:26:34,3,0,repNone,,False,Your dreams await! Are you a thinker or a doer? #UnpackYourDreams https://t.co/ChVXHlswx4
https://twitter.com/AristocratBags/status/1048158828100034560,Thu Dec 22 08:14:44 +0000 2016,2018-10-05 10:31:53,10,2,repNone,,False,India take on West Indies in their first test match of the tour! How many wickets will @ashwinravi99 unpack before the game is over? Let us know in the comments below. #UnpackYourDreams #INDvWI https://t.co/c8lfwQczMX
https://twitter.com/AristocratBags/status/1046983771759828992,Thu Dec 22 08:14:44 +0000 2016,2018-10-02 04:42:37,11,0,repNone,,False,"This #GandhiJayanti, let us remember the man who not only stood for his dreams, but encouraged us to follow ours. #UnpackYourDreams https://t.co/IFxzdG0F0S"
https://twitter.com/AristocratBags/status/1045948873783443457,Thu Dec 22 08:14:44 +0000 2016,2018-09-29 08:10:18,46,12,repNone,,False,"Congratulations to team #India and our fearless leader, @ImRo45 for winning the #AsiaCup final! #UnpackYourDreams"
https://twitter.com/AristocratBags/status/1045630233200615425,Thu Dec 22 08:14:44 +0000 2016,2018-09-28 11:04:09,48,9,repNone,,False,India have forged their place in the final of the #AsiaCup! Will @ImRo45 lead his team to victory? Send your good luck wishes to our #Hitman in comments! #INDvBAN https://t.co/06pvb7TycS
https://twitter.com/AristocratBags/status/1043935195559350272,Thu Dec 22 08:14:44 +0000 2016,2018-09-23 18:48:40,71,17,repNone,,False,"A century today and 7000 runs in #ODI, it's safe to say that our Hitman, @ImRo45 continues to unpack his dreams. Congratulate him in the comments below.#UnpackYourDreams #INDvPAK #RohitSharma https://t.co/zo6aNv1TD4"
https://twitter.com/AristocratBags/status/1043728573436125184,Thu Dec 22 08:14:44 +0000 2016,2018-09-23 05:07:38,6,0,repNone,,False,"A dedicated charger pocket, a 17-inch laptop compartment, a fixed combination lock and 5-year international warranty – Concorde is the ideal 4 wheel overnighter you want by your side. Visit https://t.co/bwKdWAxVY1 to buy now. https://t.co/08wXVXvulD"
https://twitter.com/AristocratBags/status/1043392364864143360,Thu Dec 22 08:14:44 +0000 2016,2018-09-22 06:51:39,33,9,repNone,,False,.@ImRo45’s dream run with 2 consecutive half centuries and 3 consecutive wins as captain puts Team India in the lead in the Asia Cup. RT to send in your best wishes to the captain. #UnpackYourDreams
https://twitter.com/AristocratBags/status/1042446794909790219,Thu Dec 22 08:14:44 +0000 2016,2018-09-19 16:14:18,28,8,repNone,,False,One of the biggest battles is about to unfold. How many runs will @ImRo45  unpack today? Will he lead Team #India to victory? Show your support for the #Hitman! #IndvPak https://t.co/7bU3EzYugx
https://twitter.com/AristocratBags/status/1042036404304326656,Thu Dec 22 08:14:44 +0000 2016,2018-09-18 13:03:33,29,4,repNone,,False,.@ImRo45 takes the field today as Team India captain. Unpack your wishes for the Hitman as he sets out to bring home the cup! #UnpackYourDreams https://t.co/fcnUWXa2Dc
https://twitter.com/AristocratBags/status/1041569620518264832,Thu Dec 22 08:14:44 +0000 2016,2018-09-17 06:08:43,14,5,repNone,,False,"Wishing our king of spin, @ashwinravi99  a very happy birthday! May you continue to #UnpackYourDreams. https://t.co/JMch3LVefV"
https://twitter.com/AristocratBags/status/1040828963122081792,Thu Dec 22 08:14:44 +0000 2016,2018-09-15 05:05:37,5,3,repNone,,False,"‘Fav’ if you are a tourist, RT if you are a traveller! #UnpackYourDreams https://t.co/l8xP8QH9UY"
https://twitter.com/AristocratBags/status/1039476149095739392,Thu Dec 22 08:14:44 +0000 2016,2018-09-11 11:30:01,3,1,repNone,,False,"With a warranty of up to 5 years, Maze is sure to stick around for a long innings.  Visit the https://t.co/wpwQm5FkcC to shop now. #INDvENG #UnpackYourDreams https://t.co/qwcNIO53Oa"
https://twitter.com/AristocratBags/status/1037665411183964160,Thu Dec 22 08:14:44 +0000 2016,2018-09-06 11:34:47,6,2,repNone,,False,"When he is not tormenting the opposition batsmen, @ashwinravi99 is usually up to some mischief. Find out more about his favourite passtime between matches. #UnpackYourDreams https://t.co/IDeZGExSFc"
https://twitter.com/AristocratBags/status/1037197198914727937,Thu Dec 22 08:14:44 +0000 2016,2018-09-05 04:34:17,5,1,repNone,,False,What is the one big learning that #travel has given you? Unpack it here this #TeachersDay. #UnpackYourDreams https://t.co/0Ji0uZrv2U
https://twitter.com/AristocratBags/status/1036960477325209600,Thu Dec 22 08:14:44 +0000 2016,2018-09-04 12:53:38,2,1,repNone,,False,"When it comes to #travel plans, how many of you have experienced this #VennDiagram? RT if you have! https://t.co/c5BHCRcjyx"
https://twitter.com/AristocratBags/status/1036507057715736576,Thu Dec 22 08:14:44 +0000 2016,2018-09-03 06:51:54,12,3,repNone,,False,"You unpacked your #BaggageProblems, @ImRo45 and @ashwinravi99 unpacked solutions for them! Congratulations dantus75 and sahurahuljan! You are the lucky winners of the contest. Kindly message us your details. #UnpackYourDreams https://t.co/0ikjK50TGI"
https://twitter.com/AristocratBags/status/1035754121465405440,Thu Dec 22 08:14:44 +0000 2016,2018-09-01 05:00:00,9,1,repNone,,False,"No dream is too big for you! But don’t just follow it, go out there and set out to #UnpackYourDreams! RT if you agree. https://t.co/e3DtEM3LNA"
https://twitter.com/AristocratBags/status/1035401944859201536,Thu Dec 22 08:14:44 +0000 2016,2018-08-31 05:40:35,15,4,repNone,,False,"We saw some beautiful #TravelClicksUnpacked in the #WorldPhotographyDay #contest. Congratulations to the lucky winners, pracheetijoshi and Shaandaar_Jenie. Kindly message us your details. #UnpackYourDreams https://t.co/4EH7vhwuOZ"
https://twitter.com/AristocratBags/status/1034665878149914624,Thu Dec 22 08:14:44 +0000 2016,2018-08-29 04:55:43,8,4,repNone,,False,"India has had a bright start at the #AsianGames2018. This #NationalSportsDay, let’s get behind our athletes and support them as they endeavour to make us proud. RT your support right away!  #UnpackYourDreams https://t.co/g0ZgJQsBFh"
https://twitter.com/AristocratBags/status/1034368919274811397,Thu Dec 22 08:14:44 +0000 2016,2018-08-28 09:15:42,0,0,rep1034307143078502400,Sarveshinsingh,False,@Sarveshinsingh @VIPBagsIndia Hi Sarvesh!  Please DM us your details. We will get in touch right away! - Team Aristocrat
https://twitter.com/AristocratBags/status/1033575699771142146,Thu Dec 22 08:14:44 +0000 2016,2018-08-26 04:43:44,14,5,repNone,,False,When sibling rivalry also involved the occasional battle of the bags… Unpack your most cherished sibling memories with us while you have a #HappyRakshaBandhan. https://t.co/aaMaxBCefc
https://twitter.com/AristocratBags/status/1032604349967478784,Thu Dec 22 08:14:44 +0000 2016,2018-08-23 12:23:56,19,15,repNone,,False,Thank you all for the incredible response. The #contest is now closed. Stay tuned for more updates. RT if you think you’ll win!
https://twitter.com/AristocratBags/status/1032588259065397250,Thu Dec 22 08:14:44 +0000 2016,2018-08-23 11:20:00,0,1,rep1032251395465011201,PinkCityLover,False,@PinkCityLover @ImRo45 @ashwinravi99 https://t.co/hiBmvJ0HqI
https://twitter.com/AristocratBags/status/1032587128503291905,Thu Dec 22 08:14:44 +0000 2016,2018-08-23 11:15:30,1,1,rep1032318742993285120,Lakhan_Bokhanee,False,@Lakhan_Bokhanee @ImRo45 @ashwinravi99 https://t.co/uZepN8nTo7
https://twitter.com/AristocratBags/status/1032584743089577984,Thu Dec 22 08:14:44 +0000 2016,2018-08-23 11:06:01,0,0,rep1032543208520278016,Aarti_84,False,@Aarti_84 @ImRo45 @ashwinravi99 https://t.co/nIVIQIHaXm
https://twitter.com/AristocratBags/status/1032583594890473472,Thu Dec 22 08:14:44 +0000 2016,2018-08-23 11:01:28,0,0,rep1032529965428830208,JohnTerence_A,False,@JohnTerence_A @ImRo45 @ashwinravi99 https://t.co/zO7OPd78kH
https://twitter.com/AristocratBags/status/1032583406008193026,Thu Dec 22 08:14:44 +0000 2016,2018-08-23 11:00:43,0,0,rep1032530608088436736,shaw_amit835,False,@shaw_amit835 @ImRo45 @ashwinravi99 https://t.co/bmJaiai3lS
https://twitter.com/AristocratBags/status/1032582512873283585,Thu Dec 22 08:14:44 +0000 2016,2018-08-23 10:57:10,0,0,rep1032548974845022208,_m1n8,False,@_m1n8 @ImRo45 @ashwinravi99 https://t.co/Wcf00QmiCl
https://twitter.com/AristocratBags/status/1032581869722894337,Thu Dec 22 08:14:44 +0000 2016,2018-08-23 10:54:36,0,0,rep1032530050942468096,AppieAppz,False,@AppieAppz @ImRo45 @ashwinravi99 https://t.co/2bhd1I7WB4
https://twitter.com/AristocratBags/status/1032581246260576256,Thu Dec 22 08:14:44 +0000 2016,2018-08-23 10:52:08,2,1,rep1032543372806737921,khushi_kingdom,False,@sahurahuljan @ImRo45 @ashwinravi99 https://t.co/6K0047DeT9
https://twitter.com/AristocratBags/status/1032581007722078208,Thu Dec 22 08:14:44 +0000 2016,2018-08-23 10:51:11,0,1,rep1032543563584819200,dil_13_te_80ve,False,@dil_13_te_80ve @ImRo45 @ashwinravi99 https://t.co/LBAutFkoHF
https://twitter.com/AristocratBags/status/1032580746559406080,Thu Dec 22 08:14:44 +0000 2016,2018-08-23 10:50:09,0,1,rep1032557430247440385,rajkumarkurmi_,False,@rajkumarkurmi_ @ImRo45 @ashwinravi99 https://t.co/DPl96aVM8d
https://twitter.com/AristocratBags/status/1032580444363997188,Thu Dec 22 08:14:44 +0000 2016,2018-08-23 10:48:57,0,1,rep1032562313872764928,Prabhat00553392,False,@Prabhat00553392 @ImRo45 @ashwinravi99 https://t.co/8hO11D8kwO
https://twitter.com/AristocratBags/status/1032573765299957765,Thu Dec 22 08:14:44 +0000 2016,2018-08-23 10:22:24,1,1,rep1032528780277862400,piyu196,False,"@piyu196 @ImRo45 @ashwinravi99 Hey Piyu, @ashwinravi99  is not known to offer space, but he has made an exception for you to solve your #BaggageProblems https://t.co/PX3DWnZsOy"
https://twitter.com/AristocratBags/status/1032573293021212672,Thu Dec 22 08:14:44 +0000 2016,2018-08-23 10:20:31,0,1,rep1032530369898196992,kajol_saxena,False,"@kajol_saxena @ImRo45 @ashwinravi99 Hey, Kajol, @ashwinravi99  is not known to offer space, but he has made an exception for you to solve your #BaggageProblems https://t.co/1Xg7WxjGhX"
https://twitter.com/AristocratBags/status/1032571908447862784,Thu Dec 22 08:14:44 +0000 2016,2018-08-23 10:15:01,0,1,rep1032534389056393216,Gowthaman_csk1,False,@Gowthaman_csk1 @ImRo45 @ashwinravi99 .@ashwinravi99 has a solution for you that will last a lifetime and surely solve your #BaggageProblems! https://t.co/ztnb2KmyJw
