id,Account Created At(same for all rows),status created_at,Fav_cont,retweeted_count,reply_to_status,reply_to_screen,quote,text
https://twitter.com/AristocratBags/status/1316290765161525248,Thu Dec 22 08:14:44 +0000 2016,2020-10-14 08:12:28,1402,150,repNone,,False,"Make your journeys effortless with #Hitman’s favourite collection of spacious, durable &amp; attractive bags which will make your journeys hassle free. You can grab one from https://t.co/DBBY6vxWcl or  https://t.co/tYLi6mQKsO &amp; avail of some exciting offers.  #UnpackYourDreams https://t.co/xxJrBJ6Zh0"
https://twitter.com/AristocratBags/status/1277187485525659648,Thu Dec 22 08:14:44 +0000 2016,2020-06-28 10:30:00,24,14,repNone,,False,"This empowering movie talks about something that society shies away from. Based on a real-life event, the story focuses on women's security, dignity and health. Can you guess the movie? Comment below! #AristoCharades #Aristocrat https://t.co/NQv2hvp73L"
https://twitter.com/AristocratBags/status/1275068773813219331,Thu Dec 22 08:14:44 +0000 2016,2020-06-22 14:10:59,10,6,repNone,,False,"What happens when a man impersonating to be visually-impaired witnesses murders? Who would believe him? This Bollywood thriller keeps you on toes until the very end, guess the movie! #AristoCharades #Aristocrat #GuessTheMovie https://t.co/TeDT3WjtYq"
https://twitter.com/AristocratBags/status/1274581399920492544,Thu Dec 22 08:14:44 +0000 2016,2020-06-21 05:54:20,5,0,repNone,,False,"Don't you want to experience all the adventures of life? Well, use this opportunity to do yoga and build your health. May health and peace be with you. Happy International Day Of Yoga!  #InternationalDayOfYoga #YogaDay  #Backpacking #Aristocrat #AristoBags #YogaDay2020 https://t.co/XTSfbU0js0"
https://twitter.com/AristocratBags/status/1272142614750359552,Thu Dec 22 08:14:44 +0000 2016,2020-06-14 12:23:29,57,44,repNone,,False,This Bollywood movie has a Punjabi tadka that not only restores our faith in true love but also makes us feel proud to be an Indian. Can you guess the movie? Comment below!  #AristoCharades #AristoBags #Aristocrat https://t.co/92DJC5ZHkL
https://twitter.com/AristocratBags/status/1271451695931813890,Thu Dec 22 08:14:44 +0000 2016,2020-06-12 14:38:01,7,2,repNone,,False,Hello Hikers! Here's a fun post for you. Share your enthusiasm with us and name as many trekking places you can see. Tag your friends and challenge them too. Enjoy the hunt!  #Aristocrat #Aristobags #Backpackers #Hikers #FunPost #Challenge #Trekking #Crossword https://t.co/RtARFqE2ju
https://twitter.com/AristocratBags/status/1268860936422428672,Thu Dec 22 08:14:44 +0000 2016,2020-06-05 11:03:16,10,1,repNone,,False,"What lies ahead is in our hands. This Environment Day, let's commit ourselves to protect Mother Nature and welcome a green future.  #EnvironmentDay #WorldEnvironmentDay2020  #ForNature #CelebrateBiodiversity #SaveNature #GreenFuture #Aristocrat #AristoBags #UnpackYourDreams https://t.co/CoAJ7WQcqB"
https://twitter.com/AristocratBags/status/1268044743344222208,Thu Dec 22 08:14:44 +0000 2016,2020-06-03 05:00:00,5,1,repNone,,False,We’ve trod with you across various terrains over the years while accompanying you as you #UnpackYourDreams. Share your experience with us. #Travel #tbt https://t.co/N4urwQaCst
https://twitter.com/AristocratBags/status/1266599081847058432,Thu Dec 22 08:14:44 +0000 2016,2020-05-30 05:15:28,33,21,repNone,,False,This series takes you on a thrilling journey of a commoner who also carries the responsibility of the nation on his shoulders. Guess the name of the series from the emojis and post your answers in the comments. #AristoCharades https://t.co/wvR4wcjtga
https://twitter.com/AristocratBags/status/1264542500435329025,Thu Dec 22 08:14:44 +0000 2016,2020-05-24 13:03:20,9,1,repNone,,False,"The day to step out into the new normal is almost here. May this Ramadan bring you good health, happiness and the strength to unpack your dreams. #Ramadan  #EidMubarak #EidAlFitr  #stayhomestaysafe https://t.co/gDe81Y8AH4"
https://twitter.com/AristocratBags/status/1262999214197338113,Thu Dec 22 08:14:44 +0000 2016,2020-05-20 06:50:52,6,2,repNone,,False,"Let's go #VocalForLocal with the premium collection of Aristocrat polycarbonate bags, your #AtmaNirbhar travel partner. #UnpackYourDreams https://t.co/544FOQUEK2"
https://twitter.com/AristocratBags/status/1261910432652156928,Thu Dec 22 08:14:44 +0000 2016,2020-05-17 06:44:26,6,1,repNone,,False,"Our Backpacks are 100% made in India keeping your needs in mind, so proudly don one while being #VocalForLocal. #AtmaNirbharBharat. https://t.co/L2jTlW68zV"
https://twitter.com/AristocratBags/status/1260956931033665537,Thu Dec 22 08:14:44 +0000 2016,2020-05-14 15:35:34,5,3,repNone,,False,This action packed film will take you places that you would never have imagined you'd go to. Guess the name of the movie from the emojis and post your answers in the comments! #AristoCharades https://t.co/HVSNBLTdkG
https://twitter.com/AristocratBags/status/1260622262249512961,Thu Dec 22 08:14:44 +0000 2016,2020-05-13 17:25:43,9,2,repNone,,False,Aristocrat Bags are proudly made in India and are even designed to cater to the specific needs of Indian consumers. Choose Aristocrat Bags and take a step ahead for the nation towards becoming #AtmaNirbharBharat. #VocalForLocal https://t.co/qYaWglKYm1
https://twitter.com/AristocratBags/status/1260564971848634373,Thu Dec 22 08:14:44 +0000 2016,2020-05-13 13:38:04,5,1,repNone,,False,Does your post-quarantine plan sound anything similar to this? Post your what you’re planning to unpack #QuarantineEndHoteHi in the comments. #Aristocrat https://t.co/zziQhV5bjv
https://twitter.com/AristocratBags/status/1259355625248579585,Thu Dec 22 08:14:44 +0000 2016,2020-05-10 05:32:33,3,0,repNone,,False,Here's wishing moms a very happy Mother's Day and thanking them for always having our backs in the pursuit to unpack dreams.#SSMothersDayWatch #MothersDayonMom #MothersDay  #mothersday2020 https://t.co/XDC1S1OJbZ
https://twitter.com/AristocratBags/status/1258683000168034304,Thu Dec 22 08:14:44 +0000 2016,2020-05-08 08:59:47,1,0,repNone,,False,Looks like the Legend can’t wait to satiate its wanderlust! But there’s no place safer right now than your own home. Take a screenshot of the Aristocrat Legend when it’s within the house and post them in the comments. #Aristocrat #Legend https://t.co/QEH6ob3pIO
https://twitter.com/AristocratBags/status/1258011726269702144,Thu Dec 22 08:14:44 +0000 2016,2020-05-06 12:32:22,2,0,repNone,,False,Jordan has his post-quarantine travel plan sorted. Post what you’re planning to do #QuarantineEndHoteHi #Aristocrat https://t.co/gHIMZfClBq
https://twitter.com/AristocratBags/status/1257255312475725825,Thu Dec 22 08:14:44 +0000 2016,2020-05-04 10:26:39,4,0,repNone,,False,Indian coasts are no less than a paradise where you can go to unpack some great memories. Can you guess the name of this pristine beach hidden away in the otherwise bustling Goa? Post your answers in the comments. #Aristocrat https://t.co/CLtSOvswki
https://twitter.com/AristocratBags/status/1256646410402885633,Thu Dec 22 08:14:44 +0000 2016,2020-05-02 18:07:06,0,5134,repNone,,False,RT @chetrisunil11: Jersey ❌ Autograph on a picture ❌ Reply to the post ❌ Video wishing the neighbour's son's pet dog ❌  Here's someone who…
https://twitter.com/AristocratBags/status/1256098521196818432,Thu Dec 22 08:14:44 +0000 2016,2020-05-01 05:49:59,11,1,repNone,,False,"While the things that need fixing keep piling up at home, let’s take a day to appreciate the contribution of all those who made sure these problems were always taken care of; so you could focus on unpacking your dreams. #LabourDay #Aristocrat https://t.co/UQK4VzopPG"
https://twitter.com/AristocratBags/status/1255834410428977152,Thu Dec 22 08:14:44 +0000 2016,2020-04-30 12:20:30,108,90,repNone,,False,Do you think you know Rohit Sharma? Let’s play a quick game of crosswords to find out! Comment with correct answers to the questions. #RohitSharma #Trivia https://t.co/008uQmRRDd
https://twitter.com/AristocratBags/status/1255749767491018752,Thu Dec 22 08:14:44 +0000 2016,2020-04-30 06:44:09,23,5,repNone,,False,Indian's Hitman turns 33 today! Aristo wishes Rohit Sharma a very happy birthday. Hope we see more double centuries in upcoming tournaments. You've been a game-changer. All the best! @ImRo45 #RoHit #RohitSharma #Hitman #IndianBatsman #IndianCricket #Aristocrat #HappyBirthday https://t.co/3PAcqa1cYv
https://twitter.com/AristocratBags/status/1254768430806269956,Thu Dec 22 08:14:44 +0000 2016,2020-04-27 13:44:41,8,0,repNone,,False,"Kabir knows what he wants to do once the quarantine ends, do you? Post what you want to do #QuarantineEndHoteHi and tag us for a chance to get featured! https://t.co/y3mkx19kAL"
https://twitter.com/AristocratBags/status/1253947094148079617,Thu Dec 22 08:14:44 +0000 2016,2020-04-25 07:20:59,3,0,repNone,,False,India is replete with gorgeous architectures and landscapes that’ll take your breath away. Can you guess the name of this architectural marvel and where it’s located from this bird-eye view? Retweet with comments now! https://t.co/ZTheWXKtb4
https://twitter.com/AristocratBags/status/1250305153007104001,Thu Dec 22 08:14:44 +0000 2016,2020-04-15 06:09:12,2,0,repNone,,False,There’s still one place you can travel to; and that’s back in time! Unpack such fond memories from your childhood and tell us what was your favourite destination as a child. #StayHomeStaySafe #COVID19 https://t.co/F1jcffvg5j
https://twitter.com/AristocratBags/status/1247559346080362496,Thu Dec 22 08:14:44 +0000 2016,2020-04-07 16:18:21,9,0,repNone,,False,We’re thrilled to announce our winners for the #AristoTravelBuddy contest! Thank you so much @Ami032108 and @poonam_216 for sharing your fascinating travel stories with us. We hope you stay put for now and stay safe at home! #UnpackYourDreams #Aristocrat https://t.co/u3iRHEfrvh
https://twitter.com/AristocratBags/status/1246672435052568576,Thu Dec 22 08:14:44 +0000 2016,2020-04-05 05:34:05,2,0,repNone,,False,Let’s unite as a nation and bring hope to all those who need it the most. #9Baje9Minute #COVID19 https://t.co/fHwauenSPW
https://twitter.com/AristocratBags/status/1244619947654787072,Thu Dec 22 08:14:44 +0000 2016,2020-03-30 13:38:14,1,1,rep1244502183074074625,abhilashp28645,False,@abhilashp28645 @Pls_wait4me @merlin8thomas @RincyBibin2802 @ShainaArora1 @Mehul_lm Thanks for participating and sharing the pictures with us! Stay tuned for the results!!
https://twitter.com/AristocratBags/status/1244619644175921153,Thu Dec 22 08:14:44 +0000 2016,2020-03-30 13:37:01,1,1,rep1244319004874792960,3Madhvi,False,@3Madhvi @indu0177 @ritesh_sinhal @Devanginee Folk Dancer in Rajasthan! A wonderful #AristoTravelBuddy you've met with! Thanks for sharing the images and stay tuned for the results!!!
https://twitter.com/AristocratBags/status/1244619235466215425,Thu Dec 22 08:14:44 +0000 2016,2020-03-30 13:35:24,2,0,rep1244298684063289344,vinodsapra76,False,@vinodsapra76 @mintoosapra Cheers to your #AristoTravelBuddy and hope you have many such moments of happiness together! Thanks for participating and stay updated for the results!!
https://twitter.com/AristocratBags/status/1244617144026816517,Thu Dec 22 08:14:44 +0000 2016,2020-03-30 13:27:05,0,0,rep1244290005666693120,Ami032108,False,@Ami032108 That is an astonishing experience to live for! Thanks for sharing it with us!! Please stay tuned for the results!!
https://twitter.com/AristocratBags/status/1244616803138990084,Thu Dec 22 08:14:44 +0000 2016,2020-03-30 13:25:44,2,0,rep1244282978957586433,poonam_216,False,@poonam_216 @TarakCoolDude @Rujulicious @nnikhil539 @priyankapats1 @Rashrosy The best buddy anyone can have!! Thank you for sharing the pictures with us! Stay tuned for the results!!
https://twitter.com/AristocratBags/status/1244616546606968832,Thu Dec 22 08:14:44 +0000 2016,2020-03-30 13:24:43,1,0,rep1244279527183794176,ipraveenkumar28,False,@ipraveenkumar28 @Sangeet30531036 The best buddy we all have! Cheers to your trip and #AristoTravelBuddy ! Stay update for the results!!
https://twitter.com/AristocratBags/status/1244615984943493120,Thu Dec 22 08:14:44 +0000 2016,2020-03-30 13:22:29,0,0,rep1244274621483855872,BADSHAH_MEHUL,False,@BADSHAH_MEHUL @pallavi_gupta4 Hope you and your sister have many more trips to vouch for! Thanks for sharing the sweet picture with us! Stay updated for the results!!
https://twitter.com/AristocratBags/status/1244615720693944320,Thu Dec 22 08:14:44 +0000 2016,2020-03-30 13:21:26,0,0,rep1244274503955275776,AnishaChoudhari,False,@AnishaChoudhari Our best friend's company is always lovely! Thank you for participating &amp; sharing the image with us! Stay tuned for the results!!
https://twitter.com/AristocratBags/status/1244615306531631104,Thu Dec 22 08:14:44 +0000 2016,2020-03-30 13:19:47,1,1,repNone,,False,@RockingmeAnik @aniketsaurav198 @AppaNaik @Itsmeshree03 What more can somebody ask for! Thanks for sharing this memorable experience of your! Stay updated for the results!!
https://twitter.com/AristocratBags/status/1244585510367973377,Thu Dec 22 08:14:44 +0000 2016,2020-03-30 11:21:23,2,1,rep1244535416885112833,bp051t1ve_pr1ya,False,@priya19909678 What an adventurous trip you've had! We all do need the Guide and Mr.Narendra like people in our trips. Thanks for sharing your experience and stay tuned till we announce the winner!!
https://twitter.com/AristocratBags/status/1244584342271045636,Thu Dec 22 08:14:44 +0000 2016,2020-03-30 11:16:45,1,0,rep1244343459617468417,RubyAga9339,False,@RubyAga9339 @iammargam @Richa22525021 @porwal_sarika @richa_jaseja @khemka_nidhi @GauravP26479152 Thank you sharing the picture with us! Please stay tuned till we announce the winner!
https://twitter.com/AristocratBags/status/1244583983989456896,Thu Dec 22 08:14:44 +0000 2016,2020-03-30 11:15:19,2,0,rep1244318887551725569,SKchandan07,False,@SKchandan07 @GargeeGanguly @AkhileshK2000 @Hello_Himansh @sandipdey_ Thanks for sharing with us your sweet experience. Hope you guys have many more such experiences. Stay tuned till we announce the winner!!
https://twitter.com/AristocratBags/status/1244247896448360450,Thu Dec 22 08:14:44 +0000 2016,2020-03-29 12:59:50,23,19,rep1244247894275678208,AristocratBags,False,Step 1: Reply/RT with a picture of that memory with #AristoTravelBuddy Step 2: Tag a friend who you would go on a vacation with in the comments section &amp; make them follow @aristocratbags  #ContestAlert #WinABackpack #UnpackYourDreams T&amp;C apply *https://t.co/KvkxyPL5ao
https://twitter.com/AristocratBags/status/1244247894275678208,Thu Dec 22 08:14:44 +0000 2016,2020-03-29 12:59:49,33,26,rep1244247890597253121,AristocratBags,False,Revisit those memories and share the heart-warming experiences you had with them for a chance to get featured and win an Aristocrat backpack!  Click here for the steps.
https://twitter.com/AristocratBags/status/1244247890597253121,Thu Dec 22 08:14:44 +0000 2016,2020-03-29 12:59:48,45,35,repNone,,False,"CONTEST ALERT  A wise cab driver, that motherly old lady who offered you food while you waited for your bus or the dog who followed you to your next destination, you’re bound to make such travel buddies who go the extra mile with you.  Click here for more. https://t.co/wPAYAGyMXC"
https://twitter.com/AristocratBags/status/1242654942487289863,Thu Dec 22 08:14:44 +0000 2016,2020-03-25 03:30:00,6,1,repNone,,False,"It’s time to unpack another year of health, good fortune and memorable trips. Aristocrat wishes you all a very happy Gudi Padwa.  #UnpackYourDreams #Stayhomesavelives #WashYourHands #SocialDistancing https://t.co/kPbzkD0ydm"
https://twitter.com/AristocratBags/status/1241738765007073281,Thu Dec 22 08:14:44 +0000 2016,2020-03-22 14:49:26,6,2,repNone,,False,"On behalf of everyone at Aristocrat, we thank the medical and safety staff who are helping curb the spread of #COVID19 and keeping us safe. #UnpackYourDreams #IndiaComeTogher #clapforourcareers https://t.co/uZhviCIsdK"
https://twitter.com/AristocratBags/status/1240935103850676225,Thu Dec 22 08:14:44 +0000 2016,2020-03-20 09:35:58,7,1,repNone,,False,Unpacking your dreams can wait but your health and safety can't. Do not put yourself at risk of contracting #COVID19. Stay indoors as far as possible and take the following precautions to ensure your safety and also of those around you. #UnpackYourDreams #CoronaStopKaroNa #Safety https://t.co/lY9eILjwcs
https://twitter.com/AristocratBags/status/1238661611415416832,Thu Dec 22 08:14:44 +0000 2016,2020-03-14 03:01:56,54,22,repNone,,False,"Are you ready to take up the #RahoHustleReady challenge for a chance to catch @ImRo45 live in action? If yes, post🔥 in the comments section below!  Stay tuned to know more! #RahoHustleReady #Aristocratbags  . . . . . . #Backpacks #UnpackYourDreams #ContestAlert #RohitSharma https://t.co/CnfBnolY32"
https://twitter.com/AristocratBags/status/1237928800857370624,Thu Dec 22 08:14:44 +0000 2016,2020-03-12 02:30:00,35,25,repNone,,False,"Stay hungry, stay ready, for there’s something huge coming your way! Watch this space for more!   #UnpackYourDreams #RahoHustleReady #Aristocrat #Backpacks #ContestAlert https://t.co/40LA8cyCzL"
https://twitter.com/AristocratBags/status/1237234883329585152,Thu Dec 22 08:14:44 +0000 2016,2020-03-10 04:32:37,3,2,repNone,,False,Colours never fail to lift one's spirit. Aristocrat wishes you a colourful and vibrant Holi. #HappyHoli #Holi #UnpackYourDreams https://t.co/3TeyhgbWeQ
https://twitter.com/AristocratBags/status/1236534489041387520,Thu Dec 22 08:14:44 +0000 2016,2020-03-08 06:09:30,3,2,repNone,,False,We at Aristocrat believe in forging a gender equal world and challenge the stereotypes &amp; bias. Only then can we all truly unpack our dreams. #EachForEqual #UnpackYourDreams #HappyWomensDay2020 #InternationalWomensDay #IDW2020 https://t.co/IssYAokyY5
https://twitter.com/AristocratBags/status/1236284203764867074,Thu Dec 22 08:14:44 +0000 2016,2020-03-07 13:34:57,3,2,repNone,,False,The Aristocrat Dream Nxt duffle-cum-trolley bag lets you set out there to #UnpackYourDreams with absolute comfort and ease. #Duffle #Comfort #Convenience https://t.co/O7qqQj9vyD
https://twitter.com/AristocratBags/status/1235250318767583235,Thu Dec 22 08:14:44 +0000 2016,2020-03-04 17:06:40,10,2,repNone,,False,Every Aristocrat product is designed to keep your belongings safe even under the harshest conditions so you can stay stress-free wherever you go. #UnpackYourDreams this National Safety Day with your favorite Aristocrat bag. #AristocratBags https://t.co/Ry8YpsvcR3
https://twitter.com/AristocratBags/status/1234006390248595456,Thu Dec 22 08:14:44 +0000 2016,2020-03-01 06:43:44,7,2,repNone,,False,"Stylish and compact, the Aristocrat Centuro is a sure way to make your statement while offering incredible convenience and portability. #UnpackYourDreams https://t.co/91zfPmBEc5"
https://twitter.com/AristocratBags/status/1233731600627752961,Thu Dec 22 08:14:44 +0000 2016,2020-02-29 12:31:49,6,2,repNone,,False,"Wherever you choose to stride, the Aristocrat Legend strolley bag will let you be at ease with its top-notch features and advanced functionality. To shop for yours now #UnpackYourDreams #Legend #AristocratBags https://t.co/BoMlDEhhCg"
https://twitter.com/AristocratBags/status/1232254765293158406,Thu Dec 22 08:14:44 +0000 2016,2020-02-25 10:43:24,0,0,rep1231992343936417792,AdityaOmBhola,False,@AdityaOmBhola Hello Aditya. We regret the inconvenience caused. Please DM us and we'll surely resolve your concerns.
https://twitter.com/AristocratBags/status/1230713799260327938,Thu Dec 22 08:14:44 +0000 2016,2020-02-21 04:40:09,9,2,repNone,,False,"Searching for affordable places to visit near Mumbai? Here’s a perfect pick, Panchgani! Pack your bags and rush to this amazingly beautiful land, where you can indulge in various activities like paragliding, trekking and camping.  #AristoWeekendThrills #EverythingEverywhere https://t.co/LwzLNnZIXT"
https://twitter.com/AristocratBags/status/1229642797365334016,Thu Dec 22 08:14:44 +0000 2016,2020-02-18 05:44:23,13,3,repNone,,False,It’s always helpful to learn how to speak some basic phrases from the local language of wherever you’re travelling to. It can help you connect more with the locals and you’ll also instantly come across as a friendly traveller. #AristoTravelTips #UnpackYourDreams https://t.co/OotRJWWtYw
https://twitter.com/AristocratBags/status/1228254453683257344,Thu Dec 22 08:14:44 +0000 2016,2020-02-14 09:47:36,7,2,repNone,,False,Wouldn’t you love to hear this from your valentine? Tag them here to let them know how you feel. #HappyValentinesDay #UnpackYourDreams #AristocratBags https://t.co/8P7eNnojGq
https://twitter.com/AristocratBags/status/1224755655929581568,Thu Dec 22 08:14:44 +0000 2016,2020-02-04 18:04:37,23,7,repNone,,False,Lets put an end to the wait. Congratulations to our winners of the Spin The Bag Contest held last month. Be ready to grab the Aristocrat goodies that come your way. @Sanjiv_34 @SujithDifferent @shweta_bhojwani #SpinTheBagContest #ContestAlert #UnpackYourDreams https://t.co/eCszfmWKNC
https://twitter.com/AristocratBags/status/1222908844021436417,Thu Dec 22 08:14:44 +0000 2016,2020-01-30 15:46:03,3,0,repNone,,False,"#Repost the.indian.traveller • • • • • • Karnataka  I don't think I am more obsessed with anything else than travelling out in the wild. Nothing makes me happier than that! On these small and big trips in the wild,… https://t.co/zxAcinV9sL"
https://twitter.com/AristocratBags/status/1222492116963688449,Thu Dec 22 08:14:44 +0000 2016,2020-01-29 12:10:08,23,4,repNone,,False,Today’s India vs. New Zealand match was such a delight to watch! Congratulations @ImRo45 on taking down the opponents with your power-packed sixes in a row. #UnpackYourDreams #NZvIND https://t.co/UxBSuZV7XC
https://twitter.com/AristocratBags/status/1222446399146475520,Thu Dec 22 08:14:44 +0000 2016,2020-01-29 09:08:28,41,6,repNone,,False,"Congratulating @ImRo45 as he sets a new benchmark by becoming the 4th most century scoring player. With this, he surpasses Sanath Jaysurya’s record and climbs up the centurion’s leaderboard. #Hitman #UnpackYourDreams #AristocratBags #NZvIND https://t.co/71owENt7mZ"
https://twitter.com/AristocratBags/status/1221323869710979073,Thu Dec 22 08:14:44 +0000 2016,2020-01-26 06:47:56,4,0,repNone,,False,Celebrating the day our nation unpacked its path to glory. Aristocrat wishes you a Happy Republic Day. #HappyRepublicDay #UnpackYourDreams #RepublicDay2020 https://t.co/x6vF9yWiIF
https://twitter.com/AristocratBags/status/1220380956688674816,Thu Dec 22 08:14:44 +0000 2016,2020-01-23 16:21:08,11,2,repNone,,False,Heaven is for real &amp; here's a glimpse. React with a retweet or ❤️to tell us where you think this picture was taken. #NationalTourismDay #UnpackYourDreams #AristocratBags https://t.co/gM4NQwMNqy
https://twitter.com/AristocratBags/status/1218906314463563776,Thu Dec 22 08:14:44 +0000 2016,2020-01-19 14:41:26,32,4,repNone,,False,Our #Hitman has begun his streak by adding his 1st century of 2020.  Keep cheering @ImRo45 to continue unpacking such performances. #AristocratBags #UnpackYourDreams #RohitSharma #INDvAUS
https://twitter.com/AristocratBags/status/1217722545824157696,Thu Dec 22 08:14:44 +0000 2016,2020-01-16 08:17:33,71,9,repNone,,False,Our Hitman @ImRo45 has unpacked several records thanks to his hard work and consistent performance. We proudly congratulate him as he wins the well-deserved title of the ‘ODI Cricketer of the Year 2019’. Extend your wishes too in the comments. #UnpackYourDreams https://t.co/Z1XncoZG3B
https://twitter.com/AristocratBags/status/1217328010379980800,Thu Dec 22 08:14:44 +0000 2016,2020-01-15 06:09:49,18,5,repNone,,False,Revisit your childhood and unpack the memories where you got together with your friends and went “Kai Po Che”! Tag your gang here. Aristocrat wishes you a fun and cheerful Makar Sankranti.  #HappyMakarSankranti #UnpackYourDreams https://t.co/xWL5TxayRo
https://twitter.com/AristocratBags/status/1216346506988380160,Thu Dec 22 08:14:44 +0000 2016,2020-01-12 13:09:40,22,7,repNone,,False,"Walking on the path of Swami Vivekananda’s beliefs, India’s young minds are spearheading progress and unpacking the nation’s true potential. Aristocrat takes immense pride in partnering with them in this journey. Happy National Youth Day! #UnpackYourDreams #EverythingEverywhere https://t.co/kLd027h7Rt"
https://twitter.com/AristocratBags/status/1214443675511447552,Thu Dec 22 08:14:44 +0000 2016,2020-01-07 07:08:30,206,166,repNone,,False,The most visited place is calling. The simple way to give the right answer is to screenshot the GIF when the bag’s trolley handle is pointing towards the right answer. Reply with the answers below &amp; stand a chance to win! Let’s get spinning the bag! #ContestAlert #UnpackYourDream https://t.co/PdKCGDwohG
https://twitter.com/AristocratBags/status/1213386780780769285,Thu Dec 22 08:14:44 +0000 2016,2020-01-04 09:08:46,214,190,repNone,,False,The highest rail bridge is here to take you to the win. The simple way to give the answer is to screenshot the GIF when the bag’s trolley handle is pointing towards the right answer. Reply with your answers below and stand a chance to win! #ContestAlert #UnpackYourDream https://t.co/0hn5BNeNT2
https://twitter.com/AristocratBags/status/1212610758816567296,Thu Dec 22 08:14:44 +0000 2016,2020-01-02 05:45:08,248,228,repNone,,False,The highest roads are calling. The simple way to give the answer is to screenshot the GIF when the bag’s trolley handle is pointing towards the right answer. Reply with your answers below and stand a chance to win!  Let’s get spinning the bag! #ContestAlert #UnpackYourDream https://t.co/AL3tREYwMR
